,character,line #,line
0,LEADER,0,"Internal pressure positive.  Assume
nominal hull integrity.  Hypersleep
capsules, style circa late twenties..."
1,LEADER,1,"Lights are green.  She's alive.
Well, there goes out salvage, guys."
2,MED-TECH,2,"Why don't I open the viewport?
Watch your eyes."
3,MED-TECH,3,And how are we today?
4,RIPLEY,4,Terrible.
5,MED-TECH,5,"Just terrible?  That's better
than yesterday at least."
6,RIPLEY,6,"How long have I been on
Gateway station?"
7,MED-TECH,7,"Just a couple of days.  Do you
feel up to a visitor?"
8,RIPLEY,8,Jones!
9,RIPLEY,9,"Come here Jonesy you ugly old
moose...you ugly thing."
10,MAN,10,"Nice room.  I'm Burke.  Carter Burke.
I work for the company, but other
than that I'm an okay guy.  Glad to
see you're feeling better.  I'm told
the weakness and disorientation
should pass soon.  Side effects of
the unusually long hypersleep, or
something like that."
11,RIPLEY,11,"How long was I out there?  They
won't tell me anything."
12,BURKE,12,"Well, maybe you shouldn't worry
about that just yet."
13,RIPLEY,13,How long?
14,BURKE,14,"All right.  My instinct says
you're strong enough to handle
this...Fifty-seven years."
15,RIPLEY,15,"Fifty-seven...oh, Christ..."
16,BURKE,16,"You'd drifted right through the
core systems.  It's blind luck that
deep-salvage team caught you when
they...are you all right?"
17,MED-TECH,17,"Code Blue!  415.  Code Blue!
4-1-5!"
18,RIPLEY,18,No...noooo!
19,DOCTOR,19,"Hold her...Get me an airway, stat!
And fifteen cc's of...Jesus!"
20,MED-TECH,20,"Bad dreams again?  Do you want
something to help you sleep?"
21,RIPLEY,21,No.. I've slept enough.
22,RIPLEY,22,"We made it, Jones.  We made it."
23,RIPLEY,23,Dumbshit.
24,BURKE,24,"Sorry...I've been running behind
all morning."
25,RIPLEY,25,"Have they located my daughter
yet?"
26,BURKE,26,"Well, I was going to wait
until after the inquest..."
27,RIPLEY,27,Is she...?
28,BURKE,28,"Amanda Ripley-McClaren.  Married
name, I guess.  Age:  sixty-six
...at time of death.  Two years
ago."
29,BURKE,29,I'm sorry.
30,RIPLEY,30,Amy.
31,BURKE,31,"Cancer.  Hmmmm.  They still haven't
licked that one.  Cremated.  Interred
Parkside Repository, Little Chute,
Wisconsin.  No children."
32,RIPLEY,32,"I promised her I'd be home for
her birthday.  Her eleventh
birthday.  I sure missed that
one."
33,RIPLEY,33,"Well...she has already learned
to take my promises with a grain
of salt.  When it came to flight
schedules, anyway."
34,RIPLEY,34,"You always think you can make it
up to somebody...later, you know.
But now I never can.  I never
can."
35,BURKE,35,"The hearing convenes at 0930.  You
don't want to be late."
36,RIPLEY,36,"You read my deposition...it's
complete and accurate."
37,BURKE,37,"Look, I believe you, but there are
going to be some heavyweights in
there.  You got Feds, you got
interstellar commerce commission,
you got colonial administration,
insurance company guys..."
38,RIPLEY,38,I get the picture.
39,BURKE,39,"Just tell them what happened.  The
important thing is to stay cool
and unemotional."
40,RIPLEY,40,"Do you people have earwax, of
what?  We have been here three
hours.  How many different ways
do you want me to tell the same
story?"
41,VAN LEUWEN,41,"Look at it from our perspective.
You freely admit to detonating the
engines of, and thereby destroying,
an M-Class star-freighter.  A
rather expensive piece of hardware..."
42,INSURANCE INVESTIGATOR,42,"Forty-two million in adjusted dollars.
That's minus payload, of course."
43,VAN LEUWEN,43,"The shuttle's flight recorder
corroborates some elements of
your account.  That the Nostromo
set down on LV-426, an unsurveyed
planet, at that time.  That
repairs were made.  That it resumed
its course and was subsequently set
for self-destruct.  By you.  For
reasons unknown."
44,RIPLEY,44,"Look, I told you..."
45,VAN LEUWEN,45,"It did not, however, contain any
entries concerning the hostile
life form you allegedly picked up."
46,RIPLEY,46,"Then somebody's gotten to it...
doctored the recorder.  Who had
access to it?"
47,ECA REP,47,"Would you just listen to yourself
for one minute."
48,VAN LEUWEN,48,"The analysis team which went over
your shuttle centimeter by
centimeter found no physical
evidence of the creature you
describe..."
49,RIPLEY,49,"That's because I blew it out the
Goddamn airlock!"
50,RIPLEY,50,Like I said.
51,INSURANCE MAN,51,"Are there any species like this
'hostile organism' on LV-426?"
52,ECA REP,52,"No.  It's a rock.  No indigenous
life larger than a simple virus."
53,RIPLEY,53,"I told you, it wasn't indigenous.
There was an alien spacecraft there.
A derelict ship.  We homed on its
beacon..."
54,ECA REP,54,"To be perfectly frank, we've surveyed
over three hundred worlds and no one's
ever reported a creature which, using
your words..."
55,ECA REP,55,"...'gestates in a living human host'
and has 'concentrated molecular acid
for blood.'"
56,RIPLEY,56,"Look, I can see where this is
going.  But I'm telling you those
things exist.  Back on that planetoid
is an alien ship and on that ship
are thousands of eggs.  Thousands.
Do you understand?  I suggest you
find it, using the flight recorder's
data.  Find it and deal with it --
before one of your survey teams
comes back with a little surprise..."
57,VAN LEUWEN,57,"Thank you, Officer Ripley.  That
will be..."
58,RIPLEY,58,"...because just one of those
things managed to kill my entire
crew, within twelve hours of
hatching..."
59,VAN LEUWEN,59,"Thank you, that will be all."
60,RIPLEY,60,"That's not all, Goddamnit!  If
those things get back here, that
will be all.  Then you can just
kiss it good-bye, Jack!  Just kiss
it goodbye."
61,BURKE,61,"You had them eating out of your
hand, kiddo."
62,RIPLEY,62,"They had their minds made up
before I even went in there.
They think I'm a head case."
63,BURKE,63,You are a head case.  Have a donut.
64,VAN LEUWEN,64,"It is the finding of this board of
inquiry that Warrent Officer Ellen Ripley,
NOC-14672. has acted with questionable
judgment and is unfit to hold an
ICC license as a commercial flight
officer."
65,VAN LEUWEN,65,"Said license is hereby suspended
indefinitely.  No criminal charges
will be filed at this time and you
are released on own recognizance
for a six month period of
psychometric probation, to include
monthly review by an ICC psychiatric
tech..."
66,RIPLEY,66,Why won't you check out LV-426?
67,VAN LEUWEN,67,"Because I don't have to.  The
people who live there checked it
out years ago and they never
reported and 'hostile organism'
or alien ship.  And by the way,
they call it Acheron now."
68,RIPLEY,68,"What are you talking about.
What people?"
69,VAN LEUWEN,69,"Terraformers...planet engineers.
It's what we call a shake 'n' bake
colony.  They set up atmosphere
processors to make the air
breathable...big job.  Takes
decades.  They've already been
there over twenty years.  Peacefully."
70,RIPLEY,70,How many colonists?
71,VAN LEUWEN,71,"Sixty, maybe seventy families."
72,RIPLEY,72,Sweet Jesus.
73,ELEVATOR PASSENGER,73,Do you mind?
74,LYDECKER,74,"You remember you sent some
wildcatters out to that
plateau, out past the Ilium
range, a couple days ago?"
75,SIMPSON,75,Yeah.  What?
76,LYDECKER,76,"There's a guy on the horn,
mom-and-pop survey team.  Says
he's homing on something and
wants to know if his claim will
be honored."
77,SIMPSON,77,"Christ.  Some honch in a cushy
office on Earth says go look at
a grid reference in the middle
of nowhere, we look.  They don't
say why, and I don't ask.  I
don't ask because it takes two
weeks to get an answer out here
and the answer's always 'don't
ask.'"
78,LYDECKER,78,So what do I tell this guy?
79,SIMPSON,79,"Tell him, as far as I'm concerned,
he finds something it's his."
80,JORDEN,80,"Look at this fat, juicy magnetic
profile.  And it's mine, mine,
mine."
81,ANNE,81,"Half mine, dear."
82,NEWT,82,And half mine!
83,JORDEN,83,I got too many partners.
84,NEWT,84,"Daddy, when are we going back
to town?"
85,JORDEN,85,"When we get rich, Newt."
86,NEWT,86,"You always say that.  I wanna go
back.  I wanna play 'Monster Maze.'"
87,TIM,87,You cheat too much.
88,NEWT,88,Do not.  I'm just the best.
89,TIM,89,"Do too!  You go in places we
can't fit."
90,NEWT,90,So!  That's why I'm the best.
91,ANNE,91,"Knock it off!  I catch either of
you playing in the air ducts again
I'll tan your hides."
92,NEWT,92,Mom.  All the kids play it...
93,JORDEN,93,Holy shiiit!
94,JORDEN,94,"Folks, we have scored big this
time."
95,ANNE,95,"You kids stay inside.  I mean
it!  We'll be right back."
96,ANNE,96,Shouldn't we call in?
97,JORDEN,97,"Let's wait till we know what to
call it in as."
98,ANNE,98,How about 'big weird thing'?
99,TIM,99,Cheater!
100,NEWT,100,"Timmy...they've been gone a
long time."
101,TIM,101,"It'll be okay, Newt.  Dad knows
what he's doing."
102,ANNE,102,"Mayday!  Mayday!  This is
Alpha Kilo Two Four Niner
calling Hadley Control.
Repeat.  This is..."
103,VOICE FROM VIDEO,103,"Hey, Bob!  I heard you and the
family are heading off for the
colonies!"
104,BON,104,"Best decision I ever made, Bill.
We'll be starting a new life
from scratch, in a clean world.
No crime.  No unemployment..."
105,BURKE,105,"Hi, Ripley.  This is
Lieutenant Gorman of the..."
106,BURKE,106,Ripley we have to talk.
107,BURKE,107,"They've lost contact with the
colony on Acheron."
108,RIPLEY,108,No.  There's no way!
109,BURKE,109,Hear me out...
110,RIPLEY,110,"I was reamed, steamed and
dry-cleaned by you guys...and
now you want me to go back out
there?  Forget it."
111,BURKE,111,"Look, we don't know what's going
on out there.  It may just be a
down transmitter.  But if it's
not, I want you there...as an
advisor.  That's all."
112,GORMAN,112,"You wouldn't be going in with the
troops.  I can guarantee your
safety."
113,BURKE,113,"These Colonial Marines are
some tough hombres, and they're
packing state-of-the-art firepower.
Nothing they can't handle...right,
Lieutenant?"
114,GORMAN,114,"We're trained to deal with these
kinds of situations."
115,RIPLEY,115,"What about you?  What's your
interest in this?"
116,BURKE,116,"Well, the corporation co-financed
that colony with the Colonial
Administration, against mineral
rights.  We're getting into a lot
of terraforming...'Building Better
Worlds.'"
117,RIPLEY,117,"Yeah, yeah.  I saw the commercial."
118,BURKE,118,"I heard you were working in the
cargo docks."
119,RIPLEY,119,That's right.
120,BURKE,120,"Running loaders, forklifts, that
sort of thing?"
121,RIPLEY,121,"It's all I could get.  Anyway,
it keeps my mind off of...
everything.  Days off are worse."
122,BURKE,122,"What if I said I could get you
reinstated as a flight officer?
And that the company has agreed
to pick up your contract?"
123,RIPLEY,123,If I go.
124,BURKE,124,If you go.
125,BURKE,125,"It's a second chance, kiddo.  And
it'll be the best thing in the
world for you to face this fear
and beat it.  You gotta get back
on the horse..."
126,RIPLEY,126,"Spare me, Burke.  I've had my
psych evaluation this month."
127,BURKE,127,"Yes, and I've read it.  You
wake up every night, sheets
soaking, the same nightmare
over and over..."
128,RIPLEY,128,"No!  The answer is no.  Now
please go.  I'm sorry.  Just
go, would you."
129,BURKE,129,Think about it.
130,BURKE,130,"Yello?  Oh, Ripley.  Hi..."
131,RIPLEY,131,"Burke, just tell me one thing.
That you're going out there to
kill them.  Not study.  Not bring
back.  Just burn them out...clean
...forever."
132,BURKE,132,That's the plan.  My word on it.
133,RIPLEY,133,All right.  I'm in.
134,RIPLEY,134,"And you my dear, are staying
right here."
135,SPUNKMEYER,135,"Arrgh.  I'm getting too old for
this shit."
136,DRAKE,136,"They ain't payin' us enough
for this."
137,DIETRICH,137,"Not enough to have to wake up
to your face, Drake."
138,DRAKE,138,"Suck air.  Hey, Hicks...you look
like I feel."
139,HUDSON,139,This floor's freezing.
140,APONE,140,"Christ.  I never saw such a
buncha old women.  You want me
to fetch your slippers, Hudson?"
141,HUDSON,141,"Would you, Sir?"
142,HUDSON,142,"Hey, Vasquez...you ever been
mistaken for a man?"
143,VASQUEZ,143,No.  Have you?
144,FROST,144,"Hey, hand job, you take my
towel?"
145,SPUNKMEYER,145,"I need some slack, man.  How
come they send us straight back
out like this?  We got some slack
comin', man."
146,HICKS,146,You just got three weeks.
147,SPUNKMEYER,147,"I mean breathing, not this frozen
shit."
148,DIETRICH,148,"Yeah, 'Top'...what about it?"
149,APONE,149,You know it ain't up to me.
150,APONE,150,"Awright!  Let's knock off the
grabass.  First assembly's in
fifteen...let's shag it."
151,VASQUEZ,151,Who's the fresh meat again?
152,FERRO,152,"She's supposed to be some kinda
consultant...
(exaggerated)
...She was an alien once."
153,HUDSON,153,Whoooah!  No shit?  I'm impressed.
154,APONE,154,Let's go...let's go.  Cycle through!
155,HUDSON,155,"Hey, 'Top.'  What's the op?"
156,APONE,156,"Rescue mission.  There's some
juicy colonists' daughters we
gotta rescue from virginity."
157,SPUNKMEYER,157,"Shee-it.  Dumbass colonists.
What's this crap supposed to be?"
158,WIERZBOWSKI,158,"Cornbread, I think.  Hey, I wouldn't
mind getting me some more a
that Arcturan poontang.  Remember
that time?"
159,HICKS,159,"Looks like that new Lieutenant's
too good to eat with us grunts."
160,WIERZBOWSKI,160,"Yeah.  Got a corn cob up his ass,
definitely."
161,BISHOP,161,"I'm sorry you feel that way
about Synthetics, Ripley."
162,RIPLEY,162,"You never said anything about an
android being here!  Why not?"
163,BURKE,163,"Well, it didn't occur to me.  It's
been policy for years to have a
synthetic on board."
164,BISHOP,164,"I prefer the term 'artificial person'
myself.  Is there a problem?"
165,BURKE,165,"A synthetic malfunctioned on her
last trip out.  Some deaths were
involved."
166,BISHOP,166,I'm shocked.  Was it an older model?
167,BURKE,167,Cyberdyne Systems 120-A/2.
168,BISHOP,168,"Well, that explains it.  The
A/2's were always a bit twitchy.
That could never happen now with
out behavioral inhibitors.  Impossible
for me to harm or, by omission of
action, allow to be harmed a
human being."
169,BISHOP,169,More cornbread?
170,RIPLEY,170,"Just stay away from me, Bishop!
You got that straight?"
171,WIERZBOWSKI,171,"She don't like the cornbread
either."
172,APONE,172,Tench-hut!
173,GORMAN,173,"At ease.  I'm sorry we didn't
have time to brief before we
left Gateway but..."
174,HUDSON,174,Sir?
175,GORMAN,175,"Yes, Hicks?"
176,HUDSON,176,"Hudson, Sir.  He's Hicks."
177,GORMAN,177,What's the question?
178,HUDSON,178,"Is this going to be a stand-up
fight, Sir, on another bug-hunt?"
179,GORMAN,179,"All we know is that there's
still no contact with the colony
and that a xenomorph may be
involved."
180,WIERZBOWSKI,180,A what?
181,HICKS,181,It's a bug-hunt.
182,HICKS,182,So what are these things?
183,RIPLEY,183,"I've dictated what I know on
these."
184,APONE,184,Tease us a bit.
185,SPUNKMEYER,185,Yeah...previews.
186,RIPLEY,186,"Okay.  It's important to understand
this organism's life cycle.  It's
actually two creatures.  The first
form hatches from a spore...a sort
of large egg, and attaches itself
to its victim.  Then it injects
an embryo, detaches and dies.
It's essentially a walking sex organ.
The --"
187,HUDSON,187,"Sounds like you, Hicks."
188,RIPLEY,188,"The embryo, the second form, hosts
in the victim's body for several
hours.  Gestating.  Then it..."
189,RIPLEY,189,"...then it...emerges.  Moults.
Grows rapidly --"
190,VASQUEZ,190,I only need to know one thing.
191,RIPLEY,191,Yes?
192,VASQUEZ,192,Where they are.
193,DRAKE,193,Yo!  Vasquez.  Kick ass!
194,VASQUEZ,194,Anytime.  Anywhere.
195,HUDSON,195,"Somebody said alien...she
thought they said illegal alien
and signed up."
196,VASQUEZ,196,Fuck you.
197,HUDSON,197,Anytime.  Anywhere.
198,RIPLEY,198,"Am I disturbing you conversation
Mr. Hudson?"
199,RIPLEY,199,"I hope you're right.  I really
do."
200,BURKE,200,"I suggest you study the disks
Ripley has been kind enough to
prepare for you."
201,GORMAN,201,Are there any questions?  Hudson?
202,HUDSON,202,"How do I get out of this
chicken-shit outfit?"
203,GORMAN,203,"All right.  I want this to go
smooth and by the numbers.  I
want DCS and tactical database
assimilation by 0830."
204,GORMAN,204,"Ordnance loading, weapons strip and
drop-ship prep details will have
seven hours..."
205,BISHOP,205,"Attention.  This concluded final
maneuvering operations.  Thank
you for your cooperation.  You
may resume work."
206,BURKE,206,Still nothing from the colony?
207,GORMAN,207,Dead on all channels.
208,FROST,208,"Clear, please."
209,HUDSON,209,Excuse me.
210,RIPLEY,210,"I feel like a fifth wheel
here.  Is there anything I can
do?"
211,APONE,211,"I don't know.  Is there anything
you can do?"
212,RIPLEY,212,"I can drive that loader.  I've
got a Class Two rating.  My
latest career move."
213,RIPLEY,213,Where you want it?
214,APONE,214,"Let's move it, girls!  On
the ready line.  Let's go,
let's go."
215,HUDSON,215,"I am ready, man.  Ready to get
it on.  Check-it-out.  I am the
ultimate badass...state of the
badass art.  You do not want to
fuck with me.  Hey, Ripley, don't
worry.  Me and my squad of
ultimate badasses will protect you.
Check-it-out..."
216,HUDSON,216,"Independently targetting
particle-beam phalanx.  VWAP!
Fry half a city with this puppy.
We got tactical smart-missles,
phased-plasma pulse-rifles,
RPG's.  We got sonic eeelectronic
ballbreakers, we got nukes, we
got knives...sharp sticks --"
217,HICKS,217,Save it.
218,HUDSON,218,"Sure, Hicks."
219,BURKE,219,Here we go.
220,FERRO,220,"Initiate release sequencer on my
mark.  Three.  Two.  One.  Mark!"
221,FERRO,221,Switching to DCS ranging.
222,SPUNKMEYER,222,"Two-four-o.  Nominal to profile.
Picking up some hull ionization."
223,FERRO,223,Got it.  Rough air ahead.
224,FERRO,224,Stand by for some chop.
225,RIPLEY,225,"How may drops is this for you,
Lieutenant?"
226,GORMAN,226,Thirty-eight...simulated.
227,VASQUEZ,227,How many combat drops?
228,GORMAN,228,"Well...two.  Three, including
this one."
229,FERRO,229,"Turning on final.  Coming around to
a seven-zero-niner.  Terminal
guidance locked in.  Where's
the damn beacon?"
230,GORMAN,230,"Let's see.  Everybody on line.
Drake, check you camera.  There
seems to be a..."
231,GORMAN,231,"...that's better.  Pan it around
a bit."
232,APONE,232,"Awright.  Fire-team A.  Gear up.
Let's move.  Two minutes.
Somebody wake up Hicks."
233,RIPLEY,233,That the atmosphere processor?
234,BURKE,234,"Uh-hunh.  One of thirty or so,
all over the planet.  They're
completely automated.  We
manufacture them, by the way."
235,GORMAN,235,"Hold at forty.  Slow circle of
the complex."
236,RIPLEY,236,"The structure seems intact.  They
have power."
237,GORMAN,237,"Okay, let's do it."
238,APONE,238,"Awright!  I want a nice clean
dispersal this time."
239,VASQUEZ,239,You staying in here?
240,RIPLEY,240,You bet.
241,VASQUEZ,241,Figures.
242,GORMAN,242,"Set down sixty meters this side
of the telemetry mast.  Immediate
dust off on my 'clear,' then stay
on station."
243,APONE,243,"Ten seconds, people.  Look sharp!"
244,GORMAN,244,"First squad up, on line.  Hicks,
get yours in a cordon.  Watch the
rear."
245,APONE,245,"Vasquez, take point.  Let's move."
246,APONE,246,"Sealed.  Hudson, run a bypass."
247,APONE,247,"First squad, assemble on me at
the main lock."
248,GORMAN,248,"Second team, move up.
Flanking positions."
249,GORMAN,249,"Quarter and search by twos.  Second
team move inside.  Hicks, take the
upper level.  Use your motion
trackers."
250,HICKS,250,Nothing.  No movement.
251,BURKE,251,Looks like my room in college.
252,RIPLEY,252,Wait!  Tell him to...
253,RIPLEY,253,"...Hicks.  Back up.  Pan left.
There!"
254,HICKS,254,"You seeing this okay?  Looks
melted."
255,BURKE,255,Hmm.  Acid for blood.
256,HICKS,256,"Looks like somebody bagged them
one of Ripley's bad guys here."
257,HUDSON,257,"Hey, if you like that, you're gonna
love this..."
258,APONE,258,Second squad?  What's your status?
259,HICKS,259,"Just finished our sweep.
Nobody home."
260,APONE,260,"The place is dead, Sir.  Whatever
happened, we missed it."
261,GORMAN,261,"All right, the area's secured.
Let's go in and see what their
computer can tell us."
262,GORMAN,262,"First team head for operations.
Hudson, see if you can get their
CPU on line.  Hicks, meet me at
the south lock by the up-link
tower..."
263,GORMAN,263,...We're coming in.
264,HUDSON,264,"He's coming in.  I feel safer
already."
265,VASQUEZ,265,Pendejo jerkoff.
266,HUDSON,266,"Sir, the CPU is on-line."
267,GORMAN,267,"Okay, stand by in operations."
268,GORMAN,268,Let's go.
269,RIPLEY,269,Burke!
270,WIERZBOWSKI,270,Scare you?
271,RIPLEY,271,"Christ, Wierzbowski!"
272,WIERZBOWSKI,272,"Sorry.  Hicks said to keep an
eye on you."
273,GORMAN,273,"Looks like you company can write
off its share of this colony."
274,BURKE,274,It's insured.
275,FRONT,275,"Sir, you should check this out..."
276,FROST,276,Right ahead here...
277,WIERZBOWSKI,277,Last stand.
278,GORMAN,278,No bodies?
279,FROST,279,"No, Sir.  Looks like it was a
helluva fight."
280,RIPLEY,280,Over there.
281,BURKE,281,Are these the same...?
282,RIPLEY,282,"Watch it, Burke..."
283,HICKS,283,It likes you.
284,BURKE,284,"These are dead.  There's just
the two alive."
285,RIPLEY,285,"Removed surgically before embryo
implantation.  Subject:  Marachuk,
John L.   Died during procedure."
286,RIPLEY,286,They killed him getting it off.
287,HICKS,287,Poor bastard.
288,HICKS,288,Behind us.
289,RIPLEY,289,One of us?
290,GORMAN,290,"Apone...where are your people?
Anybody in D-Block?"
291,APONE,291,Negative.  We're all in Operations.
292,HICKS,292,It's moving.
293,VASQUEZ,293,Which way?
294,VASQUEZ,294,You fuck!
295,RIPLEY,295,Come on out.  It's all right...
296,HICKS,296,"Ow!  Shit.  Watchit, she bites."
297,RIPLEY,297,"It's okay, it's okay.  It's over...
you're going to be all right now...
it's okay...you're safe..."
298,GORMAN,298,What's her name again?
299,DIETRICH,299,Rebecca.
300,GORMAN,300,"Now think, Rebecca.
Concentrate.  Just start at
the beginning..."
301,GORMAN,301,"Where are your parents?  You
have to try..."
302,RIPLEY,302,"Gorman!  Give it a rest would
you."
303,GORMAN,303,Total brain-lock.
304,DIETRICH,304,"Physically she's okay.
Borderline malnutrition, but
I don't think any permanent
damage."
305,GORMAN,305,"Come on, we're wasting our
time."
306,RIPLEY,306,"Here, try this.  A little
instant hot chocolate."
307,RIPLEY,307,"Poor thing.  You don't talk
much do you?  That's okay by
me.  Most people do a lot of
talking and they wind up not
saying very much."
308,RIPLEY,308,"Uh oh.  I made a clean spot
here.  Now I've done it.  Guess
I'll just have to do the whole
thing."
309,RIPLEY,309,"Hard to believe...there's a
little girl under all this.
And a pretty one at that."
310,BURKE,310,What's he scanning for?
311,GORMAN,311,"PDT'S.  Personal-Data Transmitters.
Every adult colonist had one
surgically implanted."
312,HUDSON,312,"If they're within twenty
klicks we'll read it out here,
but so far...zip."
313,RIPLEY,313,"I don't know how you managed
to stay alive but you're one
brave kid, Rebecca."
314,NEWT,314,N-newt.
315,RIPLEY,315,What did you say?
316,NEWT,316,"Newt.  My n-name's Newt.
Nobody calls me Rebecca except
my dork brother."
317,RIPLEY,317,"Well, Newt it is then.  My
name's Ripley...and people
call me Ripley."
318,RIPLEY,318,"Pleased to meet you.  And who
is this?  Does she have a
name?"
319,NEWT,319,Casey.  She's my only friend.
320,RIPLEY,320,What about me?
321,NEWT,321,I don't want you for a friend.
322,RIPLEY,322,Why not?
323,NEWT,323,"Because you'll be gone soon,
like the others.  Like
everybody.  You'll be dead
and you'll leave me alone."
324,RIPLEY,324,"Oh, Newt.  You mom and dad
went away like that, didn't
they?"
325,RIPLEY,325,"They'd be here if they could,
honey.  I know they would."
326,NEWT,326,They're dead.
327,RIPLEY,327,"Newt.  Look at me...Newt.  I
won't leave you.  I promise."
328,NEWT,328,You promise?
329,RIPLEY,329,Cross my heart.
330,NEWT,330,And hope to die?
331,RIPLEY,331,And hope to die.
332,HUDSON,332,"Hah!  Stop your grinnin' and
drop your linen!  Found 'em."
333,GORMAN,333,Alive?
334,HUDSON,334,"Unknown.  But, it looks like
all of them.  Over at the
processing station...sublevel
'C' under the south tower."
335,HICKS,335,"Looks like a Goddamn town
meeting."
336,GORMAN,336,Let's saddle up.
337,APONE,337,"Awright, let's go girls, they
ain't payin' us by the hour."
338,NEWT,338,"I was the best at the game.
I knew the whole maze."
339,RIPLEY,339,"The 'maze'?  You mean the
air ducts?"
340,NEWT,340,"Yeah, you know.  In the walls,
under the floor.  I was the
ace.  I could hide better
than anybody."
341,RIPLEY,341,"You're really something, ace."
342,GORMAN,342,"Forty meters in.  Ramp on
axial two-two.  Access to
sublevels."
343,GORMAN,343,B-Level.  Next one down.
344,GORMAN,344,"We're not making that out too
well.  What is it?"
345,HUDSON,345,"You tell me.  I only work
here."
346,GORMAN,346,What is it?
347,RIPLEY,347,I don't know.
348,GORMAN,348,Proceed inside.
349,RIPLEY,349,Oh God...
350,DIETRICH,350,"Looks like some sort of secreted
resin."
351,GORMAN,351,"They ripped apart the colony
for building materials."
352,RIPLEY,352,"And the colonists...When they
were done with them."
353,RIPLEY,353,"Newt, you better go sit up
front.  Go on."
354,FROST,354,Hotter'n hell in here.
355,HUDSON,355,"Yeah...but it's a dry
heat."
356,RIPLEY,356,"They're right under the
primary heat exchangers."
357,BURKE,357,"Yeah?  Maybe the organisms like
the heat, that's why they built..."
358,RIPLEY,358,"That's not what I mean.  Gorman,
if your men have to use their
weapons in there, they'll rupture
the cooling system."
359,BURKE,359,She's right.
360,GORMAN,360,So.
361,RIPLEY,361,"So...then the fusion
containment shuts down."
362,GORMAN,362,So?  So?
363,BURKE,363,"We're talking thermonuclear
explosion."
364,GORMAN,364,Shit.
365,GORMAN,365,"Apone, collect magazines
from everybody.  We can't
have any firing in there."
366,WIERZBOWSKI,366,Is he fucking crazy?
367,HUDSON,367,"What're we supposed to use,
man?  Harsh language?"
