,character,line #,line
382,BLADE,382,How can you be out here?
383,FROST,383,"I dabble in pharmaceuticals, medical
research. We've developed a type of
sun-blocker using octyl salicylate, a
few others things."
384,FROST,384,"It's not very effective in direct
sunlight, but it's a start. The goal,
of course, is to be like you, ""the
Day-walker""."
385,BLADE,385,I don't buy it.
386,FROST,386,"Why not? The future of our race runs
through your bloodstream. You've got
the best of both worlds, Blade. All of
our strengths and none of our
weaknesses."
387,BLADE,387,Maybe I don't see it that way.
388,FROST,388,"Oh, so it's back to pretending we're
human again, is it? Spare me the Uncle
Tom routine. You can't keep denying
what you are. You're one of us, Blade.
You always have been."
389,BLADE,389,You're wrong.
390,FROST,390,"Am I? You think the humans will ever
accept a half-breed like you? They
can't. They're afraid of you."
391,FROST,391,"The humans fear us because we're
superior. They fear us because in
their hearts they know their race has
become obsolete."
392,FROST,392,"Look at them, just an endless stream
of cattle in a mad race to the
slaughterhouse."
393,FROST,393,The pause that refreshes --
394,FROST,394,"Care for some? Smells good, doesn't
it? Pungent, with just an
irrepressible hint of iron."
395,BLADE,395,Pass.
396,FROST,396,"You sure now? I bled a newborn for
this. You won't find a drink that's
sweeter."
397,FROST,397,"Tell me honestly, do you really get
the same rush from that pasteurized
piss-serum of yours?"
398,FROST,398,"You're surprised I know about your
serum? You shouldn't be. I know
everything about you."
399,FROST,399,"You can't keep walking the razor's
edge, Blade. The day will come -- and
soon, when you'll have to choose
between our kind and their's. If I
were you, I'd take care not to wind up
on the wrong end of the fang."
400,FROST,400,"Love to continue this chat, but it
appears I'm melting."
401,BLADE,401,You're not going anywhere.
402,FROST,402,Watch me.
403,MERCURY,403,"This is Mercury. Tell Deacon I've
found their hiding place."
404,BLADE,404,Any progress?
405,KAREN,405,Some. It's been slow --
406,BLADE,406,You don't look so good.
407,KAREN,407,"I'm just tired, that's all. We've been
up all night."
408,KAREN,408,Excuse me.
409,BLADE (O.S.),409,It's started.
410,BLADE,410,You've got another day or two at most.
411,BLADE,411,"For what it's worth, I'm sorry."
412,KAREN,412,"You make it sound like I'm already
dead."
413,MAN,413,Extranjero. ¿Quien es?
414,BLADE,414,I'm here to see Miracia. Kam sent me.
415,WOMAN,415,This way.
416,KAREN,416,"All right, let's start with the basics
-- why do vampires need to drink
blood?"
417,WHISTLER,417,"Their own blood can't sustain
hemoglobin."
418,KAREN,418,"Then vampirism is a genetic defect,
just like Hemolytic anemia?"
419,KAREN,419,So what about gene therapy?
420,KAREN,420,"Basically you'd have to re-write the
victim's DNA, alter it so that the DNA
will produce proteins capable of
generating hemoglobin."
421,WHISTLER,421,How?
422,KAREN,422,"With a retrovirus. It's injected into
the bone marrow cells, it causes the
host's DNA to mutate. They've been
using them to treat Sickle-cell
anemia."
423,WHISTLER,423,"You're serious? You actually think
this could work?"
424,KAREN,424,"On me, yes. On Blade, I'm not so
sure --"
425,KAREN,425,"The problem is, Blade didn't contract
the vampire virus from a bite like I
did. He was born with it. The irony
is, I could probably cure every
vampire but him."
426,WHISTLER,426,"Then we're back to square one, aren't
we? Sooner or later, the Thirst always
wins."
427,KAREN,427,What happened to the power?
428,WHISTLER,428,"I don't know, but the back-up
generator should've kicked in."
429,WHISTLER,429,UV floodlights are down too.
430,WHISTLER,430,Get it!!!
431,WHISTLER,431,"Understand this -- they are monsters.
Hesitate for even a moment, and you've
lost."
432,FROST (O.S.),432,"Words to live by, Whistler."
433,FROST,433,"It's been a long time, hasn't it, ""old
friend""?"
434,MIRACIA,434,"Is something wrong, my friend?"
435,BLADE,435,You're blind --
436,MIRACIA,436,There are other ways to see. Sit.
437,MIRACIA,437,"Perhaps you have brought me something
-- an offering for the orishas?"
438,MIRACIA,438,Hold out your hands.
439,BLADE,439,"I didn't come here to get my palms
read. I need something translated."
440,MIRACIA,440,Show me.
441,MIRACIA,441,Sangre. Written in blood.
442,MIRACIA,442,"This is an old tongue, from an old
world. It concerns LaMagra."
443,BLADE,443,Who is LaMagra?
444,MIRACIA,444,"The vampire God. This speaks of His
return."
445,MIRACIA,445,"""-- there will come a Day Walker."""
446,MIRACIA,446,"""His blood will call the Sleeper from
beyond the Veil of Tears."""
447,BLADE,447,His blood -- ?
448,MIRACIA,448,"The Day Walker's blood is a disparador
-- a trigger, you see? For LaMagra's
return. One need only consume it and
the spirit of his ancestors will
settle upon him."
449,MIRACIA,449,"""And the Sleeper will rise from the
shadows anew, cleansing the world in a
Tide of Blood."""
450,BLADE,450,"""The Blood Tide""."
451,MIRACIA,451,"Yes. The vampire apocalypse. It is
said that all who feel its taint will
succumb to the Thirst."
452,BLADE,452,How do I stop it?
453,MIRACIA,453,"The Great Wheel turns, my friend. The
Dark is rising. How would you fight a
shadow?"
454,MIRACIA,454,I am tired. Dawn is coming.
455,BLADE,455,But I just got here --
456,MIRACIA,456,"You've been here longer than you
think."
457,BLADE,457,WHISTLER?!
458,BLADE,458,"Jesus, Whistler, what did they do to
you?"
459,WHISTLER,459,Frost took her --
460,BLADE,460,Don't try to talk --
461,WHISTLER,461,"Listen. You have to -- finish me off.
You don't want me coming back."
462,BLADE,462,"No, we can treat the wounds --"
463,WHISTLER,463,"Too far gone, you know that."
464,BLADE,464,"Whistler, I can't."
465,WHISTLER,465,Yes you can. Now get on with it.
466,BLADE,466,"Whistler, I --"
467,WHISTLER,467,I know.
468,WHISTLER,468,"Just be quick about it, will you? Do
it right."
469,FROST,469,"Hello, Blade. By the time you watch
this, Whistler will no doubt be
winging his way to Heaven, thanks to
your capable hands. If it makes any
difference to you, he put up quite a
fight."
470,FROST,470,"Now, I'm sure you're wondering about
Ms. Jansen's well-being. She's alive
and kicking -- ""ambulatory"", as they
like to say in the trade. Whether or
not she remains so is entirely up to
you."
471,FROST,471,"I'll make this as easy as possible for
you, Blade. You can find us at the
Edgewood Towers. We'll be waiting with
baited breath."
472,FROST,472,"Well, here we are, Doctor."
473,KAREN,473,Why haven't you killed me yet?
474,MERCURY,474,"Deacon likes to play with his food
before he eats it."
475,KAREN,475,How many of you are there?
476,FROST,476,"A few thousand scattered about the
globe. In the past, we've had to
restrict our numbers for fear of
discovery. That won't be necessary
after tonight."
477,KAREN,477,What happens then?
478,FROST,478,"The Blood Tide. Our long-prophesied
holy war against the humans. There's a
force, you see -- a spirit that exists
in our blood. I've discovered a way to
invoke it."
479,KAREN,479,LaMagra --
480,FROST,480,"That's right. The answers were there
all along, of course, scribbled down
in the forgotten languages of my kind.
Waiting for someone with the patience
to decipher them.
My elders were foolish enough to
dismiss them as wives tales. But I
knew better."
481,FROST,481,"Imagine my surprise when Blade turned
out to be the key which would set that
force free."
482,FROST,482,"LaMagra isn't a physical being. He's a
spirit, requiring a flesh and blood
host in order to manifest himself."
483,KAREN,483,You.
484,FROST,484,Who better to usher in the Blood Tide?
485,KAREN,485,"There's no need for any of this. Your
condition can be treated. Whistler and
I were working on a cure when --"
486,FROST,486,"What makes you think we want to be
cured? Blood is only part of the
equation. The hunt, the killing,
that's what the Thirst is really
about."
487,KAREN,487,But you use blood banks --
488,FROST,488,"Only as a last resort. Preserved blood
is inferior. There's no flavor left to
it, no life."
489,FROST,489,"Fortunately, I've found a way around
that particular obstacle."
490,FROST,490,"Under these conditions I can keep a
donor alive for years, producing
anywhere from fifty to a hundred pints
of blood."
491,FROST,491,"Of course, this is just a pilot
program, really. Once the Tide comes,
we'll need to expand production. So
many more mouths to feed --"
492,KAREN,492,You're a monster.
493,FROST,493,"Why? Because we live at another
species' expense? Your people farm
cattle and veal, don't they? Fattening
them up with steroids? It's called
evolution, Doctor. Survival of the
fittest."
494,FROST,494,"I have a wake-up call for the human
race. You're no longer at the top of
the food chain."
495,VAMPIRE,495,"You think I'm afraid of that toothpick
of yours?"
496,BLADE,496,"You should be. I've made some
improvements."
497,VANESSA,497,Jason.
498,BLADE,498,Mother -- ?!
499,VANESSA,499,"I've missed you so much, Jason."
500,VANESSA,500,"You have no idea what I've been
through, how much I've wanted to see
you --"
501,BLADE,501,But you -- died --
502,VANESSA,502,Deacon brought me back.
503,BLADE,503,Fight him --
504,FROST,504,"She can't. She's one of my thralls
now. She has about as much free will
as a puppet on a string."
505,FROST,505,"You love me, don't you, Vanessa?"
506,VANESSA,506,Yes.
507,FROST,507,"What do we have here? Your precious
serum? I don't think you'll be needing
this anymore."
508,BLADE,508,Please --
509,VANESSA,509,"Listen to your father, Jason. It's
going to be a better world."
510,FROST,510,"Don't look so surprised, Blade. You've
spent your life looking for the
vampire who fathered you. Well you can
rest easy now, you've found him."
511,FROST,511,Daddy's here.
512,FROST,512,"It's true, Blade. You've got my blood
running through your veins."
513,FROST,513,"Thirty years ago. A moonlit street, a
woman on her way home alone. You were
conceived the night I tore my fangs
into your mother's flesh."
514,KAREN,514,Are you all right?
515,BLADE,515,I've been better --
516,BLADE,516,How long have we been driving?
517,KAREN,517,"I don't know. I woke up just before
you did --"
518,KAREN,518,Is it bad?
519,BLADE,519,"We get out of this alive, maybe I'll
take that miracle cure of yours."
520,KAREN,520,It won't work on you.
521,BLADE,521,What are you talking about?
522,KAREN,522,"Your condition's congenital, the
genetic mutations occurred in utero.
All the other victims contracted
vampirism after birth."
523,KAREN,523,"I can't cure you, Blade. I can cure
myself, but I can't cure you."
524,KAREN,524,I'm so sorry.
525,FROST,525,"Welcome home, children."
526,FROST,526,"On its surface, this building houses
one of the city's oldest financial
institutions -- and for over
two-hundred years its served our
corporate needs. Look beneath the
surface, however, and you'll discover
another truth entirely --"
527,FROST,527,"As above, so below."
528,FROST,528,"Welcome to our hall of ancients,
Doctor. We call it the Temple of
Night."
529,FROST,529,Let's see this sword of his.
530,FROST,530,"Still quite sharp, I see."
531,KAREN,531,Blade --
532,FROST,532,"You're wasting your breath, woman. He
can't hear you now. It's the Thirst,
you see? It already has him in its
grip."
533,FROST,533,"How long has it been since you had
your serum? Twelve hours? More? You
must be quite thirsty by now."
534,FROST,534,"What does it feel like? Is your blood
on fire? Are you burning up inside?
Give in to the Thirst, Blade. Embrace
your true nature."
535,BLADE,535,-- go to hell --
536,FROST,536,"I've got news for you, Blade. We're
already here."
537,FROST,537,"Take him to the sanctuary. It's time
he was bled."
538,FROST,538,"I'd let you watch the proceedings,
Doctor, but I'm afraid that privilege
is reserved for members of my own
race. Don't worry, though, I've made
alternate arrangements for you."
539,FROST,539,"We call this the Bone Pit. It's where
we keep our mistakes, the ones who
couldn't successfully make the
transition from human to vampire."
540,FROST,540,"They'll feed on anything, given the
chance -- animals, corpses, even other
vampires."
541,FROST,541,"Of course, a strapping young woman
like yourself -- well I think you just
might be considered finger food."
542,FROST,542,"It's been a long road, hasn't it? Such
a pity Whistler led you so far astray."
543,FROST,543,"I don't blame you, though. I want you
to know that. Even after all you've
done. I understand, Blade, I really
do. It's the human side of you which
has corrupted your reasoning, made you
weak. But we'll take care of that,
won't we?"
544,BLADE,544,"I'd kill myself -- before I turned
into something like you."
545,FROST,545,"No you wouldn't. I'm going to bleed
you dry, Blade. All the poison that
makes you human."
546,FROST,546,"When the Tide comes, you'll be begging
me put you through the Change."
547,FROST,547,"It's done. We should ready ourselves
for the ritual of invocation."
548,VANESSA (O.S.),548,"There's no use fighting us, Jason."
549,BLADE,549,How could you be a part of this?
550,VANESSA,550,"These are my people now. I'm one of
them."
551,BLADE,551,You don't have to be.
552,VANESSA,552,"You don't understand. I've killed,
I've hunted, and I've enjoyed it."
553,VANESSA,553,"I wish you could see the world as I
do. Deacon opened my eyes. There's no
turning back from that."
554,BLADE,554,I don't believe that.
555,VANESSA,555,"You will. Time is on our side. Sooner
or later, the Thirst always wins."
556,BLADE,556,Mother!
557,VANESSA,557,"Your mother died the night you
were born."
558,REVENANT (O.S.),558,Karennnnn --
559,REVENANT,559,"Karreennnnnn. I never thought I'd see
you againnnnn."
560,KAREN,560,Curtis?!
561,CURTIS REVENANT,561,"Tell, me, Karennn -- ever have second
thoughts -- about us?"
562,MERCURY,562,"It won't be long now, lover."
563,QUINN,563,We should finish him off.
564,MERCURY,564,No. Deacon wants him turned.
565,QUINN,565,"Fucking waste, if you ask me."
566,FROST,566,"Tonight is the night we've waited our
entire lives for. Tonight, the
blood-dimmed Tide is loosed upon the
world. Tonight, the Age of Man comes
to an end."
567,KAREN,567,Blade.
568,FROST,568,"""And what rough beast, its hour come
round at last, slouches towards
Bethlehem to be born?"""
569,BLADE,569,Get out of here --
570,KAREN,570,I'm not leaving without you.
571,BLADE,571,You don't understand. The Thirst --
572,BLADE,572,-- tearing me -- apart.
573,KAREN,573,I know. Take some of my blood.
574,BLADE,574,No --
575,KAREN,575,"It's the only way. You know that.
We'll never get out of here alive if
you don't."
576,BLADE,576,I can't -- I won't be able to stop --
577,KAREN,577,"Yes you will. The human side of you is
stronger. I know it is."
578,BLADE,578,NO!!!!
579,KAREN,579,Don't stop --
580,KAREN,580,My God --
581,KAREN,581,Are you -- all right?
582,BLADE,582,Never been better.
583,MERCURY,583,Deacon?
584,FROST,584,No longer.
585,BLADE (O.S.),585,Frost!!!
586,BLADE,586,Who dies first?
587,FROST,587,Take him.
588,QUINN,588,Grew another hand for you sweetmeat --
589,QUINN,589,-- and now I'm gonna kill you with it.
590,BLADE,590,"Let's see if you can grow a new one
of these!"
591,BLADE,591,Next?
592,MERCURY,592,Have a taste of your own medicine!
593,FROST (O.S.),593,Enough!!!
594,FROST,594,"You're too late, Blade. I'm already
changing. Don't you see? The Sleeper
has awakened. I'm not just Frost
anymore. I'm becoming a god now,
blood incarnate."
595,VANESSA,595,"Did you think I'd forgotten you, you
little whore?"
596,FROST,596,You can't hurt me anymore.
597,BLADE,597,Where are you?!
598,FROST,598,Everywhere.
599,FROST,599,You want my blood so much?! Take it!
600,FROST,600,"I was wrong about you, Blade. You were
never one of us. You're a traitor to
your race."
601,KAREN (O.S.),601,Get away from him!
602,KAREN,602,Blade!
603,BLADE,603,"Guess you're not quite as invulnerable
as you thought."
604,FROST,604,"You're wrong -- a few minutes more, and
my transition will be complete. Even
your sword won't be able to affect me
then."
605,BLADE,605,"You don't have a few minutes, Frost."
606,FROST,606,"Just as I thought. Still chained to
your mother's breast after all these
years."
607,FROST,607,"You're too human, Blade."
608,BLADE,608,"It's because I'm human that I can do
this."
609,KAREN (O.S.),609,Blade?
610,KAREN,610,"I never imagined I'd be so happy to
see the sun rise --"
611,KAREN,611,"It's over, isn't it?"
612,BLADE,612,For them. But for me --
613,BLADE,613,I feel like it's finally beginning.
