,character,line #,line
0,ELI,0,"Dear Lord, thank you for your
generosity in providing us today
with this bountiful feast."
1,ELI,1,"Thank you for the many gifts that
you have given me. Thank you for
your protection and your guidance.
Thank you for bringing me this far.
I know my long journey's end is
near. I ask now only for the
strength and the courage to
complete the task that you in your
infinite wisdom saw fit to bestow
upon me over all men. I won't let
you down. Amen."
2,ELI,2,Hey. You hungry?
3,ELI,3,Come on now.
4,YOUNG WOMAN,4,"Oh. Please don't hurt me. Here,
take anything you want. You want
some food? Take it."
5,ELI,5,I'm not going to hurt you.
6,YOUNG WOMAN,6,That's what the last guys said.
7,ELI,7,Here.
8,YOUNG WOMAN,8,"Could you help me? The wheel came
off. I can't fix it. Maybe if I
could get it out of the ditch. But
I can't."
9,ELI,9,"One good thing about no soap any
more. You can smell the road agents
a mile off."
10,BANDIT LEADER,10,Dumb bitch. What did we tell you?
11,BANDIT LEADER,11,What you got there in the pack?
12,ELI,12,Nothing.
13,BANDIT LEADER,13,"Yeah, that's what they all say. How
about you take it off real slow and
tip it out so's we can take a look?"
14,BANDIT #2,14,He's got a gun.
15,BANDIT LEADER,15,"Shit, it ain't loaded. They never
are. Ain't that right, old man?"
16,BANDIT LEADER,16,Open the fucking pack or die.
17,ELI,17,I can't do that.
18,BANDIT LEADER,18,"Want us to do it for you? We can
get it off real easy after we've
hacked your fucking arms off."
19,ELI,19,"It's real important you boys listen
to me and understand. The man I
work for, you do not want to cross
him. See, I'm under his protection.
You stand in my way, you stand in
his. And he will cut you down with
a righteous fury - through me. For
I am his faithful instrument."
20,BANDIT LEADER,20,"What the hell are you, some kinda
preacher?"
21,ELI,21,Something like that.
22,BANDIT LEADER,22,"Well I got news for you, preacher
man. Whatever kinda God you reckon
yourself to be working for, he left
these parts a long time ago. He
ain't here to protect your ass. Now
take off the pack and set it on the
ground."
23,BANDIT LEADER,23,You fucking listening to me?
24,ELI,24,"I hear you. You lay that hand on me
again and you will not get it back."
25,BANDIT LEADER,25,"All right, I had just about enough
of this shit..."
26,BANDIT LEADER,26,"What... you just... he just cut my
fucking hand off! My fucking hand!"
27,BANDIT LEADER,27,"What you standin' around for? Kiss
him!"
28,BANDIT #3,28,"What's he talkin' about, kiss him?"
29,ELI,29,"He's in shock. He means ""kill him""."
30,ELI,30,"I told you you wouldn't be getting
that back."
31,BANDIT LEADER,31,Who are you?
32,ELI,32,My name is Eli.
33,ELI,33,"Take it and go on your way. And
don't fall in with men like these
again. No good can come."
34,YOUNG WOMAN,34,Why are you doing this?
35,ELI,35,"God, the father of mercies, through
the death and resurrection of his
son has reconciled the world to
himself and sent the holy spirit
among us for the forgiveness of
sins."
36,ELI,36,"Through the ministry of the church
may he give you pardon and peace,
and I absolve you from your sins in
the name of the father, and of the
son, and of the holy spirit. Amen."
37,YOUNG WOMAN,37,Thank you. You're... a good man.
38,ELI,38,There are no good men on the road.
39,YOUNG WOMAN,39,Where are you going?
40,ELI,40,West.
41,YOUNG WOMAN,41,Can... can I come with you?
42,ELI,42,No.
43,ELI,43,"It ain't your concern. Stay on the
path. It ain't your concern. Stay
on the path."
44,ELI,44,"You got an engineer or a fuelman
around here?"
45,ELI,45,Thanks.
46,CHAIN GANG BOSS,46,"Come on, move it!"
47,ENGINEER,47,I don't know you.
48,ELI,48,I'm not from around here.
49,ENGINEER,49,No shit. Who are you?
50,ELI,50,I'm just a customer.
51,ENGINEER,51,A customer with a shotgun?
52,ENGINEER,52,You come in here to rip me off?
53,ELI,53,No. I'll set it down. Okay?
54,ENGINEER,54,Slowly!
55,ENGINEER,55,"You carry a gun in the outland, you
don't bring one into town less you
live there. Don't you know that?"
56,ELI,56,"I'm sorry, I forgot. I've been on
the road a long time."
57,ENGINEER,57,Show me your hand.
58,ELI,58,I'm not a-
59,ENGINEER,59,I said show me your fucking hand!
60,ELI,60,I'm not one of them.
61,ENGINEER,61,What do you want?
62,ELI,62,"I'm just passing through. I need
some help. I can pay."
63,ENGINEER,63,"What kinda help? And what kinda
pay?"
64,ELI,64,"I'm going to get something out of
my pack. Okay?"
65,ELI,65,"I know, I know. Slowly."
66,ENGINEER,66,Holy shit.
67,ENGINEER,67,Where'd you find this?
68,ELI,68,"Years ago, in the outland back east
aways."
69,ENGINEER,69,Does it work?
70,ELI,70,"Yeah, it just needs a charge. Can
you do it? I got the cables."
71,ENGINEER,71,Depends if you also got the coin.
72,ENGINEER,72,"It'll take a couple hours. There's
a bar across the street you can
wait, they just opened up."
73,ELI,73,I'll wait here.
74,ENGINEER,74,You don't trust me?
75,ELI,75,I don't know you.
76,CARNEGIE,76,What is it?
77,REDRIDGE,77,"Survey team just finished up their
inspection. It ain't good."
78,CARNEGIE,78,How bad is it?
79,REDRIDGE,79,"Pressure is down again, and going
by the new rod they sank levels're
lower than they've ever been."
80,CARNEGIE,80,How long?
81,REDRIDGE,81,"Hard to say. Six months, maybe. A
little longer if we're careful. But
we're already-"
82,CARNEGIE,82,Halve the rations.
83,REDRIDGE,83,We just halved `em last-
84,CARNEGIE,84,So halve them again!
85,REDRIDGE,85,"You're going to have to say
something. Folks were none too
happy last time. Gonna be worse
now, you can count on it."
86,CARNEGIE,86,"I want you all to remember how far
we've come together. And how far we
still can go, if only we believe.
When I brought us here to this
oasis - this promised land - we
knew there would be hardships. Knew
there would be sacrifices. But we
also knew that we were creating for
ourselves a world where we could be
safe from the horrors of the
forsaken lands beyond our borders."
87,CARNEGIE,87,"And I want you all to remember
above all that it is not the water
with which we have been blessed
that is the true lifeblood of this
town... but faith."
88,CARNEGIE,88,"It is our faith that sustains us,
brothers and sisters! Hallelujah!"
89,CARNEGIE,89,"And mark me, the ultimate
validation of that faith is coming!
The sacred Word of Our Lord that
formed the world before and will
reform it once again is coming to
this town to bring it succor, bring
it nourishment, bring it new life!
For the Almighty Himself has spoken
unto me and promised it!"
90,CARNEGIE,90,"In the meantime, He has asked us
all to be patient. To walk the hard
road of the faithful just a little
longer. And to do that, we must
give just a little more."
91,CARNEGIE,91,"Water rations will be halved until
further notice."
92,CARNEGIE,92,"I understand your frustration. The
road to salvation is a difficult
one - but what lies at the end of
that road is a greater glory,
beyond anything you can imagine."
93,DISCONTENTED VILLAGER,93,"We've heard this all before! When
are you going to-"
94,CARNEGIE,94,"I know each and every one of you
will understand the necessity of
this action. It was faith that
built this town - and faith that
will sustain it even through the
dark times that may lie ahead. But
it is always darkest before dawn -
and the new dawn is coming."
95,CARNEGIE,95,May God go with you all.
96,REDRIDGE,96,"One of the road crews just rolled
into town."
97,CARNEGIE,97,"Of course they did, the bar's open.
Outlanders, always looking for
answers at the bottom of a bottle."
98,REDRIDGE,98,Not these guys.
99,REDRIDGE,99,These guys say they got something.
100,CARNEGIE,100,Get them up here now.
101,CARNEGIE,101,"Gentlemen! It's truly a delight to
see you again! I understand your
latest excursion into the outland
has been a profitable one?"
102,HOG,102,We did good.
103,CARNEGIE,103,"Well, let's see, shall we?"
104,CARNEGIE,104,No. No. No. No. No.
105,CARNEGIE,105,It's not here.
106,HOG,106,These ain't worth nothin'?
107,CARNEGIE,107,"When you bring me the book I asked
you for, it'll be worth something."
108,HOG,108,"We been doin' this a long time now.
Had to make a whole lotta corpses
to bring you all these books. You
want us to keep at it, reckon it's
worth more than a few free glasses
of that swill you call liquor."
109,CARNEGIE,109,"Gentlemen, gentlemen. I urge you
once again to take the long view
here. When we find this book - and
believe me, we will find it - we
are going to build a new world. A
world far greater, far more
righteous than this one. And you
and I are going to be perched right
on top of it, looking down upon it,
masters of all creation!"
110,CARNEGIE,110,"And you know, I think you're
absolutely right."
111,CARNEGIE (cont'd),111,"That is worth more than a few
glasses of liquor. A whole lot
more."
112,CARNEGIE,112,"The book I want is out there
somewhere, just waiting to be
found. Once there were millions of
copies - you only need to find one!
Find it and bring it here. And I
promise you, you will be rewarded
beyond anything you can imagine."
113,HOG,113,This better not be bullshit.
114,REDRIDGE,114,"Might help if they knew just what
they were looking for."
115,CARNEGIE,115,"Not one of them can read. How would
they even know when they found it?"
116,REDRIDGE,116,So how's about you just tell me?
117,REDRIDGE,117,"Two years now you been sending
these crews into the outland.
Burning up gas we can barely spare.
For a goddamn book? What the hell
kinda book can be worth all this?"
118,REDRIDGE,118,What about these?
119,CARNEGIE,119,Put them with the others.
120,ELI,120,"What's this place across the
street? They got any water?"
121,ENGINEER,121,"We got our own underground spring
here. Only fresh water in a hundred
miles - if's you can pay for it."
122,ELI,122,I'll be back.
123,ELI,123,"If that battery ain't here when I
get back, I will use this gun on
your kneecaps and I will put this
building to the torch and I will
watch it burn to the ground with
you alive inside it. So help me
God."
124,CLAUDIA,124,"Is that you, honey?"
125,CLAUDIA,125,Something wrong?
126,CARNEGIE,126,"More books came in from the road
today."
127,CLAUDIA,127,Oh? It's been a while.
128,CARNEGIE,128,"And it'll be a while longer. Just
another pile of useless junk. If we
don't find the right one soon - if
I can't give these people what they
want to hear..."
129,CLAUDIA,129,"You'll find what you're looking
for. It's out there somewhere. You
just have to have faith."
130,CARNEGIE,130,"Faith? Is that what you think we're
missing around here?"
131,CARNEGIE,131,"My old man used to have faith. He
had it in spades. My mother, too."
132,CARNEGIE (cont'd),132,"You know where it got them? You
know where it got me?"
133,CARNEGIE,133,"Faith is for the weak. It's for
them out there, the sheep. This
world is what you can see and touch
and taste. It's what you make it.
All these years with me, you still
don't have any grasp of that?
What's wrong with you, woman?"
134,CLAUDIA,134,I'm sorry.
135,CARNEGIE,135,"No, I'm sorry. I didn't mean to
scare you. Hey. You okay?"
136,CARNEGIE,136,"You just get me all riled up with
that kind of talk. It's not what I
need from you right now."
137,CARNEGIE,137,You know what I need right now?
138,BARTENDER,138,Outlander? Let me see-
139,BARTENDER,139,What'll it be?
140,ELI,140,Water.
141,BARTENDER,141,"That's the good stuff. Gotta eat
into my own ration to sell it - so
I don't sell it cheap."
142,BARTENDER,142,That'll get you maybe half-way.
143,BARTENDER,143,What about that?
144,ELI,144,That's the best I got.
145,BARTENDER,145,Solara!
146,BARTENDER,146,"Take this out back and get it
filled."
147,HOG,147,That was my cat.
148,ELI,148,Fine specimen.
149,HOG,149,I saw you push him off the bar.
150,ELI,150,I didn't push him.
151,HOG,151,You raised your hand at him.
152,ELI,152,Sorry. It won't happen again.
153,BARTENDER,153,"Hey, how about another drink, Hog?"
154,HOG,154,"That cat's been comin' in here for
nigh on two years. It got more
right to be here than you. Who the
fuck do you think you are?"
155,ELI,155,I don't want any trouble.
156,HOG,156,"Well, that's too bad, `cause-"
157,ELI,157,"I know you. Murderer of innocent
travelers on the road. You're going
to spend eternity drowning in a
lake of fire for the things that
you've done. Did you know that?"
158,ELI,158,"You go on back to your table and
I'll be on my way. All right?"
159,BURLY PATRON,159,"You push Hog, you push all of us."
160,ELI,160,"Cursed be the ground because of
you. By toil shall you eat of it.
Thorns and thistles shall it sprout
for you. From the ground were you
taken. For dust you are."
161,ELI,161,And to dust you shall return.
162,CARNEGIE,162,Did you hear that? What was that?
163,CLAUDIA,163,Maybe you should go check.
164,CARNEGIE,164,What in the hell is going on?
165,CARNEGIE,165,Get your asses out here!
166,SOLARA,166,Stop!
167,SOLARA,167,Please don't.
168,ELI,168,Go.
169,HOG,169,...What?
170,ELI,170,"It ain't for me to judge you. Your
time for that's gonna come. Believe
me. Now go on. Get out of here."
171,ELI,171,Thank you.
172,ELI,172,I'm sorry for all the mess.
173,CARNEGIE (O.S.),173,Hold it right there.
174,CARNEGIE,174,"So, who are you?"
175,ELI,175,Nobody. A walker in the outland.
176,CARNEGIE,176,"I've met walkers before. Not a
particularly civilized bunch. Some
have even taken to eating their own
kind, did you know that? You
wouldn't be one of those savages
now, would you?"
177,CARNEGIE GUNMAN,177,He ain't got the shakes.
178,CARNEGIE,178,"Good. This is a civilized town.
Under God. Do you know what that
means?"
179,CARNEGIE,179,"It means we have laws here. Laws
set down long before any of us ever
walked this earth. And one of them
is, you don't eat the flesh of your
brother. Else you're no better than
an animal. And not welcome here."
180,CARNEGIE,180,"So what's your business here,
friend? Walkers don't usually come
into town less they want something."
181,ELI,181,"I had a battery needed charging and
a canteen needed filling. I didn't
come here looking for trouble."
182,CARNEGIE,182,"Well, you sure as hell found it. Do
you know who I am?"
183,ELI,183,No.
184,CARNEGIE,184,"My name's Carnegie. I own this bar.
I own the whole town. You've never
heard of me?"
185,ELI,185,That's you out there on the street.
186,CARNEGIE,186,"Remarkable likeness, isn't it?
You'd never guess half the men who
built it were blind. A small
tribute from a grateful people. I
was deeply touched."
187,ELI,187,"You had slaves build you a monument
to yourself?"
188,CARNEGIE,188,"Don't call them slaves. That's an
old word. I'm not a slaver. I'm
trying to help these people."
189,CARNEGIE,189,"In the outland the sightless are
preyed upon like sick animals. Here
at least they're protected. They do
the essential work others don't
want. And in return they eat, they
drink, they survive. Last year, a
couple of them even got married -
performed the ceremony myself."
190,CARNEGIE,190,"You see, I'm not exploiting these
people - I'm saving them! Any one
of them is free to leave whenever
they wish. But here they stay. And
they thank me every single day for
their salvation!"
191,ELI,191,"It's none of my business what you
do here. Like you said, it's your
town. I just want to be on my way."
192,CARNEGIE,192,"What's your name, walker?"
193,CARNEGIE,193,"All right, I guess we just call you
Walker. Don't see too many folks
your age these days. You lived in
the world before? You can read?"
194,ELI,194,I read every day.
195,CARNEGIE,195,By who?
196,CARNEGIE,196,"All right, look. I'm going to make
you an offer of goodwill. Stay the
night, think it over. Try a little
local hospitality. We'll talk again
in the morning. If you're still not
interested, you're free to go. No
hard feelings."
197,ELI,197,"Thank you for your offer. But I'd
prefer to just leave right now. So
you can either let me out of here,
or I can kill my way out."
198,CARNEGIE,198,Let him go.
199,ENGINEER,199,"Oh, shit..."
200,ELI,200,How's my battery?
201,ENGINEER,201,"It's, uh... it's gonna take a
little longer than I thought."
202,ELI,202,How much longer?
203,ENGINEER,203,"It's gotta charge overnight. You,
uh, you can always stay here in
town, pick it up in the morning."
204,ELI,204,"You remember what I said would
happen if I came back here and you
didn't have my battery?"
205,ENGINEER,205,"It's right here! It's just gonna
take a while longer. I swear."
206,CARNEGIE,206,I knew you'd reconsider.
207,ELI,207,Yeah? How'd you know that?
208,CARNEGIE,208,"None of the walkers I've seen come
here from the outland were ever
what you'd call smart. I mean all
those years out there alone on the
road, some with their brains half-
fried from eating each other - it's
understandable why you people
aren't the brightest bulbs in the
box. But I never met one so dumb
that he'd turn down a meal and a
bed if it was offered."
209,ELI,209,"So you didn't send someone across
the street to the engineer?"
210,CARNEGIE,210,"Engineer? I don't know what you're
talking about. If there's something
wrong, maybe I can help."
211,CARNEGIE,211,"This is Redridge. He's kind of my
right-hand man around here."
212,CARNEGIE,212,He'll show you to your room.
213,REDRIDGE,213,"Enjoy your stay. There'll be
someone outside your room all
night. If you need anything."
214,ELI,214,Hello?
215,CLAUDIA,215,"I have this for you. Water for
washing and some food."
216,CLAUDIA,216,Well... are you going to take it?
217,ELI,217,Oh. Thank you.
218,CLAUDIA,218,You're very welcome.
219,CLAUDIA,219,It'll be dark soon.
220,CLAUDIA,220,Can I get you anything else?
221,ELI,221,"No, thank you."
222,CLAUDIA,222,Well. Have a good night.
223,ELI,223,You're Carnegie's woman?
224,CLAUDIA,224,Why do you ask?
225,ELI,225,"Just making conversation is all.
Haven't had one of those in a
while. Not a real one, leastways."
226,CLAUDIA,226,"He found me in the outland. I was
sixteen, my family had been...
well, they were gone. There was
just me and my baby."
227,ELI,227,You had a baby?
228,CLAUDIA,228,"I'd met some men on the road. Bad
men. They..."
229,ELI,229,It's all right.
230,CLAUDIA,230,"I was on the road for a year after
that. I couldn't feed myself, let
alone my little girl. And then Bill
found us and he promised he'd take
care of us. He told me he was going
to make a place where we could be
safe. And he did. He did all that.
He built this whole town. He kept
us safe. And he raised that child
like she was his own. He's been so
good to both of us. He saved us,
really."
231,ELI,231,You want to eat some?
232,ELI,232,"When did you go blind? In the war?
You get caught in a flash?"
233,CLAUDIA,233,"No, I was born this way. I think
I'm lucky like that."
234,ELI,234,Lucky?
235,CLAUDIA,235,"It's not like I ever knew what I'm
missing. I was already used to
being like this by the time... by
the time it all happened. So I got
around pretty good even when I was
on my own. And now it's easy. I
know every creaky old floorboard in
here, and it's not like I ever go
any place else. Bill would never
allow it. He worries about me so
much."
236,CLAUDIA,236,"I should go. He'll be wondering
where I am."
237,CLAUDIA,237,"Thank you. I enjoyed our
conversation."
238,ELI,238,So did I.
239,CARNEGIE,239,"You took your time in there. How
long does it take to deliver a
plate of food and some water?"
240,CLAUDIA,240,He wanted to talk.
241,CARNEGIE,241,Oh? What about?
242,CLAUDIA,242,"Nothing really. He asked me what it
was like to be blind."
243,CARNEGIE,243,He tell you anything about him?
244,CLAUDIA,244,"No. I don't think he likes to talk
about himself much."
245,CARNEGIE,245,"Yeah, I got that."
246,CLAUDIA,246,"I don't think he's going to change
his mind by morning. I don't think
he's going to stay."
247,CARNEGIE,247,What makes you say that?
248,CLAUDIA,248,"Just strikes me as the kind of man
who's of a mind, is all. Doesn't
seem like the type to go changing
it once it's set."
249,CARNEGIE,249,"Well, we'll just see about that."
250,CLAUDIA,250,"You saw him. He's not like the
others. You won't be able to smooth-
talk him and wrap him around your
finger like you usually do."
251,CARNEGIE,251,Who said anything about me?
252,CARNEGIE,252,I'm sending Solara.
253,CLAUDIA,253,You're doing what?
254,CARNEGIE,254,"You know how often these walkers
get laid? Never. Least not by
anything living or willing. Girl
like her can be very persuasive."
255,CLAUDIA,255,"You can't send her in there with
him. He's dangerous, he's a killer!"
256,CARNEGIE,256,You went in there readily enough.
257,CLAUDIA,257,"That's different. Solara's just a
child, she can't-"
258,CARNEGIE,258,"She's a grown woman now, Claudia.
Sooner or later you're going to
have to accept that. She has to
earn her keep around here, same as
the rest of us."
259,CLAUDIA,259,"By working as a whore? That's all
you think she's fit for?"
260,CARNEGIE,260,"We've each been given a talent to
help us make our way in this world.
Some people's gift is more evident
than others. Solara's sure as hell
is."
261,CLAUDIA,261,What kind of a man are you?
262,CARNEGIE,262,"I'm the kind of man who'd pull a
helpless blind girl off the road, a
girl who'd been beaten and raped,
and give her a place where she can
live without fear! Without me you'd
be just another no-eye, lying dead
in the outland, picked clean by the
buzzards, or shoveling dirt down
there with the others. That's the
kind of man I am!"
263,CLAUDIA,263,"I don't live without fear. I
haven't for a long time now."
264,CARNEGIE,264,Where are you going?
265,CLAUDIA,265,I'm not going to let you do this.
266,CARNEGIE,266,You're not going to let me?
267,CARNEGIE,267,"Nobody tells me what I can and
can't do in my own town. Nobody. I
built this world, and I am God
here! So don't go thinking about
screwing with my plans. You know
how this works. Solara goes against
me, you get hurt. You go against
me, she gets hurt."
268,CARNEGIE,268,"So let's not see anybody get hurt.
Okay?"
269,ELI,269,Come in.
270,SOLARA,270,Hi. Can I come in?
271,ELI,271,"Someone was already here with food
and water. I got everything I need."
272,SOLARA,272,You sure about that?
273,SOLARA,273,"It's too bright in here. Mind if I
turn it down a little?"
274,SOLARA,274,"That's better. I'm Solara. You're
Walker, right?"
275,ELI,275,No. My name's Eli.
276,SOLARA,276,That short for something? Elias?
277,ELI,277,Elijah.
278,SOLARA,278,"Elijah. I never heard that one
before. It's kinda cute."
279,ELI,279,"Look, I don't mean to be rude. But
I'm really not interested."
280,SOLARA,280,"You sure about that? It gets mighty
lonely out there on the road."
281,SOLARA,281,"If you're worried about money, this
is all paid for. The whole night."
282,ELI,282,"It's not that. You're a very nice
girl. But I'm not that kind of man."
283,SOLARA,283,They're all that kind of man.
284,ELI,284,I'm not.
285,SOLARA,285,"They told me you were crazy. Maybe
they were right."
286,ELI,286,I'm sorry. Good night.
287,SOLARA,287,"Please don't make me leave. I have
to stay the night. If I don't..."
288,ELI,288,"If you don't, what?"
289,SOLARA,289,He'll hurt my mom.
290,ELI,290,Who will? Carnegie?
291,ELI,291,Maybe he and I oughta have words.
292,SOLARA,292,"No! Please, don't!"
293,ELI,293,"He's hurting you. He's hurting your
mother. He's-"
294,SOLARA,294,He's my dad.
295,SOLARA,295,"Look, if you want to help me, just
let me stay here tonight. We don't
have to do anything. I'll sleep on
the floor. Tomorrow you can tell my
dad that we had a good time. I'll
be no trouble, I swear."
296,ELI,296,You want to have a conversation?
297,ELI,297,"You know, you don't have to be
afraid of me. What happened down
there in the bar..."
298,SOLARA,298,"I'm not afraid of you. I know you
didn't start that trouble. When I
first saw you, I knew you weren't
the type to go looking for it."
299,ELI,299,How'd you know that?
300,SOLARA,300,"My mom says I'm a good judge of
character. She says I can read
people. That I know a good man when
I see one."
301,SOLARA,301,"So... you're pretty old, right?"
302,SOLARA,302,"I'm sorry. I just mean, I haven't
seen too many people your age. How
old are you exactly?"
303,ELI,303,"You know, I don't rightly remember."
304,SOLARA,304,"But you're old enough. I mean, you
remember what it was like? In the
world before?"
305,SOLARA,305,What was it like?
306,ELI,306,Better than this.
307,ELI,307,"People lived longer back then.
Longer than me. Some were more than
a hundred years old."
308,SOLARA,308,Come on.
309,ELI,309,"I swear, it's true. Nowadays it's
not the same. If you're sick or
you're weak or you're old you won't
last long out on the road."
310,SOLARA,310,So how come you have?
311,ELI,311,Can I read you something?
312,SOLARA,312,Wait. You can read?
313,SOLARA,313,And you have a book?
314,ELI,314,Not just any book.
315,ELI,315,"The Lord is my shepherd. I shall
not want. He makes me lie down in
green pastures. He leads me beside
still waters. He restores my soul.
He leads me in the paths of
righteousness."
316,ELI,316,"Though I walk through the valley of
the shadow of death, I will fear no
evil. For you are with me. Your rod
and your staff, they comfort me.
You prepare a table before me in
the presence of my enemies. You
anoint my head with oil. My cup
runs over. Surely goodness and
mercy shall follow me, all the days
of my life. And I will dwell in the
house of the Lord forever."
317,SOLARA,317,"That's beautiful. Did you write
that?"
318,ELI,318,No.
319,SOLARA,319,What book is it from? Is it poetry?
320,ELI,320,"I guess you could think of it that
way. It's from the Holy Bible."
321,SOLARA,321,"I never heard of it. What's it
about?"
322,ELI,322,"It's about love, and forgiveness,
and life and death, and mercy, and
revenge, and the beginning and the
end of the world. I guess it's
about a little bit of everything."
323,SOLARA,323,Can I see?
324,SOLARA,324,What? I'm not going to do anything.
325,ELI,325,"I'm sorry. I'm charged to protect
this book. I can't trust it with
anyone. Not even for a while."
