,character,line #,line
326,SOLARA,326,What's so special about that book?
327,ELI,327,"It's the last one. There are no
other books like this. All the
others are gone - destroyed by the
war or in the burnings that came
after. This is the only one that
survived until now. The last one
anywhere."
328,SOLARA,328,How can you know that?
329,ELI,329,I just know.
330,ELI,330,"For a long while after it happened,
I just wandered on the road like
most everybody else. There were
still a lot of people around back
then, in the beginning. I didn't
really know what I should do or
where I was going. I was just
moving from place to place, trying
to stay alive. And then one day I
heard this voice. I don't know how
to explain it, it's like it was
coming from inside me. But I could
hear it, clear as day. Clear as I
can hear you talking to me now."
331,SOLARA,331,What did it say?
332,ELI,332,"It led me to this place, I don't
really know where. And I found this
book buried deep under some rubble.
No way no-one was ever going to
find it if they didn't know exactly
where to look."
333,SOLARA,333,"But you knew because the voice told
you?"
334,ELI,334,"That's right. And that voice told
me to carry the book west."
335,ELI (cont'd),335,"It told me that a path would be
laid out before me, that I'd be led
to a place where this book would be
safe. It told me I'd be protected
against anyone or anything that
tried to stand in my way. If only I
would have faith."
336,ELI (cont'd),336,"That was twenty-five years ago. And
I've been walking ever since."
337,SOLARA,337,"Because a voice you heard in your
head told you to."
338,ELI,338,"I'm not crazy. I didn't imagine it.
I know what I heard."
339,SOLARA,339,So who was it? The voice?
340,ELI,340,"A very important, very powerful
man."
341,SOLARA,341,More powerful than my dad?
342,ELI,342,"I should say so, yes."
343,SOLARA,343,Would you teach me to read?
344,ELI,344,What?
345,SOLARA,345,"I never learned. No-one around here
knows how. Only my dad, and he
won't teach me. I think he likes
being the only one who can read. I
think it makes him feel powerful."
346,ELI,346,I think you're probably right.
347,SOLARA,347,So would you teach me?
348,ELI,348,"I'm sorry. I'm leaving tomorrow.
And I won't be back this way, ever."
349,ELI,349,Are you hungry?
350,SOLARA,350,I guess a little.
351,ELI,351,"There's some food on the table over
there. Let's eat."
352,ELI,352,"It's okay, it's okay. He's with me."
353,ELI,353,"Don't be afraid, pal. This is
Solara. She's our friend."
354,ELI,354,It's okay. It means he likes you.
355,SOLARA,355,It does?
356,ELI,356,"Trust me, if he didn't like you,
you'd know about it."
357,SOLARA,357,Did you really mean that?
358,ELI,358,Mean what?
359,SOLARA,359,That I'm your friend.
360,ELI,360,Sure.
361,ELI,361,"Our father, we thank you for this
meal which you have been so
gracious to place before us."
362,ELI,362,"We thank you for a warm bed and a
roof over our heads on a cold night
such as this."
363,ELI,363,"And we thank you for the gift of
friendship in these hard times."
364,ELI,364,Amen.
365,ELI,365,You say that last part too.
366,SOLARA,366,Amen. And now we eat?
367,ELI,367,And now we eat.
368,CARNEGIE,368,"Good morning, Solara."
369,CARNEGIE,369,"I said good morning, Solara."
370,SOLARA,370,"Morning, dad."
371,CARNEGIE,371,"How was your night? Did you sleep
well?"
372,SOLARA,372,"I did like you asked. Isn't that
what you really want to know? Just
come out and say it."
373,CARNEGIE,373,"You don't speak to your father like
that. When I ask you a civil
question, I expect a civil answer."
374,CARNEGIE,374,Did he say anything?
375,SOLARA,375,No. We didn't talk much.
376,CARNEGIE,376,"Well, do you think you managed to
change his mind about staying?"
377,SOLARA,377,I don't know. He said he had to go.
378,CARNEGIE,378,"So he did talk? What else did he
say? Come on, I want all of it!"
379,SOLARA,379,"That's all he said. That he was
going to be leaving this morning."
380,CARNEGIE,380,"We'll see. This is my town, nobody
leaves until I say they leave."
381,CLAUDIA,381,"Solara, honey, eat something."
382,SOLARA,382,"Our father, thank you for this meal
which you have been so gracious to
place before us."
383,SOLARA,383,"Thank you for my mother. Please
watch over her and keep her safe."
384,CARNEGIE,384,Solara...
385,SOLARA,385,Thank you for all the-
386,CARNEGIE,386,Solara!
387,CARNEGIE,387,What the hell are you doing?
388,CARNEGIE,388,"God didn't put this food on the
table. Do you hear me?"
389,CARNEGIE,389,Who put this food on the table?
390,CARNEGIE,390,"I said who put this food on the
table?"
391,SOLARA,391,You did.
392,CARNEGIE,392,Who taught you that?
393,SOLARA,393,Eli taught me.
394,CARNEGIE,394,Who the hell is Eli?
395,SOLARA,395,The walker. That's his name.
396,CARNEGIE,396,"And he taught you how to say those
words? How did he know them?"
397,SOLARA,397,He had them written down in a book.
398,CARNEGIE,398,What kind of a book?
399,SOLARA,399,"I don't remember! It was an old
leather book. It had kind of a...
thing on the front of it."
400,CARNEGIE,400,Show me.
401,CARNEGIE,401,He had a bible?
402,SOLARA,402,"That's what it was. A holy bible.
Daddy, what's wrong? Did I..."
403,REDRIDGE,403,"Something wrong, boss?"
404,CARNEGIE,404,"Something wrong? Something wrong?
The walker's gone!"
405,REDRIDGE,405,"That can't be. I had a man outside
his room the whole time."
406,CARNEGIE,406,"He jumped out the window, you
idiot! You didn't think to put a
man outside the fucking window?"
407,CARNEGIE,407,Find him. Now!
408,REDRIDGE,408,"Boss, he could be anywhere. He..."
409,REDRIDGE,409,"A battery. Didn't he say something
about a battery?"
410,CARNEGIE,410,Go! Go!
411,ELI,411,"It ain't your concern. Stay on the
path."
412,ELI,412,Dammit...
413,ELI,413,Let her go.
414,CARNEGIE,414,"That cannon of yours casts a pretty
wide net. I don't reckon you can
hit me without hitting her."
415,ELI,415,I reckon you're right.
416,ELI,416,"This, though? With this I'll shave
the hairs clean off your balls at a
hundred paces. You believe me?"
417,CARNEGIE,417,"I believe you. I have to say I'm
surprised to hear that language
coming from you, though. I mean,
you being a holy man and all."
418,CARNEGIE,418,"She told me all about it. Told me
all about the bible, too."
419,CARNEGIE,419,Can I see it?
420,ELI,420,No.
421,CARNEGIE,421,"You know, I've been searching for a
book like that one for years. All
I've ever wanted was to bring the
word of God to these poor
unfortunates here. To shine its
light upon them and give them
something in this wretched world
that they could believe in.
Something to live for! It's why I
built this town, did you know that?
All we've been missing is the word
to show us the way. And now, praise
the Lord, you've brought it to us."
422,CARNEGIE,422,"It's not right to keep that book
hidden away, all to yourself. The
word is meant to be shared with
others. It's meant to be spread!
Isn't that what you want? I could
help you do that. You and me, we
could do it together."
423,ELI,423,"The Lord himself told me that if I
carried this book west, one day I
would find the place where it was
needed. Where it would be safe.
Where it belonged."
424,ELI,424,But this ain't it.
425,ELI,425,Come on.
426,SOLARA,426,What? What is it?
427,ELI,427,"You shall not make for yourself any
graven image..."
428,ELI,428,Now we can go.
429,SOLARA,429,Where are we going?
430,ELI,430,"I told you where I'm going. You're
free to go wherever you want."
431,SOLARA,431,Wait... I'm not coming with you?
432,ELI,432,You're only going to slow me down.
433,SOLARA,433,"So what the hell was all that about
back there?"
434,ELI,434,"The man was hurting you. I don't
like that, so I put a stop to it.
Now you're free. He can't hurt you
any more."
435,ELI,435,No need to thank me.
436,SOLARA,436,"Thank you? For what? What am I
supposed to do now?"
437,ELI,437,"Whatever you want. That's what
being free is."
438,SOLARA,438,"Whatever I want. Except go with
you."
439,ELI,439,"I have to get where I'm going. I
can't be worrying about someone
else along the way."
440,SOLARA,440,I thought you were my friend.
441,ELI,441,"It's dangerous in the outland. I
wouldn't want you to get hurt."
442,SOLARA,442,"I'll be safe so long as I'm with
you. I know it."
443,ELI,443,"You don't want this life. I gotta
do what I gotta do. Don't have no
choice in it. But you do. And I
can't let you choose this. You
don't want to be like me. You don't
want to spend your life alone."
444,SOLARA,444,"If I came with you, I wouldn't be
alone. And neither would you."
445,ELI,445,"I'm sorry. Look, maybe it's best
you just go on back to town."
446,SOLARA,446,"Fine! I'll do just that! I had a
life there! A family! I didn't ask
you to save me! I didn't ask you
for anything!"
447,SOLARA,447,Fine.
448,CARNEGIE,448,"Thank you, darling."
449,REDRIDGE,449,"He killed four of my men and walked
out of town without a scratch. They
shot off a hundred rounds at him
and he didn't get hit once. I never
even heard of anything like that."
450,CARNEGIE,450,"You know, I always thought of
myself as a shepherd. Bringing
together the wayward and the lost.
Tending to my flock. But all the
things I want to do, I can't do
them on my own. The one thing I've
needed is the one thing that's
always been missing. Then one day
it walks right into town - so close
I can almost touch it - and then
walks right on out again."
451,CARNEGIE,451,"I want you to put a crew together
and go out after him."
452,REDRIDGE,452,"He's not going to work for you. I
think he's made that plain."
453,CARNEGIE,453,"I'm not interested in him any more.
I only want the book he's carrying."
454,REDRIDGE,454,"If I'm gonna risk my ass hunting
down this maniac in the outland, I
need to know it's gonna be worth
it. I need to know what's so
special about this goddamn book."
455,CARNEGIE,455,"You have no idea. You're too young,
you don't remember the world
before. But I do. I remember."
456,CARNEGIE,456,"When I was a kid my parents used to
read that book every goddamn day.
My mother, she'd read it along with
this smooth-talking preacher on the
TV screen. They used to be able to
beam these guys right into your
house, into every house in the
world, through the air. Like magic."
457,CARNEGIE,457,"She worked two jobs and she sent
every spare penny she had to that
fucking guy on the TV. My old man,
he'd read that book, then he'd get
liquored up and kick my ass, tell
me all about the power and the
glory and how I was going to burn
forever in hell for the sins I was
born with. He made sure he beat it
into me good."
458,CARNEGIE,458,"Don't you see? It's not just any
book."
459,CARNEGIE (cont'd),459,"It has the power to motivate
people. It can give them hope, it
can terrify them. It can shape
them. Control them."
460,CARNEGIE (cont'd),460,"Do you remember how I built this
town? It wasn't done with force,
and it wasn't done just with water.
It was done with the power of
words. I created this place out of
nothing, because people believed in
a promise that I sold to them.
Those guys on the TV, they were
richer than you could ever dream,
and it was all built the same way.
With words. With promises. And with
that book."
461,CARNEGIE (cont'd),461,"That book is a weapon. Aimed right
at the hearts and minds of the weak
and the desperate. Just imagine
what I could do with it."
462,REDRIDGE,462,"Boss... we're running out of water
and the people are running out of
patience. You're trying to tell me
that a book is going to keep them
in line?"
463,CARNEGIE,463,"Oh, it'll do much more than that.
The water in this town may run dry,
but faith - that springs eternal!
And that faith will help turn this
town into a city. And this city
into a nation. It will help me
build a new world. In my image.
People will come from far and wide
to hear what's inside of it.
They'll follow me anywhere just to
get a taste of it. And they'll do
whatever I tell them."
464,REDRIDGE,464,"And what if this book don't work?
What if it don't say what you want
it to say?"
465,CARNEGIE,465,"Oh, it'll say what I want, I can
promise you that. Because I'm going
to rewrite it. I'll keep the parts
that work for me and make the rest
whatever I need it to be."
466,CARNEGIE,466,"A new bible, for a new world."
467,CARNEGIE,467,"What do you think, darling? A whole
new world, to do with as we will.
Won't that be grand?"
468,CARNEGIE,468,Find that book.
469,REDRIDGE,469,He has half a day on us already.
470,CARNEGIE,470,So use the motor pool.
471,REDRIDGE,471,There ain't much gas in reserve.
472,CARNEGIE,472,"Whatever there is, use it."
473,CLAUDIA,473,What about Solara?
474,CLAUDIA,474,She's still out there. With him.
475,CARNEGIE,475,"Right. Right. Of course. Bring her
back, too, if you can. But-"
476,REDRIDGE,476,The book. I know.
477,SOLARA,477,Shit. Shit.
478,SOLARA,478,Where the hell am I?
479,FEMALE VOICE (O.S.),479,Hello?
480,FEMALE VOICE (O.S.),480,Hello? Can anyone help me?
481,SLUMPED FEMALE,481,Hello? Is anybody there?
482,SOLARA,482,Are you all right?
483,YOUNG WOMAN,483,"Oh. Yes, I'm fine. Thank you. You
go along, I'll be okay."
484,SOLARA,484,You look like you need some help.
485,YOUNG WOMAN,485,"No, really! I'm fine. Really... I
need a man to help. Not you. You
just keep along. Please."
486,SOLARA,486,It'll just take a minute.
487,YOUNG WOMAN,487,"Really, it's fine! Please!"
488,YOUNG WOMAN,488,Let her go! She ain't got nothing!
489,BRIGAND LEADER,489,I ain't too sure about that.
490,YOUNG WOMAN,490,This wasn't the deal!
491,BRIGAND LEADER,491,"Shut your mouth, bitch. You oughta
be grateful you're getting a break."
492,BRIGAND LEADER,492,"Never did care much for that dried-
up old snatch anyhow."
493,BRIGAND LEADER,493,"This one, though... this one looks
fresh. You a virgin?"
494,BRIGAND LEADER,494,"Well, let's find out."
495,ELI,495,"I offer you both one final chance
in this life to seek forgiveness
for your sins so that your souls
may find salvation. Will you say
with me the act of contrition?"
496,BRIGAND LEADER,496,Fuck you.
497,ELI,497,"Some might think it'd be most
fitting to leave you here like
this. Let you die slow in the sun.
But I know better. I know where
you're going. And the sooner you
get there, the sooner you'll get
what's coming to you."
498,RIFLE BANDIT,498,Wait!
499,RIFLE BANDIT,499,"I want to say it. I want to be
forgiven."
500,ELI,500,"Repeat after me. Oh God, I am
heartily sorry for having offended
thee, and I detest all my sins."
501,ELI,501,"I firmly resolve, with the help of
thy grace, to confess my sins, and
do penance, and to amend my life.
Amen."
502,RIFLE BANDIT,502,Amen...
503,SOLARA,503,You came back for me.
504,ELI,504,What are friends for?
505,ELI,505,"This is the deal. You keep up. You
pull your weight. You fall behind,
I can't help you. Okay?"
506,SOLARA,506,Okay.
507,SOLARA,507,What about her?
508,ELI,508,"There's nothing can be done for
her."
509,SOLARA,509,"You killed it! That cute little
thing!"
510,ELI,510,"It's good eating, is what it is."
511,SOLARA,511,That's not funny.
512,ELI,512,"If you're going to be on the road,
you can't be picky about what you
eat. You eat what's there to eat."
513,SOLARA,513,I'm not eating that.
514,ELI,514,More for me.
515,ELI,515,"Father, we thank you for your
generosity in providing us with
this meal. Bless this food to our
use and us to thy service, and keep
us ever mindful of the needs of
others. Amen."
516,SOLARA,516,What does that taste like?
517,ELI,517,Tastes like chicken.
518,SOLARA,518,What is that?
519,ELI,519,It's a Saint Christopher medal.
520,SOLARA,520,"Who's Saint Christopher? Is he a
character from your book?"
521,ELI,521,"Christopher was a man who lived a
long time ago. He wanted to be a
good man, he wanted to help people.
So he would stand by a river that
had no bridge and carry people
across. He was a big strong man and
there was no one he couldn't carry."
522,ELI,522,"Then one day a young child came to
the river and asked to be carried
across. Christopher tried to carry
him but he was too heavy. He was
just a small boy but he was heavier
than any man he had ever carried.
The boy explained that he was the
son of God, and that he was so
heavy because he bore all the sins
of the world. After that,
Christopher was able to carry him
across and when they got to the
other side the boy baptized him in
the river. And that's how he became
a saint. Later on, he was known as
the patron saint of travelers."
523,SOLARA,523,"What is a saint, anyway?"
524,ELI,524,"It's someone who spent their life
doing good things for others.
Enough that God himself took a
special interest in them."
525,SOLARA,525,Someone like you.
526,ELI,526,"No. Not like me. Saints ain't
killers. And I done too much of
that. Spilled too much blood."
527,SOLARA,527,"Will you read me some more from the
book?"
528,ELI,528,"It's late. You should get some
sleep. Maybe tomorrow."
529,SOLARA,529,Eli?
530,ELI,530,What are you doing?
531,SOLARA,531,"You scared me! I thought you were
asleep."
532,ELI,532,"On the road you sleep with one eye
open. I asked you what you were
doing."
533,SOLARA,533,I just wanted to see the book.
534,ELI,534,"You want to see the book, you ask
me. Nobody touches it but me. Ever.
Until it gets where it's going. Do
you understand?"
535,ELI,535,Tell me you understand!
536,SOLARA,536,Okay! I understand! Ow!
537,ELI,537,"It's no use to you anyway. You
don't know how to read it."
538,SOLARA,538,"Well... now we have the time, maybe
you can teach me."
539,ELI,539,Maybe. Get some sleep.
540,REDRIDGE,540,He's been here.
541,REDRIDGE,541,The girl's with him.
542,REDRIDGE,542,Move out!
543,REDRIDGE,543,I said move out!
544,CARNEGIE GUNMAN,544,"I heard this guy's protected
somehow, some... power from up
above. That there ain't nothing on
this earth can touch him."
545,REDRIDGE,545,"He's just a man. You put a bullet
in him, he'll go down like any
other. I don't want to hear no more
of this superstitious horseshit!"
546,SOLARA,546,"You say you've been walking for
twenty-five years. Have you ever
considered that you might be lost?"
547,ELI,547,No.
548,SOLARA,548,"But how can you know? How can you
know this is the right way?"
549,ELI,549,"I told you. My path has been laid
out before me."
550,SOLARA,550,"Yeah, but laid out by who?"
551,ELI,551,By Almighty God.
552,SOLARA,552,"Well if this God guy's so mighty,
how come it's taking you so long to
get where you're going? Doesn't he
know the way?"
553,ELI,553,"You want to stay on this road with
me, don't ever let me hear you take
his name in vain like that again."
554,SOLARA,554,Sorry.
555,ELI,555,"God has a reason for everything
being the way it is. It's not
always apparent to us. But it is
his plan nonetheless."
556,SOLARA,556,"So, is he talking to you right now?
Telling you where to go?"
557,ELI,557,"It's not like that. It's kinda hard
to explain. I'm guided by faith."
558,SOLARA,558,I don't know what that word means.
559,ELI,559,"It means you know something even
though you don't know it."
560,SOLARA,560,That doesn't make any sense at all.
561,ELI,561,It doesn't have to.
562,SOLARA,562,"I don't get it. It looks almost...
normal. Like nothing ever happened.
How can it still be out here?"
563,ELI,563,I don't know.
564,SOLARA,564,"Maybe we should look inside. There
might be food."
565,ELI,565,Stay behind me.
566,SOLARA,566,This is weird.
567,ELI,567,Yeah.
568,ELI,568,Shit.
569,SOLARA,569,What?
570,ELDERLY MAN,570,Who are you?
571,ELI,571,"My name is Eli. This is Solara.
We're travelers, that's all. We
don't mean you any harm."
572,ELDERLY MAN,572,"You cut my padlock. I saw you.
Trying to break into our house."
573,ELI,573,"I'm sorry. We didn't think anybody
lived here. We thought it was
abandoned, like all the rest."
574,ELDERLY MAN,574,"Take a look around you. Look at
this yard. Does it look abandoned
to you?"
575,ELI,575,"No, sir. I... like what you've done
with the place."
576,ELDERLY MAN,576,What's your business here?
577,ELI,577,"No business. We're sorry to have
troubled you. If you'll let us down
we'll happily be on our way."
578,ELDERLY WOMAN,578,"George, look at them! They're not
robbers or road agents! One of
them's just a girl!"
579,ELDERLY MAN,579,"Seen that before. Oldest trick in
the book."
580,ELDERLY WOMAN,580,"Oh, stop! It's no trick. Let them
down!"
581,ELDERLY WOMAN,581,"I'm so sorry about my husband. We
so rarely get visitors these days,
he's suspicious of everybody."
582,ELDERLY WOMAN,582,"I'm Martha and this is my husband
George. Would you care for some
tea?"
583,MARTHA,583,"I'm afraid we don't have any cake
or biscuits for the tea. They ran
out some time ago."
584,MARTHA,584,Please.
585,MARTHA,585,How do you like it?
586,ELI,586,It's.. uh...
587,SOLARA,587,It's very good.
588,ELI,588,Have you always lived here?
589,MARTHA,589,"For almost forty years now. This
home is our pride and joy, isn't
it, George?"
590,MARTHA,590,"We refused to leave, even during
the troubles. We said, didn't we
George, we said if we're going to
die anywhere, we're going to die
right here, in our own home."
591,ELI,591,"I don't understand how you've
survived out here this long."
592,MARTHA,592,"Well, George is something of a
handyman, aren't you, dear? He did
a lot of work on the place, making
it safe. We may be old, but we're
resilient. We've had more than a
few who've tried to take this place
from us. Haven't we, George?"
593,GEORGE,593,Yes. Yes we have.
594,SOLARA,594,Are these... graves?
595,MARTHA,595,"Of course. It would be uncivilized
not to bury them. We're not
barbarians."
596,GEORGE,596,"Plus, it's good for the soil."
597,MARTHA,597,"Come on back inside. I think I
might be able to rustle up some
sandwiches."
598,ELI,598,We have to get out of here.
599,SOLARA,599,"They look so sweet... I would never
have believed they were killers."
600,ELI,600,They're worse than that.
601,SOLARA,601,What?
602,ELI,602,They didn't just kill these people.
603,ELI,603,They ate them.
604,SOLARA,604,They what?
605,ELI,605,"There's a disease in the outland.
Spread by eating human meat. It
affects the brain. Dementia, loss
of motor function. Did you notice
the old woman's hands shaking?
She's got it. They've both got it."
606,SOLARA,606,Oh my God...
607,MARTHA (O.S.),607,"I found some meat for those
sandwiches! Are you hungry?"
608,SOLARA,608,No! Thank you!
609,ELI,609,We really must be going.
610,GEORGE,610,So soon?
611,ELI,611,"Yes, I'm afraid so."
612,MARTHA,612,Are you sure you won't stay?
613,ELI,613,Yes. Thank you again for the tea.
614,SOLARA,614,Oh no... it's my dad. It's his men.
615,ELI,615,Are you sure?
616,SOLARA,616,I recognize the cars.
617,ELI,617,Back inside.
618,GEORGE,618,What did you bring upon us?
619,MARTHA,619,George? What's wrong?
620,GEORGE,620,"A whole convoy of armed
degenerates, that's what's wrong!
Coming here for them! And they led
them right to us!"
621,MARTHA,621,Oh no they don't...
622,GEORGE,622,"Martha, what are you doing?"
623,MARTHA,623,"I finally got this house just the
way I want it. I'm not going to let
anybody tear it apart!"
624,SOLARA,624,Where did you get all this stuff?
625,GEORGE,625,"Took `em off them who came looking
to take the place from us. Built up
quite the stash over the years."
626,GEORGE,626,You know how to fire a gun?
627,SOLARA,627,My daddy showed me once.
628,GEORGE,628,Just like riding a bike.
629,SOLARA,629,I never rode a bike.
630,GEORGE,630,"How about you, you know how to-"
631,GEORGE,631,Never mind.
632,REDRIDGE,632,"We know you're in there! Come on
out with your hands up and your
weapons on the deck and nobody
needs to get hurt."
633,REDRIDGE,633,"All right, look. I'm gonna make it
easy on y'all. Bring out the girl
with the book."
634,REDRIDGE (O.S.),634,"That's all we want. The girl and
the book. The rest of you's can go
your way."
635,SOLARA,635,What are we going to do?
636,ELI,636,Hand me my pack.
637,CARNEGIE GUNMAN #2,637,They ain't comin' out. They-
638,REDRIDGE,638,Holy shi...
639,REDRIDGE,639,Get down! Everybody get down!
640,REDRIDGE,640,"Damn you, return fire!"
641,MARTHA,641,"Come and get it, you god-damn sons
of mother-fucking bitches!"
642,ELI,642,"It's all right. We're going to be
all right. Trust me."
643,ELI,643,"You remember what I told you about
faith?"
644,ELI,644,"We're going to get out of this
alive. Both of us. I know."
645,SOLARA,645,Because God told you?
646,ELI,646,Because God told me.
647,GEORGE,647,What about us?
648,ELI,648,He didn't mention you.
649,GEORGE,649,Martha? Martha!
650,REDRIDGE,650,We got any more of those RPGs?
651,CARNEGIE GUNMAN #3,651,That was it.
652,REDRIDGE,652,Screw this.
653,REDRIDGE,653,Get clear!
654,ELI,654,Solara?
655,SOLARA (O.S.),655,Eli!
656,ELI,656,Are you all right?
657,SOLARA,657,I'm fine.
658,SOLARA,658,Oh God...
659,ELI,659,"Come on. We're going out the back.
We're running."
660,REDRIDGE,660,"Go ahead and try it, holy man. You
ain't that fast."
661,REDRIDGE,661,Where's the book?
662,REDRIDGE,662,I ain't playing.
663,REDRIDGE,663,Check the pack.
664,CARNEGIE GUNMAN #4,664,It ain't here.
665,REDRIDGE,665,It's gotta be.
666,REDRIDGE,666,"Hello, what have we here?"
667,REDRIDGE,667,Fuck! Get it off! Get it off me!
668,REDRIDGE,668,"If you don't got the book, what
fucking use are you?"
669,SOLARA,669,Wait!
670,SOLARA,670,"It's here! I've got it! Please
don't kill him."
671,ELI,671,Solara...
672,SOLARA,672,"It's just a book, Eli. No book is
worth giving up your life for."
673,ELI,673,You're wrong.
674,REDRIDGE,674,"You did good, sweetheart. Your
daddy would be proud. He knew you'd
come through for him."
675,SOLARA,675,"He said he would hurt my mom. If I
didn't help him."
676,REDRIDGE,676,Daddy's little girl...
677,SOLARA,677,I want you to let him go.
678,REDRIDGE,678,What?
679,SOLARA,679,"You've got what you came for. You
don't need him. Let him go."
680,REDRIDGE,680,He's killed a dozen of my men.
681,SOLARA,681,"If you hurt him, I'm not coming
back with you. You'll have to drag
me kicking and screaming."
682,REDRIDGE,682,Take your shit and get out of here.
683,REDRIDGE,683,No weapons.
