,character,line #,line
684,ELI,684,"I told you we'd both live. Now do
you have faith?"
685,DRIVER,685,What the hell...?
686,REDRIDGE,686,"Stop, stop!"
687,REDRIDGE,687,Shit. Turn around!
688,DRIVER,688,We ain't got the gas for it!
689,REDRIDGE,689,She's getting away!
690,DRIVER,690,"We got the book! And we got barely
enough gas to make it back as it
is! We can't go chasin' her!"
691,REDRIDGE,691,Stupid little bitch...
692,REDRIDGE,692,Drive on.
693,SOLARA,693,"Come on, come on..."
694,SOLARA,694,No... No!
695,SOLARA,695,Eli! Eli!
696,SOLARA,696,Eli...
697,ELI,697,Thought you'd gone back to town.
698,SOLARA,698,"I can't go back there. Eli, I'm so
sorry."
699,ELI,699,For what?
700,SOLARA,700,"For what? I betrayed you! I gave
them the book!"
701,ELI,701,"You did what you believed you had
to."
702,SOLARA,702,You're not mad at me?
703,ELI,703,I forgive you.
704,SOLARA,704,"Here. I thought you might still
need this."
705,ELI,705,Thank you.
706,SOLARA,706,What are you going to do now?
707,ELI,707,Same as always. Keep heading west.
708,SOLARA,708,"Why? I mean, you don't have the
book any more."
709,ELI,709,But I still have my faith.
710,SOLARA,710,What's that?
711,ELI,711,"It's grass. It used to grow all
over the place."
712,SOLARA,712,How come it's here?
713,ELI,713,"I don't know. Less poison in the
air this near to the ocean, maybe."
714,SOLARA,714,What's wrong?
715,ELI,715,Nothing. Just a cramp.
716,SOLARA,716,What?
717,ELI,717,Do you smell that?
718,SOLARA,718,Smell what?
719,ELI,719,"Salt in the air. We're close to the
ocean. We're almost there."
720,ELI,720,Come on.
721,ELI,721,"Watch your footing. Step where I
step."
722,SOLARA,722,This... this is the world before?
723,ELI,723,What's left of it.
724,ELI,724,Do you see that?
725,SOLARA,725,I see it. Is that it?
726,ELI,726,That's it.
727,VOICE (O.S.),727,Who goes there?
728,ALCATRAZ GUARD,728,Identify yourselves!
729,ELI,729,"My name is Elijah Stone. I have a
message for your boss. I need you
to tell him that I have a King
James Bible in my possession."
730,ALCATRAZ GUARD,730,"Remain where you are! Do not
attempt to move or you will be
fired upon!"
731,ALCATRAZ GUARD,731,"Be prepared to surrender any
weapons at the gate!"
732,SOLDIER,732,They're clean.
733,THIN MAN,733,"Welcome, both of you. I'm Professor
Lombardi. I'm the curator here."
734,ELI,734,Elijah Stone.
735,SOLARA,735,Solara.
736,LOMBARDI,736,"Solara. What a delightful name. Is
that by any chance Shakespearean?"
737,SOLARA,737,"I, uh, I think it's Japanese."
738,LOMBARDI,738,Wonderful.
739,LOMBARDI,739,"Is it true what they tell me? You
have a King James Version?"
740,ELI,740,"Been carrying it with me for twenty-
five years."
741,LOMBARDI,741,"My goodness. I can't tell you how
exciting this is. Well, come, come!"
742,LOMBARDI (cont'd),742,"I'll give you the nickel tour and
then we can all sit down and take a
look at it."
743,LOMBARDI,743,"Yes, we've been doing this for some
time now. Collected over thirty
thousand volumes from generous
donors all across the nation. We
even have a printing press that we
hope to have operational soon."
744,SOLARA,744,"You turned the whole prison into a
library?"
745,LOMBARDI,745,"Well, not exactly. We're more like
a storage facility. We're holding
these books here in trust, if you
like. When society gets back on its
feet and no longer needs us to
preserve these volumes, they'll be
here waiting."
746,LOMBARDI,746,"I must ask you, how did you hear
about us? We've been doing
everything we can to get the word
out, but we always like to know
where our benefactors come from."
747,ELI,747,I was sent here by God.
748,LOMBARDI,748,"Is that right? Well, it's good to
know we're getting such high-
profile referrals these days."
749,LOMBARDI,749,"I must say, I am so excited that we
finally have a King James. You
know, we have a Talmud here, we
have two Korans, we even have that
Scientology book. But never a
Christian bible, until now. I
honestly believed it was the one
book I'd never see again, after
what happened..."
750,LOMBARDI,750,May I ask what condition it's in?
751,ELI,751,"It's a little beat-up. But it'll do
the job."
752,LOMBARDI,752,"Well, then. What say we take a look
at it?"
753,ELI,753,Is there someplace we could sit?
754,LOMBARDI,754,Of course. Right this way.
755,CARNEGIE,755,Did you get it?
756,CARNEGIE,756,Show me.
757,CARNEGIE,757,The new world begins here...
758,CARNEGIE,758,What the fuck is this?
759,ELI,759,"Do you have something you can write
with?"
760,LOMBARDI,760,"Mmm? Oh, yes of course!"
761,LOMBARDI,761,"Could you please bring us some
writing paper?"
762,ELI,762,Bring a lot of it.
763,REDRIDGE,763,What? What is it?
764,ELI,764,Are you ready?
765,LOMBARDI,765,What exactly am I writing?
766,ELI,766,"Pay close attention and write down
every word exactly as I say it."
767,ELI,767,"The First Book of Moses called
Genesis. Chapter one, verse one. In
the beginning God created the
heavens and the earth. Verse two.
The earth was without form, and
void; and darkness was on the face
of the deep. And the spirit of God
was hovering over the face of the
waters. Verse three. And God said,
""Let there be light,"" and there was
light."
768,CLAUDIA,768,What's wrong?
769,CARNEGIE,769,"You told me once that you know how
to read this. This blind language."
770,CLAUDIA,770,"Well, a long time ago, when I was a
little girl..."
771,CARNEGIE,771,"You're going to read it for me.
Every word. And I'm going to write
it down. Start at the beginning."
772,CLAUDIA,772,"I'm sorry. It's been so long. I
don't remember. I don't remember
any of it."
773,CARNEGIE,773,God fucking dammit!
774,CLAUDIA,774,"Bill, is there something-"
775,CARNEGIE,775,Just go. Just get out of my sight.
776,ELI (V.O.),776,"Dear Lord, thank you for giving me
the strength and the conviction to
complete the task you entrusted to
me. Thank you for guiding me
straight and true, through the many
obstacles in my path."
777,ELI (V.O.) (cont'd),777,"And for keeping me resolute when
all around seemed lost."
778,ELI (V.O.),778,"Thank you for your protection and
for your many signs along the way."
779,ELI (V.O.),779,"Thank you for the good that I have
done. For whatever light you were
able to shine into the darkness of
this world through me."
780,LOMBARDI,780,"You know, you don't have to leave.
You're welcome to stay here with
us. You'll be safe."
781,SOLARA,781,Thanks.
782,SOLARA,782,But I gotta do what I gotta do.
783,LOMBARDI,783,Where will you go?
784,SOLARA,784,Home.
785,ELI (V.O.),785,Thank you for the friend I made.
786,ELI (V.O.),786,"Please watch over her as you
watched over me."
787,ELI (V.O.),787,"Thank you for allowing me finally
to rest. I'm so very tired. The
time of my departure is at hand and
now I surrender my soul into your
care, at peace in knowing that I
have carried out your will. That I
have done right with my time on
this earth."
788,ELI (V.O.),788,"I have fought the good fight. I
have finished the race."
789,ELI (V.O.),789,I have kept the faith.
