,character,line #,line
0,SAILOR #1,0,"-- Jesus, look at him --"
1,SAILOR #2,1,"-- what? -- you never saw a dead man
before? --"
2,SAILOR #3,2,"-- look, look he was shot --"
3,SAILOR #1,3,"-- don't, don't do that --"
4,SAILOR #2,4,"-- he's dead, you think he cares? --"
5,SAILOR #1,5,-- so have some respect -- it's a --
6,GIANCARLO,6,"-- it's here -- hang on -- it's here
somewhere -- give me a minute -- get
some blankets -- get some blankets
on him --"
7,GIANCARLO,7,-- here we go -- here it is --
8,THE CAPTAIN,8,Giancarlo.
9,THE CAPTAIN,9,"We pick him up? Okay, we have to
pick him up. But that's as far as it
goes."
10,GIANCARLO,10,He needs a doctor.
11,CAPTAIN,11,"Fuck that. He lives? He dies? I don't
care. We've wasted two hours on this
shit already. You do what you can,
but we're not going back."
12,CAPTAIN,12,You understand me?
13,GIANCARLO,13,"Yes, sir."
14,CAPTAIN,14,Let's get back to work!
15,GIANCARLO,15,You're awake. Can you hear me?
16,GIANCARLO,16,"You've been shot. I'm trying to help
you."
17,GIANCARLO,17,"You were in the water. You've been
shot. It's okay now."
18,THE MAN,18,Where am I?
19,GIANCARLO,19,"You're American. I thought so. From
your teeth -- the dental work --"
20,THE MAN,20,Where am I?
21,GIANCARLO,21,"You're on a boat. A fishing boat.
Italian flag. We're out of Vietri."
22,GIANCARLO,22,"It's the cold that saved you. The
water. The wounds are clean. I'm not
a doctor, but the wounds, it looks
okay. It's clean."
23,THE MAN,23,How did I get here?
24,GIANCARLO,24,"You we're lost at sea. They pulled
you out."
25,GIANCARLO,25,Who are you?
26,GIANCARLO,26,"You were shot -- two bullets -- in
the back. You understand me?"
27,GIANCARLO,27,Who are you?
28,THE MAN,28,I don't know.
29,THE MAN,29,What if it doesn't come back?
30,GIANCARLO,30,I told you. You need to rest.
31,THE MAN,31,"I can read. I can read that sign on
the door. I can count. I can talk..."
32,THE MAN,32,What are you doing?
33,THE MAN,33,What is that?
34,GIANCARLO,34,"It came from your hip. Under the
skin."
35,GIANCARLO,35,You have a bank in Zurich.
36,GIANCARLO,36,You remember Zurich?
37,THE MAN,37,No.
38,GIANCARLO,38,"Look, I'm just on this boat, okay?
I'm an engineer. Whatever this is,
it's not for me to be involved, okay?"
39,THE MAN,39,I don't remember Zurich.
40,GIANCARLO,40,You drink rum?
41,THE MAN,41,I don't know.
42,THE MAN,42,"I don't know who I am. Do you know
who I am? Do have any idea who I am?"
43,THE MAN,43,"Tell me who I am. If you know who I
am, please stop fucking around and
tell me."
44,GIANCARLO,44,"It's not much, but it should get you
to Switzerland."
45,THE MAN,45,I won't forget this.
46,TICKET AGENT,46,Una sola via?
47,THE MAN,47,Si. One way. Una sola via.
48,WOMBOSI,48,"...no, no, no -- the time is not
right, my enemies are too strong.
I'm telling you to wait for this,
you understand? I'm telling you this,
and I'm making a warning to all those
peoples out there that think that my
powers have become so weak that they
can play with me as they wish. You
will see -- I will tell you when the
evidence is clear. Then you will
have a story. My old friends will
hear about themselves."
49,MARSHALL,49,"That's Nykwana Wombosi speaking in
Paris the day before yesterday. I'm
sure most of you have a passing
knowledge of Mr. Wombosi. Some of
you on the African desks have worked
with him over the years. Some of you
very closely..."
50,MARSHALL,50,"...He was an irritation before he
took power. He was a problem when he
was in power. And he's been a disaster
for us in exile."
51,MARSHALL,51,"Wombosi likes to send us messages
through the European media. This is
an interview we pulled down from a
local German television station in
Dresden. We've been getting these
little broadsides every couple of
months. He knows this -- he knows
that -- he's writing a book about
the Agency's history in Africa --
he's going to name names. It's
basically a shakedown..."
52,MARSHALL,52,"This interview -- and I'll make the
tape available for anyone who wants
it -- he goes on to claim that he
has just survived an assassination
attempt. He says it's us. He says
he's got proof."
53,MARSHALL,53,"The overwhelming negative
ramifications of this should be
obvious."
54,MARSHALL,54,"The Director wants to know if there
is any possible shred of truth in
this accusation."
55,ZURICH COP #1 (O.S.),55,Can't you read the signs?
56,ZURICH COP #2,56,On your feet. Let's go. Right now.
57,ZURICH COP #1,57,"The park is closed. There's no
sleeping in the park."
58,ZURICH COP #2,58,Let's see some identification.
59,ZURICH COP #1,59,Come on. Your papers. Let's go.
60,THE MAN,60,I've lost them. I've...
61,THE MAN,61,My papers. They are lost.
62,ZURICH COP #1,62,Okay. Let's go. Put your hands up.
63,ZURICH COP #2,63,-- come on -- hands up -- up --
64,THE MAN,64,"-- look, I'm just trying to sleep
okay? --"
65,THE MAN,65,-- I just need to sleep --
66,ZURICH COP #2,66,"-- no -- please God no -- please
don't -- please no -- my Go"
67,CONKLIN,67,What?
68,ZORN,68,Abbott wants to talk.
69,CONKLIN,69,Tell him we're busy.
70,ZORN,70,I tried.
71,ABBOTT,71,"Storm clouds are gathering, Ted. It
looks like rain and I don't have a
thing to wear."
72,CONKLIN,72,I don't know what we're talking about.
73,ABBOTT,73,"We're talking about Marseille. We're
talking about Nykwana Wombosi. And
I'm asking you if this abortion in
Marseille has anything to do with
Treadstone."
74,ABBOTT,74,Was this Treadstone?
75,CONKLIN,75,You're asking me a direct question?
76,ABBOTT,76,Yes.
77,CONKLIN,77,"I thought you were never going to do
that."
78,ABBOTT,78,"They're putting together an agency
oversight committee. They're going
to look through everyone's budgets.
Treadstone is a rather sizable line
item in my ledger."
79,ABBOTT,79,What am I going to do about that?
80,CONKLIN,80,"You'd want to make that go away.
You'd want to remind them that
Treadstone is a training organization.
That it's all theoretical. You'd
want to sign off on that."
81,ABBOTT,81,And what if I couldn't do that?
82,CONKLIN,82,"Then I'd have to explain Treadstone.
And you'd have to explain how you
let me get this far."
83,CONKLIN,83,"Doesn't sound like much of a Plan-B,
does it?"
84,CONKLIN,84,"We'll clean up the field. You clean
up your budgets."
85,RECEPTIONIST,85,Can I help you?
86,THE MAN,86,I'm here about a numbered account.
87,RECEPTIONIST,87,"If you'll just enter your account
number here I'll direct you to the
appropriate officer."
88,BANK GUARD #1,88,"They've been waiting your hand, sir..."
89,APFEL,89,"Good morning, sir. I assume you're
here about your box."
90,THE MAN,90,...yes...
91,THE MAN,91,The box.
92,BOURNE,92,My name is Jason Bourne.
93,BOURNE,93,"Hi, I'm Jason. Jason Bourne. Jason
Bourne, nice to meet you."
94,BOURNE,94,"Bourne. My name is Jason Bourne. I
live at 121, Rue de la Jardin, Paris."
95,BOURNE,95,"I'm trying to think how long it's
been since I was here."
96,DEPOSIT GUARD,96,I'm not sure. Must be three weeks.
97,MARIE (O.S.),97,"-- no, this is not my current address.
It was my current address two days
ago when I started standing in line
outside --"
98,MARIE,98,"-- and so now I lost my apartment, I
have no address, and I have no visa,
and you keep telling me how much
help you cannot give me!"
99,CLERK,99,"Miss Kreutz, please... I'm gonna
have to ask you to keep your voice
down."
100,MARIE,100,"All the papers -- all the papers
they asked for -- I brought all the
papers --"
101,CLERK,101,"Miss Kreutz, excuse me, but you
entered into a fraudulent marriage
in an effort to circumvent the
immigration laws of the United States --"
102,MARIE,102,"You only know that because I told
you!"
103,MARIE,103,"Ask the case officer -- find his
name -- it's on the papers -- I told
him all this myself! --"
104,CLERK,104,"-- it's not the source of the
information that's important here --"
105,MARIE,105,"-- I paid this fucking guy -- I paid
him four thousand dollars -- my last
four thousand dollars to marry me,
okay? -- I told this to the case
officer last week..."
106,MARIE,106,"...here -- Mr. Thomas. I told Mr.
Thomas I didn't know this guy was
already married -- I admitted this!"
107,CLERK,107,"-- Miss Kreutz, please --"
108,MARIE,108,"-- I'm the one that got ripped off! --
not you -- not the United States
government -- me -- I'm the one being
ripped off!"
109,CLERK,109,"So now you're asking for a student
visa?"
110,CONKLIN,110,-- and they're sure it's him? --
111,ZORN,111,-- he accessed the account --
112,CONKLIN,112,-- but it was him --
113,ZORN,113,"-- yes, sir, it's confirmed --"
114,MAN ON LINE (O.S.),114,You're up.
115,WOMAN CLERK,115,You're a U.S. Citizen?
116,BOURNE,116,Yes.
117,BOURNE,117,"I mean, I think so. Yes. Yes..."
118,WOMAN CLERK,118,"Well, either you are, or you aren't."
119,BOURNE,119,Right.
120,WOMAN CLERK,120,You have your passport?
121,BOURNE,121,I have a passport. I've got...
122,BOURNE,122,"Actually, it's a little complicated."
123,WOMAN CLERK,123,"Do you have your passport, sir?"
124,BOURNE,124,"Look, maybe I should just..."
125,WOMAN CLERK,125,"Sir, you waited on line."
126,BOURNE,126,"Yeah, I know..."
127,SECURITY CHIEF (O.S.),127,-- stop! -- stop right there! --
128,SECURITY CHIEF,128,"-- YOU -- red bag -- the red bag --
stop right there! -- hands up! --"
129,GUN MARINE,129,"-- you heard him -- let's move it! --
down -- let's go! --"
130,SECURITY CHIEF,130,-- no -- no -- hold your fire! --
131,SOMEONE SCREAMING,131,"-- he's got a gun! -- he's got a
gun! --"
132,THE SECURITY CHIEF,132,"-- red! -- red! -- red! -- code red! --
South side entrance! -- male -- five-
ten, brown hair -- black jacket --
red bag --"
133,BUREAUCRAT #1,133,Excuse me?  Can I help you?
134,DEPUTY DCM,134,-- what're you talking about? --
135,SECURITY CHIEF,135,-- we're evacuating the building --
136,DEPUTY DCM,136,"-- we're in the middle of a trade
meeting! --"
137,SECURITY CHIEF,137,"-- call the code! -- I want everyone
out! --"
138,DEPUTY DCM,138,-- you gotta give me more to go on --
139,SECURITY CHIEF,139,"-- he's running from the cops, he's
got a bag filled with God knows what,
he's in the building and I don't
know where! --"
140,VOICE (O.S.),140,"-- no! -- the other way! -- take the
backstairs! -- the backstairs! --
he's on the other side -- there's a
bomb! --"
141,LEAD MARINE,141,-- HALT! -- STOP WHERE YOU ARE! --
142,SECURITY CHIEF,142,-- blow it -- shoot it open! --
143,SECURITY CHIEF,143,"-- check the closets! -- get those
back doors covered -- there's a
kitchen back there -- go! -- go! --
go!"
144,SECURITY,144,"-- we're gonna go room by room until
we find him -- so let's get teamed
up --"
145,MARIE,145,Motherfucking sonsofbitches!
146,MARIE,146,What are you looking at?
147,BOURNE,147,I need a ride.
148,MARIE,148,What?
149,BOURNE,149,I need a ride out of here.
150,MARIE,150,"Oh, Jesus..."
151,BOURNE,151,Please. I don't want to scare you.
152,MARIE,152,It's a little late for that.
153,BOURNE,153,I've got a situation here and --
154,MARIE,154,Get the fuck away from my car.
155,BOURNE,155,"I'll give you ten thousand dollars
to drive me to Paris."
156,MARIE,156,"Great. You know what? I'll give you
ten gazillion dollars to get the
fuck away from me before I start
screaming my head off."
157,BOURNE,157,"You don't want the police any more
than I do."
158,MARIE,158,Jesus...
159,BOURNE,159,Get me out of here. Please.
160,CONKLIN,160,"go -- keep going -- go...wait --
stop -- you went past it --"
161,CONKLIN,161,"It's him. My God, it's really him..."
162,COM TECH #2,162,"-- we got a cross-ref ready to go
here, sir, we're running hotel,
airline, train, and medical variables,
anything else you'd like?"
163,CONKLIN,163,No...
164,CONKLIN,164,Go ahead. Run it.
165,CONKLIN,165,"Let's get a map, let's get a grid
map on Zurich."
166,ZORN,166,Sir...
167,CONKLIN,167,What?
168,ZORN,168,"Zurich police are looking for an
American with a red bag. Apparently
he put two cops in the hospital last
night."
169,CONKLIN,169,What the fuck is he doing?
170,ZORN,170,"Maybe it's a game. Maybe he's trying
to send us a message."
171,CONKLIN,171,"It doesn't matter now. We've just
got to be the first ones there."
172,CONKLIN,172,"Get everybody up. I want them all
activated."
173,ZORN,173,All of them?
174,CONKLIN,174,You heard me.
175,COM TECH #2,175,"Sir, the cross-ref is coming up
cold..."
176,MARIE,176,So what's in Paris?
177,BOURNE,177,I want to go home.
178,MARIE,178,For twenty thousand dollars.
179,BOURNE,179,I said ten thousand.
180,MARIE,180,You have blood on your pants.
181,BOURNE,181,Okay.
182,BOURNE,182,Twenty thousand. Ten now. Ten there.
183,MARIE,183,"No. No, that was too easy --"
184,BOURNE,184,Wait up --
185,BOURNE,185,-- just wait up --
186,MARIE,186,"-- get the fuck out of here -- all
this money, this crazy offer, I mean
give me a fucking break with this,
this is --"
187,BOURNE,187,"Look, I want a ride to Paris."
188,BOURNE,188,That's all I want. I swear.
189,MARIE,189,You swear?
190,MARIE,190,"That's great. I feel so much better
now."
191,BOURNE,191,"I don't want anything but a ride.
All I want to do is go home."
192,MARIE,192,"You could buy a car for twenty grand.
You could buy this car."
193,BOURNE,193,"I don't want to go alone. I want you
to drive me to Paris. Like we're a
couple. Like we're a couple and we're
travelling together. That's all we're
doing."
194,MARIE,194,"And I don't get hurt. I get twenty
thousand dollars and I don't get
hurt."
195,BOURNE,195,I won't hurt you.
196,MARIE,196,What if I say no?
197,BOURNE,197,Then I'll find another ride.
198,MARIE,198,"Just so you know, if you're gonna
burn me on the money, you might as
well kill me."
199,MARIE,199,"I was supposed to have this car back
three days ago. It's not my car."
200,BOURNE,200,I know that.
201,MARIE,201,Shit --
202,MARIE,202,"Can I tell you how much you're
freaking me out? Okay? Because you
are -- you're completely freaking me
out."
203,BOURNE,203,"I'm sorry. Really. What do you want
me to do?"
204,MARIE,204,"I don't know. Smile. Sneeze.
Something. You've got a bag full of
money and a ride to Paris. Fuck it,
I don't know..."
205,MARIE,205,What kind of music do you like?
206,BOURNE,206,I don't know.
207,MARIE,207,What does that mean?
208,BOURNE,208,Listen to what you want.
209,MARIE,209,"Who pays twenty thousand dollars for
a ride to Paris?"
210,BOURNE,210,I don't know. I don't know who I am.
211,MARIE,211,"Yeah, well, welcome to the club."
212,BOURNE,212,"No. No, I mean, I really don't know
who I am. I can't remember anything
earlier than two weeks ago."
213,BOURNE,213,I'm serious.
214,MARIE,214,What? Like amnesia?
215,BOURNE,215,"Look, go ahead... put the radio on..."
216,MARIE,216,Amnesia?
217,MARIE,217,"You're saying you don't remember
anything that happened before two
weeks ago?"
218,BOURNE,218,That's what I'm saying.
219,MARIE,219,Give me a fucking break.
220,MORGUE BOSS,220,"Okay, Monsieur Kane... number 121..."
221,WOMBOSI,221,Get the fuck out of my way --
222,WOMBOSI,222,It's not him.
223,WOMBOSI,223,So who's crazy now?
224,MARIE,224,"And you have no idea -- not a clue --
what came before that?"
225,BOURNE,225,No.
226,MARIE,226,"When you think of it, before the
ship -- before you wake up on the
ship, what do you see?"
227,BOURNE,227,Nothing. It's just not there.
228,MARIE,228,"Well, this is great."
229,MARIE,229,"I'm sick of myself and you have no
idea who you are."
230,BOURNE,230,"I kept trying things, I thought if I
could find all the things I could
do, I could --"
231,MARIE,231,-- you could put it together --
232,BOURNE,232,"-- which was okay for a while, I was
okay with it..."
233,BOURNE,233,"But then -- there's all these other
things -- all these other things I
know how to do -- and this -- this
stuff from the bank and..."
234,BOURNE,234,I think something bad happened.
235,MARIE,235,What are you talking about?
236,BOURNE,236,I don't know.
237,MARIE,237,"Sounds like you were in an accident
or something."
238,BOURNE,238,I was shot twice in the back.
239,MARIE,239,"Okay, so you're a victim."
240,BOURNE,240,"There was a gun. Who has a safe
deposit box with a gun and all this
money and all these passports?"
241,MARIE,241,"Lots of people have guns. You're
American. Americans love guns."
242,BOURNE,242,"I fought my way out of an embassy.
I climbed down a fifty-foot wall --
I went out the window and I was doing
it -- I just did it. I knew how to
do it."
243,MARIE,243,"People do amazing things when they're
scared."
244,BOURNE,244,"Why do I? -- I come in here --
instinctively -- first thing I do --
I'm looking for the exit -- I'm
catching the sightlines -- I know I
can't sit with my back to the door --"
245,MARIE,245,"You're paranoid. You were shot. It's
natural."
246,BOURNE,246,"I can tell you the license plate
numbers of all three cars out front.
I can tell you that the waitress is
left-handed and the guy at the counter
weighs two-hundred and fifteen pounds
and knows how to handle himself. I
know that the best, first place to
look for a gun is the cab of that
grey truck outside. I know that at
this altitude I can run flat out for
half a mile before I lose my edge. I
knew that you were my first, best
option out of Zurich? How do I know
all that? How can I know all that
and not know who I am? How is that
possible?"
247,MARIE,247,"God, you're not kidding, are you?"
248,CONKLIN,248,"And that's the best angle of the
courtyard?"
249,RESEARCH TECH #1,249,That's the only angle.
250,CONKLIN,250,"What do they have on the streets?
The area. They must have something."
251,RESEARCH TECH #1,251,Hang on...
252,CONKLIN,252,What?
253,ZORN,253,"Abbott. He knows about the embassy.
He's coming down for a show and tell."
254,CONKLIN,254,That'll solve all our problems.
255,RESEARCH TECH #1,255,Sir...
256,CONKLIN,256,What's that?
257,RESEARCH TECH #1,257,"It's an angle of the street -- some
sort of alleyway -- you can just..."
258,CONKLIN,258,Enhance it.
259,CONKLIN (O.S.),259,Who the hell is that?
260,MARIE,260,I needed a break.
261,BOURNE,261,Where are we?
262,MARIE,262,We're about an hour away.
263,BOURNE,263,I can't believe I slept.
264,MARIE,264,You were tired. Here...
265,MARIE,265,"For twenty-thousand I like to throw
in breakfast."
266,MARIE,266,So what do you dream about?
267,BOURNE,267,"I dream I'm asleep. I dream that I'm
asleep and I can't wake up."
268,BOURNE,268,I don't think I smoke.
269,MARIE,269,"You ever think maybe you have a
family?"
270,BOURNE,270,I thought about it. I don't know.
271,MARIE,271,"I guess it's like Christmas every
day for you, huh?"
272,ABBOTT,272,Who is she?
273,ZORN,273,"Marie Helene Kreutz. She's twenty-
six. Born outside Munich. Father was
a welder. He died in '91. We don't
have the mother. There might be a
step-sister, we're trying to track
that down."
274,ZORN,274,"It's tough. She's a wanderer. She
pops up on the grid here and there
but... I mean, the last time she
paid an electric bill in Europe was
'94. No taxes. No steady employer.
She's got three arrests. Two
shoplifting cases, one in Spain, one
in Germany. And she actually did
three months in an Italian detention
center for credit card fraud."
275,ABBOTT,275,No political affiliations?
276,CONKLIN,276,"She's a gypsy. If it's a cover, it's
a great one."
277,ABBOTT,277,"I'm assuming we're exploring that
possibility."
278,CONKLIN,278,We're exploring every possibility.
279,CONKLIN,279,"We are in pursuit. How much more do
you want me to tell you?"
280,ABBOTT,280,"Pursuit would indicate that you know
exactly where he is."
281,CONKLIN,281,"No. Pursuit ends when we know exactly
where he is."
282,ABBOTT,282,"Yes, well, I think we need some fresh
eyes on this problem. I'm bringing
in some people from upstairs."
283,CONKLIN,283,"We've been down here for two weeks
banging our heads against the wall.
We've been sleeping down here. We
just got our first lead fourteen
hours ago, and now? -- now that we
finally have something to work with --
you want to bring planning personnel
down here?"
284,CONKLIN,284,I'd rethink that.
285,ABBOTT,285,I want a second opinion.
286,CONKLIN,286,This is an operations desk.
287,ABBOTT,287,I'm not asking.
288,BOURNE,288,"Slow down. No, don't stop. Just..."
289,MARIE,289,That's it? Is that it?
290,BOURNE,290,Four-fifty. That's the address...
291,MARIE,291,Looks familiar?
292,BOURNE,292,No.
293,BOURNE,293,No. Go around. Keep going...
294,MARIE,294,Where?
295,BOURNE,295,Yeah. Pull in here. Park it.
296,MARIE,296,"So this is it, right?"
297,BOURNE,297,I guess.
298,MARIE,298,I should go.
299,BOURNE,299,I don't remember any of this.
300,MARIE,300,Jason...
301,BOURNE,301,"Sorry. The money, right?"
302,MARIE,302,"Okay, so..."
303,BOURNE,303,Thanks for the ride.
304,MARIE,304,Anytime.
305,BOURNE,305,"Look, I don't know what's up there."
306,MARIE,306,You got me pretty fucking curious.
307,BOURNE,307,"Look, you could come up. Or you could
wait if you want. I could go check
it out. You could wait."
308,MARIE,308,Nah...
309,MARIE,309,"With you, I mean, you'd probably
just forget about me, right?"
310,BOURNE,310,How could I forget about you?
311,BOURNE,311,You're the only person I know.
312,MARIE,312,I guess you're not home.
313,CONCIERGE (O.S.),313,Monsieur Bourne...I'm coming...
314,CONCIERGE,314,"Mr. Bourne, there you are -- I was
wondering -- I haven't seen you --"
315,BOURNE,315,Here I am.
316,BOURNE,316,I seem to have lost my key.
317,CONCIERGE,317,"I've been ringing your bell. It's
good you were away. We had some
trouble with the hot water. It's
been repaired."
318,BOURNE,318,Great. We could use a shower.
319,BOURNE,319,It was a long drive.
320,MARIE,320,It's big.
321,MARIE,321,This is like a real apartment.
322,MARIE,322,This is really yours?
323,BOURNE,323,I guess so.
324,BOURNE,324,This is my frying pan.
325,BOURNE,325,This is my spoon.
326,BOURNE,326,"I'm Jason Bourne and this is my
kitchen."
327,MARIE,327,This is your office?
328,MARIE,328,"God, you live like a monk..."
329,BOURNE,329,"All this stuff -- it's all about
boats."
330,BOURNE,330,I think I'm in the shipping business.
331,MARIE,331,"See. It's starting to come back,
yeah?"
332,MARIE,332,You mind if I take a bath?
333,BOURNE,333,Go ahead.
334,PHONE MACHINE,334,"""You have no messages."""
335,OPERATOR/PHONE,335,"Bonjour, Hotel Marboeuf..."
336,BOURNE,336,...yes -- oui -- uh...
337,OPERATOR/PHONE,337,"Yes, sir. Hotel Marboeuf, Paris.
How can I direct your call?"
338,BOURNE,338,Paris?
339,OPERATOR/PHONE,339,"Yes, sir..."
340,OPERATOR/PHONE,340,How can I help you?
341,BOURNE,341,"Yes, I'm...I'm looking for Mr. Jason
Bourne."
342,OPERATOR/PHONE,342,"One moment, please..."
343,OPERATOR/PHONE,343,"I'm afraid, I have no one by that
name registered, sir."
344,BOURNE,344,D'accord... Merci.
345,BOURNE,345,Un moment -- un moment --
346,OPERATOR/PHONE,346,-- sir? --
347,BOURNE,347,"-- hang on -- I need you to check
another name for me -- hang on -- un
moment, s'il vous plait --"
348,BOURNE,348,"Kane. Do you have Mr. John Michael
Kane?"
349,OPERATOR/PHONE,349,"One moment, sir."
350,MANAGER/PHONE,350,Bonjour? Monsieur? Allo...
351,BOURNE,351,"Yes, I'm here..."
352,MANAGER/PHONE,352,"You call about Monsieur Kane? John
Michael Kane?"
353,BOURNE,353,Yes. Is he there?
354,MANAGER/PHONE,354,You are a friend of his?
355,BOURNE,355,Yes.
356,MANAGER/PHONE,356,"I have some very bad news for you,
sir. I'm terrible sorry to have to
tell you this, but Monsieur Kane has
passed away almost two weeks ago..."
357,MANAGER/PHONE,357,"There was an accident. On the
motorway. Apparently, he was killed
instantly. Really, I'm terrible sorry
to be the one to tell you this..."
358,BOURNE,358,...I understand...
359,MANAGER/PHONE,359,"...we actually, we were unaware for
several days that this had happened.
When they came for his things, it
was made known for us, you see?"
360,BOURNE,360,Who? Who came?
361,MANAGER/PHONE,361,His brother. You know his brother?
362,BOURNE,362,Right. Yes. Of course.
363,MANAGER/PHONE,363,"It's very bad this. Terrible sad.
Such a young man."
364,BOURNE,364,"Do you -- his brother -- do you have
a phone number?"
365,MANAGER/PHONE,365,I think not...
366,MANAGER/PHONE,366,"No, I'm sorry. It was very sudden.
He was here very briefly."
367,MARIE,367,"She wasn't kidding about the water.
It's freezing."
368,BOURNE,368,Hang on. I'll check the kitchen...
369,BOURNE,369,"Maybe it takes a while to get all
the way upstairs."
370,BOURNE,370,"Yeah, it's cold in here, too..."
371,BOURNE,371,Let's give it another minute.
372,MARIE,372,-- omigod! --
373,MARIE,373,-- what're you? -- no -- no --
374,BOURNE,374,"-- no -- Marie -- no! -- it's not
like that --"
375,MARIE,375,-- please -- Jason -- omigod --
376,BOURNE,376,-- quiet -- quiet --
377,MARIE,377,...what are you doing?...
378,MARIE,378,"omigod -- omigod -- what're you doing? --
what're you doing? --"
379,MARIE,379,"-- what is he? -- what've you? --
omigod -- what is this? --"
380,MARIE,380,"-- what're you doing? -- Jason,
please, tell me what's happening!"
381,BOURNE,381,Open it --
382,BOURNE,382,-- do it -- what's he got in there?
383,BOURNE,383,Who are you?
384,BOURNE,384,-- who are you?
385,BOURNE,385,"-- who are you? -- tell me who you
are -- who sent you? --"
386,BOURNE,386,"-- what is this about? -- YOU'VE GOT
TO TELL ME WHAT THIS IS ABOUT! --"
387,BOURNE,387,WHY ARE YOU TRYING TO KILL ME?
388,MARIE,388,"...omigod, no..."
389,BOURNE,389,What? -- what? --
390,BOURNE,390,-- what is it?
391,MARIE,391,"...this is my picture... he's got my
picture --"
392,MARIE,392,"-- this is me -- this is Zurich --
this... this... this is yesterday --"
393,BOURNE,393,-- just --
394,MARIE,394,-- where does this come from? --
395,MARIE,395,How do you have my picture?
396,BOURNE,396,"Marie, just --"
397,BOURNE,397,-- just stay there! -- just --
398,MARIE,398,"-- he's got my picture! -- this is
yesterday! -- this is me! --"
399,MARIE,399,-- where did you get my picture? --
400,BOURNE,400,"-- let me do this, okay? --"
401,MARIE,401,"-- do what? -- what are you doing? --
he's got my picture --"
