,character,line #,line
291,NAKAGAWA (IN JAPANESE),291,"Is it possible that someone could
live without... that?
The Coroner turns back, his face pale."
292,CORONER (IN JAPANESE),292,"Nakagawa turns away to see Igarashi approaching, talking into
a cell phone. He looks disturbed. As he hangs up:"
293,IGARASHI (IN JAPANESE),293,"Someone just reported another
death. It's not in our district...
but I think we should check it out.
Nakagawa realizes something's troubling his partner."
294,NAKAGAWA (IN JAPANESE),294,Why?
295,IGARASHI (IN JAPANESE),295,"The cause of death is not clear...
but it is the man who sold them
this house."
296,IGARASHI (IN JAPANESE),296,"CLOSE ON the spinning wheels of a bicycle.      A familiar one.
The pedals are being pumped by a beautiful young Japanese
woman -- this is YOKO (early 20s).
Yoko turns, riding down a small side street.      It ends, and
she rounds a corner stopping in front of --"
297,IGARASHI (IN JAPANESE),297,"Yoko opens the gate and walks her bike to the front door,
leaning it against the wall nearby (exactly where we saw
Matthew bump into it earlier).
She rings the door buzzer. Waits. She seems to have
expected this: she pulls a KEY from her pocket, with a
plastic LABEL on it."
298,IGARASHI (IN JAPANESE),298,"Yoko steps inside. She instinctively slips off her shoes.
She calls out, in decent English:"
299,IGARASHI (IN JAPANESE),299,"Hi, excuse me?
There's a small ENVELOPE with YOKO'S NAME resting on a small
table by the door. She takes it, opens it."
300,Revisions (Blue) -- 1/26/04         46A.,300,Emma?   It's Yoko.   I'm coming in.
301,Revisions (Blue) -- 1/26/04         46A.,301,"The house is the least ""moved-into"" that we've seen so far:
although the main furniture is in place, MOVING BOXES are
stacked in every room, in various stages of unpacking.
But there's also an unusual amount of mess in the house -- a
disarray, much like the opening sequence, that isn't exactly
related to moving in.
Yoko surveys the room, dismayed by the mess.
Then she sees EMMA at the far end of the living room, her
back to Yoko. She's looking down at something in her hands."
302,YOKO,302,"Hi, Emma.    It's good to see you
again.
Emma turns. Looks blankly at Yoko, who approaches.
Realizing the woman doesn't remember her:"
303,YOKO,303,"My name is Yoko.
The old woman still gives no sign of recognition.   Yoko
gently takes her arm."
304,YOKO,304,"You should be in bed --
Then she sees what Emma was looking at: the roll of DUCT
TAPE. She's cut her finger on the serrated cutting blade."
305,YOKO (IN JAPANESE),305,"You shouldn't be playing with this!
Shaking her head, Yoko takes the duct tape and looks around
for a place where Emma can't get at it --
-- she puts the tape ON THE STACK OF BOOKS at the top of the
bookshelf, next to the scissors (where Matthew found them)."
306,YOKO (IN JAPANESE),306,OMITTED
307,YOKO (IN JAPANESE),307,"From the entrance, we see Yoko come out of the kitchen
holding a tray with a teapot and cup.
She walks into the BACK ROOM, looking down at Emma's bed.
The old woman must be asleep: Yoko gently lays down the
tray, quietly steps out of the room and slides the door shut.
Then Yoko moves through the LIVING ROOM to the PHONE BASE --
-- she picks up THE CORDLESS, finally where it belongs.
Yoko dials a number as she walks into THE ENTRANCE HALL.     She
begins a conversation (in Japanese) as she looks at the
scattered rubbish on the ground, shaking her head.
She climbs up to the SECOND FLOOR, pausing to kneel and pick
up some pieces of crumpled paper, chatting all the while.
THUD. THUD. Yoko pauses, turning towards the open door to
the front room. The rhythmic THUMPING continues."
308,YOKO (IN JAPANESE),308,"The room is a mess. The bed is unmade, clothes are strewn on
the floor. Looks like a storm swept through it.
Yoko stands in the doorway, listening for the THUMPING
sounds. But they've stopped.
She finishes her call and hangs up. Sighs. She sticks the
cordless phone into her pocket and starts to clean the room.
As Yoko straightens the bedspread, she hears something.
Pauses. And we hear it too --
-- a familiar THROATY CROAKING SOUND.   Quiet and muffled."
309,Revisions (Blue) -- 1/26/04         49A.,309,"HER POV: the murky blackness of the hall seems to be slowly
CREEPING IN, phantomlike, around the edges of the door."
310,Revisions (Blue) -- 1/26/04         49A.,310,"Yoko stumbles back into the room.   Her eyes fixed on --
-- THE DOORWAY: the creeping darkness is now coming in
around all sides, not just the bottom.
Yoko backs up to the bed, still clutching the CORDLESS PHONE.
She looks back at the door, suddenly CRYING OUT --"
311,Revisions (Blue) -- 1/26/04         49A.,311,"-- A BLACK CAT sits in the doorway. Tail wrapped around
itself, sitting perfectly still, like a statue. Staring at
Yoko with its yellow eyes. Something unnatural about it.
Yoko backs away towards the closet.   Nowhere to go.
The cat suddenly HISSES AT HER --
-- and that's all Yoko can take.    In a panic, she opens the
closet door, ducks inside."
312,Revisions (Blue) -- 1/26/04         49A.,312,"Yoko slams the door shut, pulling herself up onto a raised
shelf. Breathing hard, looking down at --
-- the crack under the door.   The light is beginning to dim.
Yoko presses back into the closet, trapped.
The closet is starting to get dark.   Quickly.
Yoko looks around desperately.   Looking up, she sees --
-- THE ATTIC PANEL above her is wide open.
Caught between a rock and a hard place.   Yoko decides:
She shakily stands on the shelf and reaches up to pull
herself into the attic."
313,Revisions (Blue) -- 1/26/04         49A.,313,"Yoko's head appears. Then her shoulders.     She looks around,
but can't see a thing in the darkness.
She's about to pull herself all the way up --
-- when she hears the THROATY CROAKING SOUND.
Coming from the darkness.
Yoko stiffens, her breath catching in her throat.
ANOTHER POV: we're at the far end of the attic, suddenly and
rapidly RACING FORWARD TOWARDS YOKO...
ON YOKO:   something brushes her face.   Long, black hair.
There's a head, just inches from hers.    Almost nose-to-nose."
314,Revisions (Blue) -- 1/26/04         49A.,314,"Yoko is paralyzed with fear, eyes wide.   A long beat.
Then she reaches into her pocket, pulling out a LIGHTER.
Yoko raises it and flicks the wheel --
-- we get a glimpse of a PALE FACE, surrounded by long black
hair, eyes wide and mouth open, the THROATY SOUND suddenly
increasing in pitch and volume --
-- as the face moves forward --"
315,Revisions (Blue) -- 1/26/04         49A.,315,"Karen slowly wakes up in bed.    As her eyes clear, she sees --
DOUG. He sits on the edge of the bed, slightly slumped, his
back to her.
He slowly turns -- and a relieved smile crosses his face.     He
moves closer, and reaches out a hand."
316,DOUG,316,"It's okay.     I've got you.
Karen nods, lacing her fingers in his. But her eyes are
glazed and unfocused -- she's exhausted."
317,DOUG,317,"Your boss told me what happened.
I'm sorry.
She turns away, the memory bothering her.    Doug takes her
hand, massaging her fingers, worried."
318,DOUG,318,"I talked to your teachers. They
said you can take as much time as
you need. We could go to Kyoto for
a weekend, see those temples you're
always talking about.
Karen tries to smile back, but her heart's not in it."
319,KAREN,319,Running away won't help.
320,"Revisions (Blue) -- 1/26/04     51A.
KAREN",320,I'm not even sure what did happen.
321,DOUG,321,"You went to help someone who was,
quite simply, beyond help."
322,KAREN,322,"No, that's not what I mean..."
323,KAREN,323,That house. There was something...
324,DOUG,324,"Don't beat yourself up searching
for a greater truth, Kat. An old
woman passed away in her sleep.
It's sad, but that's all it is --"
325,KAREN,325,Is that how they said she died?
326,DOUG,326,"I'm sorry this happened to you.
But maybe, in a way, it will help
you later. Death is an unfortunate
but integral part of your future
career. There's no avoiding it.
Maybe now you'll be more... ready
for it."
327,KAREN,327,"I don't think I'll ever be ready
for something like that."
328,NAKAGAWA,328,"I'm sorry to disturb you, Miss
Davies. I was wondering if you
could answer some additional
questions?"
329,DOUG,329,I'm Doug.    Karen's boyfriend.
330,DOUG,330,You up for this?
331,KAREN,331,"(nodding:)
Why don't you find out when I can
check out of here."
332,NAKAGAWA,332,How are you feeling?
333,KAREN,333,Okay.   Tired.
334,NAKAGAWA,334,"You are an exchange student?
(Karen nods:)
And you have been volunteering at
the Health Center for...?"
335,KAREN,335,"Three months. I needed a social
welfare credit."
336,NAKAGAWA,336,"You said this was the first time
you'd been in that house?"
337,KAREN,337,Yes.
338,NAKAGAWA,338,"About the Japanese boy you said you
saw there --"
339,KAREN,339,Did you find him?
340,NAKAGAWA,340,"No, not yet. You said the boy had
been taped into the closet?"
341,KAREN,341,"Yes, that's right. He was...
holding a cat. A black cat.
(remembering:)
There was a book in the closet,
too. I think it was a journal."
342,NAKAGAWA,342,Did it belong to the boy?
343,KAREN,343,The writing. It looked feminine.
344,"Revisions (Blue) -- 1/26/04    54.
KAREN",344,I left it on the kitchen table.
345,NAKAGAWA,345,"I didn't see any book on the table.
Perhaps someone moved it. Did you
speak with the boy after you opened
the closet?"
346,KAREN,346,"I asked him his name.   He said
`Toshio'."
347,NAKAGAWA,347,"One more question, please."
348,NAKAGAWA,348,We found this in the room where...
349,KAREN,349,This is him. This is the boy.
350,NAKAGAWA,350,Are you certain?
351,KAREN,351,Yes.   Positive.
352,KAREN,352,Detective Nakagawa?
353,KAREN,353,"The whole time I was in that house,
I felt something was... wrong."
354,KAREN,354,What happened there?
355,NAKAGAWA,355,"The bodies of the son and daughter-
in-law of the woman you were caring
for were found in the attic.
Karen just stares at him, stunned."
356,NAKAGAWA,356,"It seems that the son killed his
wife, and then himself --
There's a KNOCK on the door. Igarashi stands in the doorway.
He speaks to Nakagawa in Japanese."
357,NAKAGAWA,357,"Please excuse me for a moment.
Nakagawa puts the photo down and steps into the hallway and
closes the door, but not all the way. Karen watches and
listens through the crack:"
358,NAKAGAWA,358,IN THE HALLWAY:   the men speak with hushed voices.
359,IGARASHI (IN JAPANESE),359,"We checked the apartment of Susan,
the sister. She wasn't there...
He trails off, hesitating."
360,NAKAGAWA (IN JAPANESE),360,Yes?
361,IGARASHI (IN JAPANESE),361,"The chain lock had been drawn from
the inside. And the deadbolt. But
we found no one in the apartment.
Nakagawa takes this in."
362,NAKAGAWA (IN JAPANESE),362,"Get the surveillance tapes from the
office building.
Igarashi nods.    But doesn't move.   After a moment, quietly:"
363,IGARASHI (IN JAPANESE),363,"They were the first family to live
in that house since the incident
three years ago --"
364,IGARASHI (IN JAPANESE),364,"Nakagawa's harsh look silences him. Then the Detective
turns, noticing KAREN watching them. He pulls the door shut."
365,IGARASHI (IN JAPANESE),365,"Nakagawa's stern voice is muffled by the closed door.    Karen
sits back in bed, disturbed.
Then her attention turns to THE FILE on the table.
She considers.   Then reaches for it.   Opens it.
It's a POLICE REPORT, in Japanese.
Karen scans it, and turns the page.     She draws a breath --
-- it's a photo of THE HOUSE. Cordoned off with police tape.
An ambulance out front. Like the scene she just left...
...only the picture is dated three years ago.
THREE DETECTIVES are visible beyond the open front door,
conferring in the entryway.
The photo of the house is attached to a POLICE REPORT, with
THREE PICTURES. A stern-looking Japanese man (TAKEO), a
somber woman (KAYAKO), and a YOUNG BOY we know very well --
Karen makes the connection. She picks up the taped-up photo
and compares it to the file... the boy and his father are the
same as in the newspaper.
Karen gently touches the ""missing"" face of KAYAKO -- then her
eyes move to the picture of THE BOY.
Her eyes widen as she reads THE JAPANESE TEXT under his face:"
366,KAREN,366,Toshio...
367,KAREN,367,"The place is quiet, completely deserted.    Except for --
-- Alex. He's behind his desk in the reception area, staring
off into space. Alex finally glances up at a clock -- it's
almost ten o'clock.
He gets up, turns off his computer, switches off the lights,
and walks around the reception desk towards --"
368,ALEX,368,Yoko?
369,ALEX,369,"What... What happened, Yoko?
Now she finally stops, two steps away.    A long beat."
370,ALEX,370,"Say something, please...
Yoko slowly raises her head towards him --
-- the lower half of her face is missing. Her jawbone has
been ripped out, her tongue hanging limply on her chest.
Alex stumbles backwards... and his foot lands right in a
puddle of blood. His legs fly out from under him and he
CRACKS HIS HEAD AGAINST THE GROUND.
HIS POV: everything goes blurry, and canted 90 degrees.       But
it looks like there's A FIGURE standing in the hallway,
watching the scene...
...a small boy holding a black cat...
Dazed, Alex plants a hand on the ground and pulls himself
into a seating position --
-- and coming face-to-face with YOKO, kneeling down directly
in front of him. Her bloody tongue dripping, lolling...
ON ALEX:   eyes wide, he opens his mouth to scream --"
371,ALEX,371,"Nakagawa sits at the desk. Exhausted, dark circles under his
eyes, he's staring down at --
THE FILE on his desk.   As if he's afraid to even open it.
But he does. He flips through the photos, pausing on that of
TOSHIO, but continuing on to THE BLACK AND WHITE PHOTO of The
House from three years ago (the one Karen saw), with the
THREE DETECTIVES.
Nakagawa turns to a FRAMED PICTURE on his desk -- it's
YOUNGER NAKAGAWA at a bar with THREE FAMILIAR DETECTIVES.
They're off-duty, grinning at the camera. Buddies.
The two photographs share THE SAME THREE DETECTIVES."
372,ALEX,372,"As Nakagawa looks at the crime scene photo, he realizes
something. He slowly stands, in shock, trembling.
The phone RINGS, startling him.
Nakagawa walks over, picks up the phone."
373,NAKAGAWA (IN JAPANESE),373,"Hello?
He listens.
His face goes blank.    He slowly lowers the phone."
374,NAKAGAWA (IN JAPANESE),374,OMITTED
375,NAKAGAWA (IN JAPANESE),375,"The CORONER sits on a stool, staring at the floor. TWO
BODIES lie under bloody white sheets on two STEEL TABLES.
Between them is a small cart -- a bloody cloth on top.
Nakagawa and Igarashi enter. The Coroner stands, nervous.
He walks to one of the tables and pulls back the sheet."
376,NAKAGAWA (IN JAPANESE),376,"Have you determined a cause of
death?"
377,CORONER (IN JAPANESE),377,"Not yet. The blood on his body --
isn't his. It belongs to her.
He points to the other table.    But doesn't look at it."
378,DOUG,378,"I got us a guidebook to Kyoto. I
thought maybe we'd leave tomorrow --"
379,KAREN,379,Why didn't you tell me?
380,DOUG,380,Tell you what?
381,KAREN,381,"About the bodies they found in the
attic."
382,DOUG,382,"You were recovering from a shock.
I didn't want to --"
383,DOUG,383,Karen -- wait --
384,DOUG,384,"Look, I'm sorry. I was just
worried about you, and -- I know
you, Karen."
385,KAREN,385,"The same thing happened three years
ago, Doug. To a Japanese family,
who lived in that house. They were
all found dead."
386,DOUG,386,"So you think the events are
connected?"
387,KAREN,387,How would you explain it?
388,DOUG,388,"Okay. How about this: the
American family knew about what had
happened there before, and this
knowledge subconsciously caused
them to repeat the same events."
389,DOUG,389,"It's exactly how superstitions
survive: if you walk under a
ladder and think uh-oh, you're in
for some bad luck, sure enough,
what do you know? You trip over --"
390,KAREN,390,"(heard it before:)
-- trip over the curb and sprain
your ankle."
391,DOUG,391,"Makes sense, right?"
392,KAREN,392,"Okay. Then explain this: when I
went to that house, I didn't know
anything about its past. But yet I
still saw..."
393,DOUG,393,Saw what?    Karen?
394,KAREN,394,"Emma and I were alone in that room,
but -- there was something else
there. I'm sure of it."
395,DOUG,395,"You watched a woman die, Kat.
That's a horrible thing to
experience. I can't imagine how
you must feel. But sometimes the
mind tries to cope with terrible
things in a way that distorts what
actually occurred."
396,KAREN,396,"You might be right, Doug. But I
know what I saw.
(then, faltering:)
I think I know what I saw..."
397,DOUG,397,"You just need to rest. We'll get
you home, get a good night's sleep."
398,KAREN,398,Yeah.
399,KAREN,399,"You've got class, and I'm sure I
only have to fill out a few forms
or something --"
400,DOUG,400,You sure?
401,KAREN,401,"I'm fine, Doug. Really."
402,KAREN,402,"Karen sits at her computer desk.   She looks exhausted.
Online, Karen pulls up the home page for The Japan Times, an
English-language newspaper.
She types Toshio's full name into a SEARCH window.
A LIST of links appear, filling the screen. Karen scans
them. Tries one. It's not what she's looking for.
She re-enters Toshio's name along with a year -- `2001'.
Only ONE LINK appears.   The word `MURDERED' in the headline."
403,KAREN,403,"Karen clicks it.   The article fills the screen.
As Karen reads it, we catch glimpses of names -- `Toshio',
`Kayako', `Takeo'. And an ominous phrase: ""MURDER/SUICIDE"".
Karen clicks a link marked `IMAGE'. A scanned picture of the
newspaper appears -- the article is on the front page, with
familiar photos of Toshio, Kayako and Takeo.
But then Karen's eyes drift to another picture at the bottom
of the page --
-- PETER. She quickly recognizes him from the picture she
found in the journal. His name is printed below the photo.
A picture of Peter and Maria's CONDO BUILDING is next to it.
She looks at the headline:   ""AMERICAN ENGLISH TEACHER THROWS
SELF FROM BUILDING"".
Karen scans the article, thinking.   Then she looks up at --
-- TOSHIO'S PICTURE."
404,KAREN,404,"Nakagawa is looking at the same picture, in his file.
OFFICER #1 appears in the hall.   Knocks gently on the door."
405,OFFICER #1 (IN JAPANESE),405,"This just came in. It's the
surveillance video you requested.
It takes a moment for Nakagawa to snap out of it.
He finally nods, takes the tape. He opens the envelope and
looks at the cassette. Like he doesn't want to watch it.
Then he turns to a TV/VCR combo and inserts the tape.
ON THE SCREEN: the 10TH FLOOR HALLWAY from Susan's office
building, and the door leading to the stairwell.
A beat.   The image FLICKERS for a moment.
Then the door suddenly bursts open and Susan, terrified, runs
from the stairwell and down the hall.
ON NAKAGAWA:   he fast-forwards the video.   Until --"
406,OFFICER #1 (IN JAPANESE),406,"ON SCREEN: -- the SECURITY GUARD appears in the hallway.        As
Susan saw earlier, he opens the door to the stairwell and
looks inside. Then he closes the door and continues o.s.
ON NAKAGAWA:   he reaches forward to turn off the video --
ON SCREEN:   -- but then the video CRACKLES with a quick burst
of static.   And the door to the stairwell opens again.
ON NAKAGAWA: he's watching, entranced, terrified.      He can
hardly believe what he's seeing --
ON SCREEN: -- A DARK FIGURE EMERGES FROM THE STAIRWELL.    It's
the shape of a woman with long hair --
-- but the figure is BLURRY AND SHIFTING, as if the black
shadow has loosely compacted itself into the form of a human.
NAKAGAWA watches, breathless, as THE FIGURE slowly enters the
hallway, passing by, underneath the camera.
The image stops flickering.    An empty hallway now.   A beat.
Nakagawa, his hand shaking, reaches forward, about to turn
off the television set, when --
DARKNESS SUDDENLY OVERTAKES THE SCREEN, rising up from the
bottom until everything is dark. A strange HUMMING RATTLE
comes from the speakers, and the image JITTERS madly.
Nakagawa leans forward, right up to the screen, trying to
make out an image in the swirling blackness --
Two eyes open, staring at Nakagawa.
Terrified, Nakagawa stands and turns away, closing his eyes.
And when he finds the strength to look back --
-- THE EYES are still there.
Locked onto him, even though he's moved.
Unflinching.   Unblinking."
407,OFFICER #1 (IN JAPANESE),407,Nakagawa stands at the front door.    Gathering his courage.
408,OFFICER #1 (IN JAPANESE),408,Revisions (Blue) -- 1/26/04   67.
409,OFFICER #1 (IN JAPANESE),409,"There's the sound of the front door UNLOCKING and Doug
enters, carrying a bag. He closes the door behind him and
walks in, turning the corner --
-- finding Karen, looking a bit dazed, standing right there.
He's startled, but quickly recovers:"
410,DOUG,410,"I come bearing gifts.
Karen smiles weakly. She takes the bag and enters the
kitchen. He watches her go, worried. Then he notices --
HER DESK. Doug walks over, looking at the printouts she's
taped to the wall. And the photo of The House in the center.
Bewildered, he sits down, leaning forward and taking a good
look. His eyes stop on the picture of TOSHIO.
Doug turns to see Karen staring at him from the kitchen.
It's an awkward moment: he's concerned, but doesn't know
what to say. And neither does Karen.
Finally she approaches, looking at Toshio's picture:"
411,KAREN,411,(almost a whisper:)
412,KAREN,412,"(intense:)
There's something wrong with that
house, Doug. Something really bad.
(re: Peter's photo)
The boy in that house, he had a
photo of this man. He died on that
same day three years ago. I need
to talk to his wife... widow. If I
can find out what happened, or
if... maybe --"
413,DOUG,413,"Maybe, what?"
414,DOUG,414,"I'm concerned about you going out
while you're so upset --"
415,KAREN,415,"You don't understand.   I have to,
Doug."
416,DOUG,416,Why?
417,KAREN,417,"Because I've been inside that
house, Doug. Don't you get it?
I've been inside!"
418,KAREN,418,I love you. But I have to go.
419,Revisions (Blue) -- 1/26/04     70-72.,419,"The same building from the newspaper clipping.   Monolithic
against a cloudy, bleak sky.
Karen stands before it, staring up at it.
Then she walks to the intercom and looks at the directory,
finds `M. Kirk'. She activates the intercom and dials the
number. It rings a few times, and then a voice picks up:"
420,"MARIA (INTERCOM, IN JAPANESE)",420,Yes?
421,KAREN,421,I'm looking for Maria Kirk?
422,KAREN,422,Who is this?
423,KAREN,423,"My name is Karen Davies. I'm a
student at -- I'm sorry to bother
you, but I was wondering if I could
ask you a few questions.
A long beat.   Karen stares at the intercom."
424,KAREN,424,Ms. Kirk?
425,KAREN,425,Questions about what?
426,KAREN,426,"I'm here because... I need to speak
with you about your husband.
When Maria's voice comes back through the intercom, she
sounds different, shaken:"
427,KAREN,427,Leave me alone.
428,KAREN,428,Maria --
429,MARIA (INTERCOM),429,"Please.
Karen stands there for a moment.   Then, as she walks away --"
430,MARIA (INTERCOM),430,Revisions (Blue) -- 1/26/04   73.
431,MARIA,431,I'm late for work.
432,KAREN,432,I just need a couple minutes.
433,MARIA,433,Make yourself at home.
434,MARIA,434,Well?
435,KAREN,435,"Your husband, Peter.    Three years
ago he..."
436,MARIA,436,He what?
437,KAREN,437,He killed himself.
438,"Revisions (Blue) -- 1/26/04        74A.
KAREN",438,"(almost ashamed:)
I'm... sorry."
439,MARIA,439,Thank you.
440,MARIA,440,How did you know Peter?
441,KAREN,441,I didn't.
442,MARIA,442,Then what are you doing here?
443,KAREN,443,"I think there's a connection
between your husband's death and
something that happened to me."
444,MARIA,444,What happened to you?
445,KAREN,445,It's... hard to explain.
446,KAREN,446,"Look, I know this sounds strange,
but... I don't think your husband
wanted to die."
447,MARIA,447,"(even:)
Then why would he throw himself out
a window?"
448,MARIA,448,Let me guess: `hard to explain'?
449,"Revisions (Blue) -- 1/26/04    74B.
MARIA",449,"I put all this behind me. I don't
want to open it back up again."
450,KAREN,450,"If that's true, then why are you
still here in Japan?"
451,MARIA,451,"Because I can't leave. I tried.
But I couldn't. Not without..."
452,MARIA,452,"He usually didn't wake up before
me. But that morning, he did. He
made coffee for us. Then he sat
there and waited for me to wake up.
And when I did, he looked me right
in the eye. And then he jumped.
The night before we'd been talking
about having children together..."
453,KAREN,453,Did you know a woman named Kayako?
454,MARIA,454,No.
455,KAREN,455,Did Peter?
456,MARIA,456,I don't think so.
457,KAREN,457,"Maybe it was someone he worked
with?"
458,MARIA,458,"Look. I've had the police up here,
I talked with Detectives, I even
hired a P.I.--
(composing herself:)"
459,"(MORE)
Revisions (Blue) -- 1/26/04     74C.",459,"I don't know what you're going
through, or what you think you know
about my husband. But I don't have
any answers. I'm sorry."
460,KAREN,460,"Please. I don't know what else to
do. Please help me."
461,MARIA,461,This is all his stuff from school.
462,MARIA,462,This was our first date.
463,KAREN,463,"(under her breath:)
Oh my God."
464,MARIA,464,What?   Did you find something?
465,MARIA,465,"The same GROUP PHOTO is in a frame on Peter's desk.
Peter stands behind the desk, using a small mirror to knot
his tie. His open door reads: `DEPARTMENT OF ENGLISH'.
A CO-WORKER (20s, Japanese) enters with a stack of mail."
466,MARIA,466,Happy Monday.
467,MARIA,467,"Yeah, right. Here's your mail.
He hands it to Peter. On the top is a small BLUE ENVELOPE.
The name in the return address is `Kayako'."
468,CO-WORKER,468,"Another one, huh?"
469,PETER,469,"I don't even know her. She says I
used to tutor her, but I don't know
who the hell she is."
470,PETER (IN JAPANESE),470,Hello?   Excuse me?
