,character,line #,line
471,Revisions (Blue) -- 1/26/04      79A.,471,"A familiar BOY is inside -- it's TOSHIO. His glazed and
staring eyes don't seem to notice Peter, standing right in
front of him."
472,PETER (IN JAPANESE),472,"Hello.
No reaction. There's definitely something wrong with this
boy. Peter looks beyond him, into the dark house."
473,PETER (IN JAPANESE),473,"My name is Peter. I'm here to see
your mother. Is she home?
The boy slowly straightens. His eyes focus on Peter. Then
he FALLS BACKWARDS. Startled, Peter tries to see inside:"
474,PETER (IN JAPANESE),474,"Hey!   Are you okay??? Hello???
Peter quickly goes back to the front door.   Tries the handle -
- it's unlocked. He opens the door."
475,PETER (IN JAPANESE),475,"Peter steps inside, unsure about entering uninvited."
476,PETER (IN JAPANESE),476,"Hello? Excuse me. I'm coming in.
His concern for the boy wins out. He kicks off his shoes,
and quickly walks to the open bathroom door."
477,PETER (IN JAPANESE),477,OMITTED
478,PETER (IN JAPANESE),478,"Peter enters, finding Toshio lying on the floor. He must
have been standing on the edge of a TUB by the window."
479,PETER (IN JAPANESE),479,"Are you alright?
As Peter helps the boy to his feet, he glances at the
bathtub. It's filled, literally to the brim, with water."
480,PETER (IN JAPANESE),480,"Peter holds Toshio's hand as he leads him back to a couch in
the living room."
481,PETER (IN JAPANESE),481,"Are you alone? Where are your
parents?
The boy sits in the couch, slumped over, still looking dazed.
Peter studies him, looking at the ugly BRUISES on his arms
and legs. There's also a big one around his neck."
482,PETER (IN JAPANESE),482,"What happened to you?
Peter reaches out to lift Toshio's chin, but he FLINCHES,
pulling backwards. His eyes manage to focus on Peter.
Then the boy looks away.    Lowers his head.   A long beat.
Peter's worried. This really doesn't look good.     He scans
the messy room, eyes falling on something.
He reaches down and picks up PIECES OF A PHOTOGRAPH, lying
next to a broken frame -- they've been crumpled into a ball.
ON THE PHOTO: Peter unfolds the pieces and rearranges them.
We've seen this picture before --
-- a FAMILY PORTRAIT. TOSHIO, holding a cute BLACK CAT.
Standing with his mother and father -- KAYAKO and TAKEO.
They're all beaming at the camera, a perfect, happy family.
Except that the mother's face has been torn out.
Then there's a muffled MEOW.    Peter looks over at the window.
Did that come from outside?
Another MEOW.   Peter walks to the window, looking out.
FROM OUTSIDE, LOOKING IN: a worried look crosses Peter's
face as the MEOW becomes more of a GROWL, as if in warning.
He looks outside, but can't see anything --"
483,PETER (IN JAPANESE),483,"-- but we see, over Peter's shoulder, that TOSHIO is now
LOOKING DIRECTLY AT HIM, eyes wide --
-- the MEOWING emitting from his wide open mouth --"
484,PETER (IN JAPANESE),484,"Karen enters quickly, going up to the front desk.
OFFICER #2, filling out paperwork, doesn't look up."
485,KAREN (IN JAPANESE),485,"Excuse me, I need to speak with
Detective Nakagawa.
Officer #2 looks up at her.   Blankly."
486,KAREN (IN JAPANESE),486,It's an emergency.
487,KAREN (IN JAPANESE),487,"One moment.
Officer #2 walks to the end of the desk, where two more
OFFICERS speak in hushed tones with DETECTIVE AOKI.
Officer #2 interrupts their conversation. And they all look
over at Karen. A beat. Then Detective Aoki approaches."
488,KAREN (IN JAPANESE),488,"You are asking for Detective
Nakagawa?"
489,KAREN,489,"Yes, I have important information
for him about a case...
She looks around. Everyone is watching her. The mood is
decidedly grim. She can tell something's up."
490,KAREN,490,"Detective Nakagawa is not here
right now. Can you tell me what
case this is regarding?
There's something behind the Detective's words."
491,KAREN,491,"His partner, Detective Igarashi?
Can I speak with him?"
492,KAREN,492,Aoki exchanges a look with the officers.
493,KAREN,493,"Can you tell me your name, please?
Karen looks at the somber faces in the quiet station.     She
backs away from the desk as the realization sinks in."
494,KAREN,494,"They're dead, aren't they?
Karen turns and runs for the exit."
495,KAREN,495,"Miss, wait please --
But she's long gone."
496,KAREN,496,"A reading light on the computer desk provides the only
illumination in the dark apartment.
Karen enters, standing in the doorway for a moment.     Shell-
shocked. As she slides off her coat:"
497,KAREN,497,Doug?
498,DOUG (ON MACHINE) (cont'd),498,"If all this is real to you, then
it's important to me, and I'm gonna
check that house out. So just sit
tight, I won't be long. I love
you."""
499,KAREN,499,No.
500,DOUG,500,Hello?
501,KAREN,501,Doug!   Where are you???
502,KAREN,502,Doug???
503,VOICE (O.S.),503,"Hey, Maria, it's me. Yeah, I'm
still at school..."
504,VOICE (O.S.),504,"-- PETER. She recognizes him immediately.    He's standing in
the hallway, talking on his cell phone."
505,VOICE (O.S.),505,"...I know, I'm sorry -- these staff
meetings always run over -- maybe
another ten minutes or so -- okay,
I'll be home soon -- I love you
too.
He hangs up.   Leans against the wall.   Looking into --
THE FRONT BEDROOM. Karen gasps as she sees TOSHIO through
the open door. He's sitting on the ground, making drawings
of BLACK CATS. This is his bedroom."
506,PETER,506,"Guess your mom's late, huh?
Then Toshio suddenly looks up.   Right at Karen.
Following Toshio's gaze, Peter quickly turns to face Karen.
But even though she's right there, he doesn't see her:
She's seeing something that happened three years ago.
As if sensing her presence, Peter walks right to the edge of
the stairs, looking down. Then:
A RUSTLING SOUND comes from the dark hallway. Peter turns
towards the REAR BEDROOM at the end of the hall."
507,PETER,507,"Peter stands in the doorway, looking into the MASTER BEDROOM
of Toshio's parents. His attention is drawn to something
near the door --
-- a DESK. It's got a computer, some files.     Someone's
personal work space.
Peter steps to the desk. He picks up A STACK OF PHOTOGRAPHS.
Family pictures: with father (TAKEO), mother (KAYAKO), and
son (TOSHIO), holding his black CAT.
KAYAKO'S FACE has been torn out of every one.
Peter notices something underneath the pile of photos -- a
familiar JOURNAL. The same one Karen found in the closet.
He opens it."
508,Revisions (Blue) -- 1/26/04        88.,508,Peter backs away in horror --
509,Revisions (Blue) -- 1/26/04        88.,509,"Peter backs into the hallway, breathing hard.
Then a familiar sound reaches our ears:   THUD.   THUD.   THUD.
It's coming from Toshio's room. And it's the same rhythmic
THUDDING we've heard coming from this room before.
Peter wrenches his gaze from the horrific sight and heads
quickly down the hall (with Karen following him):"
510,PETER,510,"Toshio!   We have to --
He stops short at the door, as he sees --
-- TAKEO, Toshio's father. Eyes rolled back in his head,
tongue swollen and lolling from his blue lips.
He's dead -- he's hanging from the ceiling by BLACK HAIR that
seems to cover its entire surface. Kayako's hair.
TOSHIO, now back to his ""dead"" appearance, playfully swings
the body. Takeo's feet THUD rhythmically against the wall."
511,KAREN,511,"Oh my God...
Peter doesn't stay to see any more.   He runs."
512,KAREN,512,"Peter tears down the stairs and runs for the front door,
passing a mirror --
-- he freezes. He saw SOMETHING in the reflection as he
passed. Something wrong.
He takes a step back and looks --
-- it's not his reflection in the mirror.   It's KAYAKO.
Peter stares at the image in disbelief. Then he notices
TOSHIO standing next to Kayako, looking up at her."
513,Revisions (Blue) -- 1/26/04     89A.,513,That came from upstairs.
514,KAREN,514,DOUG!   NO!!!
