,character,line #,line
158,MATTHEW,158,"-- and TOSHIO'S SHADOW, cast by the fallen light, begins to
STRETCH AND GROW across the ceiling. The shadow creeps over
Jennifer, shifting and coming towards Matthew --
-- Matthew grabs the lamp.    He reaches it, holding it up --
At first, it looks like both Jennifer and Toshio have
disappeared. But then --
-- Jennifer, suddenly back on the bed, SITS UPRIGHT, jerkily,
as if she's been yanked up and forward. Her mouth is wide
and gasping --
-- and then she falls back onto the bed.     Dead.
Matthew, stunned, backs away from the bed, against the
closet. Terrified, he doesn't notice --
-- the THUD THUD sound growing around him.     Then --
-- TOSHIO'S HEAD comes into frame behind him. Matthew hears
a GROWLING SOUND and turns, seeing Toshio right there! --"
159,MATTHEW,159,"The DOORBELL rings.   Then a few more times.
SUSAN (American, late 20s) enters, with two bottles of wine."
160,SUSAN,160,"Hello?
She kicks off her shoes."
161,SUSAN,161,You guys in the kitchen?
162,SUSAN,162,"Susan walks in, puts the wine on the table.     Looks around."
163,SUSAN,163,"I thought you guys were gonna cook!
She goes into the BACK ROOM.    Sits next to Emma."
164,SUSAN,164,"Hi, Mom.    How are you feeling?
Emma turns to her with her usual vacant look."
165,SUSAN,165,"I guess I came at a bad time, huh?"
166,SUSAN,166,"Twisting a corkscrew into a wine bottle, Susan leans into the
foyer, yelling upstairs:"
167,SUSAN,167,"I'll give you guys one minute to
finish whatever you're doing up
there and get your butts down here.
As she heads back towards the kitchen, we CRANE UP to see --
MATTHEW. He's walking down the second floor hall. He looks
different: the expression on his face is troubled, occupied.
And he's dragging his dead wife's body.   By the hair.
He pulls her inside the REAR ROOM -- the doorway looks more
imposing, more ominous, than before. It's dark and
malevolent, the threshold to a secret that won't stay buried.
We CRANE BACK DOWN to see Susan in the kitchen.   She's poured
a glass of wine and sighs impatiently.
She walks back down the hall into the foyer."
168,SUSAN,168,"I mean it, guys.
Silence from upstairs.   Shaking her head:"
169,SUSAN,169,"Well, I warned you. Prepare to be
emotionally scarred.
She starts up the stairs and turns the first corner --
-- MATTHEW is sitting there, hands on his knees, looking
harried. Susan YELPS."
170,SUSAN,170,"Matthew!   Don't scare me like that!
He's shaking slightly.   His eyes drift up to hers."
171,SUSAN,171,What's going on?   Where's Jennifer?
172,"Revisions (Blue) -- 1/26/04      26.
MATTHEW",172,She went out. Something came up.
173,SUSAN,173,"I hope she's not long.    I'm
absolutely starving."
174,SUSAN,174,"I knew it. You guys forgot to go
shopping, didn't you?"
175,MATTHEW,175,I'm sorry.     This is a bad time.
176,SUSAN,176,Are you okay? What's going on?
177,MATTHEW,177,You should go.
178,SUSAN,178,Did something happen?    What's --
179,MATTHEW,179,"She doesn't love me... she never
loved me..."
180,SUSAN,180,What are you talking about?
181,SUSAN,181,"Stop it, Matthew."
182,MATTHEW,182,Leave me alone.
183,SUSAN,183,"Matthew, please --"
184,MATTHEW,184,"GO AWAY!!!
Susan fumbles with the front door. She gets it open and runs
out just before Matthew reaches her.
ON MATTHEW: he stands there, head tilted down, for a moment.
Then he straightens. Slowly closes the front door.
Matthew heads back upstairs. He reaches the second floor and
opens the door to the rear bedroom.
The room beyond is dark. But A DARK FIGURE is visible,
standing in the far corner, facing Matthew.
He steps inside, and the door slowly swings shut behind him."
185,MATTHEW,185,"It's an overcast afternoon.  Swollen clouds hang low over
The House. It looks a bit more imposing than usual.
THE MAILBOX is adorned with the Japanese equivalent of a ""For
Sale"" sign -- weather-worn, and looks like it's been there
for years.
SUZUKI (30s, Japanese), a Real Estate agent, waits by the
gate. Then he notices something. Waves, and smiles.
It's SUSAN, approaching with MATTHEW, JENNIFER and EMMA.
Susan shakes Suzuki's hand and they exchange a greeting in
Japanese. She turns to her brother."
186,SUSAN,186,"This is Suzuki-san, he's the Real
Estate broker.
Suzuki bows at Matthew and Jennifer, says something."
187,MATTHEW,187,What did he say?
188,SUSAN,188,"He said: ""welcome to Tokyo"". And
that you must be very important to
your company for them to rent this
place for you."
189,SUSAN,189,Matthew grins.   Susan rolls her eyes.
190,SUSAN,190,"Everyone enters, checking the place out. Suzuki and Susan
slip off their shoes. As Matthew steps into the foyer:"
191,SUSAN,191,Your shoes.
192,MATTHEW,192,"Oh.    Right.
He kneels down, untying his shoes.   Jennifer looks perplexed."
193,JENNIFER,193,Even in our own house?
194,SUSAN,194,"Even in your own house.
Suzuki smiles as Matthew and Jennifer take off their shoes.
Susan says something to him in Japanese and he laughs. They
walk down the hall, and Matthew and Jennifer follow."
195,SUSAN,195,"Suzuki opens the blinds, letting some light into the place.
It's not helping much -- it's still pretty dreary."
196,MATTHEW,196,"Isn't the layout great? Wait `till
you see the back room. It's
perfect for Mom -- she won't have
to deal with the stairs.
Jennifer follows him through the room.   She doesn't look
quite as enthusiastic.
Matthew slides open the door leading to the TATAMI ROOM."
197,MATTHEW,197,"Her bed won't be here until next
week, but we can put the mattress
on the floor. What do you think?
Jennifer warms a bit.   The wooden room is beautiful.
Susan asks Suzuki a question in Japanese, and he responds."
198,SUSAN,198,"He says no one has lived in this
house for three years."
199,JENNIFER,199,"Why?
Susan asks Suzuki in Japanese.    He shrugs."
200,JENNIFER,200,"Ex-pen-sive.
Matthew suddenly realizes:"
201,MATTHEW,201,"Where's Mom?
We slowly CRANE UP to the SECOND FLOOR HALL, moving towards
the REAR ROOM at the end. The door is ajar."
202,MATTHEW,202,"Susan comes up the stairs, worried."
203,SUSAN,203,Mom?   Where are you?
204,SUSAN,204,"Susan looks inside -- Emma isn't there. She's about to leave
when something catches her attention. She walks to
THE CLOSET. The door is open. Susan kneels down, looking at
something inside it. She picks it up --
-- it's the CERAMIC CAT Karen found earlier. As Susan
examines it, she notices something on the wall of the closet
(which we don't see). Her face softens, and she smiles."
205,SUSAN,205,Did you get her?
206,SUSAN,206,"Take a pill, will ya?
Susan stands and walks out of the room. But we stay in the
closet, PANNING TO REVEAL the closet wall. It's covered with
BLACK CRAYON, low to the ground, the work of a child. The
images are dozens of BLACK CATS."
207,SUSAN,207,"Emma stands in the dead center of the empty bedroom.
Looking directly up at the ceiling.
Susan enters, placing the ceramic cat on THE SHELF where
Karen found it earlier. Except Susan faces it INTO THE ROOM."
208,SUSAN,208,"C'mon, Mom. You know what the
doctor said about stairs.
She takes Emma's hand, but the old woman doesn't move.
Matthew and Jennifer enter, worried."
209,MATTHEW,209,She okay?
210,SUSAN,210,"Mom?   What is it?
Everyone follows her gaze to the ceiling.   Only Emma has the
unmistakable look of dread on her face.
A long beat."
211,SUSAN,211,"Suzuki walks from the kitchen into the hallway, giving the
place one final look-over.
He pauses by the open bathroom door.   Looks inside."
212,SUSAN,212,"Suzuki enters, looking at THE TUB:    filled to the brim.
After a moment, Suzuki kneels down next to the bathtub.     He
pulls the thin CHAIN connected to the rubber stopper --
-- but the end of the chain comes out of the water.      Hmmm.
It's not connected after all.
Suzuki eyes the plug at the bottom of the tub.
Then he takes off his jacket.   Rolls up his shirt sleeve.
And reaches into the water for the rubber stopper.
It's just out of reach.
He rolls up his sleeve a little more.   Reaches deeper --
-- suddenly there's a BURST OF SOUND: a dull THUMPING,
something THRASHING in water, the SCREAMING of a YOUNG BOY,
voice MUFFLED by water --
-- Suzuki recoils as water SPLASHES UP around him --
-- he falls away from the tub in horror, landing on his butt.
THE BATHTUB: Filled to the brim.     Still and silent.    Not so
much as a ripple on the surface.
That couldn't have just been his imagination, could it?
As he slowly stands, he sees something out of the corner of
his eye --
-- a DEAD CAT, bloody and torn, in the corner of the room."
213,SUSAN,213,"As Suzuki backs away from it, eyes widening in horror, he's
startled by --
MATTHEW, standing in the doorway.   Beaming at him."
214,MATTHEW,214,"It's perfect. We'll take it.
Suzuki looks back to the corner.    There's no dead cat.
A RINGING SOUND comes into focus -- the BEEPING of a phone,
waiting for someone to pick up and make the connection..."
215,MATTHEW,215,"It's after-hours in this office space: CUBICLES fill the
center, surrounded by glass-windowed OFFICES. The glittering
lights of the Tokyo cityscape beyond show a hell of a view.
One light still burns in an office towards the end --
-- SUSAN'S OFFICE. She's working late. She wears a phone
headset while she types lines of code into her computer.
No one's answering.   A familiar answering machine picks up:"
216,MATTHEW & JENNIFER (ON MACHINE),216,"""Konnichiwa! Matt and Jennifer
aren't around, leave a message."""
217,MATTHEW & JENNIFER (ON MACHINE),217,"Hey, guys, it's Susan. Matt, are
you there? Pick up... Okay, well,
I'm leaving work now so you can try
my cell, or just call me at home
later.
She pauses.   Leans back, away from the keyboard."
218,MATTHEW & JENNIFER (ON MACHINE),218,"I just wanted to make sure Mom is
okay. Yesterday was..."
219,(MORE),219,"a bit weird, and -- I'm just a
little worried. Listen, just give
me a call when you can, okay?
She hangs up, taking the headset off.   Concerned."
220,(MORE),220,"Susan walks through the hallway. She hears a strange
scraping sound -- it sounds as though something is being
dragged.
Susan turns around, but the hallway looks normal. Is it just
her imagination?
The sound starts again, coming closer. Susan gets scared and
opens the door to the emergency stairwell beside her."
221,(MORE),221,"The hallway is chilly -- Susan shivers. She's about to start
walking down when she looks up, noticing THE LIGHTS at the
top floor FLICKERING.
A wind suddenly blows through the center of the stairwell
with an eerie ROAR.
Susan looks disconcerted as she starts walking down...
Then we hear the SCRAPING SOUND again. Startled, Susan
pauses and looks down, over the railing.
There's nothing there -- but the sound continues, growing
louder, like something is moving up towards her."
222,SUSAN,222,"Is anybody there?
Just then, the lights on the top floor finally GO OUT.
Susan's breath catches in her throat as she looks up --
The lights on the next floor go out. And the next. The
darkness above growing closer with each darkening floor.
Susan nervously looks back down -- the SCRAPING is even
closer. And then, for an instant, she sees A SKINNY PALE
HAND on the railing two floors down.
Terrified, Susan starts to back up -- but stops as she
realizes that the darkness from above is almost upon her."
223,SUSAN,223,"Then Susan sees A FINGERTIP of the hand at the corner of the
floor where she stands, and A HEAD COVERED WITH BLACK HAIR
slowly crawling up on the wall.
Susan's mouth opens in a silent screen. With nowhere to
escape, she opens the same door and rushes back into the
hallway --"
224,SUSAN (IN JAPANESE),224,"In the stairs... there was...
something... a strange person...
all the lights were going out..."
225,SUSAN,225,Please. Help me.
226,GUARD (IN JAPANESE),226,I'll take a look. Wait here.
227,GUARD (IN JAPANESE),227,"Susan takes a breath and sits down, trying to relax. It's
obvious that she feels safer, here in the Security Room.
Then she notices movement on one of the SECURITY MONITORS --
ON THE SCREEN: -- the GUARD continues down the 10TH FLOOR
HALL, stopping at the door to the stairwell.
Susan leans toward the monitor for a better view.
ON THE SCREEN: the Guard opens the stairwell door and leans
inside, checking it out.
ON SUSAN:   her eyes are glued to the screen.   Waiting.
ON THE SCREEN: the Guard, finding nothing out of the
ordinary, closes the door and continues on down the hall.
SUSAN leans back, exhaling.    Relieved.
Then the video CRACKLES with a sudden quick burst of static.
And Susan GASPS, sitting upright, as she sees --
ON THE SCREEN:   the stairwell door OPENS AGAIN.   And then --
-- something DARK moves out of the stairwell, entering the
hallway.
ON SUSAN: she recoils from the screen in horror, unable to
tear her gaze away. Her mouth opens in a silent scream, her
eyes widening as she watches --
-- and then she finds the strength to get to her feet."
228,GUARD (IN JAPANESE),228,"Susan bursts out of the security room and runs through the
empty lobby, towards the front doors."
229,GUARD (IN JAPANESE),229,"Susan rushes out of the front doors and runs to the street.
She frantically hails a cab and gets in."
230,GUARD (IN JAPANESE),230,"Susan presses herself in the corner of the back seat, purse
clutched tightly in her white knuckles."
231,GUARD (IN JAPANESE),231,"A shifting wash of colors flood the taxi: the NEON LIGHTS of
the surrounding buildings tower above, threatening to swallow
her whole."
232,GUARD (IN JAPANESE),232,"Susan rushes through the front doors, clutching her purse
strap with both hands. Shaken, just wanting to get home.
She runs to the elevator and jabs the button for her floor."
233,GUARD (IN JAPANESE),233,"Susan tries to regain her composure as the elevator rises.
She closes her eyes and leans against the wall --
-- not noticing A FAMILIAR PALE JAPANESE BOY looking at her
through the window of every floor she passes --
Toshio. He's standing CLOSER TO THE WINDOW with each floor.
Until finally, he's RIGHT NEXT TO THE GLASS --
The elevator stops at her floor:    no little boy this time."
234,GUARD (IN JAPANESE),234,"Susan gets out of the elevator, moving quickly to her
apartment at the end of the hall.
She chances a look over her shoulder as she puts the key in
her lock. Then she goes in and closes the door."
235,GUARD (IN JAPANESE),235,"Susan enters. She takes a long, deep breath. Safe at home.
She sits at her kitchen table, laying her purse down.
Her eyes go to the BROKEN CHAIN still hanging from the strap,
with some rabbit's foot fur lodged in the links.
Susan's home phone RINGS, and she jumps.    She stares at it
for a moment, then tentatively answers:"
236,SUSAN (INTO PHONE),236,Hello?
237,MATTHEW (PHONE),237,It's me.
238,SUSAN (INTO PHONE),238,Matthew!   Are you alright?
239,MATTHEW (PHONE),239,"I'm downstairs. What number are
you again?"
240,SUSAN (INTO PHONE),240,"702.   I'll buzz you in.
She presses a button on the phone, and is about to hang up --
Almost immediately there's a LOUD KNOCK at her door. She
gets to her feet, surprised. How did he get up so fast?
Susan goes to the door and looks through the peephole.
HER POV: Matthew's face, distorted by the fish-eye glass.
He's looking into the peephole, with a sneer on his face.
Susan opens the door."
241,SUSAN,241,"I don't know what you're up to, but
this is not cool --
She catches her breath.   THERE'S NO ONE THERE.
Then the phone emits the THROATY CROAKING sound.   Quickly
growing louder and LOUDER...
Susan cries out and drops the phone. It BREAKS OPEN on the
hallway floor as Susan slams her apartment door."
242,SUSAN,242,"Susan quickly draws the chain lock. Then she builds the
courage to step forward, and look through the peephole --
HER POV: the phone lies broken in the middle of the floor.
Otherwise, the hallway is empty.
Susan backs away from the door, shaking in fright.
Breathing hard, she backs into --"
243,SUSAN,243,"Susan enters, turning off her cell phone and unplugging the
bedroom phone from the wall.
Then she retreats to the safety of her bed, eyes on --
THE APARTMENT DOOR, next to the kitchen.    Silence.
Susan's breathing slows. But she looks around the room,
still anxious -- it's too quiet in here. Her panic builds.
But she's alone in the room, isn't she?
As we MOVE IN on Susan, the room starts to become quieter.
The SOUND OF TRAFFIC from outside, the HUMMING REFRIGERATOR
in the kitchen... everything fades to a stifling silence.
And Susan notices, all right.    Her breath, now suddenly loud,
catches in her throat.
A long moment of silence.   Then --
-- DRIP.   DRIP.
It's coming from the KITCHEN SINK.
Susan stares at it.   She finally stands, and --"
244,SUSAN,244,"-- slowly walks into THE KITCHEN. She reaches out and turns
the faucet handle. Tightens it. The dripping stops.
Relieved, Susan turns away --
-- DRIP.   DRIP.   It begins again.   Louder, more intense.
Scared, Susan turns back to the sink. Water is now GUSHING
OUT from the faucet, filling up a bowl in the sink.
She slowly reaches out a hand and turns the faucet, as
tightly as she can manage --
-- tighter... tighter... straining with the effort..
Until the water stops.   Only then does she let go --
-- just then, a CHILD'S PALE HAND quietly rises to the
surface from water in the bowl, and starts VIOLENTLY
SPLASHING the surface."
245,SUSAN,245,Susan screams and runs back to her bedroom --
246,SUSAN,246,"She lies down, shivering, pulling the quilt to her chin.      A
final retreat."
247,SUSAN,247,"Please... stop it...
The SPLASHING SOUNDS in the kitchen continue for a while.
Then, it suddenly stops.
Susan is so terrified that she almost faints.
Then her breathing stops.   Her eyes widen.
Her hand reaches up under her pillow, feeling around --
-- and she comes out with HER LUCKY RABBIT'S FOOT.
The one she left behind in the stairwell.
Susan suddenly CRIES OUT, her head tilting back, her body
abruptly going stiff. We soon see why:
A LUMP begins to rise at the foot of the bed. A big one.
Moving slowly up Susan's body. Reaching the edge of the
quilt, which slowly rises --
-- revealing a QUICK FLASH of the PALE FACE OF THE JAPANESE
WOMAN WITH LONG DARK HAIR on top of her!
Susan SCREAMS, and is abruptly pulled under the covers --"
248,SUSAN,248,"Dark and still.   Lying in wait.   Completely silent, except --
-- someone's KNOCKING on the front door."
249,SUSAN,249,They're still KNOCKING.
250,SUSAN,250,"Apparently, whoever's KNOCKING isn't going to give up --
-- the DOOR HANDLE jiggles.   But it's locked."
251,SUSAN,251,"Karen's CELL PHONE lays on the table in the foreground.
Beyond is the hallway, and the front door."
252,SUSAN,252,"The knocking has stopped.    Silence.
Then Karen's cell phone suddenly LIGHTS UP, ringing.
It rings four times, then goes to voice mail."
253,SUSAN,253,"A new SOUND breaks the silence: movement outside. Crunching
footsteps on gravel, someone brushing past tree limbs.
A SHADOW falls over the window.   A face looks inside --
-- it's ALEX, Karen's boss. He walks away from the window
and continues down the side of the house --
-- we TRACK down the hallway, past the bathroom, through the
kitchen, following his progress into --
THE BACK ROOM: Alex is visible through the sliding door
leading to the back porch. He peers inside.
HIS POV: A FIGURE covered head-to-toe in a white sheet lies
on the mattress. Unmoving.
Alex tries the sliding door -- it's open.     He steps inside."
254,ALEX,254,"Karen?
Silence greets him.   He stares down at the figure in the bed.
Alex licks his lips, nervous.   Finally walks to the mattress,
kneeling down next to it.
Raises a hand and grabs the sheet.      Raises it over the head --
-- it's Emma. As we last saw her, eyes on the ceiling, mouth
and eyes wide open in fear.
But now it's clear, from the tache noire in the eyes, the
blanched skin, the rigidity of her body: she's dead.
Alex falls back onto his butt, staring at Emma.     He pulls
himself away from the corpse --
-- and freezes.    There's something right behind him.
He whirls around --
-- it's KAREN.    In the corner, looking pale and dazed."
255,ALEX,255,"Two POLICE CARS and an AMBULANCE are parked out front.
An UNMARKED CAR pulls up, and DETECTIVE NAKAGAWA (40s) exits
the passenger side. He looks up at The House with dread.
The driver, DETECTIVE IGARASHI (30s), moves next to him."
256,IGARASHI (IN JAPANESE),256,"I can handle this myself, you know.
It's just a routine call. I don't
know why you wanted to come.
He turns to Nakagawa, awaiting a response. He doesn't get
one. Nakagawa just stares up at The House."
257,IGARASHI (IN JAPANESE),257,"The house feels completely different: all the interior
lights are on, a few POLICE OFFICERS mill about, two EMTs
wheel EMMA'S BODY out the front door on a gurney.
Alex sits at the kitchen table, frazzled.   He turns to --
-- KAREN. She's sitting in the living room, wrapped in a
blanket, being attended to by a FEMALE NURSE and speaking
with Nakagawa and Igarashi, who is taking notes on a pad.
Karen says something and the Detective looks over at Alex.
Then he speaks to the Nurse, who helps Karen to her feet.
Nakagawa and Igarashi enter the kitchen.    In perfect English:"
258,NAKAGAWA,258,"I am Detective Nakagawa. This is
Detective Igarashi, my assistant."
259,ALEX,259,Is Karen okay?
260,NAKAGAWA,260,"She is very shaken. We would like
her to stay in the hospital
tonight, under evaluation."
261,NAKAGAWA,261,Do you know these people?
262,ALEX,262,"Matthew Williams, and his wife
Jennifer. He's Emma's son, the
woman Karen came here to see."
263,NAKAGAWA,263,When was the last time you saw him?
264,ALEX,264,"I met them when they came to
register. It's standard procedure,
though the visits were arranged by
his employer. He works at --"
265,NAKAGAWA,265,"We've spoken with his employer.   He
did not show up for work today."
266,NAKAGAWA,266,"If you could please come by
tomorrow to make a statement, the
address is there, at the bottom --"
267,ALEX,267,"(realizing)
Yoko."
268,NAKAGAWA,268,I'm sorry?
269,ALEX,269,"Karen was a substitute -- Yoko is
the girl who is normally in charge
of Emma. She's also been missing
from work."
270,NAKAGAWA,270,For how long?
271,ALEX,271,For the last two days.
272,ALEX,272,I think I saw her bike outside.
273,ALEX,273,"Nakagawa stands outside by the front gate, looking at --"
274,ALEX,274,"-- YOKO'S BICYCLE.   He looks down at it, frowning.
Then he suddenly cocks his head.    As if sensing something.
He turns to look up at A WINDOW ON THE SECOND FLOOR.
It's empty."
275,ALEX,275,"Igarashi stands by the ANSWERING MACHINE.    The message
counter reads `1'. He presses PLAY.
SUSAN'S MESSAGE replays, and he listens carefully. As it
ends, he turns to see NAKAGAWA standing in the doorway."
276,IGARASHI (IN JAPANESE),276,"That's Matthew's sister.
He shows Nakagawa a PHOTO of Matthew and Susan, brother and
sister, grinning at the camera."
277,IGARASHI (IN JAPANESE),277,"This must be her.
The look on Nakagawa's face is grave."
278,NAKAGAWA (IN JAPANESE),278,"Call her at work, then at home. If
no one answers, send someone to --
He trails off, looking down at --
-- the PHONE BASE.   The cordless phone is missing.
Nakagawa reaches down, pressing the `LOCATE' button.
A distant BEEPING SOUND can be heard.
Everyone in the room stops what they're doing.    They listen."
279,NAKAGAWA (IN JAPANESE),279,"Nakagawa and Igarashi enter from the hallway, followed by
their men. They look up to the second floor.
The BEEPING is definitely coming from upstairs."
280,NAKAGAWA (IN JAPANESE),280,"Nakagawa and Igarashi come upstairs, their men following
close behind.
They pause in the hallway for a moment. Then Nakagawa walks
into the rear room (Matthew's office). The BEEPING is close.
He stands there, in the center of the room, listening.
Then he looks up, at the ceiling.    Everyone follows suit.
Nakagawa turns to the CLOSED CLOSET DOORS."
281,NAKAGAWA (IN JAPANESE),281,"He quickly pulls open the door.   The closet is empty.
Nakagawa looks up, peering into the darkness.
HIS POV:   the ATTIC PANEL yawns wide open.
And right next to it are FOUR LONG GROOVES in the ceiling.
As if something was dragged across it, right to the edge.
Something like fingernails.
Nakagawa leans out, looking at Igarashi."
282,NAKAGAWA (IN JAPANESE),282,I need your flashlight.
283,NAKAGAWA (IN JAPANESE),283,"A shaft of light from the flashlight through the open attic
access cuts through the thick darkness.
Nakagawa appears, pulling himself up into the attic.     He
swings his flashlight slowly around the room.
Igarashi comes up next to Nakagawa just as the Detective's
flashlight stops on something.
A beat as they exchange an uneasy look.
Then Nakagawa and Igarashi crawl through the darkness towards
the far corner of the space.
Two bodies are tucked into the corner.    MATTHEW AND JENNIFER."
284,IGARASHI (IN JAPANESE),284,"God!
Nakagawa sits in front of the bodies, examining them."
285,IGARASHI (IN JAPANESE),285,"What the hell... what is going on?
Nakagawa sees the beeping CORDLESS PHONE a few feet away.
SOMETHING next to it attracts Nakagawa's interest. We can't
see what it is, but there's some DEEP RED in it, and
something very WHITE --"
286,IGARASHI (IN JAPANESE),286,"What is that?
-- Nakagawa's eyes widen as he realizes what he's looking at."
287,IGARASHI (IN JAPANESE),287,"The POLICE CARS outside have attracted a small crowd.   The
TWO BODIES are being loaded into a POLICE VAN.
Nakagawa stands with THE CORONER. The CORONER'S ASSISTANT,
wearing a face mask and rubber gloves, approaches. He holds
something small, wrapped in a bloody white sheet.
The Coroner slowly unfolds the sheet. We can't see what he's
looking at -- but it elicits quite a reaction."
288,CORONER (IN JAPANESE),288,Who does this belong to?
289,NAKAGAWA   (IN JAPANESE),289,"We don't know.
The Coroner quickly re-covers the object."
290,CORONER (IN JAPANESE),290,"I can use the blood to help
identify the person.
As the Coroner and his assistant walk away:"
