,character,line #,line
363,KRIEGER,363,Where exactly is it?
364,ETHAN,364,In Langley.
365,LUTHER,365,"In Langley?  The one in Virginia, Langley?"
366,KRIEGER,366,"Inside
CIA headquarters at Langley."
367,KRIEGER (CONT'D),367,Is he serious?
368,CLAIRE,368,Always.
369,KRIEGER,369,"If we're going to Virginia, why don't we
drop by Fort Knox?  I can fly a
helicopter right in through the lobby and
set it down inside the vault and it will
be a hell of a lot easier than breaking
into the God damn CIA."
370,LUTHER,370,What are we downloading?
371,ETHAN,371,Information.
372,LUTHER,372,What kind?
373,ETHAN,373,Profitable.
374,CLAIRE,374,Payment on delivery.
375,LUTHER,375,I don't know.  This I don't know.
376,ETHAN,376,"This doesn't sound like the Luther
Stickell I've heard of.  What'd they used
to call you?  The Net Ranger?  Phineas
Phreak?  The only man alive who actually
hacked NATO Ghostcom."
377,LUTHER,377,"There was never any physical evidence
that I had anything to do with that..
that.."
378,LUTHER,378,With that exceptional piece of work.
379,ETHAN,379,"You don't know what you're missing. This
is the Mt. Everest of hacks."
380,LUTHER,380,"You're all kidding yourselves. Even with
top of the line crypto.  Cray access.
STU 3's --"
381,CLAIRE,381,Krieger can get it.
382,CLAIRE,382,Right?
383,KRIEGER,383,May take a little time.
384,ETHAN,384,"May take a little time. That's not what
Claire tells me about you."
385,LUTHER,385,"Thinking Machine laptops, I'm talking
about the 686 prototypes --
with
the
artificial intelligence Risk chip --"
386,KRIEGER,386,Twenty-four hours.
387,LUTHER,387,"And I get to keep the equipment when
we're done."
388,ETHAN,388,"Luther, I guess you're all out of
excuses."
389,LUTHER,389,"I can't just hack my way inside.  There's
no modem access to the mainframe, it's in
a stand-alone.  I'd have to be physically
at the terminal."
390,ETHAN,390,"Luther, relax, it's worse than you think.
The terminal's in black vault lock-down."
391,ETHAN (V.O.),391,"They missed nothing in that room.  Even
the vents have laser nets over them."
392,ETHAN (V.O.),392,"Inside, there are three countermeasure
systems that can only be deactivated by
authorized entry.  Which we won't have."
393,ETHAN (V.O.),393,"The first system is sound-sensitive,
anything above a whisper sets it off.
The second system is on the floor and
pressure-sensitive --"
394,ETHAN (V.O.),394,"--and the third detects any increase in
temperature.  Even the body heat of an
unauthorized person in the room will
trigger it."
395,ETHAN (V.O.),395,All three systems are state of the art.
396,LUTHER,396,And you really think we can do this.
397,ETHAN,397,May I come in?
398,CLAIRE,398,Sure...
399,ETHAN,399,"It's cash. And a second passport. If
anything goes wrong when we're inside, if
you sense even the slightest deviation
don't look over your shoulder, you walk
away - you hear me? Just walk away."
400,CLAIRE,400,You don't think we're going to make it.
401,ETHAN,401,I didn't say that.
402,CLAIRE,402,You didn't have to.........
403,ETHAN,403,I just need you to be safe.
404,CLAIRE,404,What about you?
405,ETHAN,405,"What about me - Jim called an abort - I
didn't comply.  I lost the team. I just
need you to be safe."
406,CLAIRE,406,I wish I'd never laid eyes on you..
407,ETHAN,407,Sorry.
408,BARNES,408,"What I want to know is how Hunt accessed
the disavowed file, even after we cut off
his authorization code."
409,"AGENT LOWDEN/AGENT
MAREK",409,"He may have used Phelps' code. They were
friends, and Phelps, was still valid for
twenty-four hours."
410,BARNES,410,"If that's the case, we need to implement
a system to immediately deactivate an
agent's code immediately..."
411,KITTRIDGE,411,"I can't believe what I'm listening to.
Hunt just kicked us in the ass,
you
guys
are standing here trying to figure out
what kind of shoes he had on!
I don't
care
how he did it, I want to know
why
he
did it!  Is he recruiting?  For what
purpose?"
412,"AGENT PAT/AGENT
LOWDEN",412,Survival.
413,KITTRIDGE,413,"Too short sighted.  This guy's proactive,
he
initiates
.  The question is
what
does
he want now and
where
does he need to get
it and Barnes what the
hell
is that
noise?!"
414,AGENT,414,"Fire alarm, Gene."
415,KITTRIDGE,415,"Oh, for -- do we have to evacuate?"
416,BARNES,416,That's S.O.P..
417,KITTRIDGE,417,S.O.P..
418,ETHAN,418,"We picked up alarms in sectors three,
seven, and twelve."
419,GUARD RICHARD,419,Yeah.  That's what I've got too.
420,ETHAN,420,What sector's the air conditioning?
421,GUARD RANDALL,421,"Uh -- twenty-one, but there's no alarm in
sector twenty-one."
422,ETHAN,422,I gotta go in there and shut it down!
423,GUARD RANDALL,423,"Nobody goes into any sector where the
alarm didn't go off."
424,ETHAN,424,"Do you
want
to blow the fire through the
whole building?"
425,GUARD RICHARD,425,"Nobody
goes into
any
sector where the
alarm
did not go off --"
426,GUARD,426,"--and it did
not
go off in twenty-one!"
427,LUTHER,427,"Twenty-one, twenty-one --"
428,GUARD RANDALL,428,Wait!  Hold it - it's on. Let's go.
429,ETHAN,429,Let's move!
430,ETHAN,430,"off
his shoulder"
431,ETHAN,431,"onto
it -- a little piece of"
432,LUTHER,432,Hi there.
433,GUARD,433,Air conditioning's through here!
434,CIA ANALYST,434,William Donloe.
435,GUARD,435,Where's the other guy?
436,ETHAN,436,Zero body count.
437,KRIEGER,437,We'll see.
438,ETHAN,438,Time up.
439,ETHAN,439,"1 - 2 - 3 - Toast, toast.  Luther, I'm
going in.  Don't disappoint me...Krieger,
from here on in, absolute silence."
440,ETHAN,440,"ETHAN's head
descends slowly into the room, his hair"
441,TECHNICIAN,441,"Oh, God."
442,TECHNICIAN,442,INTRUSION COUNTERMEASURES ON
443,LUTHER,443,"Type this password: AW96B6.  Return.  Go
to the files menu, find the NOC list
file.  Open ""NOC List.""  Put your
diskette in.  Double click on the NOC
list."
444,LUTHER,444,"Ok, good!  It's scrolling.  0K, now we're
going to download.  Edit menu.  Select
""copy to disc"".  You're downloading.
When it's all green it's done."
445,LUTHER,445,DOWNLOADING
446,LUTHER,446,Holy mother of God.
447,LUTHER,447,You've done it.  Eject it.
448,LUTHER,448,"catches
it with his right hand."
449,LUTHER,449,He's rolling.  Get moving!
450,LUTHER,450,Get out of there -- get out of there --
451,LUTHER,451,"He's at the vault - get moving!  1
yellow, 2 yellows...Toast!"
452,LUTHER,452,"You're not
moving"
453,LUTHER,453,Phew! (to himself) NOC list.
454,KRIEGER,454,Merci.
455,ETHAN,455,We're not outta here yet.
456,ETHAN,456,KEYSTROKE LOG -- FILE DOWNLOAD
457,KITTRIDGE,457,"Think
, for Christ's sake, you guys are
mired in detail, open your minds, it's
gotta be staring us in the face!  What
does Ethan Hunt
want"
458,BARNES,458,"Same thing he wanted in Prague!  Same
thing he's always wanted!  The NOC list!"
459,KITTRIDGE,459,Okay!
460,KITTRIDGE (CONT'D),460,And where is the list vulnerable?
461,KITTRIDGE (CONT'D),461,the phone starts to ring
462,KITTRIDGE (CONT'D),462,Other than here.
463,KITTRIDGE (CONT'D),463,"extremely
bad news."
464,AGENT,464,It's for you.
465,KITTRIDGE,465,"Kittridge, yup?"
466,KITTRIDGE (CONT'D),466,"You and I know about this -- and that's
where it stops.  Understand?  It never happened."
467,BARNES,467,What about him...?
468,KITTRIDGE,468,"I want him manning a radar tower in
Alaska by the end of the day.  Just mail
him his clothes."
469,KRIEGER,469,You contacting your buyer?
470,KRIEGER,470,Ethan?
471,KRIEGER (CONT'D),471,"Ethan?  Oh, 'scuse me Mr. Hunt?"
472,KRIEGER (CONT'D),472,"MAX -- Now might be an excellent time
to interpret Scripture face to face.
Meet on TGV, noon tomorrow.  Take
seat 27.  Bring our mutual friend
Job."
473,KRIEGER,473,You're not going to any meeting without me.
474,ETHAN,474,My contact is extremely shy.
475,KRIEGER,475,"I don't think you're in any position to
give orders, do you?  Not while I'm
holding this."
476,CLAIRE,476,Krieger.
477,KRIEGER,477,"Stay out of this.
OR
Lachez - moi
OR
T'agueue"
478,ETHAN,478,Don't you mean this?
479,KRIEGER,479,That's not it.  That's not the list.
480,ETHAN,480,"What's the matter, you don't know this
trick?"
481,ETHAN (CONT'D),481,Where did it go?!  It's GONE!
482,ETHAN (CONT'D),482,"But not
too
far!"
483,ETHAN (CONT'D),483,"I know what you're thinking, Krieger.
You're thinking, back in the computer
room -- I was up here -- he was down
there -- .  He was carrying two discs."
484,ETHAN (CONT'D),484,"So
hard to keep track of these things."
485,ETHAN (CONT'D),485,"both
are empty."
486,KRIEGER,486,Where is it?
487,ETHAN,487,"I thought you had it!  Do you actually
think I'd let you have the NOC list?"
488,ETHAN,488,"two
disks -- one in each hand."
489,KRIEGER,489,"Try any sleight-of-hand with my money and
Iíll cut your throat."
490,CLAIRE,490,"I'm so sorry.  Krieger was my call.  I've
never worked with him.  I'm sorry, Ethan."
491,ETHAN,491,We did what we had to do.
492,CLAIRE,492,I'm going to try and get some sleep.
493,LUTHER,493,"Krieger
did
have the NOC list."
494,ETHAN,494,Now I want you to hold onto it.
495,LUTHER,495,What makes you trust me?
496,ETHAN,496,"Because if you knew what you were getting
into, you never would have done it."
497,LUTHER,497,"I'm not letting this list get out in the
open."
498,ETHAN,498,"Exactly, that's your job.  Tomorrow on
the train, you can't let this list get
out into the open.  What's the range of
this thing?"
499,LUTHER,499,"It's hard to tell.  I'm gonna have to be
close."
500,ETHAN,500,I'll get you close.
501,CLAIRE,501,Ethan I need to talk to you.
502,ANCHOR,502,"The unlikely setting...a farm in the
heartland of America...the State of
Wisconsin, where federal agents claim to
have broken the brain trust behind an
international drug ring.  For a report we
go live now to CNN correspondent (Joe
Jones) in the state capitol, Madison.
(Joe)...?"
503,REPORTER,503,"Authorities have identified the couple as
Margaret Ethan Hunt and Donald Hunt."
504,REPORTER,504,Here they are now.
505,REPORTER,505,"They were apprehended this morning by the
DEA in a major sting operation for the
illegal manufacture of the drug
methcathinone, known on the street as
""cat""."
506,VOICE (O.S.),506,"Similar to methamphetamines, cat is seen
by officials as one of the most powerful
and dangerous drugs in the world.  Some
thirty-four cat labs have been seized so
far, but the recently widowed Mrs. Hunt
and her brother-in-law are believed to be
involved in a global drug distribution
network."
507,REPORTER,507,"Mr. Fairchild, agent Fairchild, a comment
please."
508,PUBLIC OFFICIAL,508,"I think it's sad, really.  Farmers,
unless they're a conglomerate, are always
operating on a paper-thin margin.  I'm
afraid what we have here is a case of a
naive and lonely widow with a lot of
financial problems who chose to make
money through illegal means."
509,REPORTER,509,"That was John Fairchild, the DEA agent in
charge of this investigation.  Officials
tell me that international law
enforcement agents are expected to arrive
here later today to question the Hunts.
This is Joe Jones, CNN, Love in Madison,
Wisconsin."
510,ETHAN,510,Kittridge...
511,CLAIRE,511,Bastard!
512,ETHAN,512,Don't...don't touch me...
513,CLAIRE,513,What are you going to do?
514,ETHAN,514,He's expecting my call.
515,ETHAN,515,I'm going to the station...
516,ETHAN,516,And I'm going to call him.
517,KITTRIDGE,517,Kittridge.
518,ETHAN (O.S.),518,I see you've been out visiting the folks.
519,KITTRIDGE,519,"It's Hunt.  What do you need for a
pinpoint?"
520,KITTRIDGE,520,"Been watching a little T.V., have you?"
521,ETHAN,521,"Hauling Mom off to jail in shackles was
an especially nice touch."
522,TECHNICIAN,522,He's in England.
523,KITTRIDGE,523,Get MI5.
524,KITTRIDGE,524,"Ethan, I want to reassure you that my
first order of business after you come in
is to get these ridiculous charges
against your family dropped and
eliminated completely from their files.
Come in now, we can plea down the charges
against you as well."
525,ETHAN (O.S.),525,"Can I ask you something, Kittridge?"
526,KITTRIDGE,526,Certainly Ethan.
527,ETHAN,527,"If you're dealing with someone who's
crushed, stabbed, shot and detonated five
members of his own IMF team, how
devastated do you think you're going to
make him by marching Ma and Uncle Donald
down to the county courthouse?"
528,KITTRIDGE,528,"I don't know, Ethan. Suppose you tell me?"
529,BARNES,529,Lost him.  We needed three more seconds.
530,KITTRIDGE,530,He wanted us to know he was in London.
531,KITTRIDGE,531,The man is JIM PHELPS
532,PHELPS,532,You're a hard man to catch up with.
533,PHELPS,533,"..the next day I managed to drag myself
to the safe house, must've just missed
you..anyway, I checked our aliases."
534,ETHAN,534,- and picked us up in the States -
535,PHELPS,535,"- but you left before I could get there
and I could check just so many places.."
536,ETHAN,536,"Yeah, smaller countries don't computerize
customs records -"
537,PHELPS,537,"- so I watched Europe. Once you showed
up in England..it was easy."
538,ETHAN,538,"You knew I liked the rentals at Liverpool
Street."
539,PHELPS,539,"Hey, I showed 'em to you!"
540,ETHAN,540,I remember..
541,ETHAN,541,"Jim, who do you think you're kidding?  A
doctor's gotta look at that.  You can't
sit up straight."
542,PHELPS,542,"I can sit up straight.  I just can't..sit
up straight very well.  It's not
important!  I saw who shot me.  Ethan, I
saw the mole.  It was Kittridge."
543,PHELPS,543,Kittridge!
544,ETHAN,544,"Kitteridge.  Oh my god!  Kittridge is the
mole?"
545,PHELPS,545,Yeah.
546,ETHAN,546,How did Kittridge do it?..
547,ETHAN VO,547,"- first he took care of Jack in the
elevator -"
548,ETHAN VO,548,- he shot you on the bridge -
549,ETHAN VO,549,"- he must have had back up take out
Golitsyn and Sarah at the fence.."
550,ETHAN VO,550,How did he do Hannah?
551,ETHAN VO,551,"No.  No.  He could've taken out Hannah
himself."
552,ETHAN,552,"Why, Jim?
Why?"
553,PHELPS,553,"..when you think about it, Ethan, it was
inevitable..no more Cold War.  No more
secrets you keep from everyone but
yourself, operations you answer to no one
but yourself.  Then one morning you wake
up and find out the President of the
United States is running the country -
without your permission
.  The son-of-a-
bitch!  How
dare
he?  You realize itís
over, youíre an obsolete piece of
hardware not worth upgrading, youíve got
a lousy marriage and sixty-two grand a
year.  Kittridge, weíll go after that no
good son-of-a-bitch, big time!"
554,ETHAN,554,"We donít have to, Jim.  Heíll come after
us."
555,PHELPS,555,Whatís going to make him do that?
556,ETHAN,556,"What he didnít get in Prague.  The NOC
list."
557,PHELPS,557,"Jesus, Ethan.  Good for you."
558,ETHAN,558,"A meeting tomorrow on the TGV, enroute to
Paris."
559,PHELPS,559,Tight security.  No guns.  Real plus.
560,ETHAN,560,"If I supposedly deliver the NOC list to
Max, Max has agreed to deliver Job to me.
Iíll have Claire and Luther Stickell with
me on the train.  Marcel Krieger will
have helicopter transport waiting in
Paris."
561,ETHAN,561,Jim...?
562,PHELPS,562,"I was sitting in a cafe waiting for you
and suddenly there she was, standing in
the rain just outside the safe
house..alive and beautiful..and thinking
Iím dead and gone.  God knows what sheís
had to do forget about me to keep going
and get the job done, I.."
563,PHELPS,563,"- no.  She canít know about me.  No one
can.  Not til this is over.  Thereís too
much at stake, Ethan."
564,ETHAN,564,Youíre probably right.
565,PHELPS,565,I usually am.
566,ETHAN,566,"Once we leave the safehouse, get in there
and crash.  Iíll call you from Paris."
567,PHELPS,567,You got it.
568,ETHAN,568,And get a doctor.
569,PHELPS,569,Good luck.
570,CLAIRE,570,What happened?
571,ETHAN,571,"I sent the message to Max.  Weíre on for
tomorrow."
572,CLAIRE,572,Okay...
573,ETHAN,573,Is this the only way?
574,CLAIRE,574,Yes.......come here....viens pres moi...
575,CLAIRE,575,TGV.  LONDON TERMINUS
576,KITTRIDGE,576,How long to the London Terminus?
577,AGENT,577,"Twenty, twenty-five minutes."
578,KITTRIDGE,578,"Youíve got ten.
Move"
579,MAX,579,How long until we reach the Chunnel?
580,MATTHIAS,580,Twenty minutes.
581,MATTHIAS,581,Yes...
582,MATTHIAS,582,Itís him.
583,MAX,583,This wasnít what we discussed.
584,ETHAN (O.S.),584,"My apologies Max.  Couldnít be helped.
Thereís a piece of black cloth under your
seat.  Tear it away and youíll find the
disk."
585,ETHAN (O.S.),585,IDENTITY MATCH
586,MAX,586,"Ha, dear boy!  I do hope this doesnít
prelude a meeting in private."
587,ETHAN (O.S.),587,"It doesnít, dear girl.  as long as you
tell me where the money is."
588,MAX,588,"The possibility alone is worth ten
million.  Baggage car, rack 3.  Silver
briefcase.  Combination 314."
589,ETHAN (O.S.),589,What about Job?
590,MAX,590,"I wouldnít worry about him.  Once youíve
got the money -- heíll find you."
591,MAX,591,and CLAIRE gets up to follow
592,BARNES,592,Only four more cars.
593,KITTRIDGE,593,"And if we donít find him - weíll search
the whole train again."
594,BARNES,594,Whatís Hunt doing on the TGV?
595,KITTRIDGE,595,"High speed train.  No-one gets on.  No-
one gets off.  High security.  Good place
for a pass off to Max."
596,BARNES,596,But why tell us?
597,KITTRIDGE,597,"Heís putting on a show, Barnes."
598,BARNES,598,What kind of show.
599,KITTRIDGE,599,I donít know.
600,KITTRIDGE,600,It didnít say on the tickets.
601,CLAIRE,601,Ethan...Kittridge is on the train.
602,ETHAN,602,"Kittridge is Job.  Max delivered.  How
far is he from Luther?"
603,CLAIRE,603,Two cars.  Where are you?
604,ETHAN,604,You are my eyes.  Stay with him.
605,ETHAN,605,LIST COMPLETE
606,MAX,606,Heís in the baggage car.
607,PHELPS (O/S),607,Iíll be there.
608,PHELPS (O/S),608,MODEM DENIED
609,MAX,609,Whatís the problem.
610,MATTHIAS,610,Connection denied.
611,MAX,611,Try it again.
612,MATTHIAS,612,Itís not working.
613,MAX,613,Is something wrong with the phone?
614,MAX,614,"Well is something wrong with the
batteries?"
615,MATTHIAS,615,I always check the batteries.
616,MAX,616,Run it through from the top.
617,BARNES,617,"Nothing but civilians, Gene."
618,KITTRIDGE,618,"This is bullshit - we donít even know
what Max looks like."
619,BARNES,619,"Maybe we donít have to know what he looks
like.  If heís got that list, heís going
to want to check it.  We should be
looking for laptops."
620,KITTRIDGE,620,Good idea.
621,WAITER,621,"Excuse me, Sir, your telephone..."
622,WAITER,622,TRANSFER IN PROGRESS
623,MATTHIAS,623,Itís working.
624,MAX,624,Phew!  Weíve got five minutes...
625,ETHAN (O/S),625,"Iíve got the money.  Meet me in the
baggage car."
626,KITTRIDGE,626,Get this door open.
627,KITTRIDGE,627,"Hello, Luther.  Whereís Hunt?"
628,LUTHER,628,"Mr. Kittridge, the NOC list is being
modemed off the train."
629,KITTRIDGE,629,Where?
630,CLAIRE,630,"Ethanís right behind me.  Listen to me
Jim.  Is it such a good idea to kill him?
We take the money.  Ethan takes the
blame.  No-one else has seen you alive.
No-one will believe him."
631,ETHAN,631,"Of course - Iím sorry to hear you say
that Claire."
632,CLAIRE,632,Ethan?
633,PHELPS,633,"Yes.  Ethan Hunt, darling.  Remember him?"
634,CLAIRE,634,You knew about Jim?
635,PHELPS,635,"Course he did.  Just exactly when he knew
is something of a question.  Before or
after I showed in London, mind telling
me, Ethan?"
636,ETHAN,636,"Before London.  But after you took the
Bible out of the Drake Hotel in Chicago."
637,PHELPS,637,"They stamped it, didnít they?  Those damn
Gideons."
638,PHELPS,638,"Two minutes til Krieger shows.  Thisíll
have to be quicker than Iíd like.
Certainly quicker than youíd like."
639,CLAIRE,639,"Ethan, if you knew about Jim?..Why.."
640,PHELPS,640,"Why the masquerade?  Why take the risk?
Well, Claire, youíve asked the question
and you are the answer."
641,ETHAN,641,I knew about Jim.
642,PHELPS,642,"But, he didnít know about you.  In all
fairness, Ethan, Claire was never
convinced her charms would work with you.
But I was supremely confident - having
tastes the goods.  ""Thou shall not covet
thy Neighbourís wife"", Ethan.  Oh, Ethan
is in love with you, Claire, make no
mistake about it.  And like all the
worldís lovers, heís tortured by the
same, one pathetic question - ""does she
feel the same way I do?"""
643,PHELPS,643,"Well Claire do you?  Have you been
exploiting his feelings or returning
them?"
644,CLAIRE,644,"Jim - lets just get the money and get out
of here."
645,CLAIRE (CONT'D),645,The money Ethan.
646,ETHAN,646,Youíve earned it.
647,PHELPS,647,Count it.
648,ETHAN,648,"Tell me something Claire, that night in
Prague, was it you or Jim that blew up
the car and scattered Hannah all over
town?"
649,PHELPS,649,Keep counting Claire.
650,CLAIRE,650,It was me.  I did it.
651,PHELPS,651,Satisfied?
652,CLAIRE,652,All ten million.
653,PHELPS,653,Fold it.  Fold it tight.
654,ETHAN,654,"Arenít you going to thank me Jim.  Ten
million is better than six."
655,PHELPS,655,"Donít flatter yourself - six was for
Eastern Europe
.  You made a lousy deal -
ten for the world?  What is that?  But I
needed you for the transfer with Max.  I
got a little extra change;  and you got a
little extra too."
656,PHELPS,656,Sorry Ethan.  Times up.  Say goodbye.
657,ETHAN,657,"Youíre wrong about one thing.  Iím not
the only one whoís seen you alive."
658,KITTRIDGE,658,"Good morning, Mr Phelps."
659,PHELPS,659,You son of a bitch.
660,CLAIRE,660,Donít Jim.
661,PHELPS,661,"Now we donít have to eliminate him?  You
like that, donít you Claire?  Donít you?"
662,CLAIRE,662,Yes.
663,ETHAN,663,"Jim, itís over."
664,PHELPS,664,"Ethan - Iíve always taught you, nothing
can be more dangerous than the truth.  It
can kill you."
665,ETHAN,665,Claire...Hey...
666,CLAIRE,666,This stuff is so sticky.
667,ETHAN,667,Claire.
668,CLAIRE,668,"Itís all right, Ethan..youíll bring me
back...wonít you..."
669,ETHAN,669,"I always have, Claire.."
670,ETHAN,670,"helicopter
approaches."
671,ETHAN,671,CONNECTION TERMINATED.
672,MAX,672,Damn!
673,CONDUCTOR,673,"No, no, it's
IN
the tunnel!"
674,VOICE (O.S.),674,Stop the train!
675,CONDUCTOR,675,"It'll crash into us!  Accelerate,
accelerate."
676,CONDUCTOR,676,They're dangling from either side of it
677,CONDUCTOR,677,a red and green piece of bubble gum
678,ETHAN,678,"Red light, green light.  Asta Lasagna
mother fucker."
679,LUTHER,679,I think this is what you're looking for.
680,MAX,680,"My lawyers will have a field day with
this.  Entrapment, jurisdictional
conflicts --"
681,KITTRIDGE,681,"Maybe we'll just keep the courts out of
this one."
682,MAX,682,"I'm sure we can find something I have
that you need."
683,KITTRIDGE,683,"You know, I would
love
to try."
684,LUTHER,684,Reach your folks?
685,LUTHER,685,How they feeling?
686,ETHAN,686,About what?
687,LUTHER,687,"The official apology from the Justice
Department, the VIP treatment, you know,
the whole nine yards."
688,ETHAN,688,"Well my Mother was a little confused
about how the DEA could mistake her and
Uncle Donald for a couple of dope smugglers
in the Florida keys."
689,LUTHER,689,Cheers.
690,ETHAN,690,"Here's to  you, Luther. (clink glasses)  To
being off the disavowed list."
691,LUTHER,691,"Hey, I'm the flavour of the month!"
692,ETHAN,692,"You're more than that, Luther.  They were
mistaken about you and they're trying to
show you they know it.  They want you
back in."
693,LUTHER,693,"Sure.  They want me back in so I won't
break in!  They
still
can't figure out
how we did it."
694,ETHAN,694,You didn't tell 'em at the debriefing?
695,LUTHER,695,"I figured I'd let 'em reinstate my back
pay, give me a promotion, check out my
office at Langley and
then
, maybe, talk
about it."
696,ETHAN,696,"It's all one big negotiation, isn't it?"
697,LUTHER,697,Why don't you come back with me?
698,ETHAN,698,Just don't know why I'd be doing it.
699,LUTHER,699,"You really liked Phelps, didn't you?"
700,ETHAN,700,"He was a good guy for a long, long time.
Just - not long enough. (looks up) Gotta
catch my flight..(rising)
So.  How's it feel being a solid citizen
again?"
701,LUTHER,701,"Oh man...I don't know.  I'm gonna miss
being disreputable."
702,ETHAN,702,"Well, Luther - if it makes you feel any
better I'll always think of you that way."
703,FLIGHT ATTENDANT,703,"Would you like to watch a movie, Miss
Clarke?"
704,FLIGHT ATTENDANT,704,"Excuse me, Mr. Hunt.  Would you like to
watch a movie."
705,ETHAN,705,"No, thank you."
706,FLIGHT ATTENDANT,706,"Would you consider the cinema of the
Caribbean?"
707,FLIGHT ATTENDANT,707,"Aruba, perhaps?"
