,character,line #,line
1000,THE WOLF,1000,"Good. What I need you two fellas to
do is take those cleaning products
and clean the inside of the car. And
I'm talkin' fast, fast, fast. You
need to go in the backseat, scoop up
all those little pieces of brain and
skull. Get it out of there.  Wipe
down the upholstery  now when it
comes to upholstery, it don't need
to be spic and span, you don't need
to eat off it. Give it a good once
over. What you need to take care of
are the really messy parts. The pools
of blood that have collected, you
gotta soak that shit up.  But the
windows are a different story.  Them
you really clean. Get the Windex, do
a good job. Now Jimmie, we need to
raid your linen closet. I need
blankets, I need comforters, I need
quilts, I need bedspreads. The thicker
the better, the darker the better.
No whites, can't use 'em. We need to
camouflage the interior of the car.
We're gonna line the front seat and
the backseat and the floor boards
with quilts and blankets. If a cop
stops us and starts stickin' his big
snout in the car, the subterfuge
won't last. But at a glance, the car
will appear to be normal.  Jimmie 
lead the way, boys  get to work."
1001,VINCENT,1001,"A ""please"" would be nice."
1002,THE WOLF,1002,Come again?
1003,VINCENT,1003,"I said a ""please"" would be nice."
1004,THE WOLF,1004,"Set is straight, Buster. I'm not
here to say ""please.""I'm here to
tell you want to do. And if self-
preservation is an instinct you
possess, you better fuckin' do it
and do it quick. I'm here to help.
If my help's not appreciated, lotsa
luck gentlemen."
1005,JULES,1005,"It ain't that way, Mr. Wolf. Your
help is definitely appreciated."
1006,VINCENT,1006,"I don't mean any disrespect. I just
don't like people barkin' orders at
me."
1007,THE WOLF,1007,"If I'm curt with you, it's because
time is a factor. I think fast, I
talk fast, and I need you guys to
act fast if you want to get out of
this. So pretty please, with sugar
on top, clean the fuckin' car."
1008,THE WOLF,1008,It's a 1974 Chevy Nova.
1009,THE WOLF,1009,White.
1010,THE WOLF,1010,"Nothin', except for the mess inside."
1011,THE WOLF,1011,About twenty minutes.
1012,THE WOLF,1012,Nobody who'll be missed.
1013,THE WOLF,1013,"You're a good man, Joe. See ya soon."
1014,THE WOLF,1014,"How we comin', Jimmie?"
1015,JIMMIE,1015,"Mr. Wolf, you gotta understand
somethin' "
1016,THE WOLF,1016," Winston, Jimmie  please, Winston."
1017,JIMMIE,1017,"You gotta understand something,
Winston. I want to help you guys out
and all, but that's my best linen.
It was a wedding present from my
Uncle Conrad and Aunt Ginny, and
they ain't with us anymore "
1018,THE WOLF,1018," let me ask you a question, if you
don't mind?"
1019,JIMMIE,1019,Sure.
1020,THE WOLF,1020,"Were you Uncle Conrad and Aunt Ginny
millionaires?"
1021,JIMMIE,1021,No.
1022,THE WOLF,1022,"Well, your Uncle Marsellus is. And
I'm positive if Uncle Conrad and
Aunt Ginny were millionaires, they
would've furnished you with a whole
bedroom set, which your Uncle
Marsellus is more than happy to do."
1023,THE WOLF,1023,"I like oak myself, that's what's in
my bedroom. How 'bout you Jimmie,
you an oak man?"
1024,JIMMIE,1024,Oak's nice.
1025,JULES,1025,"I will never forgive your ass for
this shit. This is some fucked-up
repugnant shit!"
1026,VINCENT,1026,"Did you ever hear the philosophy
that once a man admits he's wrong,
he's immediately forgiven for all
wrong-doings?"
1027,JULES,1027,"Man, get outta my face with that
shit! The motherfucker who said that
never had to pick up itty-bitty pieces
of skull with his fingers on account
of your dumb ass."
1028,VINCENT,1028,"I got a threshold, Jules. I got a
threshold for the abuse I'll take.
And you're crossin' it. I'm a race
car and you got me in the red. Redline
7000, that's where you are. Just
know, it's fuckin' dangerous to be
drivin' a race car when it's in the
red. It could blow."
1029,JULES,1029,"You're gettin' ready to blow? I'm a
mushroom-cloud-layin' motherfucker!
Every time my fingers touch brain
I'm ""SUPERFLY T.N.T,"" I'm the ""GUNS
OF NAVARONE."" I'm what Jimmie Walker
usta talk about. In fact, what the
fuck am I doin' in the back?  You're
the motherfucker should be on brain
detail. We're tradin'. I'm washin'
windows and you're pickin' up this
nigger's skull."
1030,THE WOLF,1030,"Fine job, gentlemen. We may get out
of this yet."
1031,JIMMIE,1031,I can't believe that's the same car.
1032,THE WOLF,1032,"Well, let's not start suckin' each
other's dicks quite yet. Phase one
is complete, clean the car, which
moves us right along to phase two,
clean you two."
1033,THE WOLF,1033,Strip.
1034,VINCENT,1034,All the way?
1035,THE WOLF,1035,To your bare ass.
1036,THE WOLF,1036,"Quickly gentlemen, we got about
fifteen minutes before Jimmie's better-
half comes pulling into the driveway."
1037,JULES,1037,This morning air is some chilly shit.
1038,VINCENT,1038,"Are you sure this is absolutely
necessary?"
1039,THE WOLF,1039,You know what you two look like?
1040,VINCENT,1040,What?
1041,THE WOLF,1041,"Like a couple of guys who just blew
off somebody's head. Yes, strippin'
off those bloody rags is absolutely
necessary. Toss the clothes in Jim's
garbage bag."
1042,JULES,1042,"Now Jimmie, don't do nothin' stupid
like puttin' that out in front of
your house for Elmo the garbage man
to take away."
1043,THE WOLF,1043,"Don't worry, we're takin' it with
us. Jim, the soap."
1044,THE WOLF,1044,"Okay gentlemen, you're both been to
County before, I'm sure. Here it
comes."
1045,JULES,1045,"Goddamn, that water's fuckin' cold!"
1046,THE WOLF,1046,"Better you than me, gentlemen."
1047,THE WOLF,1047,"Don't be afraid of the soap, spread
it around."
1048,THE WOLF,1048,Towel 'em.
1049,THE WOLF,1049,"You're dry enough, give 'em their
clothes."
1050,THE WOLF,1050,"Perfect. Perfect. We couldn't've
planned this better. You guys look
like... what do they look like,
Jimmie?"
1051,JIMMIE,1051,"Dorks. They look like a couple of
dorks."
1052,JULES,1052,"Ha ha ha. They're your clothes,
motherfucker."
1053,JIMMIE,1053,"I guess you just gotta know how to
wear them."
1054,JULES,1054,"Yeah, well, our asses ain't the expert
on wearin' dorky shit that your is."
1055,THE WOLF,1055,"C'mon, gentlemen, we're laughin' and
jokin' our way into prison. Don't
make me beg."
1056,THE WOLF,1056,"Gentlemen, let's get our rules of
the road straight. We're going to a
place called Monster Joe's Truck and
Tow. Monster Joe and his daughter
Raquel are sympathetic to out dilemma.
The place is North Hollywood, so a
few twist and turns aside, we'll be
goin' up Hollywood Way. Now I'll
drive the tainted car. Jules, you
ride with me.  Vincent, you follow
in my Porsche. Now if we cross the
path of any John Q. Laws, nobody
does a fuckin' thing 'til I do
something."
1057,(TO JULES),1057,What did I say?
1058,JULES,1058,Don't do shit unless 
1059,THE WOLF,1059, unless what?
1060,JULES,1060,Unless you do it first.
1061,THE WOLF,1061,Spoken like a true prodigy.
1062,THE WOLF,1062,"How 'bout you, Lash Larue?  Can you
keep your spurs from jingling and
jangling?"
1063,VINCENT,1063,"I'm cool, Mr. Wolf. My gun just went
off, I dunno how."
1064,THE WOLF,1064,Fair enough.
1065,THE WOLF,1065,"I drive real fuckin' fast, so keep
up. If I get my car back any different
than I gave it, Monster Joe's gonna
be disposing of two bodies."
1066,JULES,1066,We cool?
1067,WINSTON,1067,Like it never happened.
1068,WINSTON,1068,"Boys, this is Raquel. Someday, all
this will be hers."
1069,RAQUEL,1069,"Hi. You know, if they ever do ""I
SPY: THE MOTION PICTURE,"" you guys,
I'd be great.  What's with the
outfits. You guys going to a
volleyball game?"
1070,WINSTON,1070,"I'm takin' m'lady out to breakfast.
Maybe I can drop you two off. Where
do you live?"
1071,VINCENT,1071,Redondo Beach.
1072,JULES,1072,Inglewood.
1073,WINSTON,1073,"It's your future: I see... a cab
ride."
1074,WINSTON,1074,"Sorry guys, move out of the sticks."
1075,WINSTON,1075,"Say goodbye, Raquel."
1076,RAQUEL,1076,"Goodbye, Raquel."
1077,WINSTON,1077,"I'll see you two around, and stay
outta trouble, you crazy kids."
1078,JULES,1078,Mr. Wolf.
1079,JULES,1079,I was a pleasure watchin' you work.
1080,WINSTON,1080,Call me Winston.
1081,WINSTON,1081,"You hear that, young lady? Respect.
You could lean a lot from those two
fine specimens. Respect for one's
elders shows character."
1082,RAQUEL,1082,I have character.
1083,WINSTON,1083,"Just because you are a character
doesn't mean you have character."
1084,RAQUEL,1084,"Oh you're so funny, oh you're so
funny."
1085,JULES,1085,Wanna share a cab?
1086,VINCENT,1086,"You know I could go for some
breakfast.  Want to have breakfast
with me?"
1087,JULES,1087,Sure.
1088,VINCENT,1088,Thanks a bunch.
1089,VINCENT,1089,Want a sausage?
1090,JULES,1090,"Naw, I don't eat pork."
1091,VINCENT,1091,Are you Jewish?
1092,JULES,1092,"I ain't Jewish man, I just don't dig
on swine."
1093,VINCENT,1093,Why not?
1094,JULES,1094,"They're filthy animals. I don't eat
filthy animals."
1095,VINCENT,1095,"Sausages taste good. Pork chops taste
good."
1096,JULES,1096,"A sewer rat may taste like pumpkin
pie.  I'll never know 'cause even if
it did, I wouldn't eat the filthy
motherfucker. Pigs sleep and root in
shit. That's a filthy animal. I don't
wanna eat nothin' that ain't got
enough sense to disregard its own
feces."
1097,VINCENT,1097,"How about dogs? Dogs eat their own
feces."
1098,JULES,1098,I don't eat dog either.
1099,VINCENT,1099,"Yes, but do you consider a dog to be
a filthy animal?"
1100,JULES,1100,"I wouldn't go so far as to call a
dog filthy, but they're definitely
dirty. But a dog's got personality.
And personality goes a long way."
1101,VINCENT,1101,"So by that rationale, if a pig had a
better personality, he's cease to be
a filthy animal?"
1102,JULES,1102,"We'd have to be talkin' 'bout one
motherfuckin' charmin' pig. It'd
have to be the Cary Grant of pigs."
1103,VINCENT,1103,"Good for you. Lighten up a little.
You been sittin' there all quiet."
1104,JULES,1104,I just been sittin' here thinkin'.
1105,VINCENT,1105,About what?
1106,JULES,1106,The miracle we witnessed.
1107,VINCENT,1107,"The miracle you witnessed. I witnessed
a freak occurrence."
1108,JULES,1108,Do you know that a miracle is?
1109,VINCENT,1109,An act of God.
1110,JULES,1110,What's an act of God?
1111,VINCENT,1111,"I guess it's when God makes the
impossible possible. And I'm sorry
Jules, but I don't think what happened
this morning qualifies."
1112,JULES,1112,"Don't you see, Vince, that shit don't
matter. You're judging this thing
the wrong way. It's not about what.
It could be God stopped the bullets,
he changed Coke into Pepsi, he found
my fuckin' car keys. You don't judge
shit like this based on merit. Whether
or not what we experienced was an
according-to-Hoyle miracle is
insignificant. What is significant
is I felt God's touch, God got
involved."
1113,VINCENT,1113,But why?
1114,JULES,1114,"That's what's fuckin' wit' me! I
don't know why. But I can't go back
to sleep."
1115,VINCENT,1115,"So you're serious, you're really
gonna quit?"
1116,JULES,1116,"The life, most definitely."
1117,PATRON,1117,Garcon! Coffee!
1118,VINCENT,1118,"So if you're quitting the life,
what'll you do?"
1119,JULES,1119,"That's what I've been sitting here
contemplating. First, I'm gonna
deliver this case to Marsellus. Then,
basically, I'm gonna walk the earth."
1120,VINCENT,1120,"What do you mean, walk the earth?"
1121,JULES,1121,"You know, like Caine in ""KUNG FU.""
Just walk from town to town, meet
people, get in adventures."
1122,VINCENT,1122,"How long do you intend to walk the
earth?"
1123,JULES,1123,"Until God puts me where he want me
to be."
1124,VINCENT,1124,What if he never does?
1125,JULES,1125,"If it takes forever, I'll wait
forever."
1126,VINCENT,1126,So you decided to be a bum?
1127,JULES,1127,"I'll just be Jules, Vincent  no
more, no less."
1128,VINCENT,1128,"No Jules, you're gonna be like those
pieces of shit out there who beg for
change. They walk around like a bunch
of fuckin' zombies, they sleep in
garbage bins, they eat what I throw
away, and dogs piss on 'em. They got
a word for 'em, they're called bums.
And without a job, residence, or
legal tender, that's what you're
gonna be  a fuckin' bum!"
1129,JULES,1129,"Look my friend, this is just where
me and you differ "
1130,VINCENT,1130," what happened was peculiar  no
doubt about it  but it wasn't water
into wine."
1131,JULES,1131,"All shapes and sizes, Vince."
1132,VINCENT,1132,Stop fuckin' talkin' like that!
1133,JULES,1133,"If you find my answers frightening,
Vincent, you should cease askin'
scary questions."
1134,VINCENT,1134,I gotta take a shit. To be continued.
1135,PUMPKIN,1135,"Everybody be cool, this is a robbery!"
1136,HONEY BUNNY,1136,"Any of you fuckin' pricks move and
I'll execute every one of you
motherfuckers!  Got that?!"
1137,PUMPKIN,1137,"Customers stay seated, waitresses on
the floor."
1138,HONEY BUNNY,1138,"Now mean fuckin' now! Do it or die,
do it or fucking die!"
1139,PUMPKIN,1139,"You Mexicans in the kitchen, get out
here!  Asta luego!"
1140,PUMPKIN,1140,"On the floor or I'll cook you ass,
comprende?"
1141,MANAGER,1141,"I'm the manager here, there's no
problem, no problem at all "
1142,PUMPKIN,1142,You're gonna give me a problem?
1143,PUMPKIN,1143,"What? You said you're gonna give me
a problem?"
1144,MANAGER,1144,"No, I'm not. I'm not gonna give you
any problem!"
1145,PUMPKIN,1145,"I don't know, Honey Bunny. He looks
like the hero type to me!"
1146,HONEY BUNNY,1146,Don't take any chances. Execute him!
1147,MANAGER,1147,"Please don't! I'm not a hero. I'm
just a coffee shop manager. Take
anything you want."
1148,PUMPKIN,1148,"Tell everyone to cooperate and it'll
be all over."
1149,MANAGER,1149,"Everybody just be calm and cooperate
with them and this will be all over
soon!"
1150,PUMPKIN,1150,"Well done, now git your fuckin' ass
on the ground."
1151,PUMPKIN,1151,"Okay people, I'm going to go 'round
and collect your wallets. Don't talk,
just toss 'em in the bag. We clear?"
1152,PUMPKIN,1152,In the bag.
1153,PUMPKIN,1153,What's in that?
1154,JULES,1154,My boss' dirty laundry.
1155,PUMPKIN,1155,You boss makes you do his laundry?
1156,JULES,1156,When he wants it clean.
1157,PUMPKIN,1157,Sounds like a shit job.
1158,JULES,1158,"Funny, I've been thinkin' the same
thing."
1159,PUMPKIN,1159,Open it up.
1160,JULES,1160,'Fraid I can't do that.
1161,PUMPKIN,1161,I didn't hear you.
1162,JULES,1162,"Yes, you did."
1163,HONEY BUNNY,1163,What's goin' on?
1164,PUMPKIN,1164,"Looks like we got a vigilante in our
midst."
1165,HONEY BUNNY,1165,Shoot 'em in the face!
1166,JULES,1166,"I don't mean to shatter your ego,
but this ain't the first time I've
had gun pointed at me."
1167,PUMPKIN,1167,"You don't open up that case, it's
gonna be the last."
1168,MANAGER,1168,"Quit causing problems, you'll get us
all killed! Give 'em what you got
and get 'em out of here."
1169,JULES,1169,"Keep your fuckin' mouth closed, fat
man, this ain't any of your goddamn
business!"
1170,PUMPKIN,1170,"I'm countin' to three, and if your
hand ain't off that case, I'm gonna
unload right in your fuckin' face.
Clear? One..."
1171,PUMPKIN,1171,...two... three.
1172,JULES,1172,You win.
1173,JULES,1173,"It's all yours, Ringo."
1174,PUMPKIN,1174,Open it.
1175,HONEY BUNNY,1175,What is it? What is it?
1176,PUMPKIN,1176,Is that what I think it is?
1177,PUMPKIN,1177,It's beautiful.
1178,HONEY BUNNY,1178,"Goddammit, what is it?"
1179,HONEY BUNNY,1179,"Let him go! Let him go! I'll blow
your fuckin' head off! I'll kill ya!
I'll kill ya! You're gonna die, you're
gonna fuckin' die bad!"
1180,JULES,1180,"Tell that bitch to be cool! Say,
bitch be cool! Say, bitch be cool!"
1181,PUMPKIN,1181,"Chill out, honey!"
1182,HONEY BUNNY,1182,Let him go!
1183,JULES,1183,Tell her it's gonna be okay.
1184,PUMPKIN,1184,I'm gonna be okay.
1185,JULES,1185,Promise her.
1186,PUMPKIN,1186,I promise.
1187,JULES,1187,Tell her to chill.
1188,PUMPKIN,1188,Just chill out.
1189,JULES,1189,What's her name?
1190,PUMPKIN,1190,Yolanda.
1191,JULES,1191,"So, we cool Yolanda? We ain't gonna
do anything stupid, are we?"
1192,YOLANDA,1192,Don't you hurt him.
1193,JULES,1193,"Nobody's gonna hurt anybody. We're
gonna be like three Fonzies. And
what' Fonzie like?"
1194,JULES,1194,"C'mon Yolanda, what's Fonzie like?"
1195,YOLANDA,1195,He's cool?
1196,JULES,1196,"Correct-amundo! And that's what we're
gonna be, we're gonna be cool."
1197,JULES,1197,"Now Ringo, I'm gonna count to three
and I want you to let go your gun
and lay your palms flat on the table.
But when you do it, do it cool. Ready?"
1198,JULES,1198,One... two... three.
1199,YOLANDA,1199,"Okay, now let him go!"
1200,JULES,1200,"Yolanda, I thought you were gonna be
cool.  When you yell at me, it makes
me nervous.  When I get nervous, I
get scared. And when motherfuckers
get scared, that's when motherfuckers
get accidentally shot."
1201,YOLANDA,1201,"Just know: you hurt him, you die."
1202,JULES,1202,"That seems to be the situation. Now
I don't want that and you don't want
that and Ringo here don't want that.
So let's see what we can do."
1203,JULES,1203,"Now this is the situation. Normally
both of your asses would be dead as
fuckin' fried chicken. But you
happened to pull this shit while I'm
in a transitional period. I don't
wanna kill ya, I want to help ya.
But I'm afraid I can't give you the
case. It don't belong to me. Besides,
I went through too much shit this
morning on account of this case to
just hand it over to your ass."
1204,VINCENT (O.S.),1204,What the fuck's goin' on here?
1205,JULES,1205,"It's cool, Vincent! It's cool! Don't
do a goddamn thing. Yolanda, it's
cool baby, nothin's changed. We're
still just talkin'."
1206,JULES,1206,Tell her we're still cool.
1207,PUMPKIN,1207,"It's cool, Honey Bunny, we're still
cool."
1208,VINCENT,1208,"What the hell's goin' on, Jules?"
1209,JULES,1209,"Nothin' I can't handle. I want you
to just hang back and don't do shit
unless it's absolutely necessary."
1210,VINCENT,1210,Check.
1211,JULES,1211,"Yolanda, how we doin, baby?"
1212,YOLANDA,1212,I gotta go pee! I want to go home.
1213,JULES,1213,"Just hang in there, baby, you're
doing' great, Ringo's proud of you
and so am I.  It's almost over."
1214,JULES,1214,"Now I want you to go in that bag and
find my wallet."
1215,PUMPKIN,1215,Which one is it?
1216,JULES,1216,"It's the one that says Bad
Motherfucker on it."
1217,JULES,1217,"That's my bad motherfucker. Now open
it up and take out the cash. How
much is there?"
1218,PUMPKIN,1218,About fifteen hundred dollars.
1219,JULES,1219,"Put it in your pocket, it's yours.
Now with the rest of them wallets
and the register, that makes this a
pretty successful little score."
1220,VINCENT,1220,"Jules, if you give this nimrod fifteen
hundred buck, I'm gonna shoot 'em on
general principle."
1221,JULES,1221,"You ain't gonna do a goddamn thing,
now hang back and shut the fuck up.
Besides, I ain't givin' it to him.
I'm buyin' somethin' for my money.
Wanna know what I'm buyin' Ringo?"
1222,PUMPKIN,1222,What?
1223,JULES,1223,"Your life. I'm givin' you that money
so I don't hafta kill your ass. You
read the Bible?"
1224,PUMPKIN,1224,Not regularly.
1225,JULES,1225,"There's a passage I got memorized.
Ezekiel 25:17. ""The path of the
righteous man is beset on all sides
by the inequities of the selfish and
the tyranny of evil men.  Blessed is
he who, in the name of charity and
good will, shepherds the weak through
the valley of the darkness. For he
is truly his brother's keeper and
the finder of lost children. And I
will strike down upon thee with great
vengeance and furious anger those
who attempt to poison and destroy my
brothers. And you will know I am the
Lord when I lay my vengeance upon
you."" I been sayin' that shit for
years.  And if you ever heard it, it
meant your ass. I never really
questioned what it meant. I thought
it was just a coldblooded thing to
say to a motherfucker 'fore you popped
a cap in his ass. But I saw some
shit this mornin' made me think twice.
Now I'm thinkin', it could mean you're
the evil man. And I'm the righteous
man.  And Mr. .45 here, he's the
shepherd protecting my righteous ass
in the valley of darkness. Or is
could by you're the righteous man
and I'm the shepherd and it's the
world that's evil and selfish.  I'd
like that. But that shit ain't the
truth. The truth is you're the weak.
And I'm the tyranny of evil men. But
I'm tryin'. I'm tryin' real hard to
be a shepherd."
1226,JULES,1226,It's cold.
1227,VINCENT,1227,I think we oughta leave now.
1228,JULES,1228,That's probably a good idea.
