,character,line #,line
655,FABIENNE,655,"Really?! He won't be fighting no
more?!"
656,BUTCH,656,Not no more.
657,FABIENNE,657,So it all worked out in the finish?
658,BUTCH,658,"We ain't at the finish, baby."
659,FABIENNE,659,"We're in a lot of danger, aren't we?"
660,FABIENNE,660,"If they find us, they'll kill us,
won't they?"
661,FABIENNE,661,"But they won't find us, will they?"
662,FABIENNE,662,Do you still want me to go with you?
663,FABIENNE,663,"I don't want to be a burden or a
nuisance -"
664,FABIENNE,664,Say it!
665,BUTCH,665,"Fabienne, I want you to be with me."
666,FABIENNE,666,Forever?
667,BUTCH,667,...and ever.
668,FABIENNE,668,Do you love me?
669,BUTCH,669,Oui.
670,FABIENNE,670,Butch? Will you give me oral pleasure?
671,BUTCH,671,Will you kiss it?
672,FABIENNE,672,But you first.
673,FABIENNE,673,"Butch my love, the adventure begins."
674,BUTCH,674,I think I cracked a rib.
675,FABIENNE,675,Giving me oral pleasure?
676,BUTCH,676,"No retard, from the fight."
677,FABIENNE,677,Don't call me retard.
678,BUTCH,678,My name is Fabby! My name is Fabby!
679,FABIENNE,679,"Shut up fuck head! I hate that
Mongoloid voice."
680,BUTCH,680,"Okay, sorry, sorry, sorry, I take it
back!  Can I have a towel please,
Miss Beautiful Tulip."
681,FABIENNE,681,"Oh I like that, I like being called
a tulip. Tulip is much better than
Mongoloid."
682,BUTCH,682,"I didn't call you a Mongoloid, I
called you a retard, but I took it
back."
683,BUTCH,683,Merci beaucoup.
684,FABIENNE,684,Butch?
685,BUTCH,685,"Yes, lemon pie."
686,FABIENNE,686,Where are we going to go?
687,BUTCH,687,"I'm not sure yet. Wherever you want.
We're gonna get a lot of money from
this. But it ain't gonna be so much,
we can live like hogs in the fat
house forever. I was thinking we
could go somewhere in the South
Pacific. The kinda money we'll have'll
carry us a long way down there."
688,FABIENNE,688,"So if we wanted, we could live in
Bora Bora?"
689,BUTCH,689,"You betcha. And if after awhile you
don't dig Bora Bora, then we can
move over to Tahiti or Mexico."
690,FABIENNE,690,But I do not speak Spanish.
691,BUTCH,691,"You don't speak Bora Boran either.
Besides, Mexican is easy: Donde esta
el zapataria?"
692,FABIENNE,692,What does that mean?
693,BUTCH,693,Where's the shoe store?
694,FABIENNE,694,Donde esta el zapataria?
695,BUTCH,695,"Excellent pronunciation. You'll be
my little mama ceta in no time."
696,BUTCH (O.S.),696,Que hora es?
697,FABIENNE,697,Que hora es?
698,BUTCH (O.S.),698,What time is it?
699,FABIENNE,699,What time is it?
700,BUTCH (O.S.),700,"Time for bed. Sweet dream, jellybean."
701,FABIENNE,701,Butch.
702,FABIENNE,702,Forget it.
703,FABIENNE,703,"Merde! You startled me. Did you have
a bad dream?"
704,BUTCH,704,What are you watching?
705,FABIENNE,705,"A motorcycle movie, I'm not sure the
name."
706,BUTCH,706,Are you watchin' it?
707,FABIENNE,707,"In a way. Why? Would you like for me
to switch it off?"
708,BUTCH,708,Would you please?
709,BUTCH,709,"It's a little too early in the morning
for explosions and war."
710,FABIENNE,710,What was it about?
711,BUTCH,711,"How should I know, you were the one
watchin' it."
712,FABIENNE,712,"No, imbecile, what was your dream
about?"
713,BUTCH,713,"Oh, I... don't remember. It's really
rare I remember a dream."
714,FABIENNE,714,You just woke up from it.
715,BUTCH,715,"Fabienne, I'm not lying to you, I
don't remember."
716,FABIENNE,716,"Well, let's look at the grumpy man
in the morning. I didn't say you
were lying, it's just odd you don't
remember your dreams. I always
remember mine. Did you know you talk
in your sleep?"
717,BUTCH,717,"I don't talk in my sleep, do I talk
in my sleep?"
718,FABIENNE,718,You did last night.
719,BUTCH,719,What did I say?
720,FABIENNE,720,"I don't know. I couldn't understand
you."
721,FABIENNE,721,"Why don't you get up and we'll get
some breakfast at that breakfast
place with the pancakes."
722,BUTCH,722,One more kiss and I'll get up.
723,FABIENNE,723,Satisfied?
724,BUTCH,724,Yep.
725,FABIENNE,725,"Then get up, lazy bones."
726,BUTCH,726,What time is it?
727,FABIENNE,727,"Almost nine in the morning. What
time does our train arrive?"
728,BUTCH,728,Eleven.
729,FABIENNE,729,"I'm gonna order a big plate of
blueberry pancakes with maple syrup,
eggs over easy, and five sausages."
730,BUTCH,730,Anything to drink with that?
731,FABIENNE,731,"Oh yes, that looks nice. To drink, a
tall glass or orange juice and a
black cup of coffee. After that, I'm
going to have a slice of pie."
732,BUTCH,732,Pie for breakfast?
733,FABIENNE,733,"Any time of the day is a good time
for pie. Blueberry pie to go with
the pancakes. And on top, a thin
slice of melted cheese "
734,BUTCH,734, where's my watch?
735,FABIENNE,735,It's there.
736,BUTCH,736,"No, it's not. It's not here."
737,FABIENNE,737,Have you looked?
738,BUTCH,738,Yes I've fuckin' looked!!
739,BUTCH,739,"What the fuck do you think I'm doing?!
Are you sure you got it?"
740,FABIENNE,740,Uhhh... yes... beside the table drawer
741,BUTCH,741, on the little kangaroo.
742,FABIENNE,742,"Yes, it was on your little kangaroo."
743,BUTCH,743,Well it's not here!
744,FABIENNE,744,Well it should be!
745,BUTCH,745,"Oh it most definitely should be here,
but it's not. So where is it?"
746,BUTCH,746,"Fabienne, that was my father's fuckin'
watch. You know what my father went
through to git me that watch?... I
don't wanna get into it right now...
but he went through a lot. Now all
this other shit, you coulda set on
fire, but I specifically reminded
you not to forget my father's watch.
Now think, did you get it?"
747,FABIENNE,747,I believe so...
748,BUTCH,748,"You believe so? You either did, or
you didn't, now which one is it?"
749,FABIENNE,749,Then I did.
750,BUTCH,750,Are you sure?
751,FABIENNE,751,No.
752,BUTCH,752,No! It's not your fault.
753,BUTCH,753,You left it at the apartment.
754,BUTCH,754,"If you did leave it at the apartment,
it's not your fault. I had you bring
a bunch of stuff. I reminded you
about it, but I didn't illustrate
how personal the watch was to me. If
all I gave a fuck about was my watch,
I should've told you. You ain't a
mind reader."
755,FABIENNE,755,I'm sorry.
756,BUTCH,756,"Don't be. It just means I won't be
able to eat breakfast with you."
757,FABIENNE,757,Why does it mean that?
758,BUTCH,758,"Because I'm going back to my apartment
to get my watch."
759,FABIENNE,759,"Won't the gangsters be looking for
you there?"
760,BUTCH,760,"That's what I'm gonna find out. If
they are, and I don't think I can
handle it, I'll split."
761,FABIENNE,761,"I was so dreadful. I saw your watch,
I thought I brought it. I'm so sorry."
762,BUTCH,762,"Don't feel bad, sugar pop. Nothing
you could ever do would make me
permanently angry at you."
763,BUTCH,763,"I love you, remember?"
764,BUTCH,764,"Now here's some money, order those
pancakes and have a great breakfast."
765,FABIENNE,765,Don't go.
766,BUTCH,766,"I'll be back before you can say,
blueberry pie."
767,FABIENNE,767,Blueberry pie.
768,BUTCH,768,"Well maybe not that fast, but fast.
Okay?  Okay?"
769,FABIENNE,769,Okay.
770,BUTCH,770,"Bye-bye, sugar pop."
771,FABIENNE,771,Bye.
772,BUTCH,772,I'm gonna take your Honda.
773,FABIENNE,773,Okay.
774,BUTCH,774,"Of all the fuckin' things she coulda
forgot, she forgets my father's watch.
I specifically reminded her not to
forget it. ""Bedside table  on the
kangaroo."" I said the words: ""Don't
forget my father's watch."""
775,BUTCH,775,Holy shit.
776,BUTCH,776,"That's how you're gonna beat 'em,
Butch.  They keep underestimatin'
ya."
777,PEDESTRIAN,777,"Jesus, are you okay?"
778,BUTCH,778,I guess.
779,GAWKER #1,779,He's dead! He's dead!
780,GAWKER #2,780,"If you need a witness in court, I'll
be glad to help. He was a drunken
maniac. He hit you and crashed into
that car."
781,MARSELLUS,781,Who?
782,GAWKER #2,782,Him.
783,MARSELLUS,783,"Well, I'll be damned."
784,BUTCH,784,Sacre bleu.
785,LOOKY-LOO WOMAN,785,"Oh my God, I've been shot!"
786,MAYNARD,786,Can I help you wit' somethin'?
787,BUTCH,787,Shut up!
788,MAYNARD,788,Now you just wait one goddamn minute
789,BUTCH,789,"So you like chasing people, huh?"
790,BUTCH,790,"Well guess what, big man, you caught
me "
791,MAYNARD (O.S.),791," hold it right there, godammit!"
792,BUTCH,792,"Look mister, this ain't any of your
business "
793,MAYNARD,793," I'm makin' it my business! Now
toss that gun!"
794,MAYNARD,794,"Now you on top, stand up and come to
the counter."
795,MAYNARD,795,"Zed? It's Maynard. The spider just
caught a coupl'a flies."
796,MAYNARD,796,"Nobody kills anybody in my place of
business except me or Zed."
797,MAYNARD,797,That's Zed.
798,ZED,798,You said you waited for me?
799,MAYNARD,799,I did.
800,ZED,800,Then how come they're all beat up?
801,MAYNARD,801,"They did that to each other. They
was fightin' when they came in. This
one was gonna shoot that one."
802,ZED,802,You were gonna shoot him?
803,ZED,803,"Hey, is Grace gonna be okay in front
of this place?"
804,MAYNARD,804,"Yeah, it ain't Tuesday is it?"
805,ZED,805,"No, it's Thursday."
806,MAYNARD,806,Then she'll be fine.
807,ZED,807,Bring out The Gimp.
808,MAYNARD,808,I think The Gimp's sleepin'.
809,ZED,809,"Well, I guess you'll just wake 'em
up then, won't you?"
810,MAYNARD,810,Wake up!
811,MAYNARD,811,Down!
812,MAYNARD,812,Who's first?
813,ZED,813,I ain't fer sure yet.
814,ZED,814,Wanna do it here?
815,MAYNARD,815,"Naw, drag big boy to Russell's old
room."
816,MAYNARD,816,Up!
817,MAYNARD,817,Keep an eye on this one.
818,MAYNARD (O.S.),818,"Whoa, this boy's got a bit of fight
in 'em!"
819,ZED (O.S.),819,"You wanna fight? You wanna fight?
Good, I like to fight!"
820,MAYNARD (O.S.),820,"That's it... that's it boy, you're
goin' fine. Oooooooh, just like
that... that's good."
821,MAYNARD (O.S.),821,"Stay still... stay still goddamn ya!
Zed goddammit, git over here and
hold 'em!"
822,THE GIMP,822,Huhng?
823,BUTCH,823,Hey hillbilly.
824,BUTCH,824,"You want that gun, Zed? Pick it up."
825,MARSELLUS (O.S.),825,"Step aside, Butch."
826,BUTCH,826,You okay?
827,MARSELLUS,827,"Naw man. I'm pretty fuckin' far from
okay!"
828,BUTCH,828,What now?
829,MARSELLUS,829,"What now? Well let me tell you what
now.  I'm gonna call a couple pipe-
hittin' niggers, who'll go to work
on homes here with a pair of pliers
and a blow torch."
830,MARSELLUS,830,"Hear me talkin' hillbilly boy?! I
ain't through with you by a damn
sight. I'm gonna git Medieval on
your ass."
831,BUTCH,831,"I meant what now, between me and
you?"
832,MARSELLUS,832,"Oh, that what now? Well, let me tell
ya what now between me an' you. There
is no me an' you. Not no more."
833,BUTCH,833,So we're cool?
834,MARSELLUS,834,"Yeah man, we're cool. One thing I
ask  two things I ask: Don't tell
nobody about this. This shit's between
me and you and the soon-to-be-livin'-
the-rest-of-his-short-ass-life-in-
agonizing-pain, Mr. Rapist here. It
ain't nobody else's business. Two:
leave town. Tonight. Right now. And
when you're gone, stay gone.  You've
lost your Los Angeles privileges.
Deal?"
835,BUTCH,835,Deal.
836,MARSELLUS,836,"Go on now, get your ass outta here."
837,MARSELLUS,837,"Hello Mr. Wolf, it's Marsellus. Gotta
bit of a situation."
838,FABIENNE (O.S.),838,"Butch, I was so worried!"
839,BUTCH,839,"Honey, grab your radio and your purse
and let's go!"
840,FABIENNE (O.S.),840,But what about all our bags?
841,BUTCH,841,"Fuck the bags. We'll miss our train
if we don't split now."
842,FABIENNE (O.S.),842,Is everything well? Are we in danger?
843,BUTCH,843,"We're cool. In fact, we're super-
cool. But we gots to go. I'll wait
for you outside."
844,FABIENNE,844,Where did you get this motorcycle?
845,BUTCH,845,"It's a chopper, baby, hop on."
846,FABIENNE,846,What happened to my Honda?
847,BUTCH,847,"Sorry baby, I crashed the Honda."
848,FABIENNE,848,You're hurt?
849,BUTCH,849,"I might've broke my nose, no biggie.
Hop on."
850,BUTCH,850,"Honey, we gotta hit the fuckin' road!"
851,BUTCH,851,"I'm sorry, baby-love."
852,FABIENNE,852,"You were gone so long, I started to
think dreadful thoughts."
853,BUTCH,853,"I'm sorry I worried you, sweetie.
Everything's fine. Hey, how was
breakfast?"
854,FABIENNE,854,It was good 
855,BUTCH,855, did you get the blueberry pancakes?
856,FABIENNE,856,"No, they didn't have blueberry
pancakes, I had to get buttermilk 
are you sure you're okay?"
857,BUTCH,857,"Baby-love, from the moment I left
you, this has been without a doubt
the single weirdest day of my entire
life. Climb on an' I'll tell ya about
it."
858,FABIENNE,858,"Butch, whose motorcycle is this?"
859,BUTCH,859,It's a chopper.
860,FABIENNE,860,Whose chopper is this?
861,BUTCH,861,Zed's.
862,FABIENNE,862,Who's Zed?
863,BUTCH,863,"Zed's dead, baby, Zed's dead."
864,JULES (O.S.),864,"You ever read the Bible, Brett?"
865,BRETT (O.S.),865,Yes!
866,JULES (O.S.),866,"There's a passage I got memorized,
seems appropriate for this situation:
Ezekiel 25:17. ""The path of the
righteous man is beset on all sides
by the inequities of the selfish and
the tyranny of evil men..."""
867,JULES (O.S.),867,"""...blessed is he who, in the name
of charity and good will, shepherded
the weak through the valley of
darkness. And I will strike down
upon thee with great vengeance and
furious anger those who attempt to
poison and destroy my brothers. And
you will know I am the Lord when I
lay my vengeance upon you."""
868,VINCENT (O.S.),868,Friend of yours?
869,JULES (O.S.),869,"Yeah, Marvin-Vincent-Vincent-Marvin."
870,FOURTH MAN,870,Die... die... die... die...!
871,FOURTH MAN,871,I don't understand 
872,VINCENT,872,"Why the fuck didn't you tell us about
that guy in the bathroom? Slip your
mind?  Forget he was in there with a
goddamn hand cannon?"
873,JULES,873,We should be fuckin' dead right now.
874,JULES,874,"Did you see that gun he fired at us?
It was bigger than him."
875,VINCENT,875,.357.
876,JULES,876,We should be fuckin' dead!
877,VINCENT,877,"Yeah, we were lucky."
878,JULES,878,"That shit wasn't luck. That shit was
somethin' else."
879,VINCENT,879,"Yeah, maybe."
880,JULES,880,"That was... divine intervention. You
know what divine intervention is?"
881,VINCENT,881,"Yeah, I think so. That means God
came down from Heaven and stopped
the bullets."
882,JULES,882,"Yeah, man, that's what is means.
That's exactly what it means! God
came down from Heaven and stopped
the bullets."
883,VINCENT,883,I think we should be going now.
884,JULES,884,"Don't do that! Don't you fuckin' do
that!  Don't blow this shit off!
What just happened was a fuckin'
miracle!"
885,VINCENT,885,"Chill the fuck out, Jules, this shit
happens."
886,JULES,886,"Wrong, wrong, this shit doesn't just
happen."
887,VINCENT,887,"Do you wanna continue this theological
discussion in the car, or at the
jailhouse with the cops?"
888,JULES,888,"We should be fuckin' dead now, my
friend!  We just witnessed a miracle,
and I want you to fuckin' acknowledge
it!"
889,VINCENT,889,"Okay man, it was a miracle, can we
leave now?"
890,VINCENT,890,"...Ever seen that show ""COPS?""  I
was watchin' it once and this cop
was on it who was talkin' about this
time he got into this gun fight with
a guy in a hallway. He unloads on
this guy and he doesn't hit anything.
And these guys were in a hallway.
It's a freak, but it happens."
891,JULES,891,"If you wanna play blind man, then go
walk with a Shepherd. But me, my
eyes are wide fuckin' open."
892,VINCENT,892,What the fuck does that mean?
893,JULES,893,"That's it for me. For here on in,
you can consider my ass retired."
894,VINCENT,894,Jesus Christ!
895,JULES,895,Don't blaspheme!
896,VINCENT,896,"Goddammit, Jules "
897,JULES,897, I said don't do that 
898,VINCENT,898, you're fuckin' freakin' out!
899,JULES,899,"I'm tellin' Marsellus today I'm
through."
900,VINCENT,900,"While you're at it, be sure to tell
'im why."
901,JULES,901,"Don't worry, I will."
902,VINCENT,902,"I'll bet ya ten thousand dollars, he
laughs his ass off."
903,JULES,903,I don't give a damn if he does.
904,VINCENT,904,"Marvin, what do you make of all this?"
905,MARVIN,905,I don't even have an opinion.
906,VINCENT,906,"C'mon, Marvin. Do you think God came
down from Heaven and stopped the
bullets?"
907,JULES,907,What the fuck's happening?
908,VINCENT,908,"I just accidentally shot Marvin in
the throat."
909,JULES,909,Why the fuck did you do that?
910,VINCENT,910,"I didn't mean to do it. I said it
was an accident."
911,JULES,911,"I've seen a lot of crazy-ass shit in
my time "
912,VINCENT,912," chill out, man, it was an accident,
okay? You hit a bump or somethin'
and the gun went off."
913,JULES,913,"The car didn't hit no motherfuckin'
bump!"
914,VINCENT,914,"Look! I didn't mean to shoot this
son-ofa-bitch, the gun just went
off, don't ask me how!"
915,JULES,915,"Look at this mess! We're drivin'
around on a city street in broad
daylight "
916,VINCENT,916," I know, I know, I wasn't thinkin'
about the splatter."
917,JULES,917,"Well you better be thinkin' about it
now, motherfucker! We gotta get this
car off the road. Cops tend to notice
shit like you're driving a car
drenched in fuckin' blood."
918,VINCENT,918,"Can't we just take it to a friendly
place?"
919,JULES,919,"This is the Valley, Vincent. Marsellus
don't got no friendly places in the
Valley."
920,VINCENT,920,"Well, don't look at me, this is your
town, Jules."
921,VINCENT,921,Who ya callin'?
922,JULES,922,A buddy of mine in Toluca Lake.
923,VINCENT,923,Where's Toluca Lake.
924,JULES,924,"On the other side of the hill, by
Burbank Studios. If Jimmie's ass
ain't home, I don't know what the
fuck we're gonna go. I ain't got any
other partners in 818."
925,JULES,925,"Jimmie! How you doin' man, it's Jules."
926,JULES,926,"Listen up man, me an' my homeboy are
in some serious shit. We're in a car
we gotta get off the road, pronto! I
need to use your garage for a couple
hours."
927,JULES,927,"We gotta be real fuckin' delicate
with this Jimmie's situation. He's
one remark away from kickin' our
asses out the door."
928,VINCENT,928,"If he kicks us out, whadda we do?"
929,JULES,929,"Well, we ain't leavin' 'til we made
a couple phone calls. But I never
want it to reach that pitch. Jimmie's
my friend and you don't bust in your
friend's house and start tellin' 'im
what's what."
930,VINCENT,930,"Just tell 'im not to be abusive. He
kinda freaked out back there when he
saw Marvin."
931,JULES,931,"Put yourself in his position. It's
eight o'clock in the morning. He
just woke up, he wasn't prepared for
this shit. Don't forget who's doin'
who a favor."
932,VINCENT,932,"If the price of that favor is I gotta
take shit, he can stick his favor
straight up his ass."
933,JULES,933,"What the fuck did you just do to his
towel?"
934,VINCENT,934,I was just dryin' my hands.
935,JULES,935,You're supposed to wash 'em first.
936,VINCENT,936,You watched me wash 'em.
937,JULES,937,I watched you get 'em wet.
938,VINCENT,938,"I washed 'em. Blood's real hard to
get off. Maybe if he had some Lava,
I coulda done a better job."
939,JULES,939,"I used the same soap you did and
when I dried my hands, the towel
didn't look like a fuckin' Maxie
pad. Look, fuck it, alright. Who
cares? But it's shit like this that's
gonna bring this situation to a boil.
If he were to come in here and see
that towel like that... I'm tellin'
you Vincent, you best be cool. 'Cause
if I gotta get in to it with Jimmie
on account of you... Look, I ain't
threatenin' you, I respect you an'
all, just don't put me in that
position."
940,JULES,940,"Jules, you ask me nice like that, no
problem. He's your friend, you handle
him."
941,JULES,941,"Goddamn Jimmie, this is some serious
gourmet shit. Me an' Vincent woulda
been satisfied with freeze-dried
Tasters Choice. You spring this
gourmet fuckin' shit on us. What
flavor is this?"
942,JIMMIE,942,"Knock it off, Julie."
943,JULES,943,What?
944,JIMMIE,944,"I'm not a cobb or corn, so you can
stop butterin' me up. I don't need
you to tell me how good my coffee
is. I'm the one who buys it, I know
how fuckin' good it is.  When Bonnie
goes shoppin;, she buys shit.  I buy
the gourmet expensive stuff 'cause
when I drink it, I wanna taste it.
But what's on my mind at this moment
isn't the coffee in my kitchen, it's
the dead nigger in my garage."
945,JULES,945,Jimmie 
946,JIMMIE,946," I'm talkin'. Now let me ask you a
question, Jules. When you drove in
here, did you notice a sign out front
that said, ""Dead nigger storage?"""
947,JIMMIE,947," answer to question. Did you see a
sign out in front of my house that
said, ""Dead nigger storage?"""
948,JULES,948,"Naw man, I didn't."
949,JIMMIE,949,"You know why you didn't see that
sign?"
950,JULES,950,Why?
951,JIMMIE,951,"'Cause storin' dead niggers ain't my
fuckin' business!"
952,JIMMIE,952," I ain't through! Now don't you
understand that if Bonnie comes home
and finds a dead body in her house,
I'm gonna get divorced. No marriage
counselor, no trial separation 
fuckin' divorced. And I don't wanna
get fuckin' divorced. The last time
me an' Bonnie talked about this shit
was gonna be the last time me an'
Bonnie talked about this shit. Now I
wanna help ya out Julie, I really
do. But I ain't gonna lose my wife
doin' it."
953,JULES,953,Jimmie 
954,JIMMIE,954," don't fuckin' Jimmie me, man, I
can't be Jimmied. There's nothin'
you can say that's gonna make me
forget I love my wife. Now she's
workin' the graveyard shift at the
hospital. She'll be comin' home in
less than an hour and a half. Make
your phone calls, talk to your people,
than get the fuck out of my house."
955,JULES,955,"That's all we want. We don't wanna
fuck up your shit. We just need to
call our people to bring us in."
956,JIMMIE,956,"Then I suggest you get to it. Phone's
in my bedroom."
957,MARSELLUS,957,"...well, say she comes home. Whaddya
think she'll do?"
958,MARSELLUS,958,"No fuckin' shit she'll freak. That
ain't no kinda answer. You know 'er,
I don't.  How bad, a lot or a little?"
959,JULES,959,"You got to appreciate what an
explosive element this Bonnie
situation is. If she comes home from
a hard day's work and finds a bunch
of gangsters doin' a bunch of gangsta'
shit in her kitchen, ain't no tellin'
what she's apt to do."
960,MARSELLUS,960,"I've grasped that, Jules. All I'm
doin' is contemplating the ""ifs."""
961,JULES,961,"I don't wanna hear about no
motherfuckin' ""ifs.""What I wanna
hear from your ass is: ""you ain't
got no problems, Jules. I'm on the
motherfucker. Go back in there, chill
them niggers out and wait for the
cavalry, which should be comin'
directly."""
962,MARSELLUS,962,"You ain't got no problems, Jules.
I'm on the motherfucker. Go back in
there, chill them niggers out and
wait for The Wolf, who should be
comin' directly."
963,JULES,963,You sendin' The Wolf?
964,MARSELLUS,964,Feel better?
965,JULES,965,"Shit Negro, that's all you had to
say."
966,THE WOLF,966,Is she the hysterical type?
967,THE WOLF,967,When she due?
968,THE WOLF,968,Give me the principals' names again?
969,THE WOLF,969,Jules...
970,THE WOLF,970,...Vincent... Jimmie... Bonnie...
971,THE WOLF,971,"Expect a call around 10:30. It's
about thirty minutes away. I'll be
there in ten."
972,THE WOLF,972,"You're Jimmie, right? This is your
house?"
973,JIMMIE,973,Yeah.
974,THE WOLF,974,"I'm Winston Wolf, I solve problems."
975,JIMMIE,975,"Good, 'cause we got one."
976,THE WOLF,976,So I heard. May I come in?
977,JIMMIE,977,Please do.
978,THE WOLF,978,"You must be Jules, which would make
you Vincent. Let's get down to brass
tacks, gentlemen. If I was informed
correctly, the clock is ticking, is
that right, Jimmie?"
979,JIMMIE,979,100%.
980,THE WOLF,980,"Your wife, Bonnie..."
981,THE WOLF,981,"...comes home at 9:30 in the AM, is
that correct?"
982,JIMMIE,982,Uh-huh.
983,THE WOLF,983,"I was led to believe if she comes
home and finds us here, she wouldn't
appreciate it none too much."
984,JIMMIE,984,She won't at that.
985,THE WOLF,985,"That gives us forty minutes to get
the fuck outta Dodge, which, if you
do what I say when I say it, should
by plenty. Now you got a corpse in a
car, minus a head, in a garage. Take
me to it."
986,THE WOLF,986,Jimmie?
987,JIMMIE,987,Yes.
988,THE WOLF,988,"Do me a favor, will ya? Thought I
smelled some coffee in there. Would
you make me a cup?"
989,JIMMIE,989,"Sure, how do you take it?"
990,THE WOLF,990,"Lotsa cream, lotsa sugar."
991,THE WOLF,991,"About the car, is there anything I
need to know? Does it stall, does it
make a lot of noise, does it smoke,
is there gas in it, anything?"
992,JULES,992,"Aside from how it looks, the car's
cool."
993,THE WOLF,993,"Positive?  Don't get me out on the
road and I find out the brake lights
don't work."
994,JULES,994,"Hey man, as far as I know, the
motherfucker's tip-top."
995,THE WOLF,995,"Good enough, let's go back to the
kitchen."
996,THE WOLF,996,"Thank you, Jimmie."
997,THE WOLF,997,"Okay first thing, you two."
998,THE WOLF,998,"Take the body, stick it in the trunk.
Now Jimmie, this looks to be a pretty
domesticated house. That would lead
me to believe that in the garage or
under the sink, you got a bunch of
cleansers and cleaners and shit like
that, am I correct?"
999,JIMMIE,999,Yeah. Exactly. Under the sink.
