,character,line #,line
508,FREDDY,508,"...this was during the Los Angeles
marijuana drought of '86.  I still
had a connection.  Which was
insane, 'cause you couldn't get
weed anyfuckinwhere then.  Anyway,
I had a connection with this
hippie chick up in Santa Cruz.
All and my friends knew it.  And
they'd give me a call and say,
""Hey, Freddy, you buyin some, you
think you could buy me some too?""
They knew I smoked, so they'd ask
me to buy a little for them when I
was buyin.  But it got to be
everytime I bought some weed, I
was buyin for four or five
different people.  Finally I said,
""Fuck this shit.""  I'm makin this
bitch rich.  She didn't have to do
jack shit, she never even had to
meet these people.  I was fuckin
doin all the work.  So I got
together with her and told her,
""Hey, I'm sick of this shit.  I'm
comin through for everybody, and
nobody's comin through for me.
So, either I'm gonna tell all my
friends to find their own source,
or you give me a bunch of weed,
I'll sell it to them, give you the
money, minus ten percent, and I
get my pot for free.""  So, I did
if for awhile..."
509,FREDDY,509,"...but then that got to be a pain
in the ass.  People called me on
the phone all the fuckin time.  I
couldn't rent a fuckin tape
without six phone calls
interrupting me.  ""Hey, Freddy,
when's the next time you're gettin
some?""  ""Motherfucker, I'm tryin
to watch 'Lost Boys'-- when I have
some, I'll let you know.""  And
then these rinky-dink pot heads
come by--there's my friends and
everything, but still.  I got all
my shit laid out in sixty dollar
bags.  Well, they don't want sixty
dollars worth.  They want ten
dollars worth.  Breaking it up is
a major fuckin pain in the ass.  I
don't even know how much ten
dollars worth is.  ""Well, fuck,
man, I don't want that much
around.  If I have that much
around I'll smoke it.""  ""Hey, if
you guys can't control your
smokin, that's not my problem.
You motherfuckers been smokin for
five years, be a adult about it.""
Finally I just told my connection,
count me out.  But as it turns
out, I'm the best guy she had, and
she depended alot on my business.
But I was still sick to death of
it.  And she's trying to talk me
into not quitin.
Now this was a very weird
situation, 'cause I don't know if
you remember back in '86, there
was a major fuckin drought.
Nobody and anything.  People were
livin on resin and smokin the wood
in their pipes for months.  And
this chick had a bunch, and was
beggin me to sell it.  So I told
her I wasn't gonna be Joe the Pot
Man anymore.  But I would take a
little bit and sell it to my
close, close, close friends.  She
agreed to that, and said we'd keep
the same arrangement as before,
ten percent and free pot for me,
as long as I helped her out that
weekend.  She had a brick of weed
she was sellin, and she didn't
want to go to the buy alone..."
510,FREDDY,510,"...Her brother usually goes with
her, but he's in county
unexpectedly."
511,MR. WHITE,511,What for?
512,FREDDY,512,"Traffic tickets gone to warrant.
They stopped him for something,
found the warrants on 'im, took
'im to jail.  She doesn't want to
walk around alone with all that
weed.  Well, I don't wanna do
this, I have a bad feeling about
it, but she keeps askin me, keeps
askin me, finally I said okay
'cause I'm sick of listening to
it.  Well, we're picking this guy
up at the train station."
513,JOE,513,"You're picking the buyer up at the
train station?  You're carrying
the weed on you?"
514,FREDDY,514,"Yeah, the guy needed it right
away.  Don't ask me why.  So we
get to the train station, and
we're waitin for the guy.  Now I'm
carrying the weed in one of those
carry-on bags, and I gotta take a
piss.  So I tell the connection
I'll be right back, I'm goin' to
the little boys room..."
515,FREDDY (V.O.),515,"...So I walk into the men's room,
and who's standing there?"
516,FREDDY (V.O.),516,"...six Los Angeles County Sheriffs
and a German Shepherd."
517,NICE GUY EDDIE (V.O.),517,They were waiting for you?
518,FREDDY (V.O.),518,"No.  They were just a bunch of
cops hangin out in the men's room,
talkin.  When I walked through the
door they all stopped what they
were talking about and looked at
me."
519,MR. WHITE,519,"That's hard, man.  That's a fuckin
hard situation."
520,FREDDY (V.O.),520,"The German Shepherd starts
barkin'.  He's barkin' at me.  I
mean it's obvious he's barkin' at
me."
521,FREDDY (V.O.),521,"Every nerve ending, all of my
senses, the blood in my veins,
everything I has was screaming,
""Take off, man, just take off, get
the fuck outta there!""  Panic hit
me like a bucket of water.  First
there was the shock of it--BAM,
right in the face!  Then I'm just
standin there drenched in panic."
522,FREDDY (V.O.),522,"And all those sheriffs are lookin
at me and they know. They can
smell it.  As sure as that fuckin
dog cam, they can smell it on me."
523,SHERIFF #1,523,Shut up!
524,SHERIFF #2,524,"So my gun's drawn, right?  I got
it aimed right at him.  I tell
'em, ""Freeze, don't fuckin move.""
And the little idiot's lookin at
me, nodding his head ""Yes,"" sayin
""I know...I know...I know.""
Meanwhile his right hand is
creepin towards his glove box.  So
I scream at him, ""Asshole, you
better fuckin freeze right now!""
And he's still lookin right at me,
saying
""I know...I know...I know.""  And
his right hand's still going for
the glove box."
525,SHERIFF #2 (O.S.),525,"I tell 'im, ""Buddy, I'm gonna
shoot you in the face right now if
you don't put your hands on the
fuckin dash.""  And the guy's
girlfriend, a real sexy Oriental
bitch, starts screamin at him,
""Chuck, are you out of your mind?
Put your hands on the dash like
the officer said.""  And then like
nothing, the guy snaps out of it
and casually puts his hands on the
dash."
526,SHERIFF #1,526,What was he goin for?
527,SHERIFF #2,527,"His registration.  Stupid fuckin
citizen, doesn't have the
slightest idea how close he came
to gettin shot."
528,FREDDY (OS),528,"That's him, that's Mr. White."
529,HOLDAWAY,529,"Lawrence Dimick.  Let's see what
we got on him."
530,JODIE,530,"This is your life, Lawrence
Dimick!"
531,JODIE (OS),531,"Lawrence ""Larry"" Dimick.  Also
known as Lawrence Jacobs and Alvin
""Al"" Jacobs.  This guy is Mr. Joe-
Armed-Robbery.  He's
a pro and he makes it a habit not
to get caught."
532,JODIE,532,"He's only been convicted twice,
which is pretty good for somebody
living a life of crime.  Once for
armed robbery, when he was twenty-
one, in Milwaukee."
533,FREDDY,533,What was it?
534,"JODIE
JODIE",534,"Payroll office at a lumber yard.
First offense - he got eighteen
months.  He didn't get busted
again until he was thirty-two.
And then it was a backdoor bust.
A routine vice squad roust.  They
roust this bar, out buddy Lawrence
is in there knocking down a few.
He gets picked up.  He's wearing
on his person an outlaw .45
automatic, apparently his weapon
of choice.  Also, on his finger is
a diamond ring from a jewelry
store robbery a year earlier.  He
got two years back inside for
that."
535,FREDDY,535,"Goddamn, that's hard time."
536,"JODIE
JODIE",536,"So far, it's the only time he's
ever done."
537,HOLDAWAY,537,"Was this vice squad bullshit in
Milwaukee?"
538,"JODIE
JODIE",538,"No.  The vice squad roust was in
L.A.  He's been in Los Angeles
since '77."
539,FREDDY,539,When did he do this time?
540,JODIE,540,"Back in '83, got out late '86.  I
found something else out I think
you two should be aware of.
About a year and a half ago, up in
Sacramento, an undercover cop,
John Dolenz, worked his way into a
bank job.  Apparently before the
job they found out he was a cop.
Now picture this:  It's Dolenz's
birthday, a bunch of cops are
waiting in his apartment for a
surprise party.  The door opens,
everyone yells ""Surprise!"", and
standing in the doorway is Dolenz
and this other guy sticking a gun
in Dolenz's ribs.  Before anybody
knows what's going on, this
stranger shoots Dolenz dead and
starts firing two .45 automatics
into the crowd."
541,HOLDAWAY,541,What happened?
542,JODIE,542,"It was a mess.  Cops got hit,
wives got hit, girlfriends got
hit, his dog got hit.  People got
glass in their faces.  Three were
killed, six were wounded."
543,FREDDY,543,"They couldn't pin the killing on
one of the bank robbers?"
544,JODIE,544,"They tried, but they didn't have a
positive I.D. and all those guys
had alibis.  Besides, we really
didn't have anything on them.  We
had the testimony of a dead man
that they were talking
about committing a robbery.  They
never went ahead with the bank
job."
545,FREDDY,545,"And Larry Dimick was one of the
boys?"
546,JODIE,546,He was probably the one.
547,HOLDAWAY,547,"Just how sure are you with your
cover?"
548,FREDDY,548,"Today they may know something,
tomorrow they may know something
else.  But yesterday they didn't
know anything."
549,FREDDY (OS),549,What's the next step?
550,HOLDAWAY (OS),550,"Do what they told ya.  Sit in your
apartment and wait for 'em to call
you.  We'll have guys posted
outside who'll follow you when
they pick you up."
551,FREDDY,551,Hello.
552,NICE GUY EDDIE (OS),552,It's time.  Grab your jacket--
553,EDDIE,553,--We're parked outside.
554,FREDDY (OS),554,I'll be right down.
555,EDDIE,555,He'll be right down.
556,FREDDY,556,"Don't pussy out on me now.  They
don't know.  They don't know shit."
557,FREDDY,557,"You're not gonna get hurt.  You're
fucking Baretta and they believe
every word, cuz
you're super cool."
558,COP #1 (OS),558,There goes our boy.
559,COP #2 (OS),559,"I swear, a guy has to have rocks
in his head the size of Gibraltar
to work undercover."
560,COP #1 (OS),560,Do you want one of these?
561,COP #2 (OS),561,"Yeah, gimme the bear claw."
562,MR. PINK,562,"...Hey, I know what I'm talkin
about, black women ain't the same
as white women."
563,MR. WHITE,563,There's a slight difference.
564,MR. PINK,564,"Go ahead and laugh, you know what
I mean.  What a while bitch will
put up with, a black bitch won't
put up with for a minute.  They
got a line, and if you cross it,
they fuck you up."
565,EDDIE,565,"I gotta go along with Mr. Pink on
this.  I've seen it happen."
566,MR. WHITE,566,"Okay, Mr. Expert. If this is such
a truism, how come every nigger I
know treats his woman like a piece
of shit?"
567,MR. PINK,567,"I'll make you a bet that those
same damn niggers who were showin
their ass in public, when their
bitches get 'em home, they chill
the fuck out."
568,MR. WHITE,568,Not these guys.
569,MR. PINK,569,"Yeah, those guys too."
570,EDDIE,570,"Let me tell you guys a story.  In
one of daddy's clubs there was
this black cocktail waitress named
Elois."
571,MR. WHITE,571,Elois?
572,EDDIE,572,"Yeah, Elois. E and Lois.  We
called her Lady E."
573,MR. WHITE,573,"Where was she from, Compton?"
574,EDDIE,574,No.  She was from Ladora Heights.
575,MR. PINK,575,"The black Beverly Hills.  I knew
this lady from Ladora Heights
once."
576,MR. PINK,576,"""Hi, I'm from Ladora Heights, it's
the black Beverly Hills."""
577,EDDIE,577,"It's not the black Beverly Hills,
it's the black Palos Verdes.
Anyway, this chick, Elois, was a
man-eater-upper.  I bet every guy
who's ever met her has jacked off
to her at least once.  You know
who she looked like?  Christie
Love.  'Member that TV show ""Get
Christie Love""?  She was a black
female cop.  She always used to
say ""You're under arrest, sugar."""
578,MR. PINK,578,"I was in the sixth grade when that
show was on.  I totally dug it.
What the fuck was the name of the
chick who played Christie
Love?"
579,EDDIE,579,Pam Grier.
580,MR. PINK,580,"No, it wasn't Pan Grier, Pan Grier
was the other one.  Pan Grier made
the movies.  Christie Love was
like a Pam Grier TV show, without
Pam Grier."
581,MR. PINK,581,"What the fuck was that chick's
name?  Oh this is just great, I'm
totally fuckin tortured now."
582,EDDIE,582,"Well, whoever she was, Elois
looked like her.  So one night I
walk into the club, and no Elois.
Now the bartender was a wetback,
he was a friend of mine, his name
was Carlos.
So I asked him ""Hey, Carlos,
where's Lady E tonight?""  Well
apparently Lady E was married to
this real piece of dog shit.  I
mean a real animal.  And
apparently he would so things to
her."
583,FREDDY,583,"Do things?  What would he do?  You
mean like beat her up?"
584,EDDIE,584,"Nobody knows for sure what he did.
We just know he did something.
Anyway, Elois plays it real cool.
And waits for the next time this
bag of shit gets drunk.  So one
night the guy gets drunk and
passes out on the couch.  So while
the guy's
inebriated, she strips him naked.
Then she takes some crazy glue and
glues his dick to his belly."
585,EDDIE,585,"I'm dead fuckin serious.  She put
some on his dick and some on his
belly, then stuck 'em together.
The paramedics had to come and cut
it loose."
586,MR. WHITE,586,Jesus Christ!
587,FREDDY,587,"You can do some crazy things with
it."
588,EDDIE,588,"I don't know what he did to her,
but she got even."
589,MR. WHITE,589,Was he all pissed off?
590,MR. PINK,590,"How would you feel if you had to
do a handstand every time you took
a piss."
591,JOE,591,"...So they're talkin about how
they get their wives off, and the
French guys says:"
592,JOE,592,"""All I gotta do is take my pinky
and tickle my Fifi's little oo la
la  and she rises a foot off the
bed."""
593,JOE,593,So the dago says:
594,JOE,594,"""That's nothin.  When I take the
tip of my tongue and wiggle it
against my Mary Louise's little
fun pimple, she rises two feet off
da bed.""  Then our friend from
Poland says:"
595,JOE,595,"""You guys ain't no cocksmen. When
I get through fuckin my Sophie, I
wipe my dick on the curtains and
you know what?  She hits the
roof!"""
596,JOE,596,"Ha, ha, ha, ha, ha, ha!"
597,JOE,597,"Ain't that a masterpiece?  Stupid
fuckin Polack, wipes his dick on
the drapes."
598,JOE,598,"You're here, great!"
599,EDDIE,599,"We woulda gotten here sooner, but
we got backed up around La Brea
and Pico."
600,JOE,600,No hurry.
601,JOE,601,"All right, let's get to know one
another.  With the exception of
Eddie and myself, who you already
know, you'll be using aliases.
Under no circumstances are you to
tell one another your real name or
anything else about yourself.
That includes where you're from,
your wife's name, where you
might've done time, about a bank
in St. Petersburg you might've
robbed.  You guys don't say shit
about who you are, where you been
or what you've done.  Only thing
you guys can talk about is what
you're going to do.  This way the
only ones who know who the members
of the team are are Eddie and
myself.  And that's the way I like
it.  Because in the unlikely event
of one of you getting apprehended
by the cops, not that I expect
that to happen - it most
definitely should not happen - it
hasn't happened, you don't have
anything to deal with.  You don't
know any names.  You know my name,
you know Eddie's name.  That I
don't care about.  You gotta prove
it.  I ain't worried.  Besides,
this way you gotta trust me.  I
like that.  I set this up and
picked the men I wanted for it.
None of you came to me, I
approached all of you.  I know
you.  I know your work, I know
your reputation.  I know you as
men.  Except for this guy."
602,JOE,602,"But he's OK.  If he wasn't OK, he
wouldn't be here.  Okay, let me
introduce everybody to everybody.
But once again, at the risk of
being redundant, if I even think I
hear somebody telling or referring
to somebody by their Christian
name..."
603,JOE,603,"...you won't want to be you.
Okay, quickly."
604,JOE,604,"Mr. Brown, Mr. White, Mr. Blonde,
Mr. Blue, Mr. Orange, and Mr.
Pink."
605,MR. PINK,605,Why am I Mr. Pink?
606,JOE,606,Cause you're a faggot.
607,MR. PINK,607,"Why can't we pick out our own
colors?"
608,JOE,608,"I tried that once, it don't work.
You get four guys fighting over
who's gonna be Mr. Black.  Since
nobody knows anybody else, nobody
wants to back down.  So forget it,
I pick.  Be thankful you're not
Mr. Yellow."
609,MR. BROWN,609,"Yeah, but Mr. Brown?  That's too
close to Mr. Shit."
610,MR. PINK,610,"Yeah, Mr. Pink sounds like Mr.
Pussy.  Tell you what, let me be
Mr. Purple.  That sounds good to
me, I'm Mr. Purple."
611,JOE,611,"You're not Mr. Purple, somebody
from another job's Mr. Purple.
You're Mr. Pink."
612,MR. WHITE,612,"Who cares what your name is?  Who
cares if you're Mr. Pink, Mr.
Purple, Mr. Pussy, Mr. Piss..."
613,MR. PINK,613,"Oh that's really easy for you to
say, you're Mr. White.  You gotta
cool-sounding name.  So tell me,
Mr. White, if you think ""Mr. Pink""
is no big deal, you wanna trade?"
614,JOE,614,"Nobody's trading with anybody!
Look, this ain't a goddamn fuckin
city counsel meeting!  Listen up
Mr. Pink.  We got two ways here,
my way or the highway.  And you
can go down either of 'em.  So
what's it gonna be, Mr. Pink?"
615,MR. PINK,615,"Jesus Christ, Joe.  Fuckin forget
it.  This is beneath me.  I'm Mr.
Pink, let's move on."
616,JOE (OS),616,"Okay fellas, let's get into this."
617,HOLDAWAY,617,"Okay, we're gonna station men
across the street from Karina's
Fine Jewelry.  But their orders
will be not to move in unless the
robbery gets out of control.  You
gotta make sure they don't have to
move in.  You're inside to make
sure that everything goes
according to Hoyle.  We have men
set up a block away from the
warehouse rendezvous.  They got
complete visibility of the
exterior.  So as soon as Joe Cabot
shows up, we'll see it."
618,FREDDY,618,"What's your visibility of the
interior?"
619,HOLDAWAY,619,"We can't see shit on the inside.
And we can't risk gettin any
closer for fear they'll spot us."
620,FREDDY,620,"This is bullshit, Jim.  I get all
the fuckin danger of having you
guys in my back pocket but none of
the safety."
621,HOLDAWAY,621,"What's the matter, Newendyke?  Job
too tough for ya?  No one lied to
you.  You always knew we'd hang
back until Joe Cabot showed up."
622,FREDDY,622,"Oh this is great.  You ain't
giving me no fuckin protection
whatsoever.  But you are giving me
an attitude."
623,HOLDAWAY,623,"Since when does an undercover cop
have protection?  Freddy, you came
into this thing with your eyes
wide open, so don't start screamin
blind man now.  I understand
you're nervous.  I wish the
warehouse had more visible
windows, but it doesn't.  We have
to make do with the cards we're
dealt."
624,FREDDY,624,"I didn't say I wasn't gonna do it.
I'm just remarking on how shitty
the situation is!"
625,HOLDAWAY,625,"I don't mean to be harsh with ya,
but I've found tough love works
best in these situations.  We have
to get Joe Cabot in the company of
the thieves and in the same
vicinity as the loot.
We don't care about these other
bastards.  We're willing to offer
them good deals to testify against
Cabot."
626,FREDDY,626,Isn't this risk unorthodox?
627,HOLDAWAY,627,What?
628,FREDDY,628,"Letting them go ahead with the
robbery?"
629,HOLDAWAY,629,"The whole idea behind this
operation is to catch Joe Cabot
red-handed.  We bust these hired
hands, we ain't accomplished shit.
Letting them go through with the
heist is a risk, but Cabot's jobs
are very clean.  We got people
surrounding the perimeter.  We got
a guy and a gal on the inside
posing as a couple shopping for
rings.  We could replace the
employees with cops, but we'd run
the risk of tipping 'em off."
630,FREDDY,630,"That's out.  They know the faces
of who works what shift."
631,HOLDAWAY,631,"These guys are professionals.
We're professionals.  It's a risk,
but I think it's a calculated
risk."
632,MR. WHITE (VO),632,Let's go over it.  Where are you?
633,FREDDY (VO),633,"I stand outside and guard the
door.  I don't let anybody come in
or go out."
634,MR. WHITE (VO),634,Mr. Brown?
635,FREDDY (VO),635,"Mr. Brown stays in the car.  He's
parked across the street till I
give him the signal, then he pulls
up in front of the store."
636,MR. WHITE (VO),636,Mr. Blonde and Mr. Blue?
637,FREDDY (VO),637,"Crowd control.  They handle
customers and employees in the
display area."
638,MR. WHITE,638,Myself and Mr. Pink?
639,FREDDY,639,"You two take the manager in the
back and make him give you the
diamonds.  We're there for those
stones, period.  Since no display
cases are being fucked with, no
alarms should go off.  We're out
of there in two minutes, not one
second longer.  What if the
manager won't give up the
diamonds?"
640,MR. WHITE,640,"When you're dealing with a store
like this, they're insured up the
ass.  They're not supposed to give
you and resistance
whatsoever.  If you get a customer
or an employee who thinks he's
Charles Bronson, take the butt of
your gun and smash their nose in.
Drops 'em right to the floor.
Everyone jumps, he falls down,
screaming, blood squirts out his
nose.  Freaks everybody out.
Nobody says fuckin shit after
that.  You might get some bitch
talk shit to ya.  But give her a
look, like you're gonna smash her
in the face next.  Watch her shut
the fuck up.  Now if it's a
manager, that's a different story.
The managers know better than to
fuck around.  So if one's givin
you static, he probably thinks
he's a real cowboy.  So what you
gotta do is break that son-of-a-
bitch in two.  If you wanna know
something and he won't tell you,
cut off one of his fingers.  The
little one.  Then you tell 'im his
thumb's next.  After that he'll
tell ya if he wears ladies
underwear.  I'm hungry, let's get
a taco."
641,MR. BROWN,641,"My eyes!  My eyes!  I'm blind, I'm
fucking blind!"
642,FREDDY,642,"You're not blind, there's just
blood in your eyes."
643,MR. BROWN,643,"Mr. Orange?  You're Mr. Orange,
aren't you?"
644,MR. WHITE,644,Is he dead?
645,MR. WHITE,645,Did he did or not?
646,FREDDY,646,I'm sorry.
647,MR. WHITE,647,What?  Snap out of it!
648,MR. WHITE,648,Get us outta here!
649,MR. WHITE,649,The bitch's got a gun!
650,MR. WHITE (OS),650,Just hold on buddy boy.
651,FREDDY,651,"I'm sorry.  I can't believe she
killed me..."
652,EDDIE,652,"You know, all things considered,
this was pretty successful."
653,MR. WHITE,653,"I don't believe you just said
that."
654,EDDIE,654,"No, it was messy as hell, but do
you realize how much you got away
with?  There's over two million
dollars worth of diamonds here."
655,MR. PINK,655,I love this guy.
656,EDDIE,656,"Hey, what's done is done.  We can
all sit around and have a big cry
about it or we can deal with the
situation at hand."
657,MR. WHITE,657,"The situation as hand isn't that
fuckin satchel.  You and Joe have
a responsibility to your men."
658,EDDIE,658,"Hey, it's the best I could do."
659,MR. WHITE,659,The man is fucking dying.
660,EDDIE,660,"And I'm telling you, Bonnie'll
take care of him."
661,MR. WHITE,661,"He needs a doctor, not a fuckin
nurse."
662,EDDIE,662,"Ask me how many doctors I called.
You wanna embarrass yourself, ask
me how many doctors I called."
663,MR. WHITE,663,Obviously not enough.
664,EDDIE,664,"Fuck you! You gotta little black
book, then whip is out.  If not,
listen how it is.  I called three
doctors and couldn't get through
to shit.  Now, time being a
factor, I called Bonnie.  Sweet
broad, helluva broad, and a
registered nurse.  Told her a
bullshit story, upside:  she said
bring him to her apartment."
665,MR. WHITE,665,"If he dies I'm holding you
personally responsible."
666,EDDIE,666,"Fuck you buddy boy!  Okay, you
wanna play that way.  I am
personally leaving myself
vulnerable with this Bonnie
situation.  I don't think she'll
call the cops, but I don't know
for sure.  But me being too nice-
a-fuckin-guy was willin to risk
it.  But no fuckin more."
667,EDDIE,667,"I'm callin Bonnie back and tellin
her to forget it.  You take care
of your friend, you know so much
about it."
668,MR. PINK,668,"Goddamnit, will you guys grow up!"
669,EDDIE,669,"I don't need to grow up, my
friend.  I am a grown up.  I'm
being responsible, I'm taking care
of business."
670,MR. WHITE,670,"Cut the shit!  I don't think you
called anybody except some cooze
you once fucked, who happens to
wear orthopedic shoes.  And I
don't think that's good enough
care for a gut-shot man."
671,EDDIE,671,"Yeah, well I don't give a flying
fuck what you think!"
672,MR. PINK,672,"Look, he's not sayin this bitch is
gonna operate on him.  She's gonna
give him better attention than we
can until we can get a doctor.
Nobody's forgotten about doctors.
Joe'll get one in a snap.  This is
something we're doing in the
meantime.  I think both of you are
actin like a couple of assholes."
673,EDDIE,673,"Yeah, right.  I arrange a nurse, I
leave myself wide open, and I'm an
asshole."
674,EDDIE,674,What the fuck happened here?
675,MR. WHITE,675,What happened?
676,MR. ORANGE,676,"Blonde went crazy.  He slashed the
cop's face, cut off his ear and
was gonna burn him alive."
677,EDDIE,677,"Who cares what he was gonna do to
this fuckin pig?"
678,EDDIE,678,"You were saying he went crazy?
Something like that?  Worse or
better?"
679,MR. ORANGE,679,"Look, Eddie, he was pullin a burn.
He was gonna kill the cop and me.
And when you guys walked through
the door, he was gonna blow you to
hell and make off with the
diamonds."
680,MR. WHITE,680,"Uhuh, uhuh, what's I tell ya?
That sick piece of shit was a
stone cold psycho."
681,MR. ORANGE,681,"You could've asked the cop, if you
didn't just kill him.  He talked
about what he was going to do when
he was slicing him up."
682,EDDIE,682,"I don't buy it.  It doesn't make
sense."
683,MR. WHITE,683,"It makes perfect fuckin sense to
me.  Eddie, you didn't see how he
acted during the job, we did."
684,MR. PINK,684,"He's right about the ear, it's
hacked off."
685,EDDIE,685,"Let me say this out loud, just to
get it straight in my mind.
According to you, Mr. Blonde was
gonna kill you.  Then when we came
back, kill us, grab the diamonds,
and scram.  That's your story?
I'm correct about that, right?"
686,MR. ORANGE,686,"Eddie, you can believe me or not
believe me, but it's the truth.  I
swear on my mother's eternal soul
that's what happened."
687,EDDIE,687,"You're a fuckin liar.  Now why
don't you drop the fuckin fairy
tale and tell me what really
happened?"
688,MR. WHITE (OS),688,"He told you what really happened.
You just can't deal with it."
