,character,line #,line
689,MR. ORANGE (OS),689,"Okay, you're right, I'm lying.
Even though I'm fuckin dyin I'm
not above pullin a fast one.  Get
rid of Blonde, we share his split
- no, scratch that, I shot him
'cause I didn't like his hair
style.  I didn't like his shoes
either.  If it has just been his
hair, I'd've maybe, maybe I said,
let him live.  But hair and
footwear together, he's a goner."
690,EDDIE,690,"The man you killed was just
released from prison.  He got
caught at a company warehouse full
of hot items.  He could've walked
away.  All he had to do was say my
dad's name.  But instead he shut
his mouth and did his time.  He
did four years for us, and he did
'em like a man.  And we were very
grateful.  So, Mr. Orange, you're
tellin me this very good friend of
mine, who did four years for my
father, who in four years never
made a deal, no matter what they
dangled in front of him, you're
telling me that now, that now this
man is free, and we're making good
on our commitment to him, he's
just gonna decide, right out of
the fuckin blue, to rip us off?"
691,EDDIE,691,"Mr. Orange, why don't you tell me
what really happened?"
692,VOICE (OS),692,Why?  It'll just be more bullshit.
693,JOE,693,This man set us up.
694,EDDIE,694,"Daddy, I'm sorry, I don't know
what's happening."
695,JOE,695,"That's okay, Eddie, I do."
696,MR. WHITE,696,"What the fuck are you talking
about?"
697,JOE,697,"That piece of shit.  Workin with
the cops."
698,MR. WHITE   MR. PINK   EDDIE,698,What?
699,JOE,699,"I said this lump of shit is workin
with the LAPD."
700,JOE,700,Aren't you?
701,MR. ORANGE (OS),701,"I don't have the slightest fuckin
idea what you're talkin about."
702,MR. WHITE,702,"Joe, I don't know what you think
you know, but you're wrong."
703,JOE,703,Like hell I am.
704,MR. WHITE,704,"Joe, trust me on this, you've made
a mistake.  He's a good kid. I
understand you're hot, you're
super-fuckin pissed.  We're all
real emotional.  But you're
barking up the wrong tree.  I know
this man, and he wouldn't do that."
705,JOE,705,"You don't know jack shit.  I do.
This rotten bastard tipped off the
cops and got Mr. Brown and Mr.
Blue killed."
706,MR. PINK,706,Mr. Blue's dead?
707,JOE,707,Dead as Dillinger.
708,EDDIE,708,The motherfucker killed Vic.
709,MR. WHITE,709,How do you know all this?
710,JOE,710,"He was the only one I wasn't a
hundred percent on.  I should have
my fucking head examined for goin
forward when I wasn't a hundred
percent.  But he seemed like a
good kid, and I was impatient and
greedy and all the things that
fuck you up."
711,MR. WHITE,711,That's your proof?
712,JOE,712,"You don't need proof when you got
instinct.  I ignored it before,
but not no more."
713,EDDIE,713,"Have you lost your fucking mind?
Put your gun down!"
714,MR. WHITE,714,"Joe, you're making a terrible
mistake I can't let you make."
715,EDDIE,715,"Stop pointing your fuckin gun at
daddy!"
716,JOE,716,"Don't worry, Eddie.  Me and Larry
have been friends a long time, he
ain't gonna shoot.  We like each
other too much."
717,MR. WHITE,717,"Joe, if you kill that man, you die
next.  Repeat, if you kill that
man, you die next!"
718,MR. PINK,718,"C'mon, guys, nobody wants this.
We're supposed to me fuckin
professionals!"
719,JOE,719,"Larry, I'm gonna kill him."
720,MR. WHITE,720,"Goddamn you, Joe, don't make me do
this!"
721,JOE,721,"Larry, I'm askin you to trust me
on this."
722,MR. WHITE,722,Don't ask me that.
723,JOE,723,"I'm not askin, I'm betting."
724,EDDIE,724,"Daddy, don't!"
725,POLICE FORCE (OS),725,"Freeze! Get out of the car and lie
face down on the ground!"
726,MR. PINK (OS),726,Don't shoot!
727,MR. WHITE,727,"Sorry, kid.  Looks like we're
gonna do a little time."
728,MR. ORANGE,728,I'm a cop.
729,MR. ORANGE,729,"I'm sorry, I'm so sorry."
730,POLICE FORCE (OS),730,"Freeze, motherfucker!  Drop your
fucking gun!"
