,character,line #,line
0,ATTENDANT,0,You can't smoke in here.
1,CHARLES,1,"A Mercury is a good car and that's
what I was driving that day. I've
owned a lot of cars. Different
kinds. Lots of different kinds of
cars. She was standing, this girl,
on the side of the street where
there was a chicken stand; not the
Colonel, mind you, but nevertheless
a chicken stand, and I pulled the
Mercury over and rolled down the
window by electric power. She was
wearing a leather skirt and she had
a lot of hair on her arms. I like
that. I like it a lot. It means a
big bush. I like a big bush. She
said, ""Are you dating?"" I said,
""yes,"" and she got in the car. We
pulled to a remote location, one
that she and I both felt
comfortable with and she said, ""How
much can you spend?"" I said, ""What
it takes to see your bush. I know
it's a big one."" She said ""twenty
five dollars,"" which to a working
man is not chicken feed. I produced
the money and she put it in her
shoe and pulled up her skirt. There
before me lay a thin, crooked,
uncircumcised penis. You can
imagine how badly I wanted my
twenty-five dollars back."
2,THERESA,2,"I don't know why you're so weirded
out, this is not San Quentin, it's
just a nuthouse. Most of these
people don't even know where they
are, they're not gonna hurt you."
3,MARSHA,3,"In a few minutes we're gonna be in
a room with a killer. That doesn't
bother you?"
4,THERESA,4,"Hey, you're the one that wanted to
major in journalism. Anyhow, wasn't
the guy something like twelve or
thirteen when he did it, it was
twenty-five years ago, he probably
doesn't even remember it."
5,MARSHA,5,Do you smell shit?
6,THERESA,6,Yeah.
7,GUARD,7,"These are the people from that
newspaper deal."
8,WOOLRIDGE,8,"Oh yeah, from the college?"
9,MARSHA,9,Yes sir.
10,WOOLRIDGE,10,My name's Jerry Woolridge.
11,MARSHA,11,"Nice to meet you. I'm Marsha
Dwiggins and this is Theresa Evans.
She's here to take the pictures."
12,WOOLRIDGE,12,"Y'all have a seat. Is this all of
you?"
13,MARSHA,13,Yes sir.
14,WOOLRIDGE,14,"I think there must have been a
little mix up. I told your sponsor
or teacher or whatever he is, there
couldn't be any pictures. It's
s'posed to be just a little story
or article or something, isn't that
right?"
15,MARSHA,15,"Well, yeah, it's for the school
newspaper. But it has pictures. I
mean it's a regular paper, you
know."
16,WOOLRIDGE,16,"Karl's real sensitive about having
his picture made. He wouldn't even
be on the bulletin board for the
Easter Collage."
17,WOOLRIDGE,17,"Melvin, would you get me a good hot
cup with two sugar substitutes? You
girls want some coffee?"
18,MARSHA,18,No thank you.
19,WOOLRIDGE,19,"The other thing is I told your boss
on the phone to send a man. Karl
won't talk to women."
20,CHARLES,20,"There was a young man named John
Liggit Hunter who was in the
filling station business and a good
filling station business. He was
one of those young men that we run
across so often in life. I'm sure
you've run across them, that didn't
deserve the things he had. One of
those things was his beautiful
bride, Sarah. She was a Georgia
Peach. As a matter of fact she
looked more like the picture I've
had in my head than any woman I've
ever seen. I took it upon myself to
take her away from John Liggit
Hunter, who didn't deserve her. I'm
not sure if I mentioned that he was
a Frenchman who claimed to be an
Englishman. It took some very
strong nylon cord to take her away
from him. She was a fighter as well
as a Georgia Peach."
21,WOOLRIDGE,21,"I don't know what to tell you. I'm
sorry. I made myself pretty clear I
thought. He probably got busy and
wasn't thinking. I know how that
is. I used to teach shop and eighth
grade science."
22,MARSHA,22,"Well, what do we do? We drove all
the way out here."
23,THERESA,23,"Let's just go, Marsha."
24,MARSHA,24,"No, we have to get this story."
25,THERESA,25,I thought you'd be happy to leave.
26,MARSHA,26,Why won't he talk to women?
27,WOOLRIDGE,27,"He has problems. You know. With all
that. He won't hardly talk to
anybody really. Just certain
people. He's very troubled."
28,CHARLES,28,"A shovel just makes too goddamn
much racket."
29,WOOLRIDGE,29,"I don't think he's talked to a
woman in twenty-five or so years.
That I know of anyway. That's why I
said to send a man. At least maybe
he'd answer a question or two for a
man. I'm all for helping the
college out, believe me. It might
be a real good article or story."
30,MARSHA,30,"Can't you talk to him? Maybe talk
him into it. I'm a real good
interviewer. Just get me in the
room with him."
31,WOOLRIDGE,31,"Melvin, go get Karl and take him
down to the old classroom."
32,WOOLRIDGE,32,"I'll talk to him and see what we
can do."
33,WOOLRIDGE,33,"You see, Karl, growing up, only
knew that sex was wrong and that
people who did it should be killed
for it. He couldn't really read
but, well, neither could his
mother. But, his father made sure
that his mother knew what the Bible
said. And she made sure Karl knew.
You know he slept in a hole in the
ground under a toolshed, right?"
34,MARSHA,34,I knew he slept in a toolshed.
35,WOOLRIDGE,35,"His mother told him that he was
their punishment. Hers and his
father's; from God, for having sex--"
36,MARSHA,36,Before they were married?
37,WOOLRIDGE,37,"I don't think so. Just period, I
think. She told him... God gave
them the ugliest creation he could
think of. Karl has an entire book --
a notebook. On every page it says
""Franklin Chapter 1 Verse number
1."" He wrote that a few years ago
after he'd learned to write. His
father's name was Franklin."
38,MARSHA,38,"That's really strange. What does it
mean?"
39,WOOLRIDGE,39,"One of his Daddy's Bible lessons I
imagine. Y'all pull up a chair.
I'll go out and talk to him."
40,CHARLES,40,"You have to make something explode
to truly understand it. You have to
examine the tiny particles while
they're on fire."
41,MELVIN,41,"Karl, I gotta take you down to the
old classroom. Mr. Woolridge has
some people for you to see down
there. Come on. Let's go."
42,WOOLRIDGE,42,"Karl, you know, do you remember
when I told you about those people
from that newspaper?"
43,WOOLRIDGE,43,"They want to ask you some questions
about your release. They think it
would make an interesting story.
Will you talk to 'em? Get
interviewed."
44,WOOLRIDGE,44,"Now, they're women. I think it
might be good for you to. You're
gonna be seein' all kinds of people
when you go on the outside. This'll
help you I believe."
45,WOOLRIDGE,45,"Well, it surprised the dickens out
of me. He said he'll talk to you."
46,WOOLRIDGE (CONT'D),46,"But, here's the thing. He'll only
talk to you. He doesn't want you to
ask him anything. And you shouldn't
stare at him."
47,MARSHA,47,"How am I going to conduct an
interview if I can't ask him any
questions?"
48,WOOLRIDGE,48,"It's the best you're gonna get. I'm
sorry."
49,MARSHA,49,"Can I ask you a question? If he's
so troubled, why are you letting
him out? What if he does it again?
It happens all the time."
50,WOOLRIDGE,50,"He's free. His time's up. That's
the rules. He's been treated and
reevaluated. He doesn't show any
signs any more."
51,MARSHA,51,Signs?
52,WOOLRIDGE,52,"Homicidal signs. Oh, we're gonna
change the light in here for Karl.
I hope you can see to write."
53,WOOLRIDGE (CONT'D),53,You'll have to step outside.
54,WOOLRIDGE (CONT'D),54,Please.
55,THERESA,55,"Can I just sneak in there? I won't
take any pictures, I promise. I
just want to listen."
56,MELVIN,56,No ma'am. I'm sorry you can't.
57,MELVIN (CONT'D),57,You can't smoke in here. I'm sorry.
58,KARL,58,"Well, I reckon what you're a
wanting to know is what I'm doing
in here. I reckon the reason I'm in
here is 'cause I killed somebody.
But I reckon what you was a wanting
to know is how come me to kill
somebody. Well, I reckon I'll start
at the front and tell you."
59,KARL,59,"I lived most of my life out behind
my mother and father's house in a
little old shed and my daddy'd
built for me. They didn't too much
want me up there in the house with
the rest of 'em. I mostly just set
around out there in the shed all
the time a lookin' at the ground.
It didn't have no floor but I had
me a hole dug out to lay down in
and a quilt or tow that I put down
there."
60,KARL,60,"My daddy was a hard workin' man
most of his life, not that I can
say the same fer myself. I most
just set around the shed and
tinkered around with a lawn mower
or two and went to school off and
on from time to time but the
children there made quite a bit of
sport of me, made fun of me quite a
bit. Some of 'em roughed me up
sometimes so mostly I stayed out
back there in the shed. My daddy
worked down at the sawmill there,
down there at the planer mill for
an old man named Dixon.
Old man Dixon was a very cruel
feller, he didn't treat his
employees very well, didn't pay 'em
much of a wage, didn't pay my daddy
much of a wage, just barely enough
to get by on. But I reckon he got
by all right, they come out one or
the other of 'em, usually my
mother, and fed me pretty regular.
At least I know he made enough for
me to have mustard and biscuits
three or four times a week. Old man
Dixon had a boy named Jesse Dixon.
Jesse was really more cruel than
his daddy. He made quite a bit of
sport of me and takened advantage
of the little girls around the
neighborhood quite a bit."
61,KARL,61,"He used to say my mother was a very
pretty woman. He said it quite a
bit from time to time, when I was
at the school house. Well, I reckon
you want me to get on and tell you
what happened so I reckon I'll tell
you. I was settin' out in the shed
one evenin' not doin' too much,
just kindly starin' at the wall and
a waitin' fer my mother to come out
and give me my Bible lesson and I
heared a commotion up in the house
there so I got up and run up on the
screened-in porch there to see what
was a goin' on, and I looked in the
kitchen window and I seen my mother
a layin' there on the floor without
any clothes on."
62,KARL,62,"And seen Jesse Dixon a layin' on
top of her having his way with her."
63,KARL,63,"Well, I just seen red. I picked up
a kaiser blade that was a layin'
there by the screen door, some
folks calls it a sling blade, I
call it a kaiser blade. It's just a
long handle like a axe handle with
a long blade on it that's shaped
kind of like a banana. Sharp on one
edge and dull on the other. It's
what the highway boys use to cut
down weeds and whatnot.
I went in the kitchen there and I
hit Jesse Dixon up side the head
with it and knocked him off my
mother. I reckon that didn't quite
satisfy me so I hit him again in
the neck with the sharp edge and
just plumb near cut his head off.
Killed him. Well, my mother, she
jumped up from there and started
yellin', ""What did you kill Jesse
fer? What did you kill Jesse fer?"""
64,KARL,64,"Well, come to find out my mother
didn't really mind what Jesse was a
doin' to her. I reckon that made me
madder than what Jesse had made me.
I takened the kaiser blade, some
folks calls it a sling blade, I
call it a kaiser blade and hit my
mother up side the head with it an'
killed her."
65,KARL,65,"Some folks has asked me if I had it
to do over again would I do the
same thing. I don't know, I reckon
I would. Anyhow, they seen fit to
put me in here and here I've been
for a great long while. I've
learned to read some; took me four
years to read the Bible. I reckon I
understand a good deal of it. It
wasn't what I expected in a lot of
places. I've slept in a good bed
for a great long while. They've
seen fit to put me out now. They
tell me they're a settin' me free
today. Anyhow, I reckon that's all
you need to know. If you want any
more details I reckon I can tell
'em to you. I don't know if that's
enough for your newspaper or not."
66,MARSHA,66,"Will you ever kill anybody again,
Karl?"
67,KARL,67,"I don't reckon I got no reason to
kill nobody."
68,MARSHA,68,Is he leaving right this minute?
69,WOOLRIDGE,69,"We've got some paperwork to take
care of. Pretty soon. Don't worry,
you won't run into him in the
parking lot."
70,MARSHA,70,I didn't mean that.
71,WOOLRIDGE,71,"I hope the best for you, Miss
Dwiggins, with your school and your
paper and all."
72,MARSHA,72,Where will he go?
73,WOOLRIDGE,73,"Wherever he wants to. I think he's
going back to Millsburg where he's
from. It's just about twenty miles
from here."
74,MARSHA,74,Will he be supervised?
75,WOOLRIDGE,75,"As much as anybody else is, I
guess. Y'all have a good rest of
the day now."
76,KARL,76,Thank you.
77,MARSHA,77,Thank you.
78,KARL,78,"I reckon I'm gonna have to get used
to looking at pretty people."
79,WOOLRIDGE,79,"Yes, I guess you are."
80,KARL,80,"I reckon I'm gonna have to get used
to them lookin' at me, too."
81,WOOLRIDGE,81,You better go get your things.
82,KARL,82,I ain't got nothing but them books.
83,WOOLRIDGE,83,You better go get 'em.
84,KARL,84,All right then.
85,BOY,85,Can I help you?
86,KARL,86,"I was kindly wantin' somethin' or
'nother d'eat."
87,BOY,87,"Well, what did you want?"
88,KARL,88,You have any biscuits for sale?
89,BOY,89,"Naw, we don't have biscuits."
90,BOY (CONT'D),90,"Did you decide, sir?"
91,KARL,91,What you got that's good to eat?
92,BOY,92,"Well, I guess it's all good."
93,KARL,93,What do you like to eat here?
94,BOY,94,"French fries. I like to eat them
pretty good."
95,KARL,95,French-fried potaters.
96,BOY,96,Yeah.
97,KARL,97,"How much you want fer 'em? I'll get
some of them I reckon."
98,BOY,98,"Sixty for small and seventy-five
for large."
99,KARL,99,Give me the big'uns.
100,BOY,100,"These dang things are heavy. Hard
to carry, too."
101,KARL,101,"What you got in there, warshing?"
102,BOY,102,Yeah.
103,KARL,103,"Ain't you got no mama and daddy to
tend to it?"
104,BOY,104,"I got a mama, but she's at work
over at Ben's Dollar Store. My
daddy's dead."
105,BOY,105,He got hit by a train.
106,KARL,106,"How fer you going with them sacks
full of warsh?"
107,BOY,107,About a half a mile I think it is.
108,KARL,108,"I'll help you tote 'em if I don't
give out first."
109,BOY,109,Okay. You don't have to though.
110,BOY,110,"My name is Frank Wheatley. What's
your name?"
111,KARL,111,Karl's my name.
112,FRANK (BOY),112,What's you last name?
113,KARL,113,Childers.
114,FRANK,114,What are all them books?
115,KARL,115,"Different ones. One's the Bible.
One of 'ems a book on Christmas.
One of 'ems how to be a carpenter."
116,FRANK,116,"How come you're carryin' them
around with you."
117,KARL,117,Ain't got nowhere to set 'em down.
118,FRANK,118,Don't you live somewhere?
119,KARL,119,"I did live there in the state
hospital."
120,FRANK,120,Why'd you live there?
121,KARL,121,"I killed some folks quite awhile
back. They said I wadn't right in
the head and they put me in there
in the nervous hospital instead of
puttin' me in jail."
122,FRANK,122,They let you out?
123,KARL,123,Yeah.
124,FRANK,124,How come?
125,KARL,125,"They told me I was well. They had
to turn me loose."
126,FRANK,126,Are you well?
127,KARL,127,I reckon I feel all right.
128,FRANK,128,"You don't seem like you'd kill
nobody."
129,FRANK (CONT'D),129,"This is my house. You can just set
those bags on the porch."
130,FRANK (CONT'D),130,Do you like to play football?
131,KARL,131,"I never was much count at it. I
never did get picked out fer it."
132,FRANK,132,"Me and the Burnett twins and some
boys plays down at the junior high
practice field all the time. If you
ever want to come by and play. We
ain't no good either. Well, I'll
see you later."
133,KARL,133,"How does a feller go about gettin'
up to the state hospital?"
134,MAN,134,"You buy a ticket for fourteen
dollars and then set and wait for
the four-fifteen bus to Kelton."
135,KARL,135,All right then.
136,WOOLRIDGE,136,"Karl, what in the world are you
doing here?"
137,KARL,137,I want to come back and stay here.
138,WOOLRIDGE,138,"Well, you can't do that. You're a
free man. You've been let out to do
as you please."
139,KARL,139,"I reckon I don't care nothin' about
bein' a free man. I don't know how
to go about it."
140,WOOLRIDGE,140,"Well, you have to learn. It'll take
some time. Don't you know anybody
down there to help you out?"
141,KARL,141,Naw.
142,WOOLRIDGE,142,"Your daddy's still livin' down
there from what you told me."
143,WOOLRIDGE,143,"I guess he wouldn't help you any,
would he? I wasn't thinking. You
don't know anybody?"
144,KARL,144,"Naw. Never did know too much of
nobody. Not to he'p me out anyway."
145,WOOLRIDGE,145,"Listen, Karl, the truth is I don't
know where they expect you to go or
what they expect you to do. If it
was up to me, I'd let you stay here
if that's what you wanted. I'm just
doin' my job."
146,WOOLRIDGE,146,You follow me?
147,WOOLRIDGE,147,"Listen, I know an old boy that runs
a fix-it shop deal down in
Millsburg. He used to go to church
with me. You're good workin' on
small engines and things. If I put
my neck out for you with him, will
you work at it if he'll hire you?"
148,KARL,148,"I'm pretty handy I reckon on lawn
mowers and whatnot."
149,WOOLRIDGE,149,"I know, I've seen it myself. Would
you give that a try?"
150,KARL,150,I reckon.
151,WOOLRIDGE,151,"I can't promise he'll hire you.
I'll have to tell him about your
history."
152,KARL,152,I never was no good with history.
153,WOOLRIDGE,153,"No, I mean your past. About why you
were in here."
154,WOOLRIDGE,154,"I'll take you first thing in the
mornin'. You have anyplace you can
stay tonight at all?
I just can't let you stay here.
It's the rules. If something
happened well, I'd be liable."
155,KARL,155,"I reckon I can just walk around
till the mornin'. Or set and read
me a book somewhere."
156,MRS. WOOLRIDGE,156,"Karl, would you like a muffin?"
157,KARL,157,No thank ye.
158,MRS. WOOLRIDGE,158,"I understand Jerry is going to take
you somewhere else tomorrow."
159,KARL,159,"I don't reckon I know nobody name
Jerry."
160,WOOLRIDGE,160,"She's talkin' about me, Karl.
That's my first name."
161,KARL,161,"He's a-carryin' me to look fer work
in Millsburg where I was borned."
162,MRS. WOOLRIDGE,162,Would you like some coffee?
163,KARL,163,"Coffee makes me a might nervous
when I drink it."
164,DAUGHTER,164,"Daddy, can I be excused to go to
bed?"
165,WOOLRIDGE,165,"Sure, honey. You sleep with Mama
tonight. I'll sleep with your
brother and Karl can take your
room."
166,DAUGHTER,166,Why?
167,WOOLRIDGE,167,We have company. Now you go on.
168,WOOLRIDGE,168,"Well, Karl, there's plenty of
blankets and things there.
Bathroom's right there in the hall.
We'll leave first thing tomorrow."
169,MRS. WOOLRIDGE,169,"Jerry, why didn't you give him
Bubba's room? Sister's is kind of
girly, isn't it?"
170,WOOLRIDGE,170,"Yeah, I thought about that. No
sense in moving him now I guess."
171,BUBBA,171,"Daddy, don't you think one of us
ought to stay up all night and kind
of - guard or somethin'?"
172,WOOLRIDGE,172,"Why, hell no, son. What's wrong
with you?"
173,BUBBA,173,"Well, he's crazy. He's a nut ain't
he?"
174,MRS. WOOLRIDGE,174,"'Isn't' he, Bubba. Don't say ain't."
175,WOOLRIDGE,175,"Karl, you up?"
176,KARL (O.S.),176,Yes sir.
177,WOOLRIDGE,177,"Didn't you go to sleep at all,
Karl? You been sittin' there like
that all night?"
178,KARL,178,Yes sir.
179,WOOLRIDGE,179,"Well, I guess we better hit the
road."
180,BILL,180,"Hey Jerry, how it's goin'. Good to
see you. Been a long time."
181,WOOLRIDGE,181,"Good to see you, Bill. How's
everybody doin'?"
182,BILL,182,"Aw, pretty good. Kids are drivin'
me crazy and Phyliss is gonna put
me in the poorhouse. Can't complain
other than that. Wouldn't do any
good if I did."
183,BILL,183,"Do you know Scooter, Jerry?"
184,WOOLRIDGE,184,"No, don't guess I do."
185,WOOLRIDGE,185,"Scooter, good to meet you."
186,WOOLRIDGE,186,"This is him, the one I talked to
you about on the phone. Now like I
said, I'll understand if you get
nervous about it. I'm not gonna lie
to you now, he did get in that
trouble but then he was real young."
187,BILL,187,"I remember it real well. Cut them
folks to pieces. His mama one of
'em."
188,SCOOTER,188,"And that ol' Dixon boy. Hell, I
always wanted to kill him myself.
Asshole's what he was. I remember
that ol' boy"
189,SCOOTER,189,"too. Kind of retarded or somethin'
back in school."
190,WOOLRIDGE,190,"Well, he seems pretty well-adjusted
these days. I don't think he'd ever
hurt anybody."
191,BILL,191,"Don't look much like he could. You
say he can fix a small engine like
nobody's bidness."
192,WOOLRIDGE,192,"He's a regular whiz at it. That's
all he did when he was a kid."
193,BILL,193,"Well, I ain't scared of him workin'
here. You know me. I'm a church
goin' man. Forgivin' man. When your
time's up the Lord's gonna come git
you. You seared of him, Scooter?"
194,SCOOTER,194,I don't guess. Can he talk?
195,WOOLRIDGE,195,"Oh yeah. Listen I really appreciate
it. He needs the job. I don't know
what to do with him. He don't have
anybody really."
196,BILL,196,"That old man of his still livin'
over there on Clark Street I
believe."
197,WOOLRIDGE,197,"He won't have anything to do with
him. Now you say it's all right for
him to stay out here in the back?"
198,BILL,198,"Fine with me. If he steals
anything, I'll take it out of your
pocket anyway."
199,WOOLRIDGE,199,"He won't steal. I'm tellin' you
he's a pretty good ol' boy. Keeps
to himself."
200,BILL,200,"Well, I've got a roomful of work
for him to do. Can't get Scooter to
do any of it."
201,WOOLRIDGE,201,"Karl, come over here. I want you to
meet your new boss."
202,WOOLRIDGE,202,"This is Bill Cox, runs this place.
Says you can work here and stay in
the back."
203,BILL,203,"Good to know you, Karl."
204,KARL,204,Thank ye.
205,BILL,205,"Now it's minimal wage and there
ain't nothin' but a army cot and a
toilet back there."
206,WOOLRIDGE,206,"That'll be fine. Karl, I'll go to
the car and get your books."
207,BILL,207,"They say you're a whiz on fixin'
lawn mowers and things."
208,KARL,208,"I've tinkered around on 'em a
little bit."
209,BILL,209,"We order from Dairy Queen at
noontime usually. We can buy your
lunch till you get on your feet a
little."
210,KARL,210,I like them french-fried potaters.
211,BILL,211,"Yeah, me too."
212,SCOOTER,212,"They make a good double meat
burger."
213,BILL,213,"All right then, I'll see y'all
later. Karl you done a good day's
work. They right about you.
Scooter, he's gonna knock you out
of a job if you're not careful.
I'll see you tomorrow."
214,SCOOTER,214,"Wait up, I'll leave with you and
lock up."
215,BILL,215,"Karl, they's a blanket up in under
that cot and soap in the bathroom
to clean up with."
216,BILL,216,"Now there's one more thing. The way
we lock these doors at night, you
can't get out. You didn't want to
go anywhere, did you?"
217,KARL,217,I don't reckon.
218,BILL,218,"If it works out and all, maybe
we'll get you a key so you can get
out at night if you need to. See
you later."
219,BILL,219,"Scooter, did I tell about the two
old boys pissin' off the bridge?"
220,SCOOTER,220,I can't remember.
221,BILL,221,"There was these two old boys hung
their peckers off of a bridge to
piss, one old boy from California
and one old boy from Arkansas.
Old boy from California says, ""Boy
this water's cold."" Old boy from
Arkansas says ""Yeah, and it's deep
too."""
222,BILL,222,Get it? That's a goodun.
223,SCOOTER,223,"Yeah, that's a goodun. I believe
you did tell me that one before.
I've heard that a bunch. Long time
ago."
224,BILL,224,"Well, yeah it's a classic. You
know, Karl, I got to thinkin' about
it last night and it's just not
Christian of me to not let you have
a key. I mean you been in lockup so
long, you don't need me keepin' you
locked up. You need to come and go
as you please. Here, take this key,
it'll get you in and out that back
door."
225,BILL,225,Them french fries good?
226,KARL,226,"Yeah, they's good all right."
227,BILL,227,You got any money?
228,KARL,228,"They give me fifty dollars when
they turned me loose. I spent up
some of it on ridin' the bus and
eatin' french-fried potaters."
229,BILL,229,"Well, I'm gonna pay you today for
this comin' week, so you'll have
some walkin' around money. When you
get off this evenin' you better go
buy some toothpaste and cleanin' up
supplies to have back there. Some
hard candy and some magazines.
Somethin' to keep you busy at
night."
230,KARL,230,All right then.
231,BILL,231,"I'll let you off while it's still
daylight."
232,FRANK,232,"Hey there. I thought I heard
somebody on the porch. Wasn't your
name Karl?"
233,KARL,233,Yeah it is. Your name's Frank.
234,FRANK,234,Yeah. What you doin' by here?
235,KARL,235,You told me to come by.
236,FRANK,236,Did you want to play ball with us?
237,KARL,237,"I ain't no good at it. I just come
by."
238,FRANK,238,"Well, anyhow, I was just fixin' to
go see my mama down at Ben's Dollar
Store. She's workin' two till
eight."
239,KARL,239,All right then.
240,FRANK,240,"Wait a minute. You want to go with
me? You can meet my mama."
241,KARL,241,"I don't want to worry your mama
with company."
242,FRANK,242,"Aw, come on. You'll like her. She's
real nice. She'll give us somethin'
if we ask her to. Candy or
somethin'."
243,KARL,243,"I was kindly needin' to do some
tradin'. Reckon they sell
toothpaste?"
244,FRANK,244,"They sell some of everything. Come
on let's go. I won't tell her about
you bein' in the state hospital for
killin'."
245,FRANK,245,"Hey, Mama. Hey, Vaughan."
246,LINDA,246,"Hey, sweetheart. What you up to?"
247,VAUGHAN,247,"Let me guess. You want a bunch of
candy and a pop."
248,FRANK,248,Yeah.
249,VAUGHAN,249,"You're gonna rot your teeth that
way. But I bet I know what you
would like even better.
I put potted meat on special, four
cans for a dollar and they're not
moving very well. I'd sure let a
few cans go for free to the right
boy."
250,FRANK,250,"I don't like potted meat. Daddy
used to say it was made out of lips
and peckers and intestints."
251,LINDA,251,"Frank, don't talk that way. Who's
that strange lookin' man behind
you? Did he follow you in here?"
252,VAUGHAN,252,"Can I help you, sir?"
