,character,line #,line
501,DOYLE,501,"See Vaughan, you shouldn't question
a genius. Morris is a modern day
poet like in the old days."
502,MORRIS,502,"Our latest composition is as
follows: entitled:
""The Thrill"" --
""I stand on the hill
Not for a thrill
but for a breath
of a fresh kill
Never mind the man
who contemplates
doing away with license plates
He stands alone anyway
Baking the cookies of discontent
By the heat of a laundrymat vent
Leaving his soul""
(Then like in poetry I have dot dot
dot then drop down to the next line
kind of off center.)
""Leaving his soul parting waters
Under the medulla oblongata
of (then dot dot dot again)
mankind."""
503,TERENCE,503,"I don't think that's right. I
believe dot dot dot come between
medulla and oblongata or something
like that."
504,TERENCE,504,"Well it did. It wadn't before
mankind, I know that much."
505,MORRIS,505,"The dots are where I say they are.
Melody and tune. That's your trade.
You're a tunesmith Terence."
506,VAUGHAN,506,"I don't really understand the
meaning of the words."
507,DOYLE,507,"If y'all don't shut up I'm gonna go
out of my mind. And plus you're
liable to bust a spring in Karl's
head. He's already off balance."
508,TERENCE,508,"That wadn't the way you made it up
before, Morris. That's all I know."
509,RANDY,509,"We don't need fancy words, we need
to practice. We don't ever
rehearse."
510,THE JOHNSON,510,"We need some payin' gigs instead of
just messin' around on first one
patio and then another'n."
511,RANDY,511,"Morris, you should just be the
manager, you can't play nothin'
anyway."
512,DOYLE,512,"We don't have a goddamn band! Y'all
just shut the fuck up! We don't
need no practicin' or managers
cause we ain't no fuckin' band!
Morris ain't no genius and the rest
of you are just losers. Am I the
only one sane human bein' around
here? Just get the hell out of my
house and don't come back!"
513,VAUGHAN,513,"It's not your house, Doyle, it's
Linda's."
514,DOYLE,514,"I'll kill you, you fuckin' faggot!
You mind your own business. Now get
out! Now, before I get too mad to
turn back."
515,TERENCE,515,What about our instruments?
516,DOYLE,516,Now!
517,THE JOHNSON,517,"You ain't right Doyle. Somethin's
wrong with you. Nobody needs your
shit."
518,MORRIS,518,"The dots just look good on paper.
You don't sing 'em anyway. You're
showing your true Aries colors now."
519,DOYLE,519,"Get out of my goddamn face, you
fuckin' buzzard!"
520,DOYLE (CONT'D),520,"I thought I told everybody to get
out of my house. That includes
cocksuckers and retards. Get off
your asses and go."
521,LINDA,521,"This is not your house, Doyle. This
is my house and I'll say who stays
and goes. You've got a house, why
don't you go get one of your
girlfriends and go home to it."
522,DOYLE,522,"You know better than to talk like
that when I'm hurtin'. Don't make
me knock the piss out of you."
523,VAUGHAN,523,"Doyle, don't you lay one hand on
her."
524,DOYLE,524,That's funny.
525,DOYLE,525,"You go to bed and take snot nose
with you."
526,LINDA,526,"You're not stayin' here tonight. Go
get sober before you come back. I'm
tired of my child seein' this. Now
you get yourself straight or I'll
lock your ass out of my life for
good."
527,DOYLE,527,"You know what I told you, you even
think of leavin' me, I'll kill you
dead as a doornail."
528,LINDA,528,That might be better than this.
529,VAUGHAN,529,"I'm a witness. I heard you threaten
her life."
530,DOYLE,530,I thought I told you to keep out!
531,LINDA,531,Leave.
532,DOYLE,532,Don't tell me what to do.
533,LINDA,533,Leave.
534,DOYLE,534,Don't tell me what to do.
535,LINDA,535,Leave.
536,DOYLE,536,Don't tell me what to do.
537,LINDA,537,Leave.
538,DOYLE,538,Don't tell me what to do.
539,DOYLE (CONT'D),539,"Okay, I'll leave and sober up.
Everything's botherin' me, that's
all. I'm hurtin' Linda. I love you."
540,FRANK,540,I hate you!
541,DOYLE,541,"Well, I hate you, too. No I don't.
I love your mama. Nobody
understands what I go through. I'll
leave. You bunch of freaks have
fun. I'll call you tomorrow honey.
I'm sorry. You can kiss my ass,
really."
542,DOYLE,542,"You ever hit me again you little
bastard and I'll make you sorry
your daddy ever squirted your
little ass out."
543,FRANK,543,"You all right, Mama?"
544,LINDA,544,"I'm fine, honey. Let's just try and
forget about tonight."
545,FRANK,545,"We don't need to think bad
thoughts, do we Mama?"
546,LINDA,546,"No, honey, we don't."
547,LINDA,547,"I'll make some coffee and start
cleanin' up this mess. Karl, you
want some coffee, huh?"
548,KARL,548,"No, ma'am. Coffee kindly makes me
nervous when I drink it."
549,LINDA,549,"What are you doin' up again, Frank?
You need to get a little sleep."
550,FRANK,550,Did Vaughan go home?
551,LINDA,551,"Yeah, he has to go to work in a
little while. I do too."
552,FRANK,552,Did Karl go to bed?
553,LINDA,553,"I guess. He went to the garage.
Poor thing, he's probably never
seen such a crazy mess. He probably
wants to go back and live in Mr.
Cox's shop."
554,FRANK,554,I bet he don't. Karl likes me.
555,LINDA,555,I know he does.
556,FRANK,556,Mama?
557,LINDA,557,Huh?
558,FRANK,558,"Is everything gonna be all right
someday? I just stay nervous all
the time just about."
559,LINDA,559,"Yeah, honey, someday everything's
gonna be all right."
560,FRANK,560,"Doyle wouldn't really kill you,
would he?"
561,LINDA,561,"I promise we're gonna get away from
him. The time has to be right,
that's all. I'd rather him get
tired of me and leave me. Then he
wouldn't want to hurt me. He
wouldn't care then. We'll be fine.
I promise. You go to bed now."
562,LINDA,562,I love you.
563,FRANK,563,"I love you, too, Mama."
564,LINDA,564,You scared me.
565,KARL,565,I didn't aim to.
566,LINDA,566,"Want to sit down? Did you need
somethin'?"
567,KARL,567,No ma'am.
568,KARL (CONT'D),568,"Two fellers was on a bridge a
takin' a leak and one feller says
the water was cold and the other
said it was deep water. One of 'em
came from Arkansas, I believe."
569,LINDA,569,I'll be dog.
570,KARL,570,"Do you reckon you can make me some
biscuits?"
571,LINDA,571,Right now?
572,KARL,572,"Just whenever you take a notion to.
I don't aim to put you out."
573,LINDA,573,"Well, it is nearly breakfast time
anyway. I can't go to sleep. I have
to be at work in three hours. You
know how it is when you just sleep
an hour or two, you feel worse than
if you hadn't slept at all?"
574,KARL,574,Yes ma'am.
575,LINDA,575,"Well, set down and I'll make some
biscuits and gravy."
576,KARL,576,Mustard's good on 'em to me.
577,LINDA,577,Okay.
578,KARL,578,Thank ye.
579,LINDA,579,It's all right.
580,LINDA,580,"You know I was thinkin' there's
this girl that works with me. She's
real heavy, but she's cute in the
face. Well, you know, she's slow.
She's a little bit, I think. She's
not retarded, just -- it don't
matter, listen to me. I thought you
might like to meet her. Vaughan
wants to have a little supper over
at his house and we could invite
her. Would you like that?"
581,KARL,581,I wouldn't mind a havin' supper.
582,LINDA,582,"Vaughan's ""friend"" will be there,
too. He works at the funeral home.
And Frank. You know Frank likes you
a lot. He says you make him feel
calm."
583,KARL,583,"I like Frank. He's a good boy. Me
and him's made friends."
584,KARL (CONT'D),584,"Hit ain't right for me to keep from
tellin' you how come me to be put
in the state hospital."
585,LINDA,585,"That's okay. It's not really my
business. I have wondered though.
Why was it? Was it like a nervous
breakdown?"
586,KARL,586,"I killed my mother and a old boy
name Jesse Dixon. I thought they
was a-doin' wrong. I was about your
boy's age. They say I'm well now
from it."
587,LINDA,587,"Was that you? I remember that. I
was only three or four, but I
always heard about it growin' up."
588,LINDA,588,They say you're well?
589,KARL,589,Yes ma'am.
590,KARL,590,I like your garage.
591,KARL,591,"I wouldn't never hurt you or your
boy. I'd lay my hand on the Bible
and say the same thing."
592,LINDA,592,I believe you. I really do.
593,BILL,593,"How 'bout you, Jerry."
594,WOOLRIDGE,594,"How are you, Bill?"
595,BILL,595,"Doin' pretty good. Got a sick
tiller here. What's got you down
this way?"
596,WOOLRIDGE,596,"Just thought I'd check on Karl and
see if everything's working out."
597,BILL,597,"Well, he's pretty quiet. Except for
them rackets and breathin' things
he does. Ain't threatened me with a
killin' or anything."
598,BILL,598,"But boy you couldn't of been more
right about him fixin' things. That
son of a bitch is a regular Eli
Whitney on a lawnmower. Loves
french fries. Eats four larges and
don't even so much as belch. I'm
proud to have him."
599,WOOLRIDGE,599,Is him stayin' here workin' out?
600,BILL,600,"He's gone to stayin' over with that
Wheatley boy and his mama in their
garage. I think that little boy
adopted him damn near like a
mascot. But he's got a key here to
come and go as he pleases.
Everything's worked out good."
601,WOOLRIDGE,601,Can I see him?
602,BILL,602,Sure.
603,BILL (CONT'D),603,Scooter! Run get Karl for me.
604,WOOLRIDGE,604,"Are you sure you're okay staying
with that woman and boy?"
605,KARL,605,Yes sir.
606,WOOLRIDGE,606,Do they know about you?
607,KARL,607,My history.
608,WOOLRIDGE,608,Yeah.
609,KARL,609,"I told 'em about it. They know I'm
well. That Mizz Wheatley made me
some biscuits."
610,WOOLRIDGE,610,I'll be.
611,KARL,611,"That boy, he's my friend. He likes
the way I talk and I like the way
he talks."
612,WOOLRIDGE,612,"I knew you'd do all right. Well, I
just wanted to check on you. I'll
say bye to Bill and get on back."
613,BILL,613,"Karl, see if you can figure out
what's wrong with this thing. It
won't crank up and ever'thing seems
to be put together right."
614,WOOLRIDGE,614,"I'll see you, Bill."
615,BILL,615,"Okay, stop back by. Don't worry
about your boy here, he's doin'
good."
616,KARL,616,Hit ain't got no gas in it.
617,BILL,617,"See there. Thinks of the simplest
thing first."
618,ALBERT,618,"So Karl, do you intend to stay in
the lawnmower business for a while
or do you have other plans?"
619,KARL,619,I reckon.
620,VAUGHAN,620,"I think Karl is going to be a
writer or a librarian eventually.
You should see all the books he
has. He must read constantly."
621,KARL,621,"I ain't read 'em yet except two or
three of 'em. I can't understand a
lot of what I try to read. My mind,
hit wonders off to somethin' else
when I try to read."
622,ALBERT,622,"I'm the same way. Of course, in my
line of work, I stay too busy to
read.
But at least I have job security.
People may stop doing a lot of
things, but one thing is for sure,
they won't stop dying."
623,LINDA,623,"Why don't we talk about something a
little more festive."
624,VAUGHAN,624,Does everyone like the food?
625,VAUGHAN (CONT'D),625,"Good. I haven't decided yet if I'm
a good cook."
626,LINDA,626,"Hey Karl, you know what? Melinda
was voted employee of the month at
the Dollar Store last February.
Isn't that somethin'?"
627,KARL,627,"Yes ma'am, I reckon."
628,MELINDA,628,"Well, when you like pricing items
as much as I do, I guess it's just
bound to happen sooner or later."
629,VAUGHAN,629,"Karl, maybe you and Melinda might
want to take a walk or something
after dinner. It's a nice night."
630,LINDA,630,"Vaughan, don't get pushy."
631,VAUGHAN,631,I'm sorry.
632,KARL,632,"I like walkin' quite a bit from
time to time."
633,MELINDA,633,"I stay on my feet all the time at
work. I just can't find shoes
that's comfortable."
634,ALBERT,634,"Hospital shoes might be the answer.
Nurses' shoes."
635,VAUGHAN,635,"Or the kind old ladies who work in
the school cafeteria wear."
636,ALBERT,636,Same difference.
637,MELINDA,637,"I get real mean when my feet hurt.
It's the only time I don't like
checkin' out the customers, when my
feet hurt."
638,LINDA,638,"Frank, you and Karl aren't talkin'
much, you boys must really like
that food."
639,FRANK,639,"I just don't have anything to say
about shoes."
640,VAUGHAN,640,"Listen everybody, I know this may
sound corny, I've had a few glasses
of wine and that kind of makes me a
little emotional, but I'm going to
say it anyway. It just came over me
in a rush. I want you all to know
that I care about each and every
one of you at this table."
641,LINDA,641,"That's very sweet of you Vaughan.
We care about you, too. Don't we
y'all?"
642,VAUGHAN,642,"Also, Melinda, please don't tell
anybody at the store that Albert
was here tonight, okay."
643,MELINDA,643,Why?
644,VAUGHAN,644,"Well, a lot of people in town talk
and spread cruel rumors.
Unfortunately, I have to keep
certain parts of my life private."
645,MELINDA,645,"You mean about y'all bein' together
in ""that"" way?"
646,VAUGHAN,646,Yes.
647,MELINDA,647,"I think everybody at the store
knows that already. They always
talk about it. Maureen Ledbetter
told a awful story about why you
ain't allowed over at the First
Baptist Church no more."
648,LINDA,648,"Karl, why don't you and Melinda go
take a walk. It's nice out."
649,KARL,649,All right then.
650,MELINDA,650,"You walk fast, don't you?"
651,KARL,651,I reckon.
652,MELINDA,652,"These is the worst shoes I own for
walkin'. How far did you want to
go?"
653,KARL,653,"I ain't really thought about it too
much I don't reckon."
654,BILL,654,"Hey Karl, they's somebody out here
to see you. Some gal holding a nice
bouquet."
655,BILL,655,"Come on now, she wants to talk to
you. Don't just set there."
656,MELINDA,656,"Hi, Karl, I'm on lunch break. These
was on sale 'cause they're not
fresh. Two ninety-nine a bunch plus
my ten percent employee discount.
Since I didn't bring you anything
to our date last night, I thought
you'd like to have 'em."
657,KARL,657,Thank ye.
658,BILL,658,"Scooter, let's me and you go over
to Dairy Queen and pick up a few
things for lunchtime."
659,SCOOTER,659,"I can go. You don't have to. You
don't never go."
660,BILL,660,"Goddamnit, Scooter, come on. Pardon
my language, ma'am."
661,MELINDA,661,"Well, I just thought I'd give you
them. I liked walkin' with you. I
got a blister the size of a quarter
on one heel. Well, I'll see you
sometime, I guess."
662,KARL,662,A blister shore can hurt.
663,MELINDA,663,Yeah.
664,KARL,664,"Flowers is pretty. I've always
thought that."
665,MELINDA,665,"Me, too."
666,FRANK,666,"Hey Karl, you off work?"
667,KARL,667,Yeah.
668,FRANK,668,Where'd you get them flowers?
669,KARL,669,"That gal that made employee of the
month give 'em to me for awalkin'
with her."
670,FRANK,670,"I was goin' to the secret place. I
borried one of your books to take
down there. You ain't mad, are you?"
671,KARL,671,"Naw. You can look at all my books
you want to."
672,FRANK,672,It's name's A Christmas Carol.
673,KARL,673,"That's than un on Christmas I was
tellin' you about."
674,FRANK,674,You want to go with me?
675,KARL,675,Yeah.
676,FRANK,676,"I'm gettin' tired of readin' for a
while."
677,KARL,677,All right then.
678,FRANK,678,"Boy, folks sure had it rough back a
long time ago, didn't they?"
679,KARL,679,"Yeah, I reckon they did. Hit like
to tore me up when I read about
that pore little cripple boy."
680,FRANK,680,"Yeah, me too."
681,FRANK,681,"That was nice of that woman to give
you them flowers."
682,KARL,682,Hit was right thoughty of her.
683,FRANK,683,I was wantin' to ask you somethin'.
684,KARL,684,All right then.
685,FRANK,685,"You know that girl I told you
about. The one I love."
686,KARL,686,"Yeah, I recollect it."
687,FRANK,687,"Would you go see her with me? I
kind of thought I might take her
some flowers like that woman done
you."
688,KARL,688,If you want me to.
689,FRANK,689,"I ain't got no money to get 'em
with but I bet Vaughan will let me
have some of them flowers at the
store."
690,KARL,690,"I bet he will. I got a little money
if he don't. I'll get 'em for ye."
691,FRANK,691,"I usually get run off by her mama
or daddy if they're home. Reckon
why they don't like me?"
692,KARL,692,They ort to. You're a good boy.
693,FRANK,693,"Just 'cause I'm not rich don't mean
I don't love her."
694,KARL,694,Naw.
695,FRANK,695,"And I don't try to touch her. You
know, in a bad way. Foolin' around,
sex and all."
696,KARL,696,"That's real good. You ort not to if
ye ain't married to somebody. Bible
tells you that much. Hit tells some
things that don't seem right too, I
reckon. I guess a feller ort to
foller it close as he can, though."
697,KARL,697,"You don't touch yourself, do you?"
698,FRANK,698,What do you mean?
699,KARL,699,Pull on your works. Your privates.
700,FRANK,700,"Oh, jackin' off?"
701,KARL,701,"Yes sir. You ort not know that
language."
702,FRANK,702,"I didn't know till here while back
a year or two ago when I spent the
night with Ronnie Smart one time.
He said just tug on your peter and
think about your mama. I tried it,
but I felt funny thinkin' about my
mama. So, I switched over to
thinkin' about his mama and then
what he told me would happen,
happened. It sure tingles, don't
it?"
703,KARL,703,"You ort not to pull on yourself
that away."
704,FRANK,704,"I kind of like you tellin' me what
to do and not to do. Just like my
daddy. I didn't mind him tellin'
me. I hate Doyle to tell me what to
do. Mama said the only way to ever
get away from him is for him to get
away from us. That we can't leave
him or he'll try and hurt her."
705,KARL,705,He ain't no count.
706,FRANK,706,"You don't seem like a daddy. You
seem like a brother."
707,FRANK,707,"Wonder what makes you like somebody
right off when you don't even know
'em like what happened with me and
you."
708,KARL,708,I don't reckon I know.
709,FRANK,709,"And then some people you don't like
right off. It's funny."
710,FRANK,710,"You know why I want you to play
ball with me?"
711,KARL,711,Naw.
712,FRANK,712,"'Cause it's fun. It don't matter if
you ain't no good. It takes your
mind off of everything else while
you're doin' it. When you run real
fast tryin' to make a touchdown you
don't think about anything else. I
ain't no good, but my daddy always
said he was proud of me when I
threw a ball or ran with it. Did
you have any brothers and sisters
growin' up to play with?"
713,KARL,713,"I had one there for little bit. Hit
didn't get old enough to play with."
714,FRANK,714,Why not? It died?
715,KARL,715,Yeah.
716,FRANK,716,Why?
717,KARL,717,"Hit was borned a little too early
on. My mother and father made hit
come too early some way or other. I
reckon they changed their mind
about havin' another'n. I was about
six or eight year old then and they
didn't care too much for me so I
reckon they didn't need somethin'
else to worry 'em with."
718,FRANK,718,So it died when it come out?
719,KARL,719,"My daddy come to the shed out back
and got me and said throw this here
away and handed me a towel with
somethin' in it. I went for the
trash barrel there and opened up
the towel to see 'cause they was a
noise and somethin' movin' in it.
Hit was bloody-like around that
towel. Hit was a little ol' bitty
baby, no bigger than a squirrel."
720,FRANK,720,It was alive?
721,KARL,721,Yes sir. Right then it was.
722,FRANK,722,A boy or girl?
723,KARL,723,A little ol' boy.
724,FRANK,724,You threw it in a trash barrel?
725,KARL,725,"I didn't feel right about doin'
that. I takened a shoe box from
there in the shed and emptied out
some screwdrivers and nuts and
warshers from it and put the little
feller in that and buried him in
the corner of the yard there. That
seemed more proper to me, I reckon."
726,FRANK,726,"It was still alive when you buried
it?"
727,KARL,727,"I heared it cryin' a little through
that box."
728,FRANK,728,"That don't seem right. It seems
like you should have kept him alive
and took care of him if he was your
brother."
729,KARL,729,"I wadn't but six or eight. I reckon
I didn't know what to do. I didn't
know how to care for no baby. Mama
and Daddy didn't want him. They
learned me to do what they told me
to. These days I figure it might of
been best to give him right back to
the Good Lord right off the bat
anyhow."
730,FRANK,730,"That makes me feel real sad.
Couldn't you have done somethin',
Karl? I would have. I wish I would
of had him. He'd be here right now.
Livin'."
731,KARL,731,"Hits been hard thinkin' about it.
They ain't a day goes by I don't
think about it. I kindly have a
picture of it up in my head that I
see. Hit makes me sad, too. I have
bad thoughts on it. I wished they
was somethin' I could of did, too.
Shouldn't no bad things happen to
childern. All the ol' bad things
ort to be saved up for folks that's
growed up, the way I see it. I
shouldn't of told you about that. A
boy ort not hear about such things.
It just kindly come out."
732,FRANK,732,"I didn't mean to say anything bad
about you. I know you're good. You
didn't mean no harm."
733,FRANK,733,"Did you ever think about killin'
yourself on purpose like my daddy
did?"
734,KARL,734,"I've studied about it. The Bible
says not to or you end up goin' to
Hades. Some folks calls it Hell, I
call it Hades."
735,FRANK,735,"Bible says the same thing about
killin' others, too."
736,KARL,736,"Yes sir, I reckon it does."
737,FRANK,737,"I always get nervous when I hear
that doorbell. I'm okay just
walkin' over, but somethin' about
that dang doorbell. They have one
room where you can't walk on the
carpet or sit on the furniture. I
don't see much sense in havin' it."
738,HOUSEKEEPER,738,"Son, I don't know why you keep
comin' over here. You know these
folks don't want you here. They run
you off ever' time. Don't keep
doin' this to yourself. You a sweet
boy. Now go give them flowers to
somebody that'll enjoy 'em."
739,FRANK,739,"Ma'am, I really want to give them
to Karen."
740,HOUSEKEEPER,740,You his daddy?
741,KARL,741,No ma'am.
742,HOUSEKEEPER,742,"Well, whoever you are, you ought to
talk some sense into him. That
little old girl is way too fast for
him and don't wanna see him no way."
743,FRANK,743,"Will you get her for me. Please. I
really want to see her.
She'll want to see me, too, 'cause
we're not in public. Just don't
tell her folks I'm here."
744,HOUSEKEEPER,744,Okay.
745,KAREN,745,"Hey Frank. You shouldn't be coming
over here. My parents really don't
want you to."
746,FRANK,746,"I wanted to bring you some flowers.
They're pretty good ones."
747,KAREN,747,"They're from the Dollar Store. I'm
not an idiot. Besides we have a
garden full of flowers."
748,FRANK,748,"I wanted for you to meet Karl, too.
He's my new friend. But I feel like
I've always known him. I thought
you should meet him."
749,KAREN,749,"Why? Hi, Karl."
750,FRANK,750,"He's gonna be around a lot and I
hope you are too, so..."
751,KAREN,751,"Here give me the flowers, I'll do
something with them. Thank you. Now
you better go. Maybe I'll see you
down at the secret place one day in
a week or two or something. I have
a boyfriend now you know. And we're
pretty serious. He gave me a ring."
752,FRANK,752,"Can you go there with us now? Me
and Karl. We could just hang out.
Karl has some cool books."
753,KAREN,753,"Frank, I just like you as a friend.
Only at the secret place. Okay? I
can't go there now. I'll see you
later."
754,FRANK,754,But maybe just for awhile --
755,KAREN,755,"I'm closing the door now. I told
you, I'll see you later."
756,FRANK,756,"She said she'd see me later. That's
kinda good, right?"
757,KARL,757,I reckon.
758,DOYLE,758,"Well, I'll be damned, there's the
boys. I'm glad y'all came in. I
wanted to talk to y'all, too. I was
just tellin' Linda here -- Oh hell,
I'll just start over, set down you
boys."
759,DOYLE (CONT'D),759,"Well, what it is is, I just, well I
took off work early today and your
mama was good enough to do the same
so we could talk. I guess you'd say
I'm really here to apologize, which
ain't easy for me to do, about the
way I acted the other night. I was
just drunk and kinda got a little
too worked up and one thing led to
another. I care about y'all a lot,
I do. I don't mean to be so damned,
assholish I guess the word would
be. Now Karl, I don't believe I hit
you, did I? So no apology needed
there I guess, but Frank, I'm
sorry. I'm sorry I hit your mama.
I'm just jealous of her. I don't
like her life or the way she runs
it. I don't like homosexuals and
she buddies with one. I don't like
little wimpy ass kids or fuckin'
mental retards and she's got one of
each livin' with her."
760,DOYLE (CONT'D),760,"I was just kiddin'. But really I
guess people need to get along even
if they have differences."
761,DOYLE (CONT'D),761,"You see, I work construction. I
build things. Do you realize how
important that is to the world. I
have a lot of pressure on me. The
upshot is, I'm gonna spend a lot
more time over here and we're gonna
get along. Like a family should."
762,DOYLE (CONT'D),762,"I may even surprise you one day and
pop the question."
763,DOYLE (CONT'D),763,"Well, I'm goin' back to work. I
just wanted to give y'all some
little piece of happiness today."
764,DOYLE (CONT'D),764,"See you tonight honey. Karl. Be a
good boy, Frank."
765,LINDA,765,"Well, at least he's tryin'. But who
knows for how long."
766,FRANK,766,"He's lyin' Mama. He ain't gonna do
better."
767,LINDA,767,"I know honey. Just remember what I
said, we'll bide our time. You just
steer clear of him as much as you
can. Doyle's had a real hard life.
It's just about run him crazy I
think."
768,FRANK,768,"We've had a real hard life, too,
Mama."
769,LINDA,769,"You're a hell of a boy, Frank.
Someday you're gonna get all the
good things you deserve. And Karl
here's gonna get some more biscuits
tonight. What do you think about
that?"
770,KARL,770,I could shore use some. Thank ye.
771,BILL,771,"Hey there Karl, can you come unload
a generator for me?"
772,BILL,772,"Karl, lift this thing down and
carry it to the back. It's on the
blink."
773,BILL,773,"We'll have it for you in a day or
two, Walter."
774,WALTER,774,"Y'ont us to he'p you there liftin'
that?"
775,BILL,775,"Oh no, that dang Karl can lift a
bulldozier. Fix anything, too."
776,BILL,776,"He's mentally retarded, but he's a
whiz on small engines. Lord works
in mysterious ways."
