,character,line #,line
777,WALTER,777,"Hell, he didn't just make the team,
Coach says he's probably gonna
start at end on defense. He's a
chip off the old block. Ain't you,
Steve?"
778,STEVE,778,I guess so.
779,FRANK,779,What you readin'?
780,KARL,780,"Readin' on this book on how to work
carpentry. I aim to learn how to
build things out of wood one of
these times. I've always been
partial to wood buildin's and
cabinets and whatnot. These
drawin's they got here don't make
no sense to me so far."
781,KARL,781,"You seem like yore tails a'draggin'
a might. You got somethin' wrong
with ye?"
782,FRANK,782,"Seems like Doyle's wormed his way
back in. Mama said he's stayin'
over tonight and he's talkin' about
movin' in for good. We ain't ever
gonna be happy. We'll always be
nervous, won't we Karl?"
783,KARL,783,"I don't reckon I know. I ain't
found no way yet and I'm three or
four times as old as you. Might be
that's just the way folks is."
784,FRANK,784,"I feel sad about Karen Cross, too.
I just make like to myself she
loves me. I know better, though. It
just feels good to me when I
imagine it."
785,KARL,785,"Make believin' always made me feel
good too from time to time."
786,KARL (CONT'D),786,"Bill Cox is goin' to a funeral for
a Mister Turner tomorrow and a
closin' up shop early."
787,FRANK,787,Is that right?
788,KARL,788,"I'll play ball with ye. I reckon if
neither one of us is no count it
won't make no difference."
789,FRANK,789,You will? For sure?
790,KARL,790,Yeah.
791,FRANK,791,"We'll be on teams, me and you?"
792,KARL,792,Yessir.
793,FRANK,793,"Way to go, Karl. We got a
touchdown. That was a good lateral,
man. That was just like the
Wishbone."
794,KARL,794,"I dern near had me a touchdown till
them boys got a-hold of me there so
I figured I better give it off to
you. I seen you over there
follerin' me."
795,FRANK,795,"We're liable to win if we keep this
up. For somebody like you, you sure
run fast."
796,FRANK (CONT'D),796,"Come on, let's kick off to 'em."
797,FRANK,797,"I know you could of scored them
three touchdowns by yourself
instead of throwing 'em over to me."
798,KARL,798,"Them boys was tryin' to pull me
down pretty hard."
799,FRANK,799,"You're strong though. You let me
make them touchdowns so I'd feel
good. My daddy used to do that kind
of thing."
800,FRANK (CONT'D),800,"It don't matter to me about us
losin' does it to you?"
801,KARL,801,No sir.
802,FRANK,802,"It was fun, anyhow."
803,KARL,803,"I wadn't thinkin' about nothin'
else just like you told me I'd do."
804,FRANK,804,Can we play ever' Saturday?
805,KARL,805,"If I ain't too stove up. I ain't
like you. I'm old and give out."
806,KARL,806,I'm proud of ye.
807,KARL,807,I'm ye boy.
808,OLD MAN,808,I ain't got no boy.
809,KARL,809,I'm ye oldest boy name Karl.
810,OLD MAN,810,I ain't got no boy.
811,KARL,811,"They turned me aloose from the
nervous hospital. Said I was well."
812,KARL (CONT'D),812,"I got hired to work for a Mr. Cox
fixin' lawnmowers and whatnot."
813,KARL (CONT'D),813,"That grass out in the yard's all
growed up. I figured I might cut it
fer ye."
814,OLD MAN,814,"I told you, I ain't got no boy, now
get on out from here and let me be."
815,KARL,815,"I learned to read some. I've read
on the Bible quite a bit. I don't
understand all of it, but I believe
I understand a good deal of it.
Them stories Mama and you told me
ain't in there. You ort not to of
done that to ye boy."
816,KARL,816,"I've studied on killin' you. But I
don't reckon they's no reason fer
it if all you're gonna do is set
there in that chair. You'll be dead
soon enough I reckon and the
world'll be shut of ye."
817,KARL,817,"You ort not to of killed my
brother. He ort to have had a
chance to grow up. Sometimes he
would of had fun."
818,KARL,818,Little feller.
819,DOYLE,819,"What in the goddamn hell are you
doin'? It's the middle of the
night."
820,LINDA,820,"What do you want, hun?"
821,KARL,821,I want to be baptized.
822,DOYLE,822,"Baptized? Well, get baptized then.
I don't give a shit. Call a fuckin'
preacher, goddamnit! I can't
baptize you."
823,LINDA,823,"We'll go to church and get you
baptized, tomorrow's Sunday. You go
on back to bed."
824,DOYLE,824,"What are you doin' with that damn
hammer?"
825,KARL,825,"I don't rightly know. I just kindly
woke up a-holdin' it."
826,DOYLE,826,How'd your baptizin' go?
827,LINDA,827,It went real good.
828,DOYLE,828,"Well, that's good. It's about time
to eat and you know what I'm
cravin'? Some of that take out
chicken. Why don't you run get some
of it, honey, for lunch?"
829,LINDA,829,Would y'all like that?
830,FRANK,830,"Yeah, I guess."
831,KARL,831,"Yes ma'am. I like a fried chicken
leg."
832,LINDA,832,"All right, y'all gonna go with me?"
833,DOYLE,833,"Naw, hell, let them stay here with
me and do men things. There might
be some kind of ball game on we can
watch. You go on."
834,LINDA,834,I'll be back in a little bit then.
835,DOYLE,835,"I really just wanted to git your
mama out of the house for a minute
so we can have a talk. Y'all set
down."
836,DOYLE,836,"Now here's the deal. Now that I'm
gonna throw my entire life away
doin' what I want to come live here
with y'all, we have to get a few
things straight. See, Frank, me and
you mama wouldn't have any problems
if it wadn't for you. We'd never
have a bad word between us. But
since you do exist, if I'm gonna be
here as the head of the household,
we'll have to live by my rules.
And my rules are you don't speak
unless you're spoken to. Stay out
of my way and do what a regular kid
does. You're a weird little shit. I
don't get you. So wake up. Face
what they call reality. We're gonna
be a family now. And it's my
family. I'll be payin' the bills so
you got me. But I ain't your daddy.
You just treat me like I am. I'm
the boss, okay. And the other thing
is your friend Karl has to go. We
can't have a normal family with him
livin' in the garage and comin' in
the bedroom at four in the mornin'
with hammers and shit. See?"
837,FRANK,837,"Karl can stay if he wants to. Mama
said --"
838,KARL,838,Don't hit that boy no more.
839,DOYLE,839,"You shut up you, fuckin' retard.
Get your shit and get out of here."
840,DOYLE,840,"That was a wake-up slap, Frank.
Remember. Reality, like I said.
Don't forget any bit of what I said
to you and we'll be fine."
841,LINDA,841,"Where are you goin', Karl? Didn't
you want some chicken and things?"
842,KARL,842,No ma'am. I'm a'goin' off sommers.
843,LINDA,843,"Well, okay. I got you some."
844,KARL,844,"Frank, he went off, too. He ain't
gonna be in there when you get
indoors."
845,LINDA,845,Where'd he go? What's goin' on?
846,KARL,846,"He wanted to go off and play, I
reckon."
847,KARL,847,"You go in there and you and that
Doyle eat ye dinner. You don't have
to worry yourself none."
848,LINDA,848,"All right then. Well, I'll see you
later. If you see Frank, tell him
to come on back home. I don't get
to see him all day except Sundays.
He can play tomorrow."
849,KARL,849,Ma'am?
850,LINDA,850,Yeah.
851,KARL,851,"You're a good mama to that boy. You
care for him. You work hard fer him
to take care of him. You light him
up in his eyes, I've seen it. He
wouldn't know what to do without
ye."
852,LINDA,852,"Well thank you, hun. That's real
good of you to say. I wouldn't know
what to do without him either."
853,KARL,853,"You've been real good to me, too.
It ain't ever'body that'd make
biscuits in the middle of the
night. You and that boy has give me
a good feelin'."
854,LINDA,854,We sure like havin' you.
855,KARL,855,Thank ye.
856,KARL,856,"I'm just getting around to tellin'
you, but I fixed your warshin'
machine."
857,FRANK,857,"Hey, Karl. How'd you know to come
out here?"
858,KARL,858,I knowed you'd be here.
859,KARL,859,"What are you a-doin' digging with
that stob?"
860,FRANK,860,Just diggin'.
861,FRANK,861,"I ain't ever gonna be happy now.
Not with that son of a bitch movin'
in for good. I wish me and you and
Mama could just run away. But she
said he would find us wherever we
went. He's crazy. Sometimes I think
it would of been better if I wadn't
ever born."
862,KARL,862,I'm glad of it you was borned.
863,KARL,863,"I reckon I ain't gonna be there in
the garage no more."
864,FRANK,864,"You have to Karl. You have to look
out for me. You don't let that son
of a bitch run you off."
865,KARL,865,"You're just a boy. You ort not to
use that sort of language."
866,FRANK,866,"Karl, I ain't tryin' to say nothin'
bad about you, but why don't you
stop Doyle when he gets that away?
You're older than him. You're
strong, too. My daddy wouldn't let
him do that to me and Mama."
867,KARL,867,"That feller's a whole sight meaner
than me. He'd just whup the tar out
of me."
868,FRANK,868,"Yeah, I guess so. I'm real tired,
you know that. A kid my age
shouldn't be tired of things."
869,KARL,869,"I'm tired, too, Frank."
870,KARL,870,"If I ain't around no more, it don't
mean I don't care fer ye. I care
for ye a good deal. I care for you
more than anybody they is. We made
friends right off the bat."
871,FRANK,871,"I care for you, too. But you'll be
around, don't say that."
872,KARL,872,"Hit don't make no difference where
I was to be. We'll always be
friends. There ain't no way to stop
that."
873,KARL,873,I aim for you to have these books.
874,KARL,874,"Maybe you can make more sense out
of them than I can.
I made you a little old book marker
and stuck it in that book on
Christmas."
875,FRANK,875,"You don't want to give away all
your books."
876,KARL,876,I aim fer you to have 'em.
877,FRANK,877,Man. Thanks.
878,FRANK,878,"You know when you get a feelin' and
you don't know why?"
879,KARL,879,Yes sir.
880,FRANK,880,I've got a feelin' today.
881,KARL,881,Reckon what kind of a feelin'?
882,FRANK,882,"Like something different. I don't
know."
883,FRANK,883,"You're leavin' ain't you, Karl?"
884,KARL,884,"Will ye do somethin' for me if I
ast you to?"
885,FRANK,885,"You know I would. Whatever you
want."
886,KARL,886,"Don't go home tonight and stay with
that Doyle. He's got it in for ye
tonight. I got me a feelin', too.
Feels like to me you ort not be
there in that house with him
liquored up and mean. Ye mama
neither. When you get up from here,
I want you to go to that feller's
house. Your mama's friend. I want
you to give me your word on it."
887,FRANK,887,"Okay. I give you my word. Is
ever'thing gonna be okay? Are you
all right?"
888,KARL,888,"Ever'thing's okay, boy. I kindly
want to put my arm around ye for a
minute and then I'm gonna go on and
leave here."
889,FRANK,889,Okay.
890,FRANK (CONT'D),890,Karl!
891,VAUGHAN,891,"Karl, what are you doing here? Come
in."
892,KARL,892,"I ain't a-stayin'. I need to ast
you fer a favor."
893,VAUGHAN,893,Okay.
894,KARL,894,"This evenin' I want you to go get
Mizz Wheatley and that Frank and
have them stay with you tonight."
895,VAUGHAN,895,What's wrong? Is everything okay?
896,KARL,896,"That dern Doyle is in a bad way
again with that drinkin' and bein'
mean to folks. Will you give me
your word you'll do it?"
897,VAUGHAN,897,"Well, sure, okay. He hasn't hurt
them, has he?"
898,KARL,898,"Naw, not yet."
899,KARL,899,"I want ye to give this to Mizz
Wheatley. Hit ain't much, but maybe
there's a little somethin' to hep
out. Hits what I've earned fixin'
lawnmowers and whatnot fer Bill
Cox."
900,VAUGHAN,900,"What about you, Karl? Do you want
to stay here?"
901,KARL,901,"I don't reckon you have to go with
women to be a daddy to a boy."
902,KARL,902,"You've been real square dealin'
with me. The Bible says two men ort
not lay together. But I'll bet you
the Good Lord wouldn't send nobody
like you to Hades. Some folks calls
it Hell, I call it Hades."
903,KARL,903,"That boy lives inside of his own
heart. Hits an awful big place. You
take care of that boy."
904,DOYLE,904,"Where's ever'body else? You seen
'em?"
905,DOYLE,905,"I thought I told you to get the
hell moved out of here anyway."
906,KARL,906,"How does a feller go about gettin'
ahold of the police?"
907,DOYLE (CONT'D),907,"Pick up the fuckin' phone and call
'em, I guess."
908,KARL,908,What numbers do you punch?
909,DOYLE,909,"I told you to get away from here,
didn't I? I'm tryin' to relax and
look at TV."
910,DOYLE,910,"What are you doin' with that piece
of iron? I swear to God you're the
weirdest son of a bitch I ever
heard of."
911,KARL,911,I aim to kill you with it.
912,DOYLE,912,"Yeah, okay. Well, to get the police
you push 911. You'll need to tell
'em to send an ambulance, too. Or a
hearse. You fuckin' idiot. You're
gonna kill me."
913,DOYLE (O.S.),913,Oh God! Oh God!
914,KARL,914,"Yes ma'am. I need the police over
here at the Wheatley house."
915,KARL,915,"I've killed somebody with a mower
blade."
916,KARL,916,"Yes ma'am, I'm right sure of it. I
hit him two good whacks. That
second time just plumb near cut his
head in two."
917,KARL,917,"Hits a little old yeller house
right on the corner of Marigold
Street and some other street.
They's a red pickup truck out front
says DOYLE HARGRAVES CONSTRUCTION
on it. I'll be a settin' here
waitin' on ye. Beside sendin' the
police, Doyle said you might want
to send a ambulance or a hearse.
Thank ye."
918,CHARLES,918,"... on the third day I washed her.
She wasn't very clean. I got all
the right spots. She was the first
one I ever kept for any length of
time, you see I get bored easily, I
have a short attention span. I
can't say she enjoyed her stay,
although the washcloth in her mouth
held in place by good duct tape
kept any complaints to a minimum. I
don't really like people who talk a
lot. I like to do the talking. I
guess that's why I'm so fond of
you. You're so easygoing, although
I do sense a little tension in you
sometimes. By the way, how was it
out there? Did you have any fun?
Make any new acquaintances? Tell me
what it was like."
919,KARL,919,They was a boy. We made friends.
920,CHARLES,920,"I bet you did. I was never bent
that way. I'm bent the other way.
So, you liked it out there in the
world."
921,KARL,921,It's too big.
922,CHARLES,922,"Well, it's not too big in here, is
it?"
923,CHARLES,923,"I feel very generous today. I feel
like listening. I'm sure you have
plenty to tell me. And please bore
me with the details."
924,CHARLES,924,"Come on Karl, who did you kill? Was
it the boy?"
925,KARL,925,Don't say nothin' about that boy.
926,KARL,926,"Fact the bidness, don't you say
another word to me. I ain't
listenin' to you no more."
