,character,line #,line
253,FRANK,253,"Oh, that's Karl. I met him at the
laundrymat. Karl, this is my mama.
And Vaughan, Vaughan's the manager.
He lets mama off any time she feels
like it 'cause they're best
friends."
254,LINDA,254,"Nice to meet you, Karl."
255,KARL,255,Pleased to know y'all.
256,LINDA,256,"Frank come back here with me for a
minute."
257,VAUGHAN,257,"I don't think I've ever seen you
before."
258,KARL,258,"Naw, I don't believe you have. I
don't reckon I never been in here.
This store didn't used to be here."
259,VAUGHAN,259,"It's been here seventeen years. Did
you live here before or something?"
260,KARL,260,"I's horned and raised here up till
I's twelve year old."
261,VAUGHAN,261,What brings you back?
262,KARL,262,What's that you say?
263,VAUGHAN,263,Why are you here now?
264,KARL,264,"They turned me loose from the state
hospital."
265,VAUGHAN,265,Is that right?
266,VAUGHAN,266,"Are you going to be staying here
long?"
267,KARL,267,"I reckon Mr. Woolridge got me hired
on to work for Bill Cox's outfit."
268,VAUGHAN,268,Do you have family here?
269,KARL,269,Not really to speak of.
270,FRANK,270,"Hey Karl, guess what. Mama said you
can stay with us. Out in the
garage. Our car won't fit in there
anyway. It's real neat."
271,LINDA,271,"Frank told me about your situation.
And Frank loves company. You know,
especially after his daddy passed
and all. There ain't no sense in
you stayin' in that old greasy
shop."
272,LINDA,272,"He's mentally retarded, poor thing."
273,VAUGHAN,273,"He just got out of the state
hospital."
274,LINDA,274,I know.
275,FRANK,275,Can we get some candy and pops?
276,VAUGHAN,276,"Sure, go ahead."
277,VAUGHAN (CONT'D),277,"Are you sure it's safe to let him
around that guy?"
278,LINDA,278,"Frank's just crazy about him. He
likes the way he talks. He helped
him carry home the clean laundry."
279,VAUGHAN,279,"He's been in the state hospital a
long time, something must be wrong
with him."
280,LINDA,280,"He's retarded's all. You know he's
always after a father figure and
Lord knows Doyle ain't a good one
with his mean ass."
281,VAUGHAN,281,What about me?
282,LINDA,282,"I don't think he sees you as a guy
guy."
283,VAUGHAN,283,Karl is a guy guy?
284,FRANK,284,"This is what I call my secret place
'cause I come out here when I feel
like bein' by myself. I used to
come here with Karen Cross. She's
kind of like my girlfriend, or used
to be. She says she likes Jerry
Maroney now. But I'm gonna get her
back 'cause I love her. We used to
come here and hold hands and talk
and read books to each other with a
flashlight. She didn't want to have
anything to do with me in front of
other people 'cause I don't have
any money. Well, mama and me, I
mean. She seemed to like me a whole
lot when we were out here though.
She said she loved me, too. Out
here. Settin' right on that stump
you're on. See, her daddy's a
dentist so they're rich. So's Jerry
Maroney's daddy. He owns the ice
plant. Was your folks well off?"
285,KARL,285,"Naw. Didn't have too much. Enough
to scrape by on, I reckon."
286,FRANK,286,"They still around, your folks?"
287,KARL,287,"My mother's dead. My daddy's
s'posed to be around still. He
don't want to have nothin' to do
with me though."
288,FRANK,288,How do you know?
289,KARL,289,"He never did want to. I figure he
ain't changed his mind much."
290,FRANK,290,How did your mama die?
291,KARL,291,"You don't need to know all of that.
You're just a boy.
You need to think about good
thoughts while you're still a boy.
They'll be plenty of time for the
other."
292,FRANK,292,"I've had a lot of bad thoughts
since my daddy died. Sometimes I
wish I was still real little and he
was still here. My mama's real
good, but I wish I had both of 'em."
293,FRANK,293,"When we went to Memphis one time in
the car, it was rainin' so hard we
couldn't see the road. But I wadn't
scared because I thought as long as
daddy was drivin' nothin' could
happen to us. I feel that way about
mama now."
294,FRANK,294,"Mama has a boyfriend now. His name
is Doyle Hargraves. He works
construction so he makes a pretty
good livin'. He still don't help
mama out with any money though. He
ain't no good. He's mean to her. He
don't like me at all. Mama says
it's because he's jealous I belong
to my daddy instead of him. He
stays with us all night sometimes,
but he's got his own house.
Somebody told me it's so he can
still have other girlfriends. I
like it on the nights when he ain't
at our house. I'm not so nervous
then."
295,KARL,295,"How come her to keep bein'
girlfriends and all with him if
he's mean to her?"
296,FRANK,296,"She says it's for the times when
he's good to her. She's lonely
since daddy died. She said
sometimes she don't know why."
297,FRANK,297,"He threatened to kill her if she
ever left him. My daddy would kill
him if he was here and somebody was
mean to mama. Vaughan, he's real
good to mama. Vaughan that you met.
But he's not able to do anything to
Doyle, he's funny you know. Not
funny ha, ha, funny queer. He likes
to go with men instead of women.
That makes him not to be able to
fight too good. He sure is nice
though. He's from St. Louis. People
who are queer can get along better
in a big town. He got transferred
here to work. But mama said the
real reason he left is 'cause his
daddy hated him. For bein' the way
he is. I wish he liked to go with
women. I'd rather him be mama's
boyfriend than Doyle."
298,FRANK (CONT'D),298,Karl.
299,FRANK (CONT'D),299,"You know when I said daddy got hit
by a train."
300,KARL,300,"Yeah, I remember you a-tellin' me
that."
301,FRANK,301,"It ain't the truth. He shot hisself
with a shotgun on purpose."
302,KARL,302,"Why did he do that, reckon."
303,FRANK,303,"'Cause he didn't have enough money
to take care of us the way he
wanted to. That's what the letter
said. He got laid off from work and
had to just work odd jobs. I
thought he took care of us fine."
304,FRANK,304,"Karl, did you really kill somebody?"
305,KARL,305,"Yeah, I did."
306,FRANK,306,Who did you kill?
307,KARL,307,Two people.
308,FRANK,308,Were they bad people?
309,KARL,309,I thought they was.
310,FRANK,310,Maybe they needed it.
311,KARL,311,"I growed up and got taught it ain't
right to kill nobody."
312,FRANK,312,"It's okay if you're lookin' out for
yourself. If it's self-defense. Was
it self-defense?"
313,FRANK (CONT'D),313,"My daddy was good. I think too many
good people die. It ain't right.
That's what I think."
314,BILL,314,"Now, Karl, you sure you want to go
stay with these folks? You're
welcome to keep on stayin here.
It's workin' out real good."
315,KARL,315,That boy wants me to.
316,BILL,316,"All right then. I'll see you bright
and early. How you comin' along on
that garden tiller?"
317,KARL,317,"I fixed it. Hit's a workin' pretty
good."
318,BILL,318,"You done fixed it? I'll be damned.
Scooter told me it couldn't be
fixed.
'Course Scooter's about as shitless
as one poor son-of-a-bitch can be.
You done fixed it. I'll just be
damned. See you tomorrow."
319,DOYLE,319,"Well, honey, I don't guess I give a
shit. I ain't here half the time
anyway. If you want a retard livin'
in the garage, I don't guess I
care. I've got a good tool box and
socket set out there I don't want
stol'd. I guess I could take it
home with me."
320,FRANK,320,"He's real honest. He wouldn't steal
nothin'."
321,DOYLE,321,"Now son, I wadn't talkin' to you,
was I?"
322,DOYLE,322,Was I?
323,FRANK,323,No sir.
324,DOYLE,324,"No sir's right. I'm talkin' to your
mama. This is your mama's decision,
not yours. I'm lettin' it go on
because she asked me, not you."
325,DOYLE,325,"Now is this the kind of retard that
drools and rubs shit in his hair
and all that, 'cause I have trouble
eatin' around that kind of thing.
Just like I am about antique
furniture and midgets. I can't so
much as drink a glass of water
around a midget or a piece of
antique furniture. Same thing with
a droolin' retard."
326,LINDA,326,"Doyle, you're awful. You shouldn't
be that way."
327,DOYLE,327,"I ain't sayin' it's right. I'm just
tellin' the truth. What was he in
the nuthouse for?"
328,LINDA,328,"He's just mentally retarded, I
guess."
329,DOYLE,329,"He had of went nuts and did
somethin'. They don't put you in
there for just bein' a retard.
They's retards all over the place
that ain't in the nuthouse. Do you
know, Frank?"
330,FRANK,330,I ain't sure.
331,DOYLE,331,"You might want to find out. He
might of hacked his family to
pieces with a hatchet or somethin'."
332,LINDA,332,"Yeah, that's right, Frank, you
better ask him. I mean, don't hurt
his feelin's or anything, but it
would be good to know. I'm sure
it's nothin'. He seems real sweet."
333,DOYLE,333,"You sure are hung up on people
bein' sweet."
334,DOYLE,334,"Speakin' of which, where's your
girlfriend? I thought he was comin'
by here for something."
335,LINDA,335,"He'll be here in a little while,
he's takin' me to get an ice cream."
336,DOYLE,336,"Ain't that the sweetest thing. What
am I supposed to do about supper
with you traipsin' around with that
fag?"
337,LINDA,337,"You're not crippled. Get in there
and make somethin'."
338,DOYLE,338,"Boy, ain't you somethin' else.
Talkin' back and everything. It
kinda makes me horny when you talk
back."
339,LINDA,339,"Frank, why don't you go off and
play in your room if Doyle's gonna
talk nasty."
340,FRANK,340,I want to watch T.V.
341,DOYLE,341,"Yeah, honey, let the kid watch T.V.
Hell, let's all watch T.V. like a
family till your retarded friend
and your homosexual friend gets
here."
342,VAUGHAN,342,Karl?
343,KARL,343,Yes sir.
344,VAUGHAN,344,"So, you're really going to stay
here?"
345,KARL,345,That boy wants me to.
346,VAUGHAN,346,Did you knock on the door yet?
347,KARL,347,"Naw, I ain't."
348,VAUGHAN,348,"How long have you been standing
here?"
349,KARL,349,"Quite a spell, I reckon."
350,VAUGHAN,350,"Listen, before you get very used to
staying here, I think you and I
need to talk about a few things.
Can I take you to lunch?"
351,KARL,351,I done et just a little bit ago.
352,VAUGHAN,352,I mean tomorrow or the next day.
353,KARL,353,"I reckon I can stand to eat a
little somethin' or 'nother at
noontime tomorrow. Bill Cox
generally gets me a box of french
fried potaters. But I reckon he can
lay off doin' it tomorrow."
354,VAUGHAN,354,"Okay, I'll come by Mr. Cox's and
get you at noon."
355,FRANK,355,Hey. Y'all come on in.
356,LINDA,356,"Hey, Vaughan. How are you, Karl?"
357,KARL,357,"Tolerable, I reckon."
358,LINDA,358,"Karl, this is my boyfriend, Doyle.
Frank, why don't you and Karl go
out in the garage and fix him up a
place or play a game or somethin'.
Vaughan, you ready to go?"
359,VAUGHAN,359,"Sure, I guess."
360,DOYLE,360,"Don't rush ever'body, honey."
361,LINDA,361,"Maybe you and Karl want to go with
us?"
362,FRANK,362,"Naw, I don't want to. Me and Karl
got things we need to do."
363,DOYLE,363,"Hey, Vaughan, you know what I
heard? I heard you been puttin' it
to Albert Sellers that works over
at the funeral home."
364,VAUGHAN,364,I know Albert. We're friends.
365,DOYLE,365,"I heard you was more than friends.
I heard Dick Rivers caught y'all
all bowed up and goin' at it in the
same room with poor, little, old
Mizz Ogletree and her dead as a
doornail layed out on a gurney."
366,VAUGHAN,366,"That's ridiculous. That's just a
total lie."
367,LINDA,367,"Let's go, Vaughan."
368,LINDA,368,"Frank, we'll be back in a little
while. I'll bring you back
somethin'. You're food's in the
oven warmin' over."
369,DOYLE,369,"See, you made him somethin'. Hey
Vaughan, I was just goin' on with
you, jokin' around, buddy."
370,VAUGHAN,370,"Yeah, I knew that. You're a card
all right."
371,DOYLE,371,"So, Karl, come have a seat, talk to
me."
372,FRANK,372,"Come on, Karl, let's go out to the
garage."
373,DOYLE,373,"Goddamnit, I'm talkin' to the man.
You set right there, Karl."
374,DOYLE (CONT'D),374,What's in your bag?
375,KARL,375,"This and that. Toothpaste and
whatnot."
376,DOYLE,376,What's all them books?
377,KARL,377,"Different ones. The Bible's one of
'em."
378,DOYLE,378,You believe in the Bible?
379,KARL,379,"A good deal of it, I reckon. Can't
understand all of it."
380,DOYLE,380,"Well, I can't understand none of
it. This one begat this one and
that one begat this one and begat
and begat and begat and lo somebody
sayeth some shit or another. Just
how retarded are you?"
381,FRANK,381,"Stop it, Doyle!"
382,DOYLE,382,"You be quiet, Frank, we're talkin'.
The adults are talkin'. Were you in
the lockup for cuttin' somebody up
with a hatchet?"
383,KARL,383,"I ain't never used no hatchet that
I remember."
384,DOYLE,384,"You're just crazy in a retarded
kind of way then."
385,DOYLE,385,"It wouldn't matter to me if you did
do violence on somebody 'cause I
ain't afraid of shit. You think I'm
afraid for you to stay here. You're
just a humped over retard it looks
like to me. Not really, I'm just
jokin' with you. Welcome to our
humble home, buddy. Frank needs all
the friends he can get. Frank's a
real weak little kid. His daddy
taught him how to be a pussy."
386,FRANK,386,"Stop it, Doyle! Don't talk about
daddy, you hear me!"
387,DOYLE,387,"Don't talk about daddy. Y'all go on
to the garage and let me be."
388,FRANK,388,"Come on, Karl."
389,DOYLE,389,"Don't tell your mama we had a
little spat. She don't need to be
worried with your ass."
390,FRANK,390,"I'd like to kill that son of a
bitch. I hate him."
391,KARL,391,"You ort not to talk that way.
You're just a boy."
392,FRANK,392,"Well, I hate him."
393,KARL,393,"He ort not to talk that away to you
neither. He ain't no count. He's
mean to you and your mama."
394,KARL,394,"Yore mama and that feller that's
carryin' me to get somethin'
d'eat's gonna be back here
directly."
395,FRANK,395,"Will you stay here with us for a
long time?"
396,KARL,396,I reckon if you want me to.
397,KARL,397,"I got some of that potted meat and
sodie crackers left over if you
want some."
398,FRANK,398,"I don't see how you can eat that
stuff with all those insides it's
made out of."
399,KARL,399,"I reckon it tastes pretty good to
me."
400,FRANK,400,I like the way you talk.
401,KARL,401,I like the way you talk.
402,VAUGHAN,402,"Okay, Karl, the reason I brought
you here was to talk to you about
something that is on my mind."
403,VAUGHAN,403,"I guess I'll put it right out on
the table. Where do I start. Linda
and Frank are very important to me.
They're like family. My own family
was never like family. They're
horrible people. As a matter of
fact I prayed every night for years
that my father would die. I finally
realized through a lot of therapy
that I was wasting my energy on
hating him. Now I just don't care."
404,VAUGHAN,404,"You see, you and I are a lot alike,
strange as that may seem. I mean
not physically or even mentally
really, just well, maybe
emotionally or actually the hand
we've been dealt in life. We're
different. People see us as being
different anyway. You're -- well
you have your affliction or
whatever and I, well mine's not as
easy to see. I'm just going to say
it. I'm gay."
405,VAUGHAN,405,Does that surprise you?
406,VAUGHAN,406,"That I'm gay. You know what being
gay is, don't you?"
407,KARL,407,I reckon not.
408,VAUGHAN,408,Homosexual. I like men. Sexually.
409,KARL,409,"Not funny, ha, ha, funny queer."
410,VAUGHAN,410,"Well that's a very offensive way to
put it. You shouldn't say that. You
were taught that, weren't you?"
411,KARL,411,I've heard it said that way.
412,VAUGHAN,412,"Anyway, it's hard to live gay,
that's the right way to say it, in
a small town like this. I've wanted
to leave many times, but my love
for Linda and Frank and another
certain person that we won't go
into have kept me from it. Anyway,
I'm rambling. If you're going to
live in the Wheatly garage you need
to know that it won't be easy.
Doyle is a monster. Not just a
closed minded redneck, but a
monster. A dangerous person. I've
told Linda that one day that man is
going to really hurt her or that
boy. Maybe even kill one of them. I
see it in his eyes. I'm very in
tune, maybe even psychic. Doyle
will make your life hell. You're a
perfect target. When I first saw
you I was afraid of you. Not really
afraid, I guess, just taken aback.
But also, I felt a real sensitive
feeling from you. And for some
reason, Frank has adopted you. Much
like a stray animal. I'm sorry, I
didn't mean it like that. In a good
way. Anyway, I just want you to
know what you're in for. I have a
good feeling about you. You're good
for Frank. Maybe it's that he can
have an adult friend on a child's
level.
I'm sorry, I didn't mean it in a
bad way."
413,VAUGHAN,413,"There's one more thing. It's none
of my business why you were in the
state hospital. Everyone has
something in their past, maybe you
tried suicide, maybe you did
something -- terrible. But what I
see before me is a gentle, simple
man. All I want you to promise me
is that you're capable of being
around Linda and Frank. You know.
You would never hurt them under any
circumstances, would you?"
414,KARL,414,I wouldn't never hurt them.
415,VAUGHAN,415,"That's what I thought. I hope I
haven't offended you in any way.
You seem like a thinker. You seem
to always be in deep thought. Tell
me something. What are you thinking
right now?"
416,KARL,416,"I was thinkin' I could use me
another helpin' of these potaters."
417,VAUGHAN,417,Oh. How about before that?
418,KARL,418,"Before that I was thinkin' it'd be
good if I could get another three
or four cans of that potted meat if
you got any extry."
419,LINDA,419,"How come Karl won't eat here with
us?"
420,FRANK,420,"I don't know. He just said he'd eat
out there."
421,DOYLE,421,"Well, I wouldn't let it get to you."
422,LINDA,422,"I just feel sorry for the poor
thing."
423,DOYLE,423,"Who could eat with him settin'
there makin' that goddamn racket
with his throat."
424,LINDA,424,He does make some funny noises.
425,FRANK,425,"I sure like the way he talks. It
sounds like a race car motor
idlin'. It makes me not be nervous."
426,LINDA,426,"I'm glad of it, honey."
427,DOYLE,427,"What have you got to be nervous
about? You're a damn kid. You ain't
got any bills to pay or bidness to
run or old lady to stay on your ass
all the time."
428,FRANK,428,"I get nervous, that's all I know."
429,DOYLE,429,"You know what, by God?"
430,LINDA,430,What?
431,DOYLE,431,"You know what we ought to do
tonight?"
432,LINDA,432,"Please Doyle, don't."
433,DOYLE,433,"Have a damn party! Call Morris and
them and get the band together and
just party our asses off. I'd like
to show that fuckin' Karl to the
guys. They'd get a kick out of
that. Don't you know they would."
434,LINDA,434,"Please don't. Not tonight. I'm not
up for it. They always stay till
mornin'. I'm just give out, Doyle."
435,DOYLE,435,"You don't have to do anything but
pour some potato chips in a bowl
and bring beers out when we get
low."
436,FRANK,436,"Last time you got mad and run
Morris and them off and said to
stay away from here."
437,DOYLE,437,"That ain't none of your damn
bidness. Besides that's the way
friends do one another. Fuck it,
I'm gonna go call 'em. Honey, find
my guitar, I think it's out there
in the garage with that loony tune."
438,LINDA,438,"Karl, now listen, there's gonna be
a party tonight here at the house.
Doyle's invited his music-playin'
buddies over to make a bunch of
racket out on the patio."
439,FRANK,439,"They ain't even no good. The only
one can play is Randy
Horsefeathers. He claims he's an
Indian. His real name's Randy
Collins and he works at the feed
mill. He can at least play guitar."
440,LINDA,440,"He's no more an Indian than I am
though. Anyhow, Doyle's gonna try
and tease you and be mean to you to
show off to his friends. Just like
he does to Frank and me sometimes.
You just ignore it. Or stay out
here away from 'em if he'll let
you. He's an okay guy till he gets
drunk but tonight he'll get drunk.
I guarantee it."
441,FRANK,441,He ain't ever okay to me.
442,DOYLE,442,"Well, it's on! We're gonna rock.
Linda, call Vaughan. Tell him to
get over here. I'd like him to be
here. I owe him a good time."
443,LINDA,443,"No Doyle. Vaughan don't want to
come to a party with you."
444,DOYLE,444,"Too late, Honey. Fooled you. Done
called him. He'll be here."
445,DOYLE,445,"Or I'll go get him. Come on Karl, I
need you to help me ice down a tub
of beer, you and Frank."
446,DOYLE,446,Okay ladies and gentlemen
447,DOYLE,447,"or both. It's come to the time in
our show when we like to introduce
the band. Over here on lead guitar
Mr. Randy Horsefeathers. Come on
hit a hot lick, Randy."
448,DOYLE,448,"Well, come on, y'all are supposed
to clap now. Come on!"
449,LINDA,449,"Karl, you better clap your hands or
he'll just keep on."
450,DOYLE,450,"On the bass, give it up for Terence
""One Ball"" Atkins."
451,DOYLE,451,"On the tambourine and lyrics Morris
Hobbs the fuckin' genius of the
group."
452,DOYLE,452,"On drums ""The Johnson."""
453,DOYLE,453,"And last and most importantly,
Doyle Hargraves on rhythm guitar
and business affairs and the only
motherfucker with a truck big
enough to haul this outfit on the
next world fuckin' tour. Come on, a
big hand for these guys. They're
workin' their asses off here."
454,DOYLE,454,"Okay I'd like to dedicate this next
one to some very special people in
our audience tonight. To my lovely
female companion Linda, her lovely
son Frank, our new boarder Karl -
what's your last name Karl?"
455,KARL,455,Childers.
456,DOYLE,456,"Karl Childers just in from the
state facility. Make one of them
gruntin' sounds Karl or whatever it
is you do."
457,DOYLE,457,"Oh well, Karl's a little retarded,
he don't know what the hell I'm
talkin' about. And to Vaughan who
fucks a mortician in the rear
entrance right in front of his
clients. Now that takes balls. Our
number one tune for the folks,
boys. Kick it off Johnson!"
458,DOYLE (CONT'D),458,You like that Vaughan?
459,VAUGHAN,459,"Sure. It sounded like a number one
tune all right."
460,DOYLE,460,"You enjoying yourself, Karl?"
461,KARL,461,I reckon.
462,VOICE (O.S.),462,"I wished you all would lay off for
tonight. I can't hear myself think
for that racket. It's nighttime,
now let folks be! I'll call the
law!"
463,DOYLE,463,"I told you already three times, the
laws on my side. I play cards with
J.D. Shelnutt, chief' of police.
Get fucked you old bastard!"
464,DOYLE,464,"Okay now, Linda, you and the kid
clean up and get a tarpaulin over
this instruments. Me and the boys
are goin' to the county line.
We're out of liquor and beer. Come
on Karl, you and Vaughan are goin'
with us."
465,VAUGHAN,465,"I'd better go on home now, it's
late. I have to work tomorrow."
466,DOYLE,466,"Come on, don't be a pussy.
Everybody has to work."
467,LINDA,467,"He don't want to Doyle. Don't go
Vaughan if you don't want to.
You'll wreck Doyle, you're drunk."
468,DOYLE,468,"But honey, I'll be good. I promise.
I love you sweetie. I'm just tryin'
to help these two be part of
things."
469,VAUGHAN,469,"Are you sure you can drive? You've
really had a lot of alcohol."
470,DOYLE,470,Shhhh! This is the national anthem.
471,DOYLE,471,"Not that you afflicted sons of
bitches would know anything about
it, but this is art."
472,DOYLE (CONT'D),472,"Hey Freddy, what's goin' on boy. I
seen your pitcher in the paper for
catchin' that big-ass bass."
473,FREDDY,473,"Yeah She was a big 'un. You ain't
drunk drivin' are you Doyle?"
474,DOYLE,474,Yeah.
475,FREDDY,475,"I figured that. Well you better be
careful with that cripple in the
back. You'll throw him out. Looks
like you got a wagonful."
476,DOYLE,476,"We run outta somethin' to drink.
Goin' to the county line. You want
to race?"
477,FREDDY,477,"You know better than that. We're on
duty. Catch me in that Camaro next
week one night."
478,DOYLE,478,Catch you later Freddy!
479,DOYLE (CONT'D),479,"I bet you like sittin' between two
men in a dual wheel truck don't
you?"
480,VAUGHAN,480,"Oh, yeah, I'm thrilled."
481,DOYLE,481,Sarcastic right?
482,DOYLE,482,"You know the boys in the band are
probably gonna stay over tonight.
We'd be glad to have you."
483,MORRIS,483,"Anyhow I'm not sure if you follow
me on those particular points, but
it's not really important in the
smaller picture, which is where
most people dwell anyway. Not that
being manager of Ben's Dollar Store
is insignificant. Or that making it
through years of incarceration in a
state supported facility is any
small feat."
484,THE JOHNSON,484,"Morris, he's the only one in the
band that went to college."
485,RANDY,485,"I'm in junior college right now
over in Westfield."
486,THE JOHNSON,486,"That ain't no college, that's trade
school. Auto repair ain't ever made
a genius out of nobody."
487,MORRIS,487,Holidays are for campers.
488,RANDY,488,"What do you know about bein' a
genius, Johnson. You can't even
hardly keep a steady beat on that
high-price drum set."
489,TERENCE,489,"I think y'all play really tight
together, Randy. Y'all shouldn't
throw off on one another."
490,MORRIS,490,"Anything that has to be discussed
can't mean anything."
491,DOYLE,491,You got that shit right.
492,VAUGHAN,492,"What exactly do you mean by that? I
don't understand."
493,MORRIS,493,"Exactly the point, my young
levelheaded friend."
494,VAUGHAN,494,I don't get it.
495,MORRIS,495,I rest my case.
496,TERENCE,496,"Morris is real smart with
philosophies and things. That's why
him and me are the songwriting team
of our group. I make up good tunes
or melodies as we call them and
Morris is the lyrics."
497,MORRIS,497,"Not unlike Gary Brooker of the
Protocol Harum."
498,RANDY,498,"We don't ever play any songs that
y'all wrote. I never even heard one
of 'em. Y'all just talk."
499,THE JOHNSON,499,"We don't even play any songs with
words at all that I remember. We
ain't got no fuckin' microphone. Or
speaker set up."
500,TERENCE,500,"We wrote one last night standin'
outside Mini-Mart. Morris called it
""Stuart Drives a Comfortable Car.""
Then, you know, like on country
songs in parenthesis it says ""There
is usually someone in the trunk."" I
came up with a tune just humming."
