,character,line #,line
610,HAN,610,"Uh, uh, negative. We had a reactor
leak here now. Give us a few minutes
to lock it down. Large leak... very
dangerous."
611,INTERCOM VOICE,611,"Who is this? What's your operating
number?"
612,HAN,612,Boring conversation anyway.
613,HAN,613,Luke! We're going to have company!
614,LEIA,614,"Aren't you a little short to be a
stormtrooper?"
615,LUKE,615,"What? Oh... the uniform. I'm Luke
Skywalker. I'm here to rescue you."
616,LEIA,616,You're who?
617,LUKE,617,"I'm here to rescue you. I've got
your R2 unit. I'm here with Ben
Kenobi."
618,LEIA,618,Ben Kenobi is here! Where is he?
619,LUKE,619,Come on!
620,VADER,620,He is here...
621,TARKIN,621,"Obi-Wan Kenobi! What makes you think
so?"
622,VADER,622,"A tremor in the Force. The last time
I felt it was in the presence of my
old master."
623,TARKIN,623,Surely he must be dead by now.
624,VADER,624,"Don't underestimate the power of the
Force."
625,TARKIN,625,"The Jedi are extinct, their fire has
gone out of the universe. You, my
friend, are all that's left of their
religion."
626,TARKIN,626,Yes.
627,INTERCOM VOICE,627,"Governor Tarkin, we have an emergency
alert in detention block A A-twenty-
three."
628,TARKIN,628,"The princess! Put all sections on
alert!"
629,VADER,629,"Obi-Wan is here. The Force is with
him."
630,TARKIN,630,"If you're right, he must not be
allowed to escape."
631,VADER,631,"Escape is not his plan. I must face
him alone."
632,HAN,632,Chewie!
633,HAN,633,Get behind me! Get behind me!
634,HAN,634,Can't get out that way.
635,LEIA,635,"Looks like you managed to cut off
our only escape route."
636,HAN,636,"Maybe you'd like it back in your
cell, Your Highness."
637,LUKE,637,See-Threepio! See-Threepio!
638,THREEPIO,638,Yes sir?
639,LUKE,639,"We've been cut off! Are there any
other ways out of the cell bay?...
What was that? I didn't copy!"
640,THREEPIO,640,"I said, all systems have been alerted
to your presence, sir. The main
entrance seems to be the only way in
or out; all other information on
your level is restricted."
641,TROOPER VOICE,641,Open up in there!
642,THREEPIO,642,"Oh, no!"
643,LUKE,643,There isn't any other way out.
644,HAN,644,"I can't hold them off forever! Now
what?"
645,LEIA,645,"This is some rescue. When you came
in here, didn't you have a plan for
getting out?"
646,HAN,646,"He's the brains, sweetheart."
647,LUKE,647,"Well, I didn't..."
648,HAN,648,What the hell are you doing?
649,LEIA,649,"Somebody has to save our skins. Into
the garbage chute, wise guy."
650,HAN,650,"Get in there you big furry oaf! I
don't care what you smell! Get in
there and don't worry about it."
651,HAN,651,"Wonderful girl! Either I'm going to
kill her or I'm beginning to like
her. Get in there!"
652,HAN,652,"Oh! The garbage chute was a really
wonderful idea. What an incredible
smell you've discovered! Let's get
out of here! Get away from there..."
653,LUKE,653,No! wait!
654,LUKE,654,"Will you forget it? I already tried
it. It's magnetically sealed!"
655,LEIA,655,"Put that thing away! You're going to
get us all killed."
656,HAN,656,"Absolutely, Your Worship. Look, I
had everything under control until
you led us down here. You know, it's
not going to take them long to figure
out what happened to us."
657,LEIA,657,It could be worse...
658,HAN,658,It's worse.
659,LUKE,659,There's something alive in here!
660,HAN,660,That's your imagination.
661,LUKE,661,"Something just moves past my leg!
Look! Did you see that?"
662,HAN,662,What?
663,LUKE,663,Help!
664,HAN,664,Luke! Luke! Luke!
665,LEIA,665,Luke!
666,LEIA,666,"Luke, Luke, grab a hold of this."
667,LUKE,667,"Blast it, will you! My gun's jammed."
668,HAN,668,Where?
669,LUKE,669,Anywhere! Oh!!
670,HAN,670,Luke! Luke!
671,LEIA,671,Grab him!
672,LEIA,672,What happened?
673,LUKE,673,"I don't know, it just let go of me
and disappeared..."
674,HAN,674,"I've got a very bad feeling about
this."
675,LUKE,675,The walls are moving!
676,LEIA,676,"Don't just stand there. Try to brace
it with something."
677,LUKE,677,Wait a minute!
678,LUKE,678,"Threepio! Come in Threepio! Threepio!
Where could he be?"
679,FIRST TROOPER,679,Take over!
680,FIRST TROOPER,680,See to him! Look there!
681,THREEPIO,681,"They're madmen! They're heading for
the prison level. If you hurry, you
might catch them."
682,FIRST OFFICER,682,Follow me! You stand guard.
683,THREEPIO,683,Come on!
684,THREEPIO,684,"Oh! All this excitement has overrun
the circuits of my counterpart here.
If you don't mind, I'd like to take
him down to maintenance."
685,TROOPER,685,All right.
686,LUKE,686,"Threepio! Come in, Threepio! Threepio!"
687,HAN,687,Get to the top!
688,LEIA,688,I can't
689,LUKE,689,"Where could he be? Threepio! Threepio,
will you come in?"
690,THREEPIO,690,"They aren't here! Something must
have happened to them. See if they've
been captured."
691,THREEPIO,691,Hurry!
692,HAN,692,"One thing's for sure. We're all going
to be a lot thinner!"
693,HAN,693,Get on top of it!
694,LEIA,694,I'm trying!
695,THREEPIO,695,"Thank goodness, they haven't found
them! Where could they be?"
696,THREEPIO,696,"Use the comlink? Oh, my! I forgot I
turned it off!"
697,THREEPIO,697,"Are you there, sir?"
698,LUKE,698,Threepio!
699,THREEPIO,699,We've had some problems...
700,LUKE,700,"Will you shut up and listen to me?
Shut down all garbage mashers on the
detention level, will you? Do you
copy?"
701,LUKE,701,"Shut down all the garbage mashers on
the detention level."
702,LUKE,702,"Shut down all the garbage mashers on
the detention level."
703,THREEPIO,703,No. Shut them all down! Hurry!
704,THREEPIO,704,"Listen to them! They're dying, Artoo!
Curse my metal body! I wasn't fast
enough. It's all my fault! My poor
master!"
705,LUKE,705,"Threepio, we're all right!"
706,LUKE,706,We're all right. You did great.
707,LUKE,707,"Hey... hey, open the pressure
maintenance hatch on unit number...
where are we?"
708,HAN,708,Three-two-six-eight-two-seven.
709,HAN,709,"If we can just avoid any more female
advice, we ought to be able to get
out of here."
710,LUKE,710,"Well, let's get moving!"
711,HAN,711,Where are you going?
712,LEIA,712,"No, wait. They'll hear!"
713,HAN,713,"Come here, you big coward!"
714,HAN,714,Chewie! Come here!
715,LEIA,715,"Listen. I don't know who you are, or
where you came from, but from now
on, you do as I tell you. Okay?"
716,HAN,716,"Look, Your Worshipfulness, let's get
one thing straight! I take orders
from one person! Me!"
717,LEIA,717,It's a wonder you're still alive.
718,LEIA,718,"Will somebody get this big walking
carpet out of my way?"
719,HAN,719,No reward is worth this.
720,OFFICER,720,"Secure this area until the alert is
canceled."
721,FIRST TROOPER,721,Give me regular reports.
722,FIRST TROOPER,722,Do you know what's going on?
723,SECOND TROOPER,723,Maybe it's another drill.
724,SECOND TROOPER,724,What was that?
725,FIRST TROOPER,725,"Oh, it's nothing. Don't worry about
it."
726,HAN,726,There she is.
727,LUKE,727,"See-Threepio, do you copy?"
728,THREEPIO,728,"For the moment. Uh, we're in the
main hangar across from the ship."
729,LUKE,729,We're right above you. Stand by.
730,LEIA,730,"You came in that thing? You're braver
that I thought."
731,HAN,731,Nice! Come on!
732,FIRST TROOPER,732,It's them! Blast them!
733,HAN,733,Get back to the ship!
734,LUKE,734,Where are you going? Come back!
735,LEIA,735,He certainly has courage.
736,LUKE,736,"What good will it do us if he gets
himself killed? Come on!"
737,LUKE,737,I think we took a wrong turn.
738,LEIA,738,There's no lock!
739,LUKE,739,That oughta hold it for a while.
740,LEIA,740,"Quick, we've got to get across. Find
the control that extends the bridge."
741,LUKE,741,"Oh, I think I just blasted it."
742,LEIA,742,They're coming through!
743,LUKE,743,"Here, hold this."
744,LEIA,744,Here they come!
745,LEIA,745,For luck!
746,THREEPIO,746,Where could they be?
747,TROOPER,747,Close the blast doors!
748,TROOPER,748,"Open the blast doors! Open the blast
doors!"
749,VADER,749,"I've been waiting for you, Obi-Wan.
We meet again, at last. The circle
is now complete."
750,VADER,750,"When I left you, I was but the
learner; now I am the master."
751,BEN,751,"Only a master of evil, Darth."
752,VADER,752,"Your powers are weak, old man."
753,BEN,753,"You can't win, Darth. If you strike
me down, I shall become more powerful
than you can possibly imagine."
754,HAN,754,Didn't we just leave this party?
755,HAN,755,What kept you?
756,LEIA,756,We ran into some old friends.
757,LUKE,757,Is the ship all right?
758,HAN,758,"Seems okay, if we can get to it.
Just hope the old man got the tractor
beam out of commission."
759,LUKE,759,Look!
760,THREEPIO,760,"Come on, Artoo, we're going!"
761,HAN,761,Now's our chance! Go!
762,LUKE,762,No!
763,HAN,763,Come on!
764,LEIA,764,"Come on! Luke, its too late!"
765,HAN,765,Blast the door! Kid!
766,BEN'S VOICE,766,"Run, Luke! Run!"
767,HAN,767,"I hope the old man got that tractor
beam out if commission, or this is
going to be a real short trip. Okay,
hit it!"
768,HAN,768,"We're coming up on the sentry ships.
Hold 'em off! Angle the deflector
shields while I charge up the main
guns!"
769,LUKE,769,I can't believe he's gone.
770,LEIA,770,"There wasn't anything you could have
done."
771,HAN,771,"Come on, buddy, we're not out of
this yet!"
772,HAN,772,"You in, kid? Okay, stay sharp!"
773,LEIA,773,Here they come!
774,LUKE,774,They're coming in too fast!
775,THREEPIO,775,Oooh!
776,LEIA,776,We've lost lateral controls.
777,HAN,777,"Don't worry, she'll hold together."
778,HAN,778,"You hear me, baby? Hold together!"
779,LUKE,779,Got him! I got him!
780,HAN,780,Great kid! Don't get cocky.
781,LEIA,781,"There are still two more of them out
there!"
782,LUKE,782,That's it! We did it!
783,LEIA,783,We did it!
784,THREEPIO,784,Help! I think I'm melting!
785,THREEPIO,785,This is all your fault.
786,TARKIN,786,Are they away?
787,VADER,787,"They have just made the jump into
hyperspace."
788,TARKIN,788,"You're sure the homing beacon is
secure aboard their ship? I'm taking
an awful risk, Vader. This had better
work."
789,HAN,789,"Not a bad bit of rescuing, huh? You
know, sometimes I even amaze myself."
790,LEIA,790,"That doesn't sound too hard. Besides,
they let us go. It's the only
explanation for the ease of our
escape."
791,HAN,791,Easy... you call that easy?
792,LEIA,792,Their tracking us!
793,HAN,793,"Not this ship, sister."
794,LEIA,794,"At least the information in Artoo is
still intact."
795,HAN,795,"What's so important? What's he
carrying?"
796,LEIA,796,"The technical readouts of that battle
station. I only hope that when the
data is analyzed, a weakness can be
found. It's not over yet!"
797,HAN,797,"It is for me, sister! Look, I ain't
in this for your revolution, and I'm
not in it for you, Princess. I expect
to be well paid. I'm in it for the
money!"
798,LEIA,798,"You needn't worry about your reward.
If money is all that you love, then
that's what you'll receive!"
799,LEIA,799,"Your friend is quite a mercenary. I
wonder if he really cares about
anything... or anyone."
800,LUKE,800,I care!
801,LUKE,801,"So... what do you think of her, Han?"
802,HAN,802,"I'm trying not to, kid!"
803,LUKE,803,Good...
804,HAN,804,"Still, she's got a lot of spirit. I
don't know, what do you think? Do
you think a princess and a guy like
me..."
805,LUKE,805,No!
806,WILLARD,806,You're safe! We had feared the worst.
807,WILLARD,807,"When we heard about Alderaan, we
were afraid that you were... lost
along with your father."
808,LEIA,808,"We don't have time for our sorrows,
Commander. The battle station has
surely tracked us here."
809,LEIA,809,"It's the only explanation for the
ease of our escape. You must use the
information in this R2 unit to plan
the attack. It is our only hope."
810,TARKIN,810,Yes.
811,DODONNA,811,"The battle station is heavily shielded
and carries a firepower greater than
half the star fleet. It's defenses
are designed around a direct large-
scale assault. A small one-man fighter
should be able to penetrate the outer
defense."
812,GOLD LEADER,812,"Pardon me for asking, sir, but what
good are snub fighters going to be
against that?"
813,DODONNA,813,"Well, the Empire doesn't consider a
small one-man fighter to be any
threat, or they'd have a tighter
defense. An analysis of the plans
provided by Princess Leia has
demonstrated a weakness in the battle
station."
814,DODONNA,814,"The approach will not be easy. You
are required to maneuver straight
down this trench and skim the surface
to this point. The target area is
only two meters wide. It's a small
thermal exhaust port, right below
the main port. The shaft leads
directly to the reactor system. A
precise hit will start a chain
reaction which should destroy the
station."
815,DODONNA,815,"Only a precise hit will set up a
chain reaction. The shaft is ray-
shielded, so you'll have to use proton
torpedoes."
816,WEDGE,816,"That's impossible, even for a
computer."
817,LUKE,817,"It's not impossible. I used to bull's-
eye womp rats in my T-sixteen back
home. They're not much bigger than
two meters."
818,DODONNA,818,"Man your ships! And may the Force be
with you!"
819,VADER,819,"This will be a day long remembered.
It has seen the end of Kenobi and it
will soon see the end of the
Rebellion."
820,MAN'S VOICE,820,"All flight trooper, man your stations.
All flight troops, man your stations."
821,LUKE,821,"So... you got your reward and you're
just leaving then?"
822,HAN,822,"That's right, yeah! I got some old
debts I've got to pay off with this
stuff. Even if I didn't, you don't
think I'd be fool enough to stick
around here, do you? Why don't you
come with us? You're pretty good in
a fight. I could use you."
823,LUKE,823,"Come on! Why don't you take a look
around? You know what's about to
happen, what they're up against.
They could use a good pilot like
you. You're turning your back on
them."
824,HAN,824,"What good's a reward if you ain't
around to use it? Besides, attacking
that battle station ain't my idea of
courage. It's more like suicide."
825,LUKE,825,"All right. Well, take care of
yourself, Han. I guess that's what
you're best at, isn't it?"
826,HAN,826,"Hey, Luke... may the Force be with
you!"
827,HAN,827,"What're you lookin' at? I know what
I'm doing."
828,LEIA,828,What's wrong?
829,LUKE,829,"Oh, it's Han! I don't know, I really
thought he'd change his mind."
830,LEIA,830,"He's got to follow his own path. No
one can choose it for him."
831,LUKE,831,I only wish Ben were here.
832,BIGGS,832,"Luke! I don't believe it! How'd you
get here... are you going out with
us?!"
833,LUKE,833,"Biggs! Of course, I'll be up there
with you! Listen, have I got some
stories to tell..."
834,RED LEADER,834,"Are you... Luke Skywalker? Have you
been checked out on the Incom T-sixty-
five?"
835,BIGGS,835,"Sir, Luke is the best bushpilot in
the outer rim territories."
836,RED LEADER,836,"I met your father once when I was
just a boy, he was a great pilot.
You'll do all right. If you've got
half of your father's skill, you'll
do better than all right."
837,LUKE,837,"Thank you, sir. I'll try."
838,BIGGS,838,"I've got to get aboard. Listen, you'll
tell me your stories when we come
back. All right?"
839,LUKE,839,"I told you I'd make it someday, Biggs."
840,BIGGS,840,"You did, all right. It's going to be
like old times, Luke. We're a couple
of shooting stars that'll never be
stopped!"
841,CHIEF,841,"This R2 unit of your seems a bit
beat up. Do you want a new one?"
842,LUKE,842,"Not on your life! That little droid
and I have been through a lot
together."
843,LUKE,843,"You okay, Artoo?"
844,CHIEF,844,"Okay, easy she goes!"
845,THREEPIO,845,"Hang on tight,Artoo, you've got to
come back."
846,THREEPIO,846,"You wouldn't want my life to get
boring, would you?"
847,BEN'S VOICE,847,"Luke, the Force will be with you."
848,MASSASSI INTERCOM VOICE,848,"Stand-by alert. Death Star
approaching. Estimated time to firing
range, fifteen minutes."
849,RED LEADER,849,All wings report in.
850,RED TEN,850,Red Ten standing by.
851,RED SEVEN,851,Red Seven standing by.
852,BIGGS,852,Red Three standing by.
853,PORKINS,853,Red Six standing by.
854,RED NINE,854,Red Nine standing by.
855,WEDGE,855,Red Two standing by.
856,RED ELEVEN,856,Red Eleven standing by.
857,LUKE,857,Red Five standing by.
858,RED LEADER,858,Lock S-foils in attack position.
859,READ LEADER,859,"We're passing through their magnetic
field."
860,RED LEADER,860,Hold tight!
861,RED LEADER,861,Switch your deflectors on.
862,RED LEADER,862,Double front!
863,WEDGE,863,Look at the size of that thing!
864,RED LEADER,864,"Cut the chatter, Red Two."
865,RED LEADER,865,"Accelerate to attack speed. This is
it, boys!"
866,GOLD LEADER,866,"Red Leader, this is Gold Leader."
867,RED LEADER,867,"I copy, Gold Leader."
868,GOLD LEADER,868,"We're starting for the target shaft
now."
869,RED LEADER,869,"We're in position. I'm going to cut
across the axis and try and draw
their fire."
870,WEDGE,870,"Heavy fire, boss! Twenty-degrees."
871,RED LEADER,871,I see it. Stay low.
872,LUKE,872,This is Red Five; I'm going in!
873,BIGGS,873,"Luke, pull up!"
874,BIGGS,874,Are you all right?
875,LUKE,875,"I got a little cooked, but I'm okay."
876,ASTRO-OFFICER,876,"We count thirty Rebel ships, Lord
Vader. But they're so small they're
evading our turbo-lasers!"
877,VADER,877,"We'll have to destroy them ship to
ship. Get the crews to their fighters."
878,RED LEADER,878,"Luke, let me know when you're going
in."
879,LUKE,879,I'm on my way in now...
880,RED LEADER,880,"Watch yourself! There's a lot of
fire coming from the right side of
that deflection tower."
881,LUKE,881,I'm on it.
882,CONTROL OFFICER,882,"Squad leaders, we've picked up a new
group of signals. Enemy fighters
coming your way."
883,LUKE,883,"My scope's negative. I don't see
anything."
884,RED LEADER,884,"Keep up your visual scanning. With
all this jamming, they'll be on top
of you before your scope can pick
them up."
885,RED LEADER,885,"Biggs! You've picked one up... watch
it!"
886,BIGGS,886,I can't see it! Where is he?!
887,BIGGS,887,"He's on me tight, I can't shake him...
I can't shake him."
888,LUKE,888,"Hang on, Biggs, I'm coming in."
889,LUKE,889,Got him!
890,VADER,890,"Several fighters have broken off
from the main group. Come with me!"
891,BIGGS,891,Pull in! Luke... pull in!
892,WEDGE,892,"Watch your back, Luke!"
893,WEDGE,893,"Watch your back! Fighter's above
you, coming in!"
894,LUKE,894,"I'm hit, but not bad."
895,LUKE'S VOICE,895,"Artoo, see what you can do with it.
Hang on back there."
896,RED LEADER,896,Red Six...
897,RED LEADER,897,Can you see Red Five?
898,RED TEN,898,"There's a heavy fire zone on this
side. Red Five, where are you?"
899,LUKE,899,I can't shake him!
900,WEDGE,900,"I'm on him, Luke!"
901,WEDGE,901,Hold on!
902,LUKE,902,Blast it! Wedge where are you?
903,LUKE,903,"Thanks, Wedge."
904,BIGGS,904,"Good shooting, Wedge!"
905,GOLD LEADER,905,Red Leader...
906,GOLD LEADER,906,"This is Gold Leader. We're starting
out attack run."
907,RED LEADER,907,"I copy, Gold Leader. Move into
position."
908,VADER,908,Stay in attack formation!
909,GOLD LEADER,909,The exhaust post is...
910,GOLD LEADER,910,...marked and locked in!
911,GOLD LEADER,911,"Switch power to front deflector
screens."
912,GOLD LEADER,912,"How many guns do you think, Gold
Five."
913,GOLD FIVE,913,"I'd say about twenty guns. Some on
the surface, some on the towers."
914,MASSASSI INTERCOM VOICE,914,"Death Star will be in range in five
minutes."
915,GOLD LEADER,915,Switching to targeting computer.
916,GOLD TWO,916,Computer's locked. Getting a signal.
917,GOLD TWO,917,The guns... they've stopped!
918,GOLD FIVE,918,"Stabilize your read deflectors. Watch
for enemy fighters."
919,GOLD LEADER,919,"They've coming in! Three marks at
two ten."
920,VADER,920,I'll take them myself! Cover me!
921,WINGMAN'S VOICE,921,"Yes, sir."
922,GOLD LEADER,922,I can't maneuver!
923,GOLD FIVE,923,Stay on target.
924,GOLD LEADER,924,We're too close.
925,GOLD FIVE,925,Stay on target!
926,GOLD LEADER,926,Loosen up!
927,GOLD FIVE,927,Gold Five to Red Leader...
928,GOLD FIVE,928,"Lost Tiree, lost Dutch."
929,RED LEADER,929,"I copy, Gold Five."
930,GOLD FIVE,930,They came from behind...
931,OFFICER,931,"We've analyzed their attack, sir,
and there is a danger. Should I have
your ship standing by?"
932,TARKIN,932,"Evacuate? In out moment of triumph?
I think you overestimate their
chances!"
933,VOICE,933,"Rebel base, three minutes and closing."
934,RED LEADER,934,"Red Group, this is Red Leader."
935,RED LEADER,935,Rendezvous at mark six point one.
936,WEDGE,936,This is Red Two. Flying toward you.
937,BIGGS,937,"Red Three, standing by."
938,DODONNA,938,"Red Leader, this is Base One. Keep
half your group out of range for the
next run."
939,RED LEADER'S VOICE,939,"Copy, Base One. Luke, take Red Two
and Three. Hold up here and wait for
my signal... to start your run."
940,RED LEADER,940,This is it!
941,RED TEN,941,We should be able to see it by now.
942,RED LEADER,942,"Keep your eyes open for those
fighters!"
943,RED TEN,943,There's too much interference!
944,RED TEN'S VOICE,944,"Red Five, can you see them from where
you are?"
945,LUKE,945,No sign of any... wait!
946,LUKE,946,Coming in point three five.
947,RED TEN,947,I see them.
948,RED LEADER,948,I'm in range.
949,RED LEADER,949,Target's coming up!
950,RED LEADER,950,Just hold them off for a few seconds.
951,VADER,951,Close up formation.
952,RED LEADER,952,Almost there!
953,RED TEN,953,I can't hold them!
954,RED LEADER,954,It's away!
955,RED NINE'S VOICE,955,It's a hit!
956,RED LEADER,956,Negative.
957,RED LEADER,957,"Negative! It didn't go in. It just
impacted on the surface."
958,LUKE,958,"Red Leader, we're right above you.
Turn to point..."
959,LUKE,959,...oh-five; we'll cover for you.
960,RED LEADER,960,Stay there...
961,RED LEADER,961,...I just lost my starboard engine.
962,RED LEADER,962,Get set to make your attack run.
963,DEATH STAR INTERCOM VOICE,963,"Rebel base, one minute and closing."
964,LUKE,964,"Biggs, Wedge, let's close it up.
We're going in. We're going in full
throttle."
965,WEDGE,965,"Right with you, boss."
966,BIGGS,966,"Luke, at that speed will you be able
to pull out in time?"
967,LUKE,967,"It'll be just like Beggar's Canyon
back home."
968,BIGGS,968,"We'll stay back far enough to cover
you."
969,WEDGE,969,"My scope shows the tower, but I can't
see the exhaust port! Are you sure
the computer can hit it?"
970,LUKE,970,"Watch yourself! Increase speed full
throttle!"
971,WEDGE,971,What about the tower?
972,LUKE,972,"You worry about those fighters! I'll
worry about the tower!"
973,LUKE,973,"Artoo... that, that stabilizer's
broken loose again! See if you can't
lock it down!"
974,WEDGE,974,I'm hit! I can't stay with you.
975,LUKE,975,"Get clear, Wedge."
976,LUKE,976,You can't do any more good back there!
977,WEDGE,977,Sorry!
978,VADER,978,Let him go! Stay on the leader!
979,BIGGS,979,"Hurry, Luke, they're coming in much
faster this time. I can't hold them!"
980,LUKE,980,"Artoo, try and increase the power!"
981,BIGGS,981,"Hurry up, Luke!"
982,BIGGS,982,Wait!
983,DEATH STAR INTERCOM VOICE,983,"Rebel base, thirty seconds and
closing."
984,VADER,984,I'm on the leader.
985,THREEPIO,985,"Hang on, Artoo!"
986,BEN'S VOICE,986,"Use the Force, Luke."
987,BEN'S VOICE,987,"Let go, Luke."
988,VADER,988,The Force is strong with this one!
989,BEN'S VOICE,989,"Luke, trust me."
990,BASE VOICE,990,"His computer's off. Luke, you switched
off your targeting computer. What's
wrong?"
991,LUKE,991,Nothing. I'm all right.
992,LUKE,992,I've lost Artoo!
993,MASSASSI INTERCOM VOICE,993,"The Death Star has cleared the planet.
The Death Star has cleared the planet."
994,DEATH STAR INTERCOM VOICE,994,"Rebel base, in range."
995,TARKIN,995,You may fire when ready.
996,DEATH STAR INTERCOM VOICE,996,Commence primary ignition.
997,VADER,997,I have you now.
998,VADER,998,What?
999,HAN,999,Yahoo!
1000,WINGMAN,1000,Look out!
1001,HAN,1001,"You're all clear, kid."
1002,HAN,1002,"Now let's blow this thing and go
home!"
1003,INTERCOM VOICE,1003,Stand by to fire at Rebel base.
1004,INTERCOM VOICE,1004,Standing by.
1005,HAN,1005,"Great shot, kid. That was one in a
million."
1006,BEN'S VOICE,1006,"Remember, the Force will be with
you... always."
1007,LEIA,1007,Luke! Luke! Luke!
1008,HAN,1008,Hey! Hey!
1009,LUKE,1009,"I knew you'd come back! I just knew
it!"
1010,HAN,1010,"Well, I wasn't gonna let you get all
the credit and take all the reward."
1011,LEIA,1011,"Hey, I knew there was more to you
than money."
1012,LUKE,1012,"Oh, no!"
1013,THREEPIO,1013,"Oh, my! Artoo! Can you hear me? Say
something!"
1014,THREEPIO,1014,"You can repair him, can't you?"
1015,TECHNICIAN,1015,We'll get to work on him right away.
1016,THREEPIO,1016,"You must repair him! Sir, if any of
my circuits or gears will help, I'll
gladly donate them."
1017,LUKE,1017,He'll be all right.
