,character,line #,line
0,THREEPIO,0,"Did you hear that? They've shut down
the main reactor. We'll be destroyed
for sure. This is madness!"
1,THREEPIO,1,We're doomed!
2,THREEPIO,2,"There'll be no escape for the Princess
this time."
3,THREEPIO,3,What's that?
4,THREEPIO,4,"I should have known better than to
trust the logic of a half-sized
thermocapsulary dehousing assister..."
5,LUKE,5,"Hurry up! Come with me! What are you
waiting for?! Get in gear!"
6,THREEPIO,6,"Artoo! Artoo-Detoo, where are you?"
7,THREEPIO,7,At last! Where have you been?
8,THREEPIO,8,"They're heading in this direction.
What are we going to do? We'll be
sent to the spice mine of Kessel or
smashed into who knows what!"
9,THREEPIO,9,"Wait a minute, where are you going?"
10,IMPERIAL OFFICER,10,"The Death Star plans are not in the
main computer."
11,VADER,11,"Where are those transmissions you
intercepted?"
12,VADER,12,What have you done with those plans?
13,REBEL OFFICER,13,"We intercepted no transmissions.
Aaah... This is a consular ship.
Were on a diplomatic mission."
14,VADER,14,"If this is a consular ship... were
is the Ambassador?"
15,VADER,15,"Commander, tear this ship apart until
you've found those plans and bring
me the Ambassador. I want her alive!"
16,TROOPER,16,There she is! Set for stun!
17,TROOPER,17,"She'll be all right. Inform Lord
Vader we have a prisoner."
18,THREEPIO,18,"Hey, you're not permitted in there.
It's restricted. You'll be deactivated
for sure.."
19,THREEPIO,19,"Don't call me a mindless philosopher,
you overweight glob of grease! Now
come out before somebody sees you."
20,THREEPIO,20,"Secret mission? What plans? What are
you talking about? I'm not getting
in there!"
21,THREEPIO,21,I'm going to regret this.
22,CHIEF PILOT,22,There goes another one.
23,CAPTAIN,23,"Hold your fire. There are no life
forms. It must have been short-
circuited."
24,THREEPIO,24,"That's funny, the damage doesn't
look as bad from out here."
25,THREEPIO,25,Are you sure this things safe?
26,WOMAN,26,I've told you kids to slow down!
27,FIXER,27,"Did I hear a young noise blast through
here?"
28,CAMIE,28,It was just wormie on another rampage.
29,LUKE,29,Shape it up you guys!... Biggs?
30,LUKE,30,"I didn't know you were back! When
did you get in?"
31,BIGGS,31,"Just now. I wanted to surprise you,
hot shot. I thought you'd be here...
certainly didn't expect you to be
out working."
32,LUKE,32,"The Academy didn't change you
much...but you're back so soon? Hey,
what happened, didn't you get your
commission?"
33,BIGGS,33,"Of course I got it. Signed aboard
The Rand Ecliptic last week. First
mate Biggs Darklighter at your
service..."
34,BIGGS,34,"...I just came to say good-bye to
all you unfortunate landlocked
simpletons."
35,LUKE,35,"I almost forgot. There's a battle
going on! Right here in our system.
Come and look!"
36,DEAK,36,Not again! Forget it.
37,LUKE,37,There they are!
38,BIGGS,38,"That's no battle, hot shot... they're
just sitting there! Probably a
freighter-tanker refueling."
39,LUKE,39,"But there was a lot of firing
earlier..."
40,LUKE,40,"Hey, easy with those..."
41,CAMIE,41,"Don't worry about it, Wormie."
42,FIXER,42,"I keep telling you, the Rebellion is
a long way from here. I doubt if the
Empire would even fight to keep this
system. Believe me Luke, this planet
is a big hunk of nothing..."
43,LEIA,43,"Lord Vader, I should have known.
Only you could be so bold. The
Imperial Senate will not sit for
this, when they hear you've attacked
a diplomatic..."
44,VADER,44,"Don't play games with me, Your
Highness. You weren't on any mercy
mission this time. You passed directly
through a restricted system. Several
transmissions were beamed to this
ship by Rebel spies. I want to know
what happened to the plans they sent
you."
45,LEIA,45,"I don't know what you're talking
about. I'm a member of the Imperial
Senate on a diplomatic mission to
Alderaan..."
46,VADER,46,"You're a part of the Rebel Alliance...
and a traitor. Take her away!"
47,COMMANDER,47,"Holding her is dangerous. If word of
this gets out, it could generate
sympathy for the Rebellion in the
senate."
48,VADER,48,"I have traced the Rebel spies to
her. Now she is my only link to find
their secret base!"
49,COMMANDER,49,"She'll die before she tells you
anything."
50,VADER,50,"Leave that to me. Send a distress
signal and then inform the senate
that all aboard were killed!"
51,SECOND OFFICER,51,"Lord Vader, the battle station plans
are not aboard this ship! And no
transmissions were made. An escape
pod was jettisoned during the
fighting, but no life forms were
aboard."
52,VADER,52,"She must have hidden the plans in
the escape pod. Send a detachment
down to retrieve them. See to it
personally, Commander. There'll be
no one to stop us this time."
53,COMMANDER,53,"Yes, sir."
54,THREEPIO,54,"How did I get into this mess? I really
don't know how. We seem to be made
to suffer. It's our lot in life."
55,THREEPIO,55,"I've got to rest before I fall apart.
My joints are almost frozen."
56,THREEPIO,56,What a desolate place this is.
57,THREEPIO,57,Where are you going?
58,THREEPIO,58,"Well, I'm not going that way. It's
much too rocky. This way is much
easier."
59,THREEPIO,59,"What makes you think there are
settlements over there?"
60,THREEPIO,60,Don't get technical with me.
61,THREEPIO,61,"What mission? What are you talking
about? I've had just about enough of
you! Go that way! You'll be
malfunctioning within a day, you
nearsighted scrap pile!"
62,THREEPIO,62,"And don't let me catch you following
me begging for help, because you
won't get it."
63,THREEPIO,63,"No more adventures. I'm not going
that way."
64,THREEPIO,64,"That malfunctioning little twerp.
This is all his fault! He tricked me
into going this way, but he'll do no
better."
65,THREEPIO,65,"Wait, what's that? A transport! I'm
saved!"
66,THREEPIO,66,"Over here! Help! Please, help!"
67,LUKE,67,"...so I cut off my power, shut down
the afterburners and came in low on
Deak's trail. I was so close I thought
I was going to fry my instruments.
As it was I busted up the Skyhopper
pretty bad. Uncle Owen was pretty
upset. He grounded me for the rest
of the season. You should have been
there... it was fantastic."
68,BIGGS,68,"You ought to take it easy Luke. You
may be the hottest bushpilot this
side of Mos Eisley, but those little
Skyhoppers are dangerous. Keep it
up, and one day, whammo, you're going
to be nothing more than a dark spot
on the down side of a canyon wall."
69,LUKE,69,"Look who's talking. Now that you've
been around those giant starships
you're beginning to sound like my
uncle. You've gotten soft in the
city..."
70,BIGGS,70,I've missed you kid.
71,LUKE,71,"Well, things haven't been the same
since you left, Biggs. It's been
so... quiet."
72,BIGGS,72,"Luke, I didn't come back just to say
good-bye... I shouldn't tell you
this, but you're the only one I can
trust... and if I don't come back, I
want somebody to know."
73,LUKE,73,What are you talking about?
74,BIGGS,74,I made some friends at the Academy.
75,BIGGS,75,"...when our frigate goes to one of
the central systems, we're going to
jump ship and join the Alliance..."
76,LUKE,76,"Join the Rebellion?! Are you kidding!
How?"
77,BIGGS,77,"Quiet down will ya! You got a mouth
bigger than a meteor crater!"
78,LUKE,78,I'm sorry. I'm quiet.
79,LUKE,79,"Listen how quiet I am. You can barely
hear me..."
80,BIGGS,80,"My friend has a friend on Bestine
who might help us make contact."
81,LUKE,81,"You're crazy! You could wander around
forever trying to find them."
82,BIGGS,82,"I know it's a long shot, but if I
don't find them I'll do what I can
on my own... It's what we always
talked about. Luke, I'm not going to
wait for the Empire to draft me into
service. The Rebellion is spreading
and I want to be on the right side --
the side I believe in."
83,LUKE,83,And I'm stuck here...
84,BIGGS,84,"I thought you were going to the
Academy next term. You'll get your
chance to get off this rock."
85,LUKE,85,"Not likely! I had to cancel my
application. There has been a lot of
unrest among the Sandpeople since
you left... they've even raided the
outskirts of Anchorhead."
86,BIGGS,86,"Your uncle could hold off a whole
colony of Sandpeople with one blaster."
87,LUKE,87,"I know, but he's got enough vaporators
going to make the place pay off. He
needs me for just one more season. I
can't leave him now."
88,BIGGS,88,"I feel for you, Luke, you're going
to have to learn what seems to be
important or what really is important.
What good is all your uncle's work
if it's taken over by the Empire?...
You know they're starting to
nationalize commerce in the central
systems... it won't be long before
your uncle is merely a tenant, slaving
for the greater glory of the Empire."
89,LUKE,89,"It couldn't happen here. You said it
yourself. The Empire won't bother
with this rock."
90,BIGGS,90,Things always change.
91,LUKE,91,"I wish I was going... Are you going
to be around long?"
92,BIGGS,92,"No, I'm leaving in the morning..."
93,LUKE,93,Then I guess I won't see you.
94,BIGGS,94,Maybe someday... I'll keep a lookout.
95,LUKE,95,"Well, I'll be at the Academy next
season... after that who knows. I
won't be drafted into the Imperial
Starfleet that's for sure... Take
care of yourself, you'll always be
the best friend I've got."
96,BIGGS,96,"So long, Luke."
97,THREEPIO,97,Artoo-Detoo! It's you! It's you!
98,FIRST TROOPER,98,"Someone was in the pod. The tracks
go off in this direction."
99,SECOND TROOPER,99,"Look, sir -- droids."
100,THREEPIO,100,Wake up! Wake up!
101,THREEPIO,101,We're doomed.
102,THREEPIO,102,Do you think they'll melt us down?
103,THREEPIO,103,"Don't shoot! Don't shoot! Will this
never end?"
104,BERU,104,"Luke, tell Owen that if he gets a
translator to be sure it speaks Bocce."
105,LUKE,105,"It looks like we don't have much of
a choice but I'll remind him."
106,OWEN,106,I have no need for a protocol droid.
107,THREEPIO,107,"Sir -- not in an environment such as
this -- that's why I've also been
programmed for over thirty secondary
functions that..."
108,OWEN,108,"What I really need is a droid that
understands the binary language of
moisture vaporators."
109,THREEPIO,109,"Vaporators! Sir -- My first job was
programming binary load lifter...
very similar to your vaporators. You
could say..."
110,OWEN,110,Do you speak Bocce?
111,THREEPIO,111,"Of course I can, sir. It's like a
second language for me... I'm as
fluent in Bocce..."
112,OWEN,112,All right shut up!
113,OWEN,113,I'll take this one.
114,THREEPIO,114,"Shutting up, sir."
115,OWEN,115,"Luke, take these two over to the
garage, will you? I want you to have
both of them cleaned up before dinner."
116,LUKE,116,"But I was going into Toshi Station
to pick up some power converters..."
117,OWEN,117,"You can waste time with your friends
when your chores are done. Now come
on, get to it!"
118,LUKE,118,"All right, come on! And the red one,
come on. Well, come on, Red, let's
go."
119,LUKE,119,Uncle Owen...
120,OWEN,120,Yeah?
121,LUKE,121,"This R2 unit has a bad motivator.
Look!"
122,OWEN,122,"Hey, what're you trying to push on
us?"
123,THREEPIO,123,"Excuse me, sir, but that R2 unit is
in prime condition. A real bargain."
124,LUKE,124,Uncle Owen...
125,OWEN,125,Yeah?
126,LUKE,126,What about that one?
127,OWEN,127,"What about that blue one? We'll take
that one."
128,LUKE,128,"Yeah, take it away."
129,THREEPIO,129,"Uh, I'm quite sure you'll be very
pleased with that one, sir. He really
is in first-class condition. I've
worked with him before. Here he comes."
130,LUKE,130,"Okay, let's go."
131,THREEPIO,131,"Now, don't you forget this! Why I
should stick my neck out for you is
quite beyond my capacity!"
132,THREEPIO,132,"Thank the maker! This oil bath is
going to feel so good. I've got such
a bad case of dust contamination, I
can barely move!"
133,LUKE,133,"It just isn't fair. Oh, Biggs is
right. I'm never gonna get out of
here!"
134,THREEPIO,134,Is there anything I might do to help?
135,LUKE,135,"Well, not unless you can alter time,
speed up the harvest, or teleport me
off this rock!"
136,THREEPIO,136,"I don't think so, sir. I'm only a
droid and not very knowledgeable
about such things. Not on this planet,
anyways. As a matter of fact, I'm
not even sure which planet I'm on."
137,LUKE,137,"Well, if there's a bright center to
the universe, you're on the planet
that it's farthest from."
138,THREEPIO,138,"I see, sir."
139,LUKE,139,"Uh, you can call me Luke."
140,THREEPIO,140,"I see, sir Luke."
141,LUKE,141,Just Luke.
142,THREEPIO,142,"And I am See-Threepio, human-cyborg
relations, and this is my counterpart,
Artoo-Detoo."
143,LUKE,143,Hello.
144,LUKE,144,"You got a lot of carbon scoring here.
It looks like you boys have seen a
lot of action."
145,THREEPIO,145,"With all we've been through, sometimes
I'm amazed we're in as good condition
as we are, what with the Rebellion
and all."
146,LUKE,146,"You know of the Rebellion against
the Empire?"
147,THREEPIO,147,"That's how we came to be in your
service, if you take my meaning,
sir."
148,LUKE,148,Have you been in many battles?
149,THREEPIO,149,"Several, I think. Actually, there's
not much to tell. I'm not much more
than an interpreter, and not very
good at telling stories. Well, not
at making them interesting, anyways."
150,LUKE,150,"Well, my little friend, you've got
something jammed in here real good.
Were you on a cruiser or..."
151,LEIA,151,"Help me, Obi-Wan Kenobi. You're my
only hope."
152,LUKE,152,What's this?
153,THREEPIO,153,"What is what?!? He asked you a
question..."
154,THREEPIO,154,What is that?
155,LEIA,155,"Help me, Obi-Wan Kenobi. You're my
only hope. Help me, Obi-Wan Kenobi.
You're my only hope."
156,THREEPIO,156,"Oh, he says it's nothing, sir. Merely
a malfunction. Old data. Pay it no
mind."
157,LUKE,157,Who is she? She's beautiful.
158,THREEPIO,158,"I'm afraid I'm not quite sure, sir."
159,LEIA,159,"Help me, Obi-Wan Kenobi..."
160,THREEPIO,160,"I think she was a passenger on our
last voyage. A person of some
importance, sir -- I believe. Our
captain was attached to..."
161,LUKE,161,Is there more to this recording?
162,THREEPIO,162,"Behave yourself, Artoo. You're going
to get us in trouble. It's all right,
you can trust him. He's our new
master."
163,THREEPIO,163,"He says he's the property of Obi-Wan
Kenobi, a resident of these parts.
And it's a private message for him.
Quite frankly, sir I don't know what
he's talking about. Our last master
was Captain Antilles, but with what
we've been through, this little R2
unit has become a bit eccentric."
164,LUKE,164,"Obi-Wan Kenobi? I wonder if he means
old Ben Kenobi?"
165,THREEPIO,165,"I beg your pardon, sir, but do you
know what he's talking about?"
166,LUKE,166,"Well, I don't know anyone named Obi-
Wan, but old Ben lives out beyond
the dune sea. He's kind of a strange
old hermit."
167,LUKE,167,"I wonder who she is. It sounds like
she's in trouble. I'd better play
back the whole thing."
168,THREEPIO,168,"He says the restraining bolt has
short circuited his recording system.
He suggests that if you remove the
bolt, he might be able to play back
the entire recording."
169,LUKE,169,"H'm? Oh, yeah, well, I guess you're
too small to run away on me if I
take this off! Okay."
170,LUKE,170,There you go.
171,LUKE,171,"Well, wait a minute. Where'd she go?
Bring her back! Play back the entire
message."
172,THREEPIO,172,"What message? The one you're carrying
inside your rusty innards!"
173,AUNT BERU,173,Luke? Luke! Come to dinner!
174,LUKE,174,"All right, I'll be right there, Aunt
Beru."
175,THREEPIO,175,"I'm sorry, sir, but he appears to
have picked up a slight flutter."
176,LUKE,176,"Well, see what you can do with him.
I'll be right back."
177,THREEPIO,177,"Just you reconsider playing that
message for him."
178,THREEPIO,178,"No, I don't think he likes you at
all."
179,THREEPIO,179,"No, I don't like you either."
180,LUKE,180,"You know, I think that R2 unit we
bought might have been stolen."
181,OWEN,181,What makes you think that?
182,LUKE,182,"Well, I stumbled across a recording
while I was cleaning him. He says he
belongs to someone called Obi-Wan
Kenobi."
183,LUKE,183,"I thought he might have meant old
Ben. Do you know what he's talking
about? Well, I wonder if he's related
to Ben."
184,OWEN,184,"That old man's just a crazy old
wizard. Tomorrow I want you to take
that R2 unit into Anchorhead and
have its memory flushed. That'll be
the end of it. It belongs to us now."
185,LUKE,185,"But what if this Obi-Wan comes looking
for him?"
186,OWEN,186,"He won't, I don't think he exists
any more. He died about the same
time as your father."
187,LUKE,187,He knew my father?
188,OWEN,188,"I told you to forget it. Your only
concern is to prepare the new droids
for tomorrow. In the morning I want
them on the south ridge working out
those condensers."
189,LUKE,189,"Yes, sir. I think those new droids
are going to work out fine. In fact,
I, uh, was also thinking about our
agreement about my staying on another
season. And if these new droids do
work out, I want to transmit my
application to the Academy this year."
190,OWEN,190,"You mean the next semester before
harvest?"
191,LUKE,191,"Sure, there're more than enough
droids."
192,OWEN,192,"Harvest is when I need you the most.
Only one more season. This year we'll
make enough on the harvest so I'll
be able to hire some more hands. And
then you can go to the Academy next
year."
193,OWEN,193,"You must understand I need you here,
Luke."
194,LUKE,194,But it's a whole 'nother year.
195,OWEN,195,"Look, it's only one more season."
196,LUKE,196,"Yeah, that's what you said last year
when Biggs and Tank left."
197,AUNT BERU,197,Where are you going?
198,LUKE,198,"It looks like I'm going nowhere. I
have to finish cleaning those droids."
199,AUNT BERU,199,"Owen, he can't stay here forever.
Most of his friends have gone. It
means so much to him."
200,OWEN,200,"I'll make it up to him next year. I
promise."
201,AUNT BERU,201,"Luke's just not a farmer, Owen. He
has too much of his father in him."
202,OWEN,202,That's what I'm afraid of.
203,LUKE,203,What are you doing hiding there?
204,THREEPIO,204,"It wasn't my fault, sir. Please don't
deactivate me. I told him not to go,
but he's faulty, malfunctioning;
kept babbling on about his mission."
205,LUKE,205,"Oh, no!"
206,THREEPIO,206,"That R2 unit has always been a
problem. These astro-droids are
getting quite out of hand. Even I
can't understand their logic at times."
207,LUKE,207,"How could I be so stupid? He's nowhere
in sight. Blast it!"
208,THREEPIO,208,"Pardon me, sir, but couldn't we go
after him?"
209,LUKE,209,"It's too dangerous with all the
Sandpeople around. We'll have to
wait until morning."
210,OWEN,210,"Luke, I'm shutting the power down
for the night."
211,LUKE,211,"All right, I'll be there in a few
minutes. Boy, am I gonna get it."
212,LUKE,212,"You know that little droid is going
to cause me a lot of trouble."
213,THREEPIO,213,"Oh, he excels at that, sir."
214,OWEN,214,"Luke? Luke? Luke? Where could he be
loafing now!"
215,OWEN,215,Have you seen Luke this morning?
216,AUNT BERU,216,"He said he had some things to do
before he started today, so he left
early."
217,OWEN,217,"Uh? Did he take those two new droids
with him?"
218,AUNT BERU,218,I think so.
219,OWEN,219,"Well, he'd better have those units
in the south range repaired be midday
or there'll be hell to pay!"
220,LUKE,220,How's that.
221,LUKE,221,"Old Ben Kenobi lives out in this
direction somewhere, but I don't see
how that R2 unit could have come
this far. We must have missed him.
Uncle Owen isn't going to take this
very well."
222,THREEPIO,222,"Sir, would it help if you told him
it was my fault."
223,LUKE,223,"Sure. He needs you. He'd probably
only deactivate you for a day or
so..."
224,THREEPIO,224,"Deactivate! Well, on the other hand
if you hadn't removed his restraining
bolt..."
225,LUKE,225,"Wait, there's something dead ahead
on the scanner. It looks like our
droid... hit the accelerator."
226,LUKE,226,"Hey, whoa, just where do you think
you're going?"
227,THREEPIO,227,"Master Luke here is your rightful
owner. We'll have no more of this
Obi-Wan Kenobi jibberish... and don't
talk to me about your mission, either.
You're fortunate he doesn't blast
you into a million pieces right here."
228,LUKE,228,"Well, come on. It's getting late. I
only hope we can get back before
Uncle Owen really blows up."
229,THREEPIO,229,"If you don't mind my saying so, sir,
I think you should deactivate the
little fugitive until you've gotten
him back to your workshop."
230,LUKE,230,"No, he's not going to try anything."
231,LUKE,231,What's wrong with him now?
232,THREEPIO,232,"Oh my... sir, he says there are
several creatures approaching from
the southeast."
233,LUKE,233,"Sandpeople! Or worst! Come on, let's
have a look. Come on."
234,LUKE,234,"There are two Banthas down there but
I don't see any... wait a second,
they're Sandpeople all right. I can
see one of them now."
235,BEN,235,"Hello there! Come here my little
friend. Don't be afraid."
236,BEN,236,"Don't worry, he'll be all right."
237,LUKE,237,What happened?
238,BEN,238,"Rest easy, son, you've had a busy
day. You're fortunate you're still
in one piece."
239,LUKE,239,"Ben? Ben Kenobi! Boy, am I glad to
see you!"
240,BEN,240,"The Jundland wastes are not to be
traveled lightly. Tell me young Luke,
what brings you out this far?"
241,LUKE,241,"Oh, this little droid! I think he's
searching for his former master...
I've never seen such devotion in a
droid before... there seems to be no
stopping him. He claims to be the
property of an Obi-Wan Kenobi. Is he
a relative of yours? Do you know who
he's talking about?"
242,BEN,242,"Obi-Wan Kenobi... Obi-Wan? Now thats
a name I haven't heard in a long
time... a long time."
243,LUKE,243,"I think my uncle knew him. He said
he was dead."
244,BEN,244,"Oh, he's not dead, not... not yet."
245,LUKE,245,You know him!
246,BEN,246,"Well of course, of course I know
him. He's me! I haven't gone by the
name Obi-Wan since oh, before you
were born."
247,LUKE,247,Then the droid does belong to you.
248,BEN,248,"Don't seem to remember ever owning a
droid. Very interesting..."
249,BEN,249,"I think we better get indoors. The
Sandpeople are easily startled but
they will soon be back and in greater
numbers."
250,LUKE,250,Threepio!
251,THREEPIO,251,"Where am I? I must have taken a bad
step..."
252,LUKE,252,"Can you stand? We've got to get out
of here before the Sandpeople return."
253,THREEPIO,253,"I don't think I can make it. You go
on, Master Luke. There's no sense in
you risking yourself on my account.
I'm done for."
254,LUKE,254,"No, you're not. What kind of talk is
that?"
255,BEN,255,"Quickly, son... they're on the move."
256,LUKE,256,"No, my father didn't fight in the
wars. He was a navigator on a spice
freighter."
257,BEN,257,"That's what your uncle told you. He
didn't hold with your father's ideals.
Thought he should have stayed here
and not gotten involved."
258,LUKE,258,You fought in the Clone Wars?
259,BEN,259,"Yes, I was once a Jedi Knight the
same as your father."
260,LUKE,260,I wish I'd known him.
261,BEN,261,"He was the best star-pilot in the
galaxy, and a cunning warrior. I
understand you've become quite a
good pilot yourself. And he was a
good friend. Which reminds me..."
262,BEN,262,"I have something here for you. Your
father wanted you to have this when
you were old enough, but your uncle
wouldn't allow it. He feared you
might follow old Obi-Wan on some
damned-fool idealistic crusade like
your father did."
263,THREEPIO,263,"Sir, if you'll not be needing me,
I'll close down for awhile."
264,LUKE,264,"Sure, go ahead."
265,LUKE,265,What is it?
266,BEN,266,"Your fathers lightsaber. This is the
weapon of a Jedi Knight. Not as clumsy
or as random as a blaster."
267,BEN,267,"An elegant weapon for a more civilized
time. For over a thousand generations
the Jedi Knights were the guardians
of peace and justice in the Old
Republic. Before the dark times,
before the Empire."
268,LUKE,268,How did my father die?
269,BEN,269,"A young Jedi named Darth Vader, who
was a pupil of mine until he turned
to evil, helped the Empire hunt down
and destroy the Jedi Knights. He
betrayed and murdered your father.
Now the Jedi are all but extinct.
Vader was seduced by the dark side
of the Force."
270,LUKE,270,The Force?
271,BEN,271,"Well, the Force is what gives a Jedi
his power. It's an energy field
created by all living things. It
surrounds us and penetrates us. It
binds the galaxy together."
272,BEN,272,"Now, let's see if we can't figure
out what you are, my little friend.
And where you come from."
273,LUKE,273,I saw part of the message he was...
274,BEN,274,I seem to have found it.
275,LEIA,275,"General Kenobi, years ago you served
my father in the Clone Wars. Now he
begs you to help him in his struggle
against the Empire. I regret that I
am unable to present my father's
request to you in person, but my
ship has fallen under attack and I'm
afraid my mission to bring you to
Alderaan has failed. I have placed
information vital to the survival of
the Rebellion into the memory systems
of this R2 unit. My father will know
how to retrieve it. You must see
this droid safely delivered to him
on Alderaan. This is our most
desperate hour. Help me, Obi-Wan
Kenobi, you're my only hope."
276,BEN,276,"You must learn the ways of the Force
if you're to come with me to Alderaan."
277,LUKE,277,"Alderaan? I'm not going to Alderaan.
I've got to go home. It's late, I'm
in for it as it is."
278,BEN,278,"I need your help, Luke. She needs
your help. I'm getting too old for
this sort of thing."
279,LUKE,279,"I can't get involved! I've got work
to do! It's not that I like the
Empire. I hate it! But there's nothing
I can do about it right now. It's
such a long way from here."
280,BEN,280,That's your uncle talking.
281,LUKE,281,"Oh, God, my uncle. How am I ever
going to explain this?"
282,BEN,282,"Learn about the Force, Luke."
283,LUKE,283,"Look, I can take you as far as
Anchorhead. You can get a transport
there to Mos Eisley or wherever you're
going."
