,character,line #,line
284,BEN,284,"You must do what you feel is right,
of course."
285,TAGGE,285,"Until this battle station is fully
operational we are vulnerable. The
Rebel Alliance is too well equipped.
They're more dangerous than you
realize."
286,MOTTI,286,"Dangerous to your starfleet,
Commander, not to this battle station!"
287,TAGGE,287,"The Rebellion will continue to gain
a support in the Imperial Senate as
long as...."
288,TARKIN,288,"The Imperial Senate will no longer
be of any concern to us. I've just
received word that the Emperor has
dissolved the council permanently.
The last remnants of the Old Republic
have been swept away."
289,TAGGE,289,"That's impossible! How will the
Emperor maintain control without the
bureaucracy?"
290,TARKIN,290,"The regional governors now have direct
control over territories. Fear will
keep the local systems in line. Fear
of this battle station."
291,TAGGE,291,"And what of the Rebellion? If the
Rebels have obtained a complete
technical readout of this station,
it is possible, however unlikely,
that they might find a weakness and
exploit it."
292,VADER,292,"The plans you refer to will soon be
back in our hands."
293,MOTTI,293,"Any attack made by the Rebels against
this station would be a useless
gesture, no matter what technical
data they've obtained. This station
is now the ultimate power in the
universe. I suggest we use it!"
294,VADER,294,"Don't be too proud of this
technological terror you've
constructed. The ability to destroy
a planet is insignificant next to
the power of the Force."
295,MOTTI,295,"Don't try to frighten us with your
sorcerer's ways, Lord Vader. Your
sad devotion to that ancient religion
has not helped you conjure up the
stolen data tapes, or given you
clairvoyance enough to find the
Rebel's hidden fort..."
296,VADER,296,I find your lack of faith disturbing.
297,TARKIN,297,"Enough of this! Vader, release him!"
298,VADER,298,As you wish.
299,TARKIN,299,"This bickering is pointless. Lord
Vader will provide us with the
location of the Rebel fortress by
the time this station is operational.
We will then crush the Rebellion
with one swift stroke."
300,LUKE,300,"It looks like Sandpeople did this,
all right. Look, here are Gaffi
sticks, Bantha tracks. It's just...
I never heard of them hitting anything
this big before."
301,BEN,301,"They didn't. But we are meant to
think they did. These tracks are
side by side. Sandpeople always ride
single file to hide there numbers."
302,LUKE,302,"These are the same Jawas that sold
us Artoo and Threepio."
303,BEN,303,"And these blast points, too accurate
for Sandpeople. Only Imperial
stormtroopers are so precise."
304,LUKE,304,"Why would Imperial troops want to
slaughter Jawas?"
305,LUKE,305,"If they traced the robots here, they
may have learned who they sold them
to. And that would lead them home!"
306,BEN,306,"Wait, Luke! It's too dangerous."
307,LUKE,307,Uncle Owen! Aunt Beru! Uncle Owen!
308,VADER,308,"And, now Your Highness, we will
discuss the location of your hidden
Rebel base."
309,BEN,309,"There's nothing you could have done,
Luke, had you been there. You'd have
been killed, too, and the droids
would be in the hands of the Empire."
310,LUKE,310,"I want to come with you to Alderaan.
There's nothing here for me now. I
want to learn the ways of the Force
and become a Jedi like my father."
311,BEN,311,"Mos Eisley Spaceport. You will never
find a more wretched hive of scum
and villainy. We must be cautious."
312,TROOPER,312,How long have you had these droids?
313,LUKE,313,About three or four seasons.
314,BEN,314,They're for sale if you want them.
315,TROOPER,315,Let me see your identification.
316,BEN,316,"You don't need to see his
identification."
317,TROOPER,317,"We don't need to see his
identification."
318,BEN,318,"These are not the droids your looking
for."
319,TROOPER,319,"These are not the droids we're looking
for."
320,BEN,320,He can go about his business.
321,TROOPER,321,You can go about your business.
322,BEN,322,Move along.
323,TROOPER,323,Move along. Move along.
324,THREEPIO,324,"I can't abide these Jawas. Disgusting
creatures."
325,LUKE,325,"Go on, go on. I can't understand how
we got by those troopers. I thought
we were dead."
326,BEN,326,"The Force can have a strong influence
on the weak-minded. You will find it
a powerful ally."
327,LUKE,327,"Do you really think we're going to
find a pilot here that'll take us to
Alderaan?"
328,BEN,328,"Well, most of the best freighter
pilots can be found here. Only watch
your step. This place can be a little
rough."
329,LUKE,329,I'm ready for anything.
330,THREEPIO,330,"Come along, Artoo."
331,BARTENDER,331,We don't serve their kind here!
332,LUKE,332,What?
333,BARTENDER,333,"Your droids. They'll have to wait
outside. We don't want them here."
334,LUKE,334,"Listen, why don't you wait out by
the speeder. We don't want any
trouble."
335,THREEPIO,335,I heartily agree with you sir.
336,CREATURE,336,Negola dewaghi wooldugger?!?
337,HUMAN,337,He doesn't like you.
338,LUKE,338,I'm sorry.
339,HUMAN,339,I don't like you either.
340,HUMAN,340,"Don't insult us. You just watch
yourself. We're wanted men. I have
the death sentence in twelve systems."
341,LUKE,341,I'll be careful than.
342,HUMAN,342,You'll be dead.
343,BEN,343,"This little one isn't worth the
effort. Come let me buy you
something..."
344,BARTENDER,344,No blasters! No blaster!
345,BEN,345,"This is Chewbacca. He's first-mate
on a ship that might suit our needs."
346,THREEPIO,346,I don't like the look of this.
347,HAN,347,"Han Solo. I'm captain of the
Millennium Falcon. Chewie here tells
me you're looking for passage to the
Alderaan system."
348,BEN,348,"Yes, indeed. If it's a fast ship."
349,HAN,349,"Fast ship? You've never heard of the
Millennium Falcon?"
350,BEN,350,Should I have?
351,HAN,351,"It's the ship that made the Kessel
run in less than twelve parsecs!"
352,HAN,352,"I've outrun Imperial starships, not
the local bulk-cruisers, mind you.
I'm talking about the big Corellian
ships now. She's fast enough for
you, old man. What's the cargo?"
353,BEN,353,"Only passengers. Myself, the boy,
two droids, and no questions asked."
354,HAN,354,"What is it? Some kind of local
trouble?"
355,BEN,355,"Let's just say we'd like to avoid
any Imperial entanglements."
356,HAN,356,"Well, that's the trick, isn't it?
And it's going to cost you something
extra. Ten thousand in advance."
357,LUKE,357,"Ten thousand? We could almost buy
our own ship for that!"
358,HAN,358,"But who's going to fly it, kid! You?"
359,LUKE,359,"You bet I could. I'm not such a bad
pilot myself! We don't have to sit
here and listen..."
360,BEN,360,"We haven't that much with us. But we
could pay you two thousand now, plus
fifteen when we reach Alderaan."
361,HAN,361,"Seventeen, huh!"
362,HAN,362,"Okay. You guys got yourself a ship.
We'll leave as soon as you're ready.
Docking bay Ninety-four."
363,BEN,363,Ninety-four.
364,HAN,364,"Looks like somebody's beginning to
take an interest in your handiwork."
365,TROOPER,365,"All right, we'll check it out."
366,HAN,366,"Seventeen thousand! Those guys must
really be desperate. This could really
save my neck. Get back to the ship
and get her ready."
367,BEN,367,You'll have to sell your speeder.
368,LUKE,368,"That's okay. I'm never coming back
to this planet again."
369,GREEDO,369,"Going somewhere, Solo?"
370,HAN,370,"Yes, Greedo. As a matter of fact, I
was just going to see your boss.
Tell Jabba that I've got his money."
371,GREEDO,371,"It's too late. You should have paid
him when you had the chance. Jabba's
put a price on your head, so large
that every bounty hunter in the galaxy
will be looking for you. I'm lucky I
found you first."
372,HAN,372,"Yeah, but this time I got the money."
373,GREEDO,373,"If you give it to me, I might forget
I found you."
374,HAN,374,I don't have it with me. Tell Jabba...
375,GREEDO,375,"Jabba's through with you. He has no
time for smugglers who drop their
shipments at the first sign of an
Imperial cruiser."
376,HAN,376,"Even I get boarded sometimes. Do you
think I had a choice?"
377,GREEDO,377,"You can tell that to Jabba. He may
only take your ship."
378,HAN,378,Over my dead body.
379,GREEDO,379,"That's the idea. I've been looking
forward to killing you for a long
time."
380,HAN,380,"Yes, I'll bet you have."
381,HAN,381,Sorry about the mess.
382,VADER,382,"Her resistance to the mind probe is
considerable. It will be some time
before we can extract any information
from her."
383,IMPERIAL OFFICER,383,"The final check-out is complete. All
systems are operational. What course
shall we set?"
384,TARKIN,384,"Perhaps she would respond to an
alternative form of persuasion."
385,VADER,385,What do you mean?
386,TARKIN,386,"I think it is time we demonstrate
the full power of this station."
387,TARKIN,387,"Set your course for Princess Leia's
home planet of Alderaan."
388,TROOPER,388,With pleasure.
389,THREEPIO,389,"Lock the door, Artoo."
390,TROOPER,390,"All right, check that side of the
street. It's secure. Move on to the
next door."
391,THREEPIO,391,"I would much rather have gone with
Master Luke than stay here with you.
I don't know what all the trouble is
about, but I'm sure it must be your
fault."
392,THREEPIO,392,You watch your language!
393,LUKE,393,"He says it's the best he can do.
Since the XP-38 came out, they're
just not in demand."
394,BEN,394,It will be enough.
395,BEN,395,"If the ship's as fast as he's
boasting, we ought to do well."
396,JABBA,396,"Come on out, Solo!"
397,HAN,397,"I've been waiting for you, Jabba."
398,JABBA,398,I expected you would be.
399,HAN,399,I'm not the type to run.
400,JABBA,400,"Han, my boy, there are times when
you disappoint me... why haven't you
paid me? And why did you have to fry
poor Greedo like that... after all
we've been through together."
401,HAN,401,You sent Greedo to blast me.
402,JABBA,402,"Han, why you're the best smuggler in
the business. You're too valuable to
fry. He was only relaying my concern
at your delays. He wasn't going to
blast you."
403,HAN,403,"I think he thought he was. Next time
don't send one of those twerps. If
you've got something to say to me,
come see me yourself."
404,JABBA,404,"Han, Han! If only you hadn't had to
dump that shipment of spice... you
understand I just can't make an
exception. Where would I be if every
pilot who smuggled for me dumped
their shipment at the first sign of
an Imperial starship? It's not good
business."
405,HAN,405,"You know, even I get boarded
sometimes, Jabba. I had no choice,
but I've got a charter now and I can
pay you back, plus a little extra. I
just need some more time."
406,JABBA,406,"Put your blasters away. Han, my boy,
I'm only doing this because you're
the best and I need you. So, for an
extra, say twenty percent I'll give
you a little more time... but this
is it. If you disappoint me again,
I'll put a price on your head so
large you won't be able to go near a
civilized system for the rest of
your short life."
407,HAN,407,"Jabba, I'll pay you because it's my
pleasure."
408,LUKE,408,What a piece of junk.
409,HAN,409,"She'll make point five beyond the
speed of light. She may not look
like much, but she's got it where it
counts, kid. I've added some special
modifications myself."
410,HAN,410,"We're a little rushed, so if you'll
hurry aboard we'll get out of here."
411,THREEPIO,411,"Hello, sir."
412,TROOPER,412,Which way?
413,TROOPER,413,"All right, men. Load your weapons!"
414,TROOPER,414,Stop that ship!
415,TROOPER,415,Blast 'em!
416,HAN,416,"Chewie, get us out of here!"
417,THREEPIO,417,"Oh, my. I'd forgotten how much I
hate space travel."
418,HAN,418,"It looks like an Imperial cruiser.
Our passengers must be hotter than I
thought. Try and hold them off. Angle
the deflector shield while I make
the calculations for the jump to
light speed."
419,HAN,419,"Stay sharp! There are two more coming
in; they're going to try to cut us
off."
420,LUKE,420,"Why don't you outrun them? I thought
you said this thing was fast."
421,HAN,421,"Watch your mouth, kid, or you're
going to find yourself floating home.
We'll be safe enough once we make
the jump to hyperspace. Besides, I
know a few maneuvers. We'll lose
them!"
422,HAN,422,Here's where the fun begins!
423,BEN,423,"How long before you can make the
jump to light speed?"
424,HAN,424,"It'll take a few moments to get the
coordinates from the navi-computer."
425,LUKE,425,"Are you kidding? At the rate they're
gaining..."
426,HAN,426,"Traveling through hyperspace isn't
like dusting crops, boy! Without
precise calculations we could fly
right through a star or bounce too
close to a supernova and that'd end
your trip real quick, wouldn't it?"
427,LUKE,427,What's that flashing?
428,HAN,428,"We're losing our deflector shield.
Go strap yourself in, I'm going to
make the jump to light speed."
429,MOTTI,429,We've entered the Alderaan system.
430,LEIA,430,"Governor Tarkin, I should have
expected to find you holding Vader's
leash. I recognized your foul stench
when I was brought on board."
431,TARKIN,431,"Charming to the last. You don't know
how hard I found it signing the order
to terminate your life!"
432,LEIA,432,"I surprised you had the courage to
take the responsibility yourself!"
433,TARKIN,433,"Princess Leia, before your execution
I would like you to be my guest at a
ceremony that will make this battle
station operational. No star system
will dare oppose the Emperor now."
434,LEIA,434,"The more you tighten your grip,
Tarkin, the more star systems will
slip through your fingers."
435,TARKIN,435,"Not after we demonstrate the power
of this station. In a way, you have
determined the choice of the planet
that'll be destroyed first. Since
you are reluctant to provide us with
the location of the Rebel base, I
have chosen to test this station's
destructive power... on your home
planet of Alderaan."
436,LEIA,436,"No! Alderaan is peaceful. We have no
weapons. You can't possibly..."
437,TARKIN,437,"You would prefer another target? A
military target? Then name the system!"
438,TARKIN,438,"I grow tired of asking this. So it'll
be the last time. Where is the Rebel
base?"
439,LEIA,439,Dantooine.
440,LEIA,440,They're on Dantooine.
441,TARKIN,441,"There. You see Lord Vader, she can
be reasonable."
442,TARKIN,442,"Continue with the operation. You may
fire when ready."
443,LEIA,443,What?
444,TARKIN,444,"You're far too trusting. Dantooine
is too remote to make an effective
demonstration. But don't worry. We
will deal with your Rebel friends
soon enough."
445,LEIA,445,No!
446,VADER,446,Commence primary ignition.
447,LUKE,447,Are you all right? What's wrong?
448,BEN,448,"I felt a great disturbance in the
Force... as if millions of voices
suddenly cried out in terror and
were suddenly silenced. I fear
something terrible has happened."
449,BEN,449,"You'd better get on with your
exercises."
450,HAN,450,"Well, you can forget your troubles
with those Imperial slugs. I told
you I'd outrun 'em."
451,HAN,451,Don't everyone thank me at once.
452,HAN,452,"Anyway, we should be at Alderaan
about oh-two-hundred hours."
453,THREEPIO,453,"Now be careful, Artoo."
454,THREEPIO,454,"He made a fair move. Screaming about
it won't help you."
455,HAN,455,"Let him have it. It's not wise to
upset a Wookiee."
456,THREEPIO,456,"But sir, nobody worries about
upsetting a droid."
457,HAN,457,"That's 'cause droids don't pull
people's arms out of their socket
when they lose. Wookiees are known
to do that."
458,THREEPIO,458,"I see your point, sir. I suggest a
new strategy, Artoo. Let the Wookiee
win."
459,BEN,459,"Remember, a Jedi can feel the Force
flowing through him."
460,LUKE,460,You mean it controls your actions?
461,BEN,461,"Partially. But it also obeys your
commands."
462,HAN,462,"Hokey religions and ancient weapons
are no match for a good blaster at
your side, kid."
463,LUKE,463,"You don't believe in the Force, do
you?"
464,HAN,464,"Kid, I've flown from one side of
this galaxy to the other. I've seen
a lot of strange stuff, but I've
never seen anything to make me believe
there's one all-powerful force
controlling everything. There's no
mystical energy field that controls
my destiny."
465,HAN,465,"It's all a lot of simple tricks and
nonsense."
466,BEN,466,"I suggest you try it again, Luke."
467,BEN,467,"This time, let go your conscious
self and act on instinct."
468,LUKE,468,"With the blast shield down, I can't
even see. How am I supposed to fight?"
469,BEN,469,"Your eyes can deceive you. Don't
trust them."
470,BEN,470,Stretch out with your feelings.
471,BEN,471,"You see, you can do it."
472,HAN,472,I call it luck.
473,BEN,473,"In my experience, there's no such
thing as luck."
474,HAN,474,"Look, going good against remotes is
one thing. Going good against the
living? That's something else."
475,HAN,475,"Looks like we're coming up on
Alderaan."
476,LUKE,476,"You know, I did feel something. I
could almost see the remote."
477,BEN,477,"That's good. You have taken your
first step into a larger world."
478,TARKIN,478,Yes.
479,OFFICER CASS,479,"Our scout ships have reached
Dantooine. They found the remains of
a Rebel base, but they estimate that
it has been deserted for some time.
They are now conducting an extensive
search of the surrounding systems."
480,TARKIN,480,She lied! She lied to us!
481,VADER,481,"I told you she would never consciously
betray the Rebellion."
482,TARKIN,482,Terminate her... immediately!
483,HAN,483,"Stand by, Chewie, here we go. Cut in
the sublight engines."
484,HAN,484,"What the...? Aw, we've come out of
hyperspace into a meteor shower.
Some kind of asteroid collision.
It's not on any of the charts."
485,LUKE,485,What's going on?
486,HAN,486,"Our position is correct, except...
no, Alderaan!"
487,LUKE,487,What do you mean? Where is it?
488,HAN,488,"Thats what I'm trying to tell you,
kid. It ain't there. It's been totally
blown away."
489,LUKE,489,What? How?
490,BEN,490,Destroyed... by the Empire!
491,HAN,491,"The entire starfleet couldn't destroy
the whole planet. It'd take a thousand
ships with more fire power than
I've..."
492,HAN,492,There's another ship coming in.
493,LUKE,493,Maybe they know what happened.
494,BEN,494,It's an Imperial fighter.
495,LUKE,495,It followed us!
496,BEN,496,No. It's a short range fighter.
497,HAN,497,"There aren't any bases around here.
Where did it come from?"
498,LUKE,498,"It sure is leaving in a big hurry.
If they identify us, we're in big
trouble."
499,HAN,499,"Not if I can help it. Chewie...jam
it's transmissions."
500,BEN,500,"It'd be as well to let it go. It's
too far out of range."
501,HAN,501,Not for long...
502,BEN,502,"A fighter that size couldn't get
this deep into space on its own."
503,LUKE,503,"It must have gotten lost, been part
of a convoy or something."
504,HAN,504,"Well, he ain't going to be around
long enough to tell anyone about us."
505,LUKE,505,"Look at him. He's headed for that
small moon."
506,HAN,506,"I think I can get him before he gets
there... he's almost in range."
507,BEN,507,That's no moon! It's a space station.
508,HAN,508,It's too big to be a space station.
509,LUKE,509,I have a very bad feeling about this.
510,HAN,510,"Yeah, I think your right. Full
reverse! Chewie, lock in the auxiliary
power."
511,LUKE,511,Why are we still moving towards it?
512,HAN,512,"We're caught in a tractor beam! It's
pulling us in!"
513,LUKE,513,"But there's gotta be something you
can do!"
514,HAN,514,"There's nothin' I can do about it,
kid. I'm in full power. I'm going to
have to shut down. But they're not
going to get me without a fight!"
515,BEN,515,"You can't win. But there are
alternatives to fighting."
516,OFFICER,516,To you stations!
517,OFFICER,517,Come with me.
518,OFFICER,518,"Close all outboard shields! Close
all outboard shields!"
519,TARKIN,519,Yes.
520,VOICE,520,"We've captured a freighter entering
the remains of the Alderaan system.
It's markings match those of a ship
that blasted its way out of Mos
Eisley."
521,VADER,521,"They must be trying to return the
stolen plans to the princess. She
may yet be of some use to us."
522,VOICE,522,"Unlock one-five-seven and nine.
Release charges."
523,OFFICER,523,"There's no one on board, sir.
According to the log, the crew
abandoned ship right after takeoff.
It must be a decoy, sir. Several of
the escape pods have been jettisoned."
524,VADER,524,Did you find any droids?
525,OFFICER,525,"No, sir. If there were any on board,
they must also have jettisoned."
526,VADER,526,"Send a scanning crew on board. I
want every part of this ship checked."
527,OFFICER,527,"Yes, sir."
528,VADER,528,"I sense something... a presence I
haven't felt since..."
529,OFFICER,529,"Get me a scanning crew in here on
the double. I want every part of
this ship checked!"
530,LUKE,530,"Boy, it's lucky you had these
compartments."
531,HAN,531,"I use them for smuggling. I never
thought I'd be smuggling myself in
them. This is ridiculous. Even if I
could take off, I'd never get past
the tractor beam."
532,BEN,532,Leave that to me!
533,HAN,533,"Damn fool. I knew that you were going
to say that!"
534,BEN,534,"Who's the more foolish... the fool
or the fool who follows him?"
535,TROOPER,535,"The ship's all yours. If the scanners
pick up anything, report it
immediately. All right, let's go."
536,HAN'S VOICE,536,"Hey down there, could you give us a
hand with this?"
537,GANTRY OFFICER,537,"TX-four-one-two. Why aren't you at
your post? TX-four-one-two, do you
copy?"
538,GANTRY OFFICER,538,"Take over. We've got a bad
transmitter. I'll see what I can do."
539,LUKE,539,"You know, between his howling and
your blasting everything in sight,
it's a wonder the whole station
doesn't know we're here."
540,HAN,540,"Bring them on! I prefer a straight
fight to all this sneaking around."
541,THREEPIO,541,"We found the computer outlet, sir."
542,BEN,542,"Plug in. He should be able to
interpret the entire Imperial computer
network."
543,THREEPIO,543,"He says he's found the main computer
to power the tractor beam that's
holding the ship here. He'll try to
make the precise location appear on
the monitor."
544,THREEPIO,544,"The tractor beam is coupled to the
main reactor in seven locations. A
power loss at one of the terminals
will allow the ship to leave."
545,BEN,545,"I don't think you boys can help. I
must go alone."
546,HAN,546,"Whatever you say. I've done more
that I bargained for on this trip
already."
547,LUKE,547,I want to go with you.
548,BEN,548,"Be patient, Luke. Stay and watch
over the droids."
549,LUKE,549,But he can...
550,BEN,550,"They must be delivered safely or
other star systems will suffer the
same fate as Alderaan. Your destiny
lies along a different path than
mine. The Force will be with you...
always!"
551,HAN,551,"Boy you said it, Chewie."
552,HAN,552,Where did you dig up that old fossil?
553,LUKE,553,Ben is a great man.
554,HAN,554,"Yeah, great at getting us into
trouble."
555,LUKE,555,I didn't hear you give any ideas...
556,HAN,556,"Well, anything would be better than
just hanging around waiting for him
to pick us up..."
557,LUKE,557,Who do you think...
558,LUKE,558,What is it?
559,THREEPIO,559,"I'm afraid I'm not quite sure, sir.
He says ""I found her"", and keeps
repeating, ""She's here."""
560,LUKE,560,"Well, who... who has he found?"
561,THREEPIO,561,Princess Leia.
562,LUKE,562,The princess? She's here?
563,HAN,563,Princess? What's going on?
564,THREEPIO,564,"Level five. Detention block A A-twenty-
three. I'm afraid she's scheduled to
be terminated."
565,LUKE,565,"Oh, no! We've got to do something."
566,HAN,566,What are you talking about?
567,LUKE,567,"The droid belongs to her. She's the
one in the message... We've got to
help her."
568,HAN,568,"Now, look, don't get any funny ideas.
The old man wants us to wait right
here."
569,LUKE,569,"But he didn't know she was here.
Look, will you just find a way back
into the detention block?"
570,HAN,570,I'm not going anywhere.
571,LUKE,571,"They're going to execute her. Look,
a few minutes ago you said you didn't
want to just wait here to be captured.
Now all you want to do is stay."
572,HAN,572,"Marching into the detention area is
not what I had in mind."
573,LUKE,573,But they're going to kill her!
574,HAN,574,Better her than me...
575,LUKE,575,She's rich.
576,HAN,576,Rich?
577,LUKE,577,"Yes. Rich, powerful! Listen, if you
were to rescue her, the reward would
be..."
578,HAN,578,What?
579,LUKE,579,Well more wealth that you can imagine.
580,HAN,580,"I don't know, I can imagine quite a
bit!"
581,LUKE,581,You'll get it!
582,HAN,582,I better!
583,LUKE,583,You will...
584,HAN,584,"All right, kid. But you'd better be
right about this."
585,LUKE,585,All right.
586,HAN,586,What's your plan?
587,LUKE,587,"Uh... Threepio, hand me those binders
there will you?"
588,LUKE,588,"Okay. Now, I'm going to put these on
you."
589,LUKE,589,"Okay. Han, you put these on."
590,HAN,590,"Don't worry, Chewie. I think I know
what he has in mind."
591,THREEPIO,591,"Master Luke, sir! Pardon me for
asking... but, ah... what should
Artoo and I do if we're discovered
here?"
592,LUKE,592,Lock the door!
593,HAN,593,And hope they don't have blasters.
594,THREEPIO,594,That isn't very reassuring.
595,LUKE,595,I can't see a thing in this helmet.
596,HAN,596,This is not going to work.
597,LUKE,597,Why didn't you say so before?
598,HAN,598,I did say so before!
599,OFFICER,599,Where are you taking this... thing?
600,LUKE,600,"Prisoner transfer from Block one-one-
three-eight."
601,OFFICER,601,"I wasn't notified. I'll have to clear
it."
602,HAN,602,Look out! He's loose!
603,LUKE,603,He's going to pull us all apart.
604,HAN,604,Go get him!
605,HAN,605,"We've got to find out which cell
this princess of yours is in. Here
it is... cell twenty-one-eight-seven.
You go get her. I'll hold them here."
606,HAN,606,"Everything is under control. Situation
normal."
607,INTERCOM VOICE,607,What happened?
608,HAN,608,"Uh... had a slight weapons
malfunction. But, uh, everything's
perfectly all right now. We're fine.
We're all fine here, now, thank you.
How are you?"
609,INTERCOM VOICE,609,We're sending a squad up.
