,character,line #,line
653,LENNY,653,Whattya mean?
654,MAX,654,"All I'm saying... you don't know how
high up the food chain this thing
goes.  I've heard stuff."
655,LENNY,655,What stuff?
656,MAX,656,"Smoke.  Rumors.  I've heard stuff
about a death squad.  A group a guys
loyal to the hardline school.  Guys
that've had too many years of city
hall and the review boards and the
goddamn media pissing down their
necks, suspending cops right and
left, tying their hands... while
outa the other side a their mouths
these same people're squealing save
us, save us, do something you
fucking morons, crime is totally out
of control."
657,LENNY,657,Jesus.
658,MAX,658,"Yeah.  So don't walk near me in
public, alright."
659,LENNY,659,"Thanks, buddy.  See... things
weren't bad enough.  They weren't
fucking bad enough!"
660,MACE,660,"The only card we have to play is the
tape.  You know, we get it to the
media somehow..."
661,LENNY,661,"Yeah, right, blow it open."
662,MAX,662,"Mace... no disrespect... but you run
this on the 11 o'clock news, by
midnight you got the biggest riot in
history.  They'll see the fucking
smoke from Canada."
663,LENNY,663,Okay... what about Strickland?
664,MAX,664,No.  Bad idea.
665,MACE,665,Who's Strickland?
666,LENNY,666,"Deputy Commissioner Palmer
Strickland.  The sanctimonious prick
who busted me out.  His ass is so
tight when he farts only dogs can
hear it.  I know this guy.  If
there's one cop who's not dirty
it's him."
667,MAX,667,"Listen to me, Lenny... stay away
from cops.  All cops.  You have no
way of knowing who you can trust."
668,MACE,668,"So you're saying we just pretend is
didn't happen?  It happened!  The
LAPD executed one of the most
important black men in America!  Who
the fuck are you to bury this?!"
669,MAX,669,"Fine.  Do you want blood running
waist deep in the storm drains?  The
gangbangers'll spread like a wave
through this city and burn it to the
ground.  And when the fires start
the street cops'll be capping off at
anything that moves.  It'll be all-
out war and you know it."
670,MACE,670,"Yeah, well maybe it's time for a
war!"
671,MAX,671,You really want that on your head?
672,LENNY,672,"Hey, Max, Mace... whoa... time out."
673,MAX/MACE,673,What!?
674,LENNY,674,"Whoever killed Iris did Tick.  It's
the same sick wirehead shit.  Same
reason... to burn the trail.  If
Faith knows anything about this, and
I think she does, then she's on the
list.  So... who's driving?"
675,FAITH,675,"Lenny!  Jesus!  You scared the Hell
out of me."
676,FAITH,676,What's going on?
677,LENNY,677,"Faith, we know about Jeriko.  Iris
made me a copy of the tape."
678,FAITH,678,"Oh God, Lenny.  I was trying to keep
you out of this."
679,LENNY,679,"How did it happen?  What was Iris
doing riding around with Jeriko
wearing a wire?"
680,FAITH,680,We should talk alone.
681,LENNY,681,No.  Mace is in this.
682,MACE,682,Tell us.
683,FAITH,683,"Tran's gotten obsesses with
playback, a total wiretrip junkie.
And he's such a control freak, he's
been having people followed,
videotaped... recording his business
partners' calls.  Wiring up people
left and right."
684,TRAN,684,Let's go get her.  We're late.
685,MAX,685,"Tran, listen.  I was wondering how
you want me to work it tonight, down
at the Bonaventure.  You want me
downstairs at the party or upstairs
at the suite?  Where you going to
be, mostly?"
686,FAITH,686,"Tran and Jeriko weren't getting
along.  He was afraid Jeriko was
getting ready to dump him, but he
wasn't sure, so he started with the
surveillance.  A couple nights ago
he wires up Iris and sends her and
the other girl, Diamanda, over to
Jeriko's table."
687,FAITH,687,"That night Iris calls up, freaking.
She comes over and Tran watches the
tape.  He just loses it.  He can't
believe the disaster she's gotten
him into.  He's terrified the cops
will beat it out of her who she was
working for, and come looking for
him."
688,LENNY,688,"Kinda guy you can count on in a
pinch."
689,MACE,689,"Why didn't he just go public with
the tape?  Save himself that way."
690,FAITH,690,"The scandal would wipe him out.  If
it got out that he had his own
artists under surveillance... he'd
lose all his other acts.  He'd be
over."
691,FAITH,691,"So finally he gives Iris some cash
and tells her to check into the
hotel under a wrong name till he
figures out what to do."
692,LENNY,692,"Yeah... he figured out what to do
all right."
693,FAITH,693,You think Tran killed her?
694,LENNY,694,"The killer knew right where she was.
Because he put her there."
695,FAITH,695,What a nightmare.
696,TRAN,696,"Go get her, Joey.  Stupid bitch."
697,TRAN,697,We'll talk about this later.
698,MACE,698,Come on.  We're out of here.
699,LENNY,699,"Leave here with me, right now."
700,FAITH,700,"Okay, Lenny.  My guardian angel."
701,TEX,701,Teach you...
702,TEX,702,to mess with...
703,TEX,703,a helpless cripple!
704,CORTO,704,Not here.  Lets go.
705,MAX,705,"Everything's cool.  Too much to
drink."
706,MACE,706,"Yeah, uh... he slipped on the
stairs.  We're taking him to
emergency."
707,MACE,707,Excuse me.
708,COP,708,Go to Cedars.  It's closest.
709,FAITH,709,"Well, I'm certainly in the mood for
a party."
710,TRAN,710,Take her up to the suite.
711,TRAN,711,"Have a glass of champagne... or
six... I'll be up in a while to help
you ring in the New Year."
712,FAITH,712,I live for the moment.
713,MACE,713,"You are a pussy-whipped sorry-ass
motherfucker, you know that?"
714,LENNY,714,Owww!!  Take it easy.
715,LENNY,715,Uh huh.  So where are they now?
716,MAX,716,"He's got her up in the room, under
guard.  And he's still working the
party... acting smooth like nothin's
nothin'.  So buddy... I say we work
a trade."
717,LENNY (V.O.),717,What do you mean?
718,MAX,718,"Give him the tape.  See?  It's
fucking brilliant!  The tape for
Faith.  I know he'll go for it.  I
can set it up."
719,LENNY (V.O.),719,"This is what we laughingly refer to
as a plan, right?"
720,MAX,720,"Come on!  If he gives us any shit,
we kill 'em all.  Whattya say?"
721,MAX,721,"Just get your butt down here.  If
I'm not at the shindig downstairs
go to the room.  It's 2203.  You
writin'?"
722,LENNY,722,2-2-0-3.  Got it.  Stay on her.
723,MAX (V.O.),723,I intend to.
724,LENNY,724,"Okay, we gotta get over there."
725,LENNY,725,"Can you borrow a dress from Cecile
or something--"
726,MACE,726,I'm not going.
727,LENNY,727,"Whatya mean?  We're going!  Tran's
gonna do her right there unless--"
728,MACE,728,"Lenny... shutup.  Just park your
mouth and listen.  It's a set-up.
Think about it!  Why's he been
sending you tapes?  To freak you,
get you to rush in without thinking.
Then they put one in you, put one in
her, put the gun in your hand...
crime of passion.  This guy's bent
enough to think of that."
729,LENNY,729,That sounds right.
730,LENNY,730,I'm going.
731,MACE,731,"You gonna get yourself killed for
this?  This toxic-waste bitch!"
732,LENNY,732,What the fuck are you doing?!
733,MACE,733,"Lenny!  This is your life, Lenny!
Right here.  Right now.  This is
realtime... not playback.  Real...
time.  Time to get real.  Understand
what I'm saying... she doesn't love
you.  Maybe she did once, I don't
know, but she doesn't now.  These
are used emotions.  It's time to
trade them in."
734,MACE,734,"Lenny, memories were meant to fade.
They're designed that way for a
reason."
735,LENNY,735,"Have you ever been in love with
somebody who didn't return that
love?"
736,MACE,736,Yeah.  Lenny.  I have.
737,LENNY,737,"It didn't stop you from loving them.
Right?  Or understanding them, or
being able to forgive them..."
738,MACE,738,I guess.
739,LENNY,739,"And it didn't stop you from wanting
to protect them.  Did it?"
740,MACE,740,No.  It didn't.
741,LENNY,741,"I worked Vice, Narcotics... Violent
Crimes... and I saw every known
depravity.  I was lost, Mace.  In
outer darkness.  Then I busted this
strung-out little teeny-hooker.
When I met Faith she was just
another runaway giving twenty dollar
blowjobs to buy crank.  Another lost
soul."
742,MACE,742,You never told me.
743,LENNY,743,"But she was different.  There was a
light in her eyes... and she had
this voice.  It was scary, all that
pain coming out of that little body.
Like she could take all the hurt and
rage of the entire world and lift it
up to heaven in one voice.  I helped
her.  And I promised her that I'd
always be there... to protect her."
744,LENNY,744,"See?  It's not about what's in her
head.  It's what's in mine.  I can't
let go of the promise.  It's...
like... it's all I have left."
745,MACE,745,"No, it's not."
746,MACE,746,"Come on, Lenny.  Let's go to a
party."
747,MACE,747,That's it.  Let's bail.
748,LENNY,748,Mace... you're a girl.
749,MACE,749,"Good, Lenny.  I can see why the
detective gig didn't work out.  Come
on."
750,LENNY,750,Got your ticket?
751,MACE,751,"No.  They must have sent it to my
beach house by mistake."
752,LENNY,752,You see Tran?
753,MACE,753,Uh unh.
754,LENNY,754,"Come on, Max.  Come on, buddy..."
755,LENNY,755,Damnit.
756,LENNY,756,Alright.  We're going up.
757,MACE,757,"And do what?  Take on his whole
posse?"
758,LENNY,758,"I still got one ace to play.  Tran's
got what I want... and I've got what
he wants..."
759,MACE,759,"That's the original.  There are no
copies."
760,LENNY,760,"Exactly.  That's why it's a make-
able deal."
761,MACE,761,"Look.  That tape is a lightning bolt
from God.  It's worth more than you,
more than me, more than Faith.  You
understand?  It can change things.
Things that need changing before we
all go off the end of the road.  And
you do not have the right to use it
for currency."
762,MACE,762,"You go... you go alone.  This is
where I draw the line.  I care about
you Lenny... a lot more than you
know... which makes us both pretty
stupid.  But you pawn that tape, you
mean nothing to me."
763,MACE,763,"Ah, hell.  Lenny--"
764,LENNY,764,See that guy?
765,LENNY,765,"The one with the ramrod up his ass.
That's Strickland."
766,LENNY,766,Take it to him.
767,MACE,767,A cop?  You want me to trust a cop?!
768,LENNY,768,No.  Trust me.
769,MACE,769,Oh boy.
770,MACE,770,What if you're wrong?
771,LENNY,771,"Then we'll be right where we are
now."
772,MACE,772,"Yeah, right.  Fucked."
773,STRICKLAND,773,Yes?
774,MACE,774,"There's a tape in there you need to
see.  I mean right now."
775,STRICKLAND,775,"If it wasn't New Year's Eve, I'd
arrest you for possession of illegal
equipment--"
776,MACE,776,"Just look at the tape!  You want to
know who killed Jeriko One?  Go in
the stall right now and hit Play."
777,YOUNG COP,777,"Sir, is there a problem here?"
778,MACE,778,Damn!  I knew it--
779,LENNY,779,"Now, Wade, can we talk here, like
two human beings--"
780,LENNY,780,It's not personal.
781,CORTO,781,"Aw, not the fucking nose!!"
782,VITA,782,"Hey, enjoy the party."
783,FAITH,783,Oh.  I didn't hear you come in.
784,LENNY,784,"No, no, no..."
785,FAITH,785,I love you.
786,TRAN,786,"You're going to die, you're both
going to fucking die."
787,MAX,787,"This piece of puke hired me to kill
you, baby.  Do you believe that?
Isn't that right, Tran?  You
pinhead."
788,FAITH,788,"Oh my God.  I don't believe this is
happening."
789,MAX,789,"Believe it.  Now bring me the
trodes, baby.  Come on, quick."
790,FAITH,790,What're you going to do?
791,FAITH,791,You can't just... kill him.
792,MAX,792,I'm not.  Just a little poach job.
793,FAITH,793,Jesus.
794,MAX,794,"Hey, he was going to kill you.  And
this ratfuck paid to have Iris
killed, to save his own sorry ass."
795,MAX,795,"You shut the fuck up, right now,
I'm gonna pull this fuckin' trigger!"
796,MAX,796,"Look, baby, it's now of never... the
guy is a known input junkie, so a
little OD won't surprise anybody.
It's the only way we can be
together.  You know it's true."
797,FAITH,797,My God.
798,MAX,798,"Here's how much I love you, baby."
799,MAX,799,"Don't make any assumptions about our
friendship, Lenny."
800,LENNY,800,"No.  I suppose not.  I didn't know
you were colorblind, Max."
801,MAX,801,Only way I could stand your ties.
802,MAX,802,I'll have that.  Glock 22.  Nice.
803,LENNY,803,Where's Faith?
804,MAX,804,"I sent her to the party.  I figured
I'd wait up here until you killed
Tran."
805,LENNY,805,"What makes you think I'm gonna kill
Tran?"
806,MAX,806,You just did.
807,LENNY,807,Jesus!
808,MAX,808,"You know, statistically that's the
second most common word people say
right before they die.  Shit being
number one."
809,LENNY,809,"So... I killed Tran.  Then you ran
in, being on his payroll, and shot
me."
810,MAX,810,"That's pretty much the way it
happened."
811,LENNY,811,"Wait a minute.  Now I'm remembering.
I killed Iris too, didn't I?"
812,MAX,812,"That's right.  They'll find the
original of her snuff clip in your
apartment.  The one I left for you
at the club was a copy."
813,LENNY,813,"Was I a really busy guy?  Did I do
Tick too?"
814,MAX,814,You bet.  Did you like it?
815,LENNY,815,"So why Max... why d'ya have to do
Iris?  She never hurt anybody."
816,MAX,816,"Picture it... I feel like I gotta
share this with somebody.  It's too
perfect."
817,LENNY,817,I won't say anything.
818,MAX,818,"I know.  So, I'm working for this
puke, right?  And he says he'll pay
me quite large to do the hooker.
But also I gotta do his bitch
girlfriend cause she knows the whole
score and she's totally out of
control."
819,MAX,819,"Only he doesn't know about me and
Faith.  So I say to myself, if I
turn the job down, he just gets
somebody else.  And I lose Faith...
to coin a phrase.  So to buy time, I
do the skank.  I still gotta do
something about Tran... I figure
it's him or me... but I can't cap
him without a chump to take the
fall.  And who better than his
girlfriend's loser ex-boyfriend... a
known criminal... who has been seen
hassling them in public numerous
times."
820,LENNY,820,"And who was, regrettably, also your
best fucking friend."
821,MAX,821,"No plan is perfect, Lenny.  Hey,
cheer up.  World's gonna end in ten
minutes anyway."
822,LENNY,822,"You must be so pleased, I followed
your jellybean trail right here,
like a good little chump."
823,MAX,823,You got froggy on me a couple times.
824,MAX (V.O.),824,"I thought that riff about the Death
Squad was pretty good.  I hadda keep
you from bringing the cops into it."
825,LENNY,825,So there never was a death squad.
826,MAX,826,Naawww.
827,LENNY,827,"Just those two loose-cannon cops
running around covering their butts."
828,MAX,828,"Yeah.  Pretty zany, huh?  All this
shit caused by a random traffic
stop.  Hey... nothing means nothing.
You know that.  Look around... the
whole planet's in total chaos.  You
gotta take what you can, while you
can.  Cause some shitbird can come
up and put a fuckin' .22 in the back
a your head any second."
829,LENNY,829,How did you hook up with Faith?
830,MAX,830,"This dink hires me a month ago to
eyeball her, right?  But Faith knows
me from you, right, so she comes up
to me and says, 'Hey Max why you
following me?' I say, 'I'll buy you
a drink and explain.' And she says..."
831,FAITH,831,"'So, do you enjoy watching me?'"
832,MAX,832,"You were supposed to go downstairs,
baby."
833,FAITH,833,"I know.  I don't always do exactly
what I'm told."
834,FAITH,834,"So I said, 'Do you enjoy watching
me?'  And you said -- come on Max."
835,MAX,835,"I said, 'Yeah.  I'd even do it for
free.'"
836,FAITH,836,"Uh huh.  And I said, 'That's good,
because I like the feeling of
someone watching me.  I acquired
the taste from Lenny.'"
837,MAX,837,"And then she said, 'Since we're
going to be spending so much time
together--'"
838,FAITH,838,"'We might as well make the best of
it.'"
839,LENNY,839,"Jesus, Faith."
840,FAITH,840,Lenny!!
841,MAX,841,Fucking bitch!!
842,MACE,842,All the way down!  RIGHT NOW!!
843,MACE,843,"Wait.  Let me tell you what's going
on here--"
844,MACE,844,NO!!  NO!!!
845,STRICKLAND,845,"These two are under arrest for
murder."
846,STRICKLAND,846,"Get some medical attention for this
woman."
847,LENNY,847,Are you okay?
848,MACE,848,"I got 'em, Lenny."
849,LENNY,849,SHOOT!
850,SPREG,850,YOU FUCKING NIGGER BITCH!!
851,LENNY,851,"Yeah, what?"
852,MACE,852,Are we under arrest?
853,LENNY,853,"Naw.  They just have to ask us a
few questions... for about six
hours."
854,CROWD,854,TEN!  NINE!  EIGHT!...
855,CROWD,855,SEVEN!  SIX!  FIVE!...
856,CROWD,856,"FOUR!  THREE!  TWO!  ONE!  HAPPY NEW
YEAR!"
857,MACE,857,"Hey, Lenny.  We made it."
858,LENNY,858,Yeah.  We did.
859,MACE,859,Well...
860,MACE,860,Get going.  You're still bleeding.
861,LENNY,861,See you downtown.
862,MACE,862,Yeah.  See you there.
