,character,line #,line
299,LENNY,299,"That would be between me and Faith,
wouldn't it?"
300,TRAN,300,"I don't feel anything between you.
See, your trouble is you assume too
much, Lenny.  You assume there's
something where there's nothing.
You assume you have a life.  But
you're only hustling pieces of other
lives on tape, and broken parts of
your own."
301,FAITH,301,"We have nothing to talk about,
Lenny."
302,TRAN,302,"Joey, make sure Mr. Nero gets safely
to his car."
303,LENNY,303,"Faith, call me, okay?"
304,FAITH,304,"No, Lenny."
305,LENNY,305,"Tick, listen, I can't stop right
now.  but I'll call you tomorrow
about that thing we were talking
about."
306,TRAN,306,"Lenny the loser.  Panhandler of
stolen dreams."
307,FAITH,307,"Leave him alone, Tran."
308,TRAN,308,"He's no concern of mine, as long as
you don't talk to him.  Don't talk
to anybody.  You understand?  Not
with everything that's going on
right now."
309,FAITH,309,You're too goddamned paranoid.
310,TRAN,310,"Paranoia's only reality on a finer
scale."
311,LENNY,311,"So, those rascals still haven't
grown back yet, huh?"
312,TEX,312,"Nope.  Guess not.  Any day now,
though."
313,LENNY,313,"Present.  Something I had made.  Let
me know what you think."
314,TEX,314,"Hey, alright.  Got something here
for you, too."
315,TEX,315,"It just showed up tonight, don't
know who left it."
316,LENNY,316,Fan mail from some flounder?
317,LENNY,317,"Hi, baby.  I've missed you."
318,FAITH,318,"I know.  Lenny, if Tran finds you
talking to me he'll hurt you."
319,LENNY,319,I'm already hurting.
320,FAITH,320,You have to go.  I mean it.
321,LENNY,321,"Yeah, OK, whatever you say.  Just
answer one question.  Is anything
wrong?  Iris said you might be in
trouble."
322,FAITH,322,You talked to Iris?  When?
323,LENNY,323,Tonight.
324,FAITH,324,"Well I haven't seen her in months.
Who knows what's going on in her
head.  You're really running out of
excuses to come around, aren't you?"
325,LENNY,325,"I know you Faith.  You're afraid of
something.  What's going on?"
326,FAITH,326,"Let it alone, Lenny.  It'll take
care of itself."
327,LENNY,327,"It's Tran, isn't it?  This guy is
poison, Faith.  Listen to me.  He's
got you walled in on all sides.  And
he uses the wire too much, he gets
off on tape, not on you."
328,FAITH,328,"That's a good one, coming from you."
329,LENNY,329,"Why don't you just split?  You don't
love him, anybody can see that.  And
to him you're just some kinda
possession, like a Ferrari,
something to show the other guys."
330,FAITH,330,He has his uses too.
331,LENNY,331,"What?  He gonna record you on his
label?"
332,FAITH,332,Maybe.
333,LENNY,333,"Come on, Faith!  He's just toying
with you.  And when he gets bored,
you'll be yesterday's papers."
334,LENNY,334,"Look, baby, I've watched you create
yourself out of nothing.  You're
like a goddamn cruise missile,
targeted on making it.  And you
will."
335,FAITH,335,Damn right.
336,LENNY,336,"It's you up on that stage, not him.
You don't need him."
337,FAITH,337,"You have to get out of here.  If
Tran catches you he'll... he's
acting crazy.  He's doing way too
much playback and he's getting
completely paranoid.  He's such a
control freak, he's even paying Max
to follow me around."
338,LENNY,338,Max Pelcher?  You're kidding?
339,FAITH,339,"Yeah, for about a month now.  Lenny,
just stay away from Tran, okay?  And
stay away from me.  Stop trying to
rescue me.  Those days are over.
I'm a big girl now.  Stop trying to
save me, okay, because I don't need
saving... Just... give up on me."
340,LENNY,340,Can't do it.
341,FAITH,341,"You know one of the ways movies
still have Squid beat?  Because they
always say ""The End."" You always
know when it's over.  It's over!
Now please leave.  I have to go on
again in a couple of minutes."
342,FAITH,342,Hell.
343,LENNY,343,"Shoulda told me about your new gig,
buddy."
344,MAX,344,"I was gonna tell ya.  Hey, it's just
a job.  I feel like shit about it."
345,LENNY,345,You should feel like shit.
346,MAX,346,"I figured, what the hell, I could
take the prick's money and make sure
Faith was OK at the same time.  Do
us both good.  Right?"
347,LENNY,347,"Fairly twisted logic, Max, even for
you."
348,LENNY,348,"Hey, at least you got a job!"
349,LENNY,349,Watch her for me.  Stay on her.
350,MAX,350,I'm on her.
351,LENNY,351,Can I get that?
352,MACE,352,"Hey Lenny, where the hell are you, I
think Tran's got Beemer looking for
you."
353,LENNY,353,Thanks for the tip.
354,LENNY,354,"I recognize you.  You're Wade
Beemer.  Running back for the Rams,
am I right?"
355,BEEMER,355,"Yeah, that's right."
356,LENNY,356,"I saw you play, man.  You were good.
Like a fucking freight train I
remember saying.  So what happened,
injuries or what?"
357,BEEMER,357,Bullshit politics.
358,LENNY,358,"It's always politics.  Like this
thing we're in here, he's paying you
to tune me up, right?  But I could
pay you more not to.  See what I
mean?  I could write you a check
right now--"
359,BEEMER,359,"Come on, let's go, I got to get
back."
360,LENNY,360,"Okay cash!  Logical.  Here's
everything I have on me, what do you
say?  How about a Rolex?"
361,BEEMER,361,"I already got a real one.  Come on,
it won't be too bad.  It's not
personal."
362,LENNY,362,Just not the eyes.
363,LENNY,363,"They oughta get some lights back
there.  A person could get killed
slipping on those stairs.  Let's go."
364,MACE,364,"You're some piece of work, you know
that.  Just calmly backstroking
around in the big toilet bowl, and
somehow you never let it touch you.
I mean, between Vice and this so-
called occupation you're in now, you
must've seen it all."
365,LENNY,365,"I have crawled through the gutter...
through every wrinkle in the human
brain."
366,MACE,366,"What I'm saying.  But you still come
out this goofball romantic."
367,LENNY,367,"It is my sword and my shield, Macey."
368,MACE,368,What's that?  Present from Faith?
369,LENNY,369,No idea.
370,LENNY,370,It's a test pattern so far.
371,LENNY,371,"Alright, a little B&E action."
372,LENNY,372,"Hey, getting good.  Solid suspense
build."
373,MACE,373,What is it?
374,LENNY,374,"Go to the Sunset Sheraton.  RIGHT
NOW!  Just go!  GO!"
375,IRIS,375,"I haven't seen your face... I
haven't heard your voice... you can
still let me go..."
376,LENNY,376,"Holy shit.  He's jacking her in to
his own output.  She's seeing what
he's seeing.  She's seeing herself."
377,LENNY,377,On my God.  Oh my God.
378,MACE,378,"My God, Lenny.  What is it?"
379,LENNY,379,Black.  Jack.
380,MACE,380,Blackjack?  I don't understand--
381,LENNY,381,"Snuff clip.  It was Iris.  She said
she needed my help and I... aw
Jesus, Mace... the sick fucker
killed her."
382,MACE,382,Are you sure it's real?
383,MAX,383,Ohhhh shit.
384,MAX,384,Well... I've lost my appetite.
385,MAX,385,For about a year.
386,MACE,386,No way.
387,MAX,387,You alright?  Y'okay?
388,LENNY,388,"Yeah.  No, not really."
389,MAX,389,Let's work it.
390,LENNY,390,"Not now... I don't want to think
about it--"
391,MAX,391,"Come on, Lenny.  You used to be good
at this stuff.  Play it down.
What's the perp doing?"
392,LENNY,392,"He stalks her.  He rapes her.  Then
he does her..."
393,MAX,393,"And he records it.  Thrill kill.
Wants to see it again.  And again."
394,LENNY,394,"He records himself raping and
killing her--"
395,MAX,395,"But at the same time he's sending
the signal to her--"
396,LENNY,396,"So she feels... what he feels...
while he's in her.  The thrill while
he's killing her... is sent to her,
heightening her fear... which in
turn heightens the turn on for him."
397,LENNY,397,"I've seen a lot, Max."
398,MAX,398,So've I.  Too much.
399,LENNY,399,But this is a bad one.
400,MAX,400,Top ten.
401,LENNY,401,"He makes her see her own death,
feeds off the reaction... killer and
victim merging... orgasm and agony
merging.  And he records it all."
402,MACE,402,And gives it to you.
403,LENNY,403,Wants to share.
404,MAX,404,"That's right.  He wants to share.
Needs an audience.  This is one sick
puppy."
405,LENNY,405,Why me?
406,MACE,406,"Cause you're the man, right?  The
Magic Man.  If it's got something to
do with the wire, sooner or later it
washes up on your beach."
407,LENNY,407,"I've never dealt in black-jacks.
Never.  Everybody knows that."
408,MAX,408,"He's skull-fucking you, bud.  Trying
to get a reaction.  Maybe pushing
you to do something."
409,MACE,409,"Maybe he just figures Lenny will
appreciate what he's created.  It's
the dark end of the street, Lenny.
How do you like it now?"
410,LENNY,410,"Jesus, Mace.  Back off."
411,MACE,411,"This guy is someone you know, one of
your squid-head contacts."
412,MAX,412,"Problem is, Lenny knows everybody."
413,MACE,413,Take the tape to the cops.
414,LENNY,414,Uh unh.  No way!  They'd crucify me.
415,MACE,415,"So some psycho wire-freak gets to
keep running around--"
416,MAX,416,"Naw, he's right.  They'll figure
Lenny's the perp, or go through his
client list, ruin his life... such
as it is.  Look, I'll call the guys
in Homicide... tell them she was a
friend of mine and they'll keep me
in the loop.  Get me the forensics
and all that."
417,MAX,417,"Get some sleep.  I'll call you when
I get something."
418,MAX,418,"And Lenny... I'd keep moving if I
were you."
419,FAITH,419,"You're crazier than I thought,
Lenny.  Coming here... Tran's just
in there."
420,LENNY,420,Iris is dead.  She was murdered.
421,FAITH,421,Who did it?
422,LENNY,422,"Don't know.  But this guy's real
damaged goods.  Iris knew someone
was after her... and she said you
were in danger too."
423,LENNY,423,"Now no more games, Faith.  Whatever
you're hiding, whatever's going on,
you have to get out of here now.
Come with me right now.  Don't even
think about it."
424,FAITH,424,"Then what?  Then what, Lenny?!  You
going to protect me?  Big tough guy.
You're a talker, Lenny.  You don't
even have a gun."
425,LENNY,425,I have a gun.  It's under my bed.
426,FAITH,426,"You don't know what you're fucking
with here."
427,LENNY,427,Tell me.
428,TRAN,428,"Go ahead, Faith.  Tell him."
429,FAITH,429,"Look, Tran... Lenny just came by to
give me some bad news.  An old
friend of mine has been murdered.
You remember Iris?"
430,TRAN,430,"A tragic story, no doubt."
431,TRAN,431,How'd you get up here?
432,LENNY,432,Charm.
433,TRAN,433,"Uh huh.  Look, Nero.  I'll make you
an offer."
434,TRAN,434,"Take her.  Right now.  If she wants
to go, if she's unhappy here, she
can go.  I'll let her choose.  Faith
always knows what she wants."
435,TRAN,435,Hands off.  See?
436,LENNY,436,It's alright.  He means it.
437,TRAN,437,I do mean it.
438,TRAN,438,"And I mean this... if Faith stays
you go away and never come back.
You scuttle back into your cockroach
hole and never cross my vision
again.  You understand?"
439,FAITH,439,"I made my choice, Lenny."
440,TRAN,440,You're going down.
441,FAITH,441,"I don't love you, Lenny.  Give up."
442,FAITH,442,"You said you were going to get her
out of this."
443,TRAN,443,"Maybe now you appreciate the danger
we're in."
444,TRAN,444,"It was touching the way you stood by
me in there.  ""Stand by your man"".
I was moved.  You were very good.  I
don't think he even understands that
you did it for him."
445,FAITH,445,"He doesn't know what's going on.
Leave him alone."
446,TRAN,446,"I'd love to.  But he keeps showing
up.  And you keep talking to him.  I
can't have that--"
447,TRAN,447,"The only time a whore should open
her mouth is when she's giving head."
448,FAITH,448,Fuck you.
449,TRAN,449,Maybe later.
450,LENNY,450,"Listen, can we be smart here?  I
could make it really worth your
while... I could cut you a check for
500 each... hell, make it an even
grand... I'm not saying you don't
land a couple shots, just go light
is all I'm saying... here, take my
Rolex."
451,CORTO,451,Lemme see.
452,CORTO,452,"We tried to find a smaller girl, to
beat the shit out of you, Lenny...
but it was short notice."
453,MACE,453,Safety's on.
454,MACE,454,Lenny!
455,LENNY,455,Is this great fabric or what?
456,MACE,456,"You ever wonder why you get beat up
a lot?"
457,LENNY,457,Never really thought about it.
458,LENNY (V.O.),458,"Come on... look in the mirror.  You
know it's there, you're keeping your
eyes off it, you bastard... SHIT!
Who are you?"
459,LENNY,459,"He knows what he's doing.  He's worn
before... a lot."
460,MACE,460,So that gives you something.
461,LENNY,461,"It gives me... I don't know... maybe
two hundred people who I know wear."
462,MACE,462,"Don't crank the gain any more.
You're gonna fry yourself."
463,LENNY,463,"I need to see more... get more
detail.  Something.  I feel his
presence, so strong..."
464,MACE,464,"No more, Lenny."
465,LENNY,465,Yeah.  I'm ghosting pretty bad.
466,LENNY,466,"She came to me for help.  I should
have read it better... I just
figured, y'know... another strung-
out hooker having a bad night."
467,MACE,467,It's not your fault.
468,LENNY,468,"Sex killers act alone.  So there's
no information on the street, which
is how cases get made.  Cops know
they'll never nail this guy the
second they look at the scene."
469,LENNY,469,"And anyway, nobody gives a shit
about a dead hooker.  They're
roadkill."
470,LENNY,470,"See, it's all about what they see
walking in.  A dead hooker,
handcuffs, penetration... they'll
see a trick gone wrong.  Random
kill.  The kind you never solve."
471,MACE,471,"But that doesn't add, does it."
472,LENNY,472,No it doesn't.
473,MACE,473,"Because Iris knew somebody was after
her."
474,LENNY,474,"She said ""If they get me"".  They.
Which means the whole sex-killer
thing is a cover, which means
somebody whacked her for a reason."
475,MACE,475,So the guy's not a sicko.
476,LENNY,476,"If he could do what's on that tape,
he's a sicko."
477,MACE,477,"Okay, so he's a freak who thinks
he's sane pretending to be a freak.
The point is, he was a hitter.
Somebody wanted to shut her up.  But
why not just put a little lead in
her ear?"
478,LENNY,478,"Because it had to look random.  Not
connected to anything or anyone."
479,LENNY,479,But then why give the rape to me?
480,MACE,480,"That's where it gets a little
strange."
481,LENNY,481,"And what about the guy that was
following me?"
482,MACE,482,Now you're really getting paranoid.
483,LENNY,483,"The question is not whether I am
paranoid, but whether I am paranoid
enough.  You want to rub my neck?"
484,MACE,484,Sure.
485,LENNY,485,How's Zander?
486,MACE,486,"OK.  He asks about you all the time.
It's been weeks since you've seen
him."
487,MACE,487,"I'm sorry about getting on your case
earlier.  I just see you getting
sucked in deeper and deeper, and I
-- anyway.  I'm sorry."
488,LENNY,488,S'okay.  I know you still love me.
489,ZANDER,489,"Where were you Mom?  Did you meet a
guy?"
490,MACE,490,Just Lenny.
491,ZANDER,491,Right.  That explains it.
492,MACE,492,Are you going to make me beg?
493,MACE,493,What is that?
494,ZANDER,494,"Cheerios and wieners.  I made it
myself.  It's good."
495,MACE,495,"Well give me some then... I'm
starving."
496,MAX (V.O.),496,"Hey, the last day of the world and
you spend it in bed."
497,LENNY,497,"W'sup, Max?"
498,MAX,498,"Not a whole hell of a lot.  They've
just been saying words over Jeriko.
Tensions running pretty high down
here.  I'm telling you."
499,LENNY (V.O.),499,Faith OK?
500,MAX,500,"Yeah.  She's leaving with Tran so I
got to boogie.  Real quick... Iris
checked into the Sheraton last night
under a false name.  Paid cash."
501,LENNY,501,Looks like she was holding out.
502,MAX,502,"Yup.  Hey, so I heard you dropped in
on Tran last night.  Another slick
Lenny move."
503,LENNY (V.O.),503,"He's in this somehow... I don't know
how.  Just stay close to Faith."
504,MAX,504,"I'm on her, amigo.  No worries.
Gotta jam."
505,MACE,505,Whatup Lenny?
506,LENNY,506,"Jesus, Mace!"
507,MACE,507,Where we going?
508,LENNY,508,Anywhere.
509,LENNY,509,We'll talk about it in the car.
510,LENNY,510,"Hand me that box of tapes, will you?"
511,MACE,511,What is it?
512,LENNY,512,This tie doesn't go with blue!
513,POOR MAN,513,"... the New Years Eve mega-bash of
the century.  Ten square blocks of
madness, with live music, fireworks
and the actual rich and famous of LA
hobnobbing with us peons.  Also
yours truly the Poor Man will be
there at the KROQ bandshell, giving
away ""Millennium LA"" and ""KROQ 2-K""
T-shirts by the truckload--"
514,MACE,514,"Will you relax.  There's nobody back
there."
515,LENNY,515,"Mace, the guy had a knife.  To my
throat.  In my living room.
Relaxing might be right out, okay?!"
516,MACE,516,"You better keep a low profile for a
while."
517,LENNY,517,No shit.  You got someplace in mind?
518,ZANDER,518,What do you got?
519,LENNY,519,Today I have...
520,MACE,520,"Lenny, have you lost it completely?"
521,LENNY,521,"Easy, there, Mom.  Easy.  This is
audio only."
522,LENNY,522,"John Coltrane.  ""A Love Supreme.""
Give it a listen, let me know what
you think, maybe you won't go for it
now, but it'll get in your head and
grow like a seed into something
really beautiful."
523,ZANDER,523,Let's play it now!
524,LENNY,524,"Later.  Your mom'n I are heading
right back out."
525,CECILE,525,"Hey, come on, I been baby-sitting a
full 24 hours, I have to get ready
for the party tonight..."
526,MACE,526,Cecile.
527,MACE,527,"You're not the only little boy I
have to look out for, honey."
528,TICK,528,"Whoa.  That is one unbelievable
piece of eyefuck."
529,LENNY,529,"Skip the art criticism, Tick, what
can you tell me about the wearer."
530,TICK,530,Well... the guy's fucked up.
531,MACE,531,"We know that, Tick."
532,TICK,532,"No, I mean the killer's got some
kind of distortion in his visual
cortex.  The color and gray-scale
values are all messed up, like color
blindness."
533,TICK,533,"Lookit, you see the peak period
ratios there?  Could be some kind of
tumor or brain lesion or something.
Some kind of trauma"
534,TICK,534,"This is not good.  I don't like this
at all..."
535,LENNY,535,What?
536,TICK,536,"Well, it's cutting awful close to
me.  I mean she was just here."
537,LENNY,537,Who was just here?
538,TICK,538,"Iris, man.  Pay attention."
539,LENNY,539,"Wait, wait... wait a minute.  Iris
was here?!"
540,TICK,540,"Yeah, she came by last night.
Shaking like a junkie, wanting me to
make a copy of some clip."
541,LENNY,541,What clip?  What was it?
542,TICK,542,"I don't know, man, she wouldn't let
me see it.  Said I wouldn't want to
see it.  She said she was going to
give it to you to hold for her.
Like insurance or somethin'"
543,LENNY,543,She never gave me a tape.
544,MACE,544,"Think back about what she said.
Exactly what she said."
545,LENNY,545,"She wanted to go out to my car,
something about my car..."
546,MACE,546,Something in your car...
547,LENNY,547,"That's a handy little attitude
adjuster."
548,LENNY,548,Damn.  I'm boxed in.
549,MACE,549,What's it say?
550,LENNY,550,Nothing.  Let's go play this back.
551,SPREG,551,Give me the tape.  Right now.
552,LENNY,552,"What tape?  I'm just trying to get
my car back but the place is
closed--"
553,SPREG,553,Shut the fuck up Nero.
554,MACE,554,"Lenny, give them the tape."
555,LENNY,555,"It's in my case.  Okay?  I'm going
to open my case..."
556,ENGELMAN,556,"Facing us, where we can see it."
557,LENNY,557,Take it and turn her loose.  Okay?
558,SPREG,558,Absolutely.
559,LENNY,559,"Oh no, we're not being followed,
Lenny, Don't be so paranoid, Lenny."
560,LENNY,560,Shit!
561,MACE,561,"Take it easy.  The glass is bullet
resistant."
562,LENNY,562,"Bullet resistant?  Whatever happened
to bullet proof?"
563,MACE,563,"Lenny.  Calm down.  This is what I
do."
564,LENNY,564,Goddamnit!!  911 is busy!
565,MACE,565,"It's okay, Lenny"
566,MACE,566,"They'd never get here in time
anyway."
567,MACE,567,This is bad.
568,LENNY,568,"The gas tank's going to go any
second!"
569,LENNY,569,Are you out of your fucking mind?!
570,MACE,570,"Fire's out, isn't it?"
571,MACE,571,"Get in here.  Come on Lenny, move
it.  MOVE!!"
572,MACE,572,Get ready to hold your breath.
573,MACE,573,"Lenny, kick out hard, then just
follow me. Okay?"
574,SPREG,574,Let's get out of here.
575,MACE,575,"I can't believe we had to give them
the damn tape."
576,LENNY,576,"Yeah, me neither.  It was one of my
favorites.  Me and Faith in a hot
tub on my birthday.  I'm going to
really miss it."
577,LENNY,577,Are we impressed yet?
578,CURTIS,578,"I got better things to do on New
Year's Eve than be some kinda damn
chauffeur..."
579,MACE,579,Hey Curtis?  Just drive.
580,LENNY,580,Those two guys were cops.
581,MACE,581,You sure?
582,LENNY,582,"It's the walk.  Something.  Anyway,
they'll run your plates and get your
address.  We gotta keep moving."
583,CECILE,583,"Lornette, girl... what's going on?"
584,MACE,584,"We're going to aunt Cecile's, honey.
We're going to watch fireworks from
there.  Let's go.  Chop chop."
585,ZANDER,585,"Aw, Mom!"
586,LENNY,586,"Come on Zander.  You can ride on my
shoulders.  Here you go."
587,MACE,587,"Cecile, get in the car.  Now."
588,ONE OF THE BOYS,588,"Yo, Mace.  Whatup wit you, homegirl?
You never come roun' here no more."
589,MACE,589,He's with me.
590,MACE,590,Tell me.
591,LENNY,591,"I can't tell you.  You've got to
see."
592,MACE,592,Uh unh.  I won't do it.
593,LENNY,593,"Mace.  I know what you think about
the wire.  But I'm asking you to do
this.  It's that important."
594,LENNY,594,"Sorry this has to be your first
playback."
595,LENNY,595,"Keep your eyes closed, or you'll see
double."
596,JERIKO,596,Shit.  Fuckin' Five-O
597,COP VOICE,597,Go to the bottom of the ramp.
598,JERIKO,598,"Goddamn, now what you pull me over
for?  If I was going any slower I'd
be parked--"
599,COP VOICE 1,599,"Get down on your knees and put your
hands on your head.  Now!"
600,COP VOICE 2,600,"Everyone else, out of the car and
down on the ground."
601,COP VOICE 1,601,"Put your hands behind your head
right now!"
602,ENGELMAN,602,"Put your hands on the hood of the
car and don't move."
603,JERIKO,603,"I suppose you stopped us cause you
had suspects fitting our description
in the area, what you're gonna tell
me.  What was the description?  Two
black males in a car?  Yeah, right,
I heard that one before..."
604,JERIKO,604,"Well you stopped the wrong black
male tonight officer... what is it?
Spreg.  Officer Spreg.  Cause I'm
the 800 pound gorilla in your mist,
fucker.  I make more in a day than
you make in a year, and my lawyers
love to spend my money dragging
sorry-ass Aryan robocops like you
into court.  Get a man down on the
ground with no probable cause.  Fuck
you!"
605,SPREG,605,Shut the fuck up!
606,DIAMANDA,606,"Leave the fuck off of us, we weren't
doing anything..."
607,SPREG,607,"Shut up!  Don't make me walk over
there."
608,SPREG,608,"You're that rap puke?  Jeriko One?
You're the one getting all the
gangbangers to form citizens groups
and go downtown... trying to rake
the LAPD over a cheese grater?"
609,JERIKO,609,"That's right.  And you're gonna be
in my next song, motherfucker, it's
called Robo-Spreg."
610,JERIKO,610,"It's a song about a cop who meets
his worst nightmare, a nigger with
enough political juice to crush his
ass like a stink bug.  You're gonna
be famous."
611,SPREG,611,I don't think so.
612,SPREG,612,Hey... I don't hear you laughing!
613,SPREG,613,Get the bitches.
614,LENNY,614,"Hang on.  Hang on, Max."
615,LENNY,615,You see?
616,MACE,616,I see.
617,MACE,617,"I see the earth opening up and
swallowing us all."
618,LENNY,618,Yeah I know.
619,LENNY,619,So what do we do?
620,MAX,620,"Don't talk to anybody.  Anybody.
You're invisible.  Okay?  Just meet
me at Tick's in a half hour.  And
Lenny... don't get pulled over."
621,LENNY,621,"We got to make another copy of this.
Little life insurance."
622,MACE,622,"You know what this tape could do if it
gets out."
623,LENNY,623,"I've got a good idea, yeah."
624,MACE,624,"People finding out... seeing... that
the LAPD just flat out executed
Jeriko One.  Jesus.  Maybe they
ought to see."
625,LENNY,625,"Maybe.  But tonight is probably not
the best night.  Come on, we're
rollin'."
626,CECILE,626,"Lornette, when you gonna stop laying
off everything on me?  We had plans
tonight--"
627,MACE,627,"Listen to me, little sister.
There's something going on, and it's
very big.  Now you've got to take
care of Zander.  And stay off the
streets tonight... you hear me on
this?"
628,MACE,628,"Curtis.  What about you?  Do we
understand each other?  You stay
put."
629,CURTIS,629,Yeah.  I'm wit it.
630,CURTIS,630,Damn!  She worse than you.
631,LENNY,631,"So, let's see, I've got Tran's
goons, some squidhead psycho and the
LAPD all trying to kill me.  Happy
new year, Lenny."
632,MACE,632,"Well, look at the plus side."
633,LENNY,633,There's a plus side?
634,MACE,634,"Yeah.  You gave up your hot tub tape
to save me.  That's real progress
for you."
635,LENNY,635,It was a tough call.
636,MACE,636,"I still can't square the psycho
smarts of whoever did Iris with
those two cops."
637,LENNY,637,"I don't think those cops did Iris.
I think whoever Iris was wearing for
killed her."
638,MACE,638,Why?
639,LENNY,639,"To break the trail.  If those cops
had gotten hold of her, they would
have beat it out of her who she was
wearing for, and then gone after
them too.  Our killer is running as
scared as we are.  Which makes him
really dangerous.  Judging by how
scared I am."
640,MAX,640,"Sounds like Tick's already
celebrating."
641,LENNY,641,"You may be a little overdressed for
this party."
642,LENNY,642,"Yo, Tick!  It's Lenny.  Open up!"
643,LENNY,643,"Tick, I got to talk to you, man...
oh shit."
644,LENNY,644,He's been cooked-off
645,MAX,645,Is he dead?
646,LENNY,646,"No.  But his frontal lobes are like
two runny eggs.  They put an
amplifier in-line to boost the
signal till it french-fried his
brain."
647,LENNY,647,"He's totally cut off from the outer
world."
648,MACE,648,How long does it last?
649,MACE,649,Oh.
650,MAX,650,"Those two psycho cops are on a
slash-and-burn to find the tape and
cover their tracks."
651,MACE,651,"This seems a little sophisticated
for them.  These are not subtle
guys."
652,MAX,652,"There's more to this whole thing
than you think."
