,character,line #,line
661,GORDON (O.S.),661,"Now Bernoulli's Principle states
that the air flowing over a bird's
wings... is moving at a lower
pressure than the pressure below
the wing... that's called 'lift.'
Course, it's just a theory... it's
never been tested."
662,WEST,662,"You're not makin' me feel any
better."
663,COLEMAN,663,"Here's a coupla bon voyage
presents."
664,GORDON,664,"Coleman! Must you smoke when
handling explosives!"
665,WEST,665,"He's just a little nervous 'cause
no one's ever flown before."
666,WEST,666,Avant...! Avant!!!
667,GORDON,667,"We're not getting enough lift!
We need more speed!"
668,WEST,668,"Hey, uh... that's the cliff over
there, you know?"
669,GORDON,669,"Yes, I do know."
670,GORDON,670,It worked...? It worked!!
671,WEST,671,"If you had to get one right, I'm
real glad it was this one."
672,GORDON,672,Yeee-haaa!
673,LOVELESS,673,"Mr. President, I'll ask you once
again. Sign the surrender or I
decimate this town!"
674,PRESIDENT GRANT,674,You've had my answer.
675,LOVELESS,675,"I find the sound of people
screaming while they get blown to
smithereens, ruins the ear for
music. Don't you?"
676,LOVELESS,676,Commence firing!
677,GORDON,677,I think I'll call it...
678,WEST,678,Lemme guess... an Elevation Enhancer?
679,GORDON,679,"No, Air... Gordon."
680,WEST,680,"Go down, down there!"
681,GORDON,681,"You can't just 'go down there.'
Flight depends on lift, which must
be calibrated to the angle of
descent..."
682,WEST,682,"Shut up and go down there, will
ya?"
683,LOVELESS,683,"Well, Mr. President. Have you had
enough yet? Would you like to
sign the surrender or shall we set
a course for Denver? Wichita?
Washington, perhaps?"
684,PRESIDENT GRANT,684,"Well, I'll be damned... it's West
and Gordon... flying!"
685,PRESIDENT GRANT,685,"Keep that surrender handy. I
think you're going to need it!"
686,LOVELESS,686,Don't be too sure...
687,LOVELESS,687,"I'm through with diplomacy... Take
him away and kill him!"
688,WEST,688,"What does your boy da Vinci say
about puttin' this bird down?"
689,GORDON,689,"I don't think he thought it would
ever work, so he didn't get that
far. I'm open to suggestions."
690,WEST,690,"Take out as many bad guys out as
you can."
691,LOVELESS,691,Munitia!   Munitia!!!
692,GORDON,692,"Sorry about that, sir. Nose up,
flaps down. Have to remember that
next time."
693,PRESIDENT GRANT,693,"Son, never apologize for saving a
President's life."
694,AMAZONIA (O.S.),694,"Soon you all can fly again. This
time with little angel wings."
695,LOVELESS,695,"Gentlemen, I am truly impressed by
your effort and ingenuity. Why
not swear an oath of loyalty to
me... and forego your executions."
696,WEST,696,"Why not? Well, I guess maybe I'd
rather see what happens when I
stuff your ass into that cannon
up there and fertilize the
landscape."
697,GORDON,697,"Uh, Jim, I think a polite 'no'
would suffice..."
698,LOVELESS,698,"Lippenreider, take over the
controls."
699,LOVELESS,699,"We may not have a woodshed on
board, but that boy is gonna get a
whoopin' anyway!"
700,WEST,700,"So, I guess you're the one who's
gonna give me my whoopin'."
701,WEST,701,Pfft.   I got one a' those.
702,WEST,702,But you've got two of those.
703,WEST,703,"Okay, lemme talk to Gordon, I'll
see if he can..."
704,WEST,704,Damn.
705,WEST,705,No more Mister Knife guy!
706,SHOVEL GUY,706,I learned that from a Chinaman.
707,WEST,707,I just made that up.
708,WEST,708,Don't forget your shovel!
709,WEST,709,"Is that all you got for me,
Loveless?!"
710,WEST,710,"Uh, I just threw my shovel out.
So this really isn't fair. If
you don't mind, I'd like to..."
711,"WEST
(incredulous)",711,Noooo.
712,WEST,712,Sorry.
713,METAL HEAD,713,Urrrrrrrrrrggggghhh!!!
714,"WEST
(downward)",714,"You guys just don't get out
enough."
715,WEST,715,"When you get right down to it,
Loveless, you just can't beat
a good pair of legs."
716,LOVELESS,716,"You're obviously not a poker
player, Mr. West..."
717,LOVELESS,717,Two pair always beats a pair.
718,LOVELESS,718,"Now... Was it someone particularly
close to you who perished in that
military action?"
719,"LOVELESS
(stunned)",719,"Hmmm.   Well, that hit a nerve."
720,LOVELESS,720,"A mother, perhaps? A father?"
721,LOVELESS,721,"It feels so good to stretch my
legs."
722,LOVELESS,722,"I likes to beat my feet on the
Mississippi mud!"
723,GORDON,723,Stop this violence!
724,PRESIDENT GRANT,724,Drop 'em.
725,GORDON (O.S.),725,Stop or I'll shoot!
726,LOVELESS,726,"You expect to kill me with that
little pea shooter?"
727,GORDON,727,If I have to.    Yes.
728,LOVELESS,728,"Why is it, that I'm unafraid?"
729,LOVELESS,729,"I believe you gentlemen are the
polar opposites of a moral
dilemma and I'm stuck in the
middle. On one end, we have
Mr. West, a man of primitive
vigours uncomplicated by
intellect. And on the other,
there's Mr. Gordon. A man of
ideas, but unlike myself, lacks
the passion to kill for them.
He'd like to be able to act his
way out of it. And for some
reason when he's actin', someone
always seems to get killed."
730,WEST,730,"Shoot him, Gordon...!"
731,LOVELESS,731,"I'm right about you, aren't I,
Gordon? And that's why I'm
gonna kill your friend here.
Then I'm going to kill you."
732,LOVELESS,732,"After all that, you missed."
733,GORDON,733,Not exactly.
734,WEST,734,"Better than a fountain pen, don't
you think."
735,WEST,735,"By the way, your chivalry's about
to be tested."
736,PRESIDENT GRANT,736,"We'll be joining them in a moment
if you can't stop that thing!"
737,PRESIDENT GRANT,737,"Let's see how clever you really
are..."
738,WEST,738,"For almost four long years I've
been trackin' the animal
responsible for the Massacre at
New Liberty. And I hear that's you..."
739,LOVELESS,739,"Please, West... show a little mercy
to a poor defenseless cripple..."
740,WEST,740,"Now, now, Doctor... let's not cloud
this otherwise sunny day with that
poor-ol'-me-cripple-talk. Just
buck up and say to yourself, 'I am
indefatigably hard-pumpin' and
steely!'"
741,LOVELESS,741,"After I kill ya, I swear I'm gonna
boil you down to axle grease!"
742,WEST,742,Now that's the ol' doctor I know!
743,LOVELESS,743,"Well, I'll be a monkey's uncle.
How did we arrive in this dark
situation?"
744,WEST,744,I don't know.    Guess I'm stumped!
745,LOVELESS,745,"And I'm so cotton-pickin' afraid
of heights. They just give me the
spooks!"
746,WEST,746,"Ah, don't be afraid, Loveless.
With this being the last leg of
our journey and all, you should
soak in the view, you're really
missing something."
747,LOVELESS,747,"Mister West, I'm gonna cut this
conversation short..."
748,WEST,748,"Good one, Loveless.   I didn't think
of that one."
749,LOVELESS,749,"Mister West!!! I am faced with a
difficult decision here. On one
hand, there is the overwhelming
love that I have for myself, and
on the other, the raw, seething
hatred I have for you! Now, I
could kill you very easily, just
by pulling this lever..."
750,LOVELESS,750,"But, of course, I would die along
with you. I guess the only thing
that I can take comfort in is the
hope that you would hit those
rocks a second before me and I
could enjoy immeasurable bliss
before I vanish."
751,LOVELESS,751,"What to do, what to do..."
752,WEST,752,"Allow me to make that decision
easy on you, Loveless. Because
I want to see you dead a hell of
a lot more than I want to live."
753,LOVELESS,753,"Why is it that I have a sneaking
suspicion, that although you are
as black as the night on the
outside... inside, you are yellow?!"
754,LOVELESS,754,"You don't have it in you, do you...
boy?!"
755,WEST,755,"You were right. Let's cut this
conversation short!"
756,LOVELESS,756,Weeeeeeeeeest!!!!
757,WEST,757,Now that looked like it hurt.
758,PRESIDENT GRANT,758,"Gentlemen, I now strongly believe
the United States is going to be
truly united. Not because of this
railroad... but because of you."
759,PRESIDENT GRANT,759,"I've signed into law the creation
of an agency whose sole duty is to
protect the President and the
country from lunatics like
Loveless."
760,PRESIDENT GRANT,760,"Welcome to the Secret Service,
Agents No. 1 and No. 2."
761,GORDON,761,"Uh, just out of curiosity, sir...
who's Agent No. 1?"
762,PRESIDENT GRANT,762,"I don't think that matters very
much, do you? Gordon? Besides,
you'll have plenty of time to
discuss it on your new assignment."
763,PRESIDENT GRANT,763,See you back in Washington.
764,GORDON,764,"But, sir... what about our train?"
765,PRESIDENT GRANT,765,"Well, I'm taking it of course.
Hell, you let Loveless blow up
mine."
766,RITA (O.S.),766,Jim... Arte...?
767,WEST,767,Rita!   You look great.
768,GORDON,768,"Ravishing, a vision."
769,RITA,769,"I just wanted to thank you for
everything you've done for me...
before I went back home to Texas."
770,WEST,770,"Texas? Why're you going back
there? Why don't you come with me
back to Washington?"
771,GORDON,771,"Or better still, come with me to
Washington. I could introduce you
to people I still know in the
theater..."
772,WEST,772,"She's not really an entertainer,
remember?"
773,RITA,773,I can't go with either of you.
774,RITA,774,"It's not that you both don't have
your attributes."
775,RITA,775,"You're so sophisticated and such a
wonderful cook."
776,RITA,776,"Jim, you're good with a gun... and
have great legs."
777,RITA,777,"And you're both so brave. But...
I'm afraid I haven't been
completely honest with you."
778,WEST AND GORDON,778,Uh-oh...
779,RITA,779,"Professor Escobar's not my father.
He's my husband."
780,WEST,780,"Rita... why didn't you just tell
us that in the first place?"
781,RITA,781,"Well, I was going to... but would
you have really brought me along
if I said I was married?
Honestly."
782,RITA,782,I didn't think so.
783,RITA,783,"At least you still have each
other."
784,WEST (O.S.),784,"You know, Arte..."
785,GORDON (O.S.),785,"What's that, Jim?"
786,WEST (O.S.),786,Maybe Rita's right...
787,WEST,787,"Besides... there's a lot of
other women in the world."
788,GORDON,788,"That's easy for you to say. She
didn't walk off with your best
dress."
