,character,line #,line
433,WILLOW,433,Wait!  Gold!  Gold!
434,WILLOW,434,"Help, Madmartigan!  The oar!"
435,WILLOW,435,My gold!
436,RAZIEL,436,Kill him!
437,WILLOW,437,No!
438,RAZIEL,438,Kill him!
439,RAZIEL,439,No!!  Help!!  Willow!!!
440,RAZIEL,440,"Willow...you...you got...magic...!
Wait...we could team up...!"
441,RAZIEL,441,Flee!  Flee!
442,SORSHA,442,"Raziel.  Did you think my mother
would allow you to escape?"
443,SORSHA,443,"This is what we're looking for.  It
bears the markings."
444,SORSHA,444,"Don't worry, Willow.  If there's
one thing I'm good at, it's charm-
ing a woman..."
445,SORSHA,445,"So.  Couldn't live without me, huh?"
446,SORSHA,446,Lose your skirt?  How embarassing.
447,SORSHA,447,Still got what counts.
448,SORSHA,448,Not for long.
449,SORSHA,449,"We'll join the column.  Bring them
with us."
450,TEEMO,450,We gotta follow them.
451,ROOL,451,"Us??  We'll never catch them.  Any-
way, we're all done, Teemo.  Let's
go home."
452,TEEMO,452,"Get back here, Rool!"
453,ROOL,453,Ouch!  Let go of me!
454,WILLOW,454,I can't go on...
455,WILLOW,455,"Willow, why don't you use your mag-
ic to get us out of here?"
456,RAZIEL,456,He's no magician.
457,RAZIEL,457,He turned that monster into stone!
458,RAZIEL,458,Did *you* give that acorn its power?
459,WILLOW,459,No.
460,RAZIEL,460,"A magician *makes* magic.  Any fool
can use it."
461,RAZIEL,461,Then you get us out of here.
462,RAZIEL,462,I will!  But I need help!
463,WILLOW,463,I'll help you...!
464,WILLOW,464,I won't.
465,RAZIEL,465,You must learn magic.
466,WILLOW,466,That's all I ever wanted!
467,RAZIEL,467,Then I will teach you.
468,RAZIEL,468,"Nice horse...nice hair...real nice
hair...I'd say you've got the most
beautiful hair I've ever--"
469,SORSHA,469,Wolff wants to boil you in oil.
470,SORSHA,470,Don't tempt me.
471,WILLOW,471,"If you rest the baby on your
shoulder, she'll stop crying."
472,SORSHA,472,Shut up.
473,SORSHA,473,"Mmmm, I love the smell of a woman."
474,SORSHA,474,"My step-father's going to tear you
apart."
475,SORSHA,475,"I'm torn apart already.  I mean it!
Under all that armor is a
beautiful--"
476,SORSHA,476,"Who is that girl, anyway?"
477,RAZIEL,477,"Sorsha, Queen Bavmorda's daughter."
478,RAZIEL,478,"Forget that one, Madmartigan."
479,RAZIEL,479,"Willow.  To learn magic, first you
must make your own philosopher's
stone!"
480,WILLOW,480,What do I need for that?
481,RAZIEL,481,"We must start with feathers, dung,
and a lock of your hair."
482,RAZIEL,482,Now that's a woman...!
483,RAZIEL,483,"Keep working at it.  Forget all you
know, or think you know.  A
magician's power depends on disord-
er of the mind."
484,RAZIEL,484,You got that one covered.
485,WILLOW,485,"I hope she's all right.  How much
more do I have to do of this?"
486,RAZIEL,486,"Till it's in a powder.  The energy
exits within you..."
487,WILLOW,487,"I know, and the magician's goal is
to find his true self.  But what's
this got to do with it?"
488,RAZIEL,488,"As below, so above.  You hold the
univers, Willow, in your hand."
489,RAZIEL,489,"I'm beginning to think you two
*deserve* to be locked up."
490,WILLOW,490,"The universe is a living creature,
like you and me, Madmartigan."
491,WILLOW,491,We're a tiny version of all that?
492,RAZIEL,492,"As above, so below."
493,WILLOW,493,I'm all finished.  Now what?
494,RAZIEL,494,Burn it to a fine ash.
495,WILLOW,495,How am I gonna do that?
496,RAZIEL,496,"Patience.  Concentrate.  You will
find a way."
497,WILLOW,497,What's going on?
498,WILLOW,498,Hurt him and you'll answer to me!
499,SORSHA,499,"This baby won't do what I say.  You
seem to know what to do.  Here!
Make it shut up."
500,WILLOW,500,She needs to be changed.
501,SORSHA,501,I changed her already!
502,WILLOW,502,She needs to be changed again.
503,SORSHA,503,"Who is that horrible friend of
yours?"
504,WILLOW,504,Madmartigan.
505,SORSHA,505,Who is he?
506,WILLOW,506,I don't know much about him.
507,SORSHA,507,"He's very bold.  Do you really
think my hair is beautiful?"
508,WILLOW,508,"Uh, yes.  It's very nice hair."
509,WILLOW,509,She's hungry.
510,SORSHA,510,"I know she's hungry.  I tried to
feed her but she wouldn't eat a
thing.  I'm not a wet nurse."
511,WILLOW,511,Here.  Hold her.
512,SORSHA,512,"I tried everything.  A spoon.  I
poured milk into her mouth, she just
spat it out.  I don't know what to
do, I'm not a mother."
513,WILLOW,513,Sometimes she likes it heated.
514,WILLOW,514,She's a good baby.
515,WILLOW,515,I did it!  I got the ashes!
516,RAZIEL,516,Good!  The first step is complete.
517,RAZIEL,517,Did she ask about me?
518,WILLOW,518,Who?
519,WILLOW,519,"Come on, Peck, don't give me a hard
time.  You were in her ten all
night.  Did she say anything?"
520,WILLOW,520,She said lots of thing.s
521,WILLOW,521,Willow!
522,WILLOW,522,"She asked about you, Madmartigan."
523,WILLOW,523,Well what did she say?
524,SORSHA,524,"Here.  You're going to need these
where we're going."
525,SORSHA,525,She's in love.
526,WILLOW,526,"You're crazy.  I think you're in
love."
527,RAZIEL,527,"We don't have much time left!  Go
on!  Go on!"
528,WILLOW,528,"I must concetrate my
imagination...to creat a
new...reality!"
529,RAZIEL,529,What's the magician's weapon?
530,WILLOW,530,The limitless power of...
531,RAZIEL,531,"Your will!  Your will!  What else
could it be?"
532,WILLOW,532,"I can't remember all these things.
What am I learning?"
533,RAZIEL,533,The art of transformation!
534,WILLOW,534,But what am I gonna transform??
535,RAZIEL,535,Me!
536,WILLOW,536,You?
537,WILLOW,537,"What are you gonna become, Raziel?
Queen of the rodents?"
538,SORSHA,538,The baby's cold.  Take her.
539,RAZIEL,539,"You remind me of your father, Sor-
sha."
540,SORSHA,540,My father was a weakling.
541,RAZIEL,541,He was a great king.
542,RAZIEL,542,"Not like your step-father, not like
your mother.  He ruled Tir Asleen
with kindness, and a generous
heart."
543,SORSHA,543,My mother calls that weakness.
544,SORSHA,544,What do *you* call it?
545,SORSHA,545,I do what I'm told.
546,SORSHA,546,"Too bad you're not more like
your father."
547,SORSHA,547,Be careful.
548,KAEL,548,Don't tell me what to do.
549,KAEL,549,We gotta get the baby out of here.
550,RAZIEL,550,"Tonight!  Complete the
philosopher's stone!  I must be
turned back!"
551,WILLOW,551,"I'll do it, Raziel..."
552,RAZIEL,552,"Let it settle.  Carefully, slowly.
Concentration and will.  Now pour
the water off."
553,WILLOW,553,"Oooh, this smells terrible."
554,RAZIEL,554,"That's the life spark.  Exxence of
magic and sorcery!"
555,WILLOW,555,Ouch!!
556,RAZIEL,556,Shhhhh!
557,WILLOW,557,What'd you bit me for!!
558,RAZIEL,558,"We need blood.  To nourish the
stone.  charge the stone with ener-
gy."
559,RAZIEL,559,"The components of the stone are
fusing..."
560,RAZIEL,560,"Again:  what is the magician's
weapon?"
561,WILLOW,561,His will.
562,RAZIEL,562,Now use it.
563,WILLOW,563,I just wanted to test it first.
564,RAZIEL,564,"No!  Change me back into a sor-
ceress, Willow."
565,WILLOW,565,"Avaggdu, supriom, luwatha..."
566,WILLOW,566,What did I do?
567,WILLOW,567,"Not bad, Peck.  I'm impressed.  You
busted the lock."
568,WILLOW,568,"Madmartigan.  Let's go.  Let's get
Eloran Danan."
569,WILLOW,569,Let's get Elora Danan.
570,RAZIEL,570,Wait!  What about me!
571,RAZIEL,571,"You're a magician, Willow.  But I'm
a thief.  Wait here.  I'll get the
baby."
572,RAZIEL,572,"I'm supposed to be a beautiful wo=
man."
573,WILLOW,573,"Come on, Madmartigan...!"
574,WILLOW,574,"What are you doing?  Get out of
there...!"
575,WILLOW,575,I love you.
576,SORSHA,576,"One move, and you really will be a
woman."
577,SORSHA,577,You're a fool.  Now put her back.
578,SORSHA,578,I'm not going to let this baby die.
579,SORSHA,579,Don't make me kill you.
580,SORSHA,580,I believe you would...
581,SORSHA,581,Why did you say that?
582,SORSHA,582,Say what?
583,SORSHA,583,I love you.
584,SORSHA,584,Because it's true.
585,SORSHA,585,I don't believe you.
586,SORSHA,586,"I wish it weren't true.  I swore
I'd never let this happen.  I hate
you.  I hate your beauty, I hate
your innocence, I hate the feelings
you've awakened in me."
587,MADMARTIGAN,587,"I'm in love with you, Sorsha.  I
don't want to be, but a power has
enchanted me and I stand helpless
against it.  It's torture.  Battle-
field or prison cell was never half
as cruel."
588,MADMARTIGAN,588,"I want you and I can't have you so
I want you all the more.  If this
were another time and another place
I'd--"
589,SORSHA,589,You'd what?
590,KAEL,590,What's going on here!!
591,SORSHA,591,Deceiver!!
592,MADMARTIGAN,592,Whoops!
593,MADMARTIGAN,593,Willow!  Jump on the shiled!
594,KAEL,594,Bowmen!  Horses!  After them!
595,MADMARTIGAN,595,"Sorsha!  I didn't betray you.  I
love you!"
596,KAEL,596,Kill them!!
597,WILLOW,597,Nooo!!!
598,MADMARTIGAN,598,"Willow!  Willow!  Are you all
right?"
599,VILLAGER,599,King Kael!
600,ANOTHER VILLAGER,600,Nockmaar troops!
601,MADMARTIGAN,601,Help us.
602,AIRK,602,"Madmartigan.  Settled down with a
family huh?"
603,MADMARTIGAN,603,"You left me to die, friend."
604,AIRK,604,You managed alright.
605,MADMARTIGAN,605,Is this what's left of your army?
606,OFFICER,606,Keep that baby quiet.
607,KAEL,607,"Where is it!  Tell us or we'll burn
your village!  Sorsha!"
608,OFFICER,608,Kill her.
609,MADMARTIGAN,609,You'll draw the others.
610,AIRK,610,"It's you they're after, Madmarti-
gan.  What did you do this time?"
611,MADMARTIGAN,611,"They're not after me.  They want
the baby."
612,AIRK,612,Who is this baby?
613,WILLOW,613,"The princess, Elora Danan."
614,PEOPLE,614,The prophecy has come true.
615,AIRK,615,Give her to us.  We'll protect her.
616,RAZIEL,616,Not safe!  Not safe!
617,WILLOW,617,"We're taking her to Tir Asleen.
She'll be safe there from
Bavmorda's powers."
618,AIRK,618,"Tir Asleen is a myth.  It doesn't
exist."
619,RAZIEL,619,"It does!  It does!  I will show
you!"
620,AIRK,620,"You gonna be a hero, Madmartigan?
I've lost half my men fighting
Kael, and Bavmorda, and the Nock-
maar army.  Now you and this Peck,
and that magpie up in the rafters,
are gonna take 'em on alone?"
621,MADMARTIGAN,621,Then come with us.
622,AIRK,622,"The war is here!  In towns and vil-
lages like this!"
623,AIRK,623,You're chasing a dream.
624,MADMARTIGAN,624,Just get me some horses.
625,MADMARTIGAN,625,"Once again, Airk, we say goodbye."
626,AIRK,626,"One day one of us willl stand on
the other's grave."
627,RAZIEL,627,Nockmaar!  Nockmaar!
628,RAZIEL,628,This way!  The cave!
629,WILLOW,629,"Madmartigan!  I can't stand being
in closed-in places."
630,MADMARTIGAN,630,Want me to carry Elora?
631,WILLOW,631,I'm used to her.  How's she doing?
632,MADMARTIGAN,632,"She's doing a lot better than we
are, Peck."
633,MADMARTIGAN,633,"Willow...this may be a bad time to
ask this question but...what if
Raziel's wrong?"
634,WILLOW,634,"She can't be wrong.  She's a very
very very powerful sorceress."
635,MADMARTIGAN,635,"She's a bird, Willow."
636,WILLOW,636,"That's my fault, not hers.  I've
got to keep practicing.  I'm still
in the learning stage but magic,
Madmartigan, requires concentration
and--"
637,MADMARTIGAN,637,Watch it!
638,WILLOW,638,Ahhh!
639,WILLOW,639,I hate this.
640,MADMARTIGAN,640,"Go, Willow!  Run!  Run!"
641,MADMARTIGAN,641,Willow!  Willow!
642,KAEL,642,Go after them!
643,MADMARTIGAN,643,"Hurry, Willow!  Throw it!"
644,RAZIEL,644,Look out!
645,KAEL,645,After them!!
646,RAZIEL,646,Tir Asleen.
647,WILLOW,647,There's nobody here.
648,RAZIEL,648,"The Knights of the Pacalcade.  The
king's bravest warriors."
649,RAZIEL,649,"Turn them back, Willow!"
650,WILLOW,650,How??
651,RAZIEL,651,"Use the philosopher's stone!  Hur-
ry!  Invocation!  Release them!"
652,WILLOW,652,"Beings within, beings without!
Danu danu walkail funfawtha!"
653,WILLOW,653,"I did it!  Madmartigan!  Come here!
Look!  You gotta see this!  I did
it!"
654,RAZIEL,654,More!  More!
655,KAEL,655,Assault!  Scale the walls!
656,WILLOW,656,Tuatha tuatha danu!
657,WILLOW,657,"Raziel!  I transformed them all!
I'm a magician!"
658,RAZIEL,658,"You didn't transform them, Willow,
you released them.  That was noth-
ing.  Now change me."
659,WILLOW,659,I feel like I could do anything!
660,KNIGHT,660,It belonged to our king.
661,WILLOW,661,"Capture the enery...limitless
power of the will...avvdachh doth
indicht rredd baerkinhaekin!"
662,WILLOW,662,"Raziel?  Is that you?  Oh-oh.  What
happened?"
663,RAZIEL,663,I hate this.
664,KAEL,664,Attack!!
665,MADMARTIGAN,665,Sorsha.
666,SORSHA,666,Madmartigan.
667,MADMARTIGAN,667,Whose side are you on?
668,SORSHA,668,Yours.
669,MINION,669,Arrrggghhh!
670,SORSHA,670,I love you.
671,KAEL,671,Sorsha!!
672,KAEL,672,Bordak!
673,KAEL,673,Kill them both!
674,KAEL,674,"Troops!  To Nockmaar!  Ride with
me!"
675,WILLOW,675,"I'm sorry.  There were too many of
them."
676,MADMARTIGAN,676,"Out for a little ride in the coun-
try, Airk?"
677,AIRK,677,"Thought you might get lonely, Mad-
martigan!"
678,MADMARTIGAN,678,"Thank you, friend."
679,AIRK,679,Let's go.
680,MADMARTIGAN,680,Sorsha!  Any way in there?
681,SORSHA,681,"No.  The fortress is protected on
all sides."
682,AIRK,682,Make camp!  We'll assault at dawn.
683,BAVMORDA,683,Kael!
684,KAEL,684,Queen Bavmorda.  I have the child.
685,BAVMORDA,685,We must start the ritual!
686,BAVMORDA,686,Who is that?
687,KAEL,687,An army of rebels and traitors.
688,BAVMORDA,688,Where is Sorsha?
689,KAEL,689,She has turned against you.
690,BAVMORDA,690,"Purify the altar!  Arrange the im-
plements!  I'll deal with Sorsha!"
691,BAVMORDA,691,This is not an army!
692,RAZIEL,692,"Willow!  Get out of here!  Quick!
Hide!"
693,RAZIEL,693,"Get down!  The ritual chant!
Quick!  Protect yourself!"
694,WILLOW,694,Why?
695,RAZIEL,695,Just do it!
696,MADMARTIGAN,696,"We've come for Elora Danan!  Turn
her over to us!"
697,BAVMORDA,697,"You dare to challenge me?  You are
not warriors.  You're pigs!"
698,BAVMORDA,698,You're all pigs!
699,SORSHA,699,Mother!  No!!
700,BAVMORDA,700,You made your decision!
701,BAVMORDA,701,"Begin the ritual.  Now!  Light the
first candle."
702,BAVMORDA,702,"Come, thunder.  Come lightning.
Touch this altar with your pwer.
Come into my tower..."
703,BAVMORDA,703,"Dark runes, dark powers!  Blend and
bind, bind and blend, Universal
night!  And the might of Nockmaar!"
704,RAZIEL,704,"It's over, Willow.  You did well.
You protected yourself."
705,WILLOW,705,"I've come all this way and now
Elora Dana's going to die!"
706,RAZIEL,706,No!  I can still defeat Bavmorda!
707,WILLOW,707,"She's too powerful, Raziel"
708,RAZIEL,708,"A true magician, Willow, never
surrenders.  She is a sorceress--I
am a sorceress!  Transform me now
and I will destroy her!  Hexagram!"
709,WILLOW,709,"Banish all disturbing forces from
this place.  Fire, water, above and
below.  Balance.  Balance.  Bal-
ance."
710,"RAZIEL
(voice distorted)",710,Don't give up!  Willow!
711,WILLOW,711,Raziel!
712,RAZIEL,712,"We've got a lot of work to do, Wil-
low.  Bring in our brave men."
713,BAVMORDA,713,"Black fire forever kindled within,
Let the second right begin!"
714,AIRK,714,"Uphill with our rough weapons,
we'll never make it!"
715,SORSHA,715,Elora Danan will die!
716,RAZIEL,716,"By dawn, upon thirteen tolls of the
runic drum!"
717,WARRIOR,717,"Bavmorda is too powerful.  We need
more forces.  I say we retreat!"
718,RAZIEL,718,"Bavmorda cannot transform you.
I've protected this camp with a
spell."
719,MADMARTIGAN,719,"Can you use your magic to get our
men into the fortress, Raziel?"
720,RAZIEL,720,"Bavmorda has shielded it with a
spell of her own."
721,WILLOW,721,Wait!!
722,WILLOW,722,"I have an idea.  Back in my village
we catch a lot of hedgehogs."
723,MADMARTIGAN,723,"Willow, this is war, not agricul-
ture!"
724,WILLOW,724,"I know, I know!  But this is a way
to get into that castle..."
725,AIRK,725,It's too much work.
726,WARRIOR,726,It can't be done.
727,SORSHA,727,Kael will never fall for it.
728,MADMARTIGAN,728,"I don't know, Willow."
729,WILLOW,729,"Madmartigan, you promised me you'd
take care of Elora Danan like your
own daughter.  She is all that
matters.  Are you going to abandon
her?"
730,AIRK,730,"Come on, Madmartigan.  you gonna
listen to a Peck?  You and I are
warriors.  You know this plan will
never work."
731,MADMARTIGAN,731,"We'll probably die here, Sorsha."
732,SORSHA,732,I have no family.
733,RAZIEL,733,"If we do not fight, and the baby
dies, all hope for the future is
lost.  I shall face the danger
alone if I have to."
734,WILLOW,734,"Me, too."
735,MADMARTIGAN,735,"Time is running out.  We must now
decide who's going to leave and who
is going to stay..."
736,BAVMORDA,736,Ocht veth nockkthirth bordak!
737,RAZIEL,737,Time is running out.
738,WILLOW,738,Surrender!!
739,WILLOW,739,"We are all-powerful magicians!
Give us the baby or we will destroy
you!!"
740,KAEL,740,Kill them!
741,RAZIEL,741,"Patience, Willow."
742,WILLOW,742,"Courage, Willow."
743,AIRK,743,Let's squah 'em!
744,SORSHA,744,"No, Willow!!"
745,SORSHA,745,I will face my mother alone.
746,BAVMORDA,746,Sorsha!!
747,SORSHA,747,I won't let you kill her!
748,BAVMORDA,748,"You are a weakling.  Like you fa-
ther!  Can you not see that I am
about to become all-powerful!"
749,SORSHA,749,No!!
750,BAVMORDA,750,Raziel...!!
751,RAZIEL,751,"The baby will be queen.  It has
been foretold, Bavmorda."
752,BAVMORDA,752,"My ritual will kill the prophecy!
Now the child dies with it, its en-
ergy exiled into oblivion!"
753,BAVMORDA,753,"You see?  I hold the power of the
universe!"
754,RAZIEL,754,Not until your ritual is complete!
755,BAVMORDA,755,"And who will stop me?  The elements
are slaves to my command!"
756,RAZIEL,756,"There is no one who can match your
sorcery.  Except me!"
757,MADMARTIGAN,757,Airk!!
758,MADMARTIGAN,758,Airk!  Airk!
759,MADMARTIGAN,759,"Madmartigan...you're a brave
warrior...a true friend...a good
man..."
760,MADMARTIGAN,760,"We're gonna win this war, Airk."
761,BAVMORDA,761,"As above, so below!  Universe of
evil, Raziel!  It conquers even
you!"
762,BAVMORDA,762,*Stop!  Bring back that child!!!*
763,BAVMORDA,763,Who are you?
764,WILLOW,764,I'm Willow Ufgood.  I'm a magician.
765,WILLOW,765,I'm a *great* magician.
766,BAVMORDA,766,Is that the extent of your power?
767,BAVMORDA,767,Place it on the altar.
768,WILLOW,768,No.  You can't have her.
769,BAVMORDA,769,"By ritual, by sorcery, I well draw
the lightning and send this child
into the destructive realm."
770,WILLOW,770,"And with my magic I'll send her
into the...into the..."
771,BAVMORDA,771,You're no magician.
772,WILLOW,772,Into the good.
773,BAVMORDA,773,"Even I don't have the power to do
that.  You're a fraud."
774,BAVMORDA,774,Impossible!  Bordak!  Bordak!
775,BAVMORDA,775,Aaaaahhhh!!!
776,RAZIEL,776,"Willow...Willow...how...how did you
do that?"
777,WILLOW,777,"It was just the old disappearing
pig trick."
778,RAZIEL,778,"Willow Ufgood.  Take this Book of
Sorcery.  You are on your way to
becoming a great magician."
779,WILLOW,779,"Your dream has come true, madmarti-
gan."
780,MADMARTIGAN,780,"Goodbye, Peck."
781,WILLOW,781,"Farewell, Elora Danan."
782,KIAYA,782,Willow!!
783,WILLOW,783,Kiaya!!
