,character,line #,line
0,DRUID,0,Is it a girl?
1,ETHNA,1,It is a girl.
2,DRUID,2,Show me its arm.
3,DRUID,3,"It's true then.  I must tell Queen
Bavmorda."
4,MOTHER,4,"Ethna, please.  Help me.  They're
going to kill my baby."
5,ETHNA,5,They'll kill you.
6,MOTHER,6,Please save my baby.
7,ETHNA,7,Pretend this is the child.
8,MOTHER,8,"Thank you, Ethna.  Thank you."
9,BAVMORDA,9,"We will start the ritual at dusk.
You're certain this is the one?"
10,DRUID,10,It bears the markings.
11,BAVMORDA,11,"I must see for myself!  Just as the
omen foretold!"
12,BAVMORDA,12,So.  You *were* the one.
13,MOTHER,13,"Yes.  But nothing you can do will
stop the prophecy."
14,BAVMORDA,14,"This child will have no power over
me...."
15,BAVMORDA,15,Where's the baby!
16,GUARD,16,The midwife!
17,BAVMORDA,17,"Find that baby!  Use the dogs!
Sorsha!"
18,BAVMORDA,18,Kill her.
19,DEATH DOG,19,Bordak!
20,MIDWIFE,20,I don't have her!  No!  No!
21,RANON,21,"Dada!  We found something in the
river!"
22,WILLOW,22,"I can't run off and play with you
now.  I've got work to do."
23,WILLOW,23,"But Dada, you gotta see it!  Hurry!"
24,WILLOW,24,"Back!  Don't go near it.  We don't
know where it's been.  It could be
diseased."
25,MIMS,25,It's a baby!
26,RANON,26,It's not a Nelwyn baby.
27,WILLOW,27,"No, it's too big to be a Nelwyn
baby.  It looks like a daikini..."
28,MIMS,28,"Ooh, it's so cute..."
29,WILLOW,29,"Mims!  Get back here!  It might
bite you."
30,RANON,30,"Can't we keep it, Dada?"
31,WILLOW,31,Absolutely not.
32,WILLOW,32,Ufgood!  Willow Ufgood!
33,WILLOW,33,"Shhh, shhh!  It's the Prefect --
that's all I need.  Mims, Ranon,
keep this thing hidden..."
34,KIAYA,34,"Mr. Burglekutt!  He hasn't done
anything wrong!"
35,KIAYA,35,"Ufgood!  What do you think you're
doing!  I tell the planting seeds
in this village."
36,KIAYA,36,"I told him we didn't steal it, Wil-
low."
37,KIAYA,37,"You haven't paid your debts.  Where
did you get these seeds?"
38,WILLOW,38,"In the forest.  My family's been
gathering them since last fall.
There's no law against that, Bur-
glekutt."
39,KIAYA,39,"Willow!  You left the children
alone by the river??"
40,KIAYA,40,"Too late, Ufgood.  You'll never get
your planting done before the rains
start.  You're gonna lose this
land."
41,WILLOW,41,"Absolutely, under no condition, is
anyone in this family going to fall
in love with that baby."
42,WILLOW,42,"Kiaya!  We can't keep that baby.
Mims, Ranon.  Hey!  I will not be
ignored!"
43,WILLOW,43,"This is bad.  If we're caught with
that little daikini it'll be the
end of us.  Careful, Ranon, I need
that for the festival.
(indicates magic cloth)
Kiaya, what are we going to do?"
44,KIAYA,44,We're gonna give this baby a bath.
45,WILLOW,45,"Burglekutt's right.  There's not
enough time to finish plowing.
We'll lose everything and I'll end
up working in the mines."
46,KIAYA,46,"Willow, do you think we should take
her to the Village Council?"
47,WILLOW,47,"No, no!  They'll think it's a bad
omen.  There'll be a flood or a
drought or a plague and
everybody'll blame me for it!"
48,RANON,48,Look.  What's that?
49,WILLOW,49,"I don't know.  This is trouble.
I'll talk to the High Aldwin about
it tomorrow at the Festival."
50,WILLOW,50,"And now!  For our final amazing bit
of magic, I will make an entire pig
completely disappear!"
51,CROWD,51,Aaww!  Booo!  Sssss!
52,WILLOW,52,"Meegosh, I'm in trouble."
53,MEEGOSH,53,"Hey, it wasn't that bad.  You need
a better pig, that's all."
54,MEEGOSH,54,"Now Burglekutt's got you in the
squeeze.  Soon you'll be down in
the mines like me."
55,WILLOW,55,"Mining.  I hate closed-in spaces.
That's the last thing I'd ever do."
56,WILLOW,56,I gotta get my crop planted.
57,MEEGOSH,57,"You know I'll help you as much as I
can, Willow."
58,MIMS,58,"Dada, can we get treacle candy?
Can we, can we?  Please?"
59,WILLOW,59,"Meegosh, can you watch the chil-
dren?  I gotta talk to the High
Aldwin."
60,MEEGOSH,60,The High Aldwin??  Why?
61,WILLOW,61,Sir!  I have to talk to you.
62,WILLOW,62,"Not today, Willow."
63,WILLOW,63,"It's a matter of great importance
to me!"
64,WILLOW,64,"Intuition, Willow -- remember?  I
know you're eager to be my appren-
tice, Willow.  But today is the
spring festival."
65,WILLOW,65,"Apprentice?  To the High Aldwin!!
Willow Ufgood???"
66,DEATH DOG,66,Bordak!  Bordak!
67,MEEGOSH,67,What was it looking for?
68,MEEGOSH,68,"It said ""bordak""!  What does it
mean?"
69,MEEGOSH,69,"Baby!  It means baby!  It was look-
ing for somebody's baby!"
70,MIMS,70,Mommy?
71,WILLOW,71,Kiaya!  Kiaya!
72,WILLOW,72,"We can't keep this baby, Kiaya.  We
must take her to the Council."
73,WILLOW,73,"An evil beast from the outer world
has invaded our peaceful village,
looking for a baby!"
74,WILLOW,74,It's a sign!  An omen!
75,ANOTHER VILLAGER,75,Our crops will die!
76,ANOTHER VILLAGER,76,"Silence!  One beast we can kill.
But there may be more!  And they
won't give up their search till
they've found what they're looking
for!"
77,MEEGOSH,77,Whose baby is it!
78,MEEGOSH,78,Who's to blame for this!
79,MEEGOSH,79,Willow Ufgood!  Come before me!
80,MEEGOSH,80,"Earlier today you tried to tell me
something, Willow."
81,WILLOW,81,"My family found this baby in the
river, High Aldwin."
82,WILLOW,82,A daikini child...
83,(his eyes close),83,"...of some importance, I feel..."
84,(his eyes close),84,"That's what the beasts want!  Give
it back!"
85,WILLOW,85,"They'll kill her!  We can't let
this baby die!"
86,WILLOW,86,What do we care!
87,WILLOW,87,"...importance...yes...this child
is special..."
88,WILLOW,88,What should we do?
89,WILLOW,89,"This child must be taken beyond the
boundaries of our village.  All the
way to the daikini crossroads."
90,WILLOW,90,Who will do that?
91,SEVERAL VILLAGERS,91,Vohnkar!  Vohnkar!
92,SEVERAL VILLAGERS,92,"The outer world is dangerous and
corrupt, Vohnkar.  And this baby is
hunted by blood-hungry beasts.  Are
you willing to sacrifice your life?"
93,VOHNKAR,93,"If I go, who'll defend you if other
beasts attack?"
94,VOHNKAR,94,"He's right!  It seems only fair
that the man to take this baby to
the crossroads..."
95,VOHNKAR,95,"...be the very man who plucked
it..."
96,VOHNKAR,96,...out of the river!
97,WILLOW,97,"I can't do it!  I haven't put my
crop in!"
98,WILLOW,98,"You caused this trouble.  You found
the baby...you get rid of it!"
99,WILLOW,99,I nominate Willow Ufgood!
100,WILLOW,100,I will consult the bones!
101,WILLOW,101,The bones tell me nothing.
102,(he eyes Willow),102,"But I must make a decision.  Is
there love in your heart for this
child?"
103,WILLOW,103,Yes.
104,WILLOW,104,"The bones have spoken!  Willow?
The security of this village
depends on you!"
105,MIMS,105,Dada?
106,MIMS,106,"Watch out for brownies, Dada."
107,WILLOW,107,"I will, Mims.  Goodnight."
108,RANON,108,"Dada, what's a daikini?"
109,WILLOW,109,"Daikinis are giant people who live
far far away."
110,RANON,110,Are you scared?
111,RANON,111,"I could be you rguard!  I could
carry your spear!"
112,"WILLOW
(smiles)",112,"What a great son you are, Ranon.  I
wish I could take you with me.  Now
go to sleep..."
113,"WILLOW
(smiles)",113,"Now, you know where you're going?"
114,"WILLOW
(smiles)",114,"Down there, through those trees,
follow the river.  You'll know the
crossroads by a big daikini struc-
ture.  Willow, this is serious
business.  Don't waste any time,
the outer world is no place for a
Nelwyn.  Give the baby to the first
daikini you see, then hurry home as
fast as you can."
115,WILLOW,115,"If I'm not strong enough to be your
apprentice, how can I do this?"
116,WILLOW,116,"You're strong enough.  But you're
going to need courage, Willow."
117,WILLOW,117,"I don't want courage.  I don't want
to be a warrior.  All I've ever
wanted was to do magic, real magic,
like you!"
118,WILLOW,118,"Real magic, Willow, is simply the
art of controlling the reality of
others.  You lack faith in your-
self.  You must learn to trust your
intuition."
119,WILLOW,119,"Go in the direction the bird is
flying."
120,"WILLOW
(amazed)",120,"Oh, if I could do that I'd--I'd
turn Burglekutt into a toad!"
121,"WILLOW
(amazed)",121,"Waste magic on revenge?  You have
much to learn, Willow..."
122,KIAYA,122,"Willow, we've never been apart.  I
miss you already.  Take this.  It
will bring you luck."
123,WILLOW,123,"You cut your hair, Kiaya?"
124,KIAYA,124,Willow!!
125,KIAYA,125,"We've patrolled the hills.  This is
where they killed the nursemaid."
126,SORSHA,126,"She must have done something with
the child.  Widen the search!"
127,SORSHA,127,Get away from there!
128,WILLOW,128,"I hate this.  Where am I?  I should
stick you in a tree and go back
home."
129,WILLOW,129,I'm sorry.  I didn't mean that.
130,WILLOW,130,That's it.  The crossroads...
131,WILLOW,131,I hate this.
132,WILLOW,132,I hate this.
133,WILLOW,133,I really hate this.
134,WILLOW,134,"Hey, Peck...get me some water...or
you'll diiiiie...!"
135,WILLOW,135,"I will--I'll getcha water--getcha
lotsa water--anything you say--!"
136,WILLOW,136,Peck!
137,WILLOW,137,"You're a weasely little Peck!
Gimme some water!"
138,WILLOW,138,I'm not coming near you!
139,WILLOW,139,"Please?  I'm dyin' of thirst in
here."
140,WILLOW,140,Good.  How long will it take?
141,WILLOW,141,"Don't make me angry, Peck."
142,WILLOW,142,"You be careful.  I'm a powerful
sorcerer.  I could turn you into a
toad just like that."
143,WILLOW,143,Miserable Pecks.
144,WILLOW,144,That's more like it.
145,WILLOW,145,"Do any other daikinis ever come by
here?"
146,WILLOW,146,Why.
147,WILLOW,147,"I have to give this baby to some-
body."
148,WILLOW,148,"I'm somebody.  Lemme out and I'll
take care of your baby."
149,WILLOW,149,"No.  Somebdoy put you in there for a
reason.  I'll wait for somebody else."
150,WILLOW,150,Hey!  Somebody's coming!
151,WILLOW,151,Peck!  Quick!  Douse the fire!
152,WILLOW,152,"No, you fool!  Put it out I say!
Out!"
153,WILLOW,153,No!!
154,PICT,154,Whose fire!
155,PICT,155,No!  Help!  Stop!
156,PICT,156,Where are they?  Where did they go?
157,PICT,157,"Thanks for your help, Peck."
158,WILLOW,158,Are you okay?
159,WILLOW,159,"As if you care.  I saved your life,
Peck.  Those guys woulda killed us!"
160,WILLOW,160,"You wanna give your baby to them??
They eat babies!"
161,WILLOW,161,I don't know.
162,WILLOW,162,"The world's gone insane.  Good men
locked in cages, criminals running
free.  It doesn't pay to be honest,
Peck."
163,WILLOW,163,"Don't call me a Peck.  My name is
Willow."
164,WILLOW,164,"Hello, Willow.  I'm Madmartigan."
165,WILLOW,165,You a woodcutter?
166,WILLOW,166,Farmer.
167,WILLOW,167,"Farmer!  I knew it!  You're a vic-
tim, Willow.  Yep, you and me:
victims of a rotten, corrupt, cor-
rupt, rotten world."
168,WILLOW,168,"Listen, Willow my friend.  I'm
really a good man.  Give me my
freedom, and I'll look after that
baby for you.  Trust me."
169,WILLOW,169,"That's it--good--good--like that,
yes, good, good, the chain--that's
it, come on--come on--!"
170,WILLOW,170,"Nooo, I don't think I should."
171,WILLOW,171,"Peck!!  Stupid Peck!  I'll kill ya!
Let me out!"
172,WILLOW,172,"Morning, Willow."
173,WILLOW,173,"Sorry I yelled at you.  I've been
in this cage toooo long.  Can't
think straight anymore.  Owww...!"
174,WILLOW,174,You all right?
175,WILLOW,175,These burns.  My arms.  Ouch...
176,WILLOW,176,See if this helps.
177,WILLOW,177,"Aaaaaahhhh.  Better.  Here, I made
something for the baby."
178,WILLOW,178,What's inside?
179,WILLOW,179,A tooth.
180,(Willow reacts),180,I'm strving.  I got no used for it.
181,WILLOW,181,Stop!  Wait!
182,(with authority),182,Smells like a battle.
183,WILLOW,183,Are you a warrior?
184,WILLOW,184,"The greatest swordsman that ever
lived."
185,WILLOW,185,What's that?  I hear something!
186,WILLOW,186,You hear trouble.
187,WILLOW,187,What is it?
188,WILLOW,188,"A hundred horses...five or six
wagons...  and about six thousand
fools."
189,WILLOW,189,Sir?  Sir!
190,OFFICER,190,Out of the way!
191,AIRK,191,"Push 'em harder!  No rest at mid-
day!  We need to make ten more
leagues by dark!"
192,WILLOW,192,"Sir!  Sir!  I have this baby.  We
found her in our village.  Will you
take her...?"
193,AIRK,193,"We're going into battle, little
one.  Find a woman to take care of
it."
194,AIRK,194,"He thought you were a woman, Airk!"
195,AIRK,195,"Madmartigan!  What did you do this
time?"
196,AIRK,196,"Nothing you wouldn't have done it my
place!"
197,AIRK,197,"I always knew you'd end up in a
crow's cage."
198,AIRK,198,"Least I'm not down there herding
sheep!"
199,AIRK,199,"You're lucky somebody got to you
first, Madmartigan!  I'd've killed
you myself after that stunt at
Land's End!"
200,AIRK,200,"Airk!  Come on, Airk.  Lemme outa
here."
201,AIRK,201,"Hey, remember?  You don't need my
help, Madmartigan.  Little rabbit
trap like this?  Come on!  I could
open it for you, but I wouldn't
wanna insult you!"
202,AIRK,202,"Gimme a sword, Airk.  I'll win your
war for you."
203,AIRK,203,"You're nothing but trouble, Madmar-
tigan.  And I got plenty of that.
Stay in your coffin and rot!"
204,AIRK,204,"I'll be around long after you're
dead, Airk!  You slime!  When I get
outa here I'll cut your head off
and stick it on a pig-pole!"
205,WILLOW,205,Friend of yours?
206,WILLOW,206,"Hello, little baby..."
207,WILLOW,207,"Whatcha thinkin' about, Willow?"
208,WILLOW,208,I hate this.
209,WILLOW,209,"Nobody's gonna take your baby.
Know why?  Nobody cares..."
210,(beat),210,Except me.
211,(beat),211,"You wanna go back to your farm.
You wanna go back to your family.
I could take care of that baby.
I'll look after her like she was me
own."
212,WILLOW,212,"You don't know anything about ba-
bies."
213,WILLOW,213,"Ahhh!  But I know a lot of women
who do.  Why, if I had somebody in
my life--a little daughter for
instance--I'd have a reason to
live..."
214,WILLOW,214,"Willow.  You can't let me die here.
Not when I wanna help you."
215,WILLOW,215,You gotta promise to feed her.
216,WILLOW,216,I will.
217,WILLOW,217,Fresh goat's milk.
218,WILLOW,218,Absolutely!
219,WILLOW,219,"And give her a bath everyday, and
don't let her get cold.  And keep
her diaper changed."
220,WILLOW,220,Of course!  I promise!
221,WILLOW,221,"Come to Daddy, little darlin'."
222,WILLOW,222,I think she likes me!
223,WILLOW,223,"Here are her diaper rags.  And this
is her milk bladder.  And when she
cries--she's either hungry or she's
tired--rock her on your left
shoulder.  She likes that."
224,WILLOW,224,"Don't worry, Willow.  She's in good
hands.  You haven't made a mistake."
225,WILLOW,225,Bye.
226,"WILLOW
(to Madmartigan)",226,Please take good care of her.
227,"WILLOW
(to Madmartigan)",227,"You've done a great job.  Now you
go back to your family and get your
crop in."
228,WILLOW,228,"Look, it's Willow Ufgood!  He's
come home!  Welcome back, Willow!
He deserves a medal:  he's quite
mystical.  For honor, for bravery,
for his intuitive powers..."
229,WILLOW,229,"...let's make him Apprentice
Aldwin.  Better still:  High
Aldwin!  Make way!  It's Willow Uf-
good, High Aldwin of---"
230,WILLOW,230,"Come back here, you!  That's my
baby!!"
231,WILLOW,231,"Oh no, it's a trap!"
232,WILLOW,232,Oh noooooo!!
233,WILLOW,233,Where am I?  Where's the baby?
234,FRANJEAN,234,"I am Franjean, king of the world."
235,WILLOW,235,That baby's my responsibility!
236,FRANJEAN,236,"I don't care.  We paid for her.  Go
back to sleep, monsieur..."
237,WILLOW,237,"Yeow!
(he loses consciousness)
Madmartigan...I never should've
trusted you..."
238,TEEMO,238,Tongue.
239,WILLOW,239,Who are you?
240,ROOL,240,"Quiet, you fool!"
241,"TEEMO
(formal)",241,"We are emissaries of her majesty,
Queen Cherlindrea, of the land of
Coshairm."
242,WILLOW,242,Queen Cherlindrea?
243,TEEMO,243,"She requests the presence of your-
self and the young princess."
244,WILLOW,244,Who??
245,TEEMO,245,"You're the guardian, aren't you?"
246,ROOL,246,"Quit yakking, Teemo.  We gotta get
outa here!"
247,TEEMO,247,"Elves!  They're always tormenting
babies.  They make them cry and
take their tears."
248,ROOL,248,Somebody has to do it.
249,WILLOW,249,Why??
250,ROOL,250,How else they gonna make dew drops?
251,WILLOW,251,I'm getting her out of there!
252,TEEMO,252,"No!  You let us handle this.  Come
along, Rool!"
253,TEEMO,253,"Watch this.  Right between the
eyes."
254,ROOL,254,He never misses.
255,TEEMO,255,"Ooops.  Was that right?  That
wasn't right."
256,TEEMO,256,Hyah!  Hyah!  Git!
257,WILLOW,257,I can't go out there with the baby!
258,WILLOW,258,Elves!!
259,WILLOW,259,"Ohhh, I hate this."
260,TEEMO,260,"Take your time.  Don't worry about
the elves.  They won't come out
here."
261,WILLOW,261,Why not?
262,ROOL,262,Because of the trolls.
263,WILLOW,263,Trolls?
264,TEEMO,264,"Relax.  They only come out at
night."
265,WILLOW,265,This is not going well.
266,TEEMO,266,"Hurry!  Queen Cherlindrea will know
what to do."
267,TEEMO,267,"Come on.  This is a privilege.  No-
body ever gets called before Her
Majesty."
268,ROOL,268,Stand up!  It's the queen!
269,ROOL,269,Willow Ufgood.
270,"WILLOW
(blinded)",270,Yes...?
271,"WILLOW
(blinded)",271,"I hope you are comfortable here,
inside my kingdom..."
272,TEEMO,272,Talk!  Say something!
273,WILLOW,273,"I can't see anything--she's too
bright!"
274,WILLOW,274,I'm sorry...
275,WILLOW,275,"Broke-heart of nightingale for our
honored guest."
276,WILLOW,276,"It is Elora Danan!  The prophecy
has come true."
277,WILLOW,277,"You mean, you know who this baby
belongs to?"
278,WILLOW,278,"She belongs to all of us.  She is
the future queen and ruler of all
kingdoms on earth."
279,WILLOW,279,What a relief.  Now I can go home.
280,WILLOW,280,"No, Willow.  Your journey has just
begun.  It has been foretold that
this child shall bring about the
downfall of Queen Bavmorda, whose
evil powers have darkened our
world.  Upon you depends this
princess's life."
281,WILLOW,281,Me?
282,WILLOW,282,"You are the guardian, Willow.  You
must take her to Tir Asleen."
283,WILLOW,283,What is Tir Asleen?
284,WILLOW,284,"It is a distant castle, where a
great king and queen will look
after Elora Danan and keep her safe
until she is old enough to rule."
285,WILLOW,285,"Where is Tir Asleen?  How far is
it?"
286,WILLOW,286,"The way has been lost in time. But
there is one person, a druid sor-
ceress, who might guide you there.
She was exiled by Queen Bavmorda
many years ago.  Her name is Fin
Raziel."
287,WILLOW,287,"You need a warrior for this job.
I'm nobody."
288,WILLOW,288,"You are very important, Willow."
289,WILLOW,289,"No I'm not.  Have you really looked
at me?"
290,WILLOW,290,I'm short!  Even for a Nelwyn!
291,WILLOW,291,"Why can't you do it?  You have mag-
ical powers."
292,WILLOW,292,"My prsence cannot extend beyond
this forest.  But I can give you
these..."
293,WILLOW,293,"They will protect you.  Use them
wisely."
294,WILLOW,294,They look like acorns.
295,WILLOW,295,"Anything you hurl them at will turn
to stone."
296,WILLOW,296,They're magic?  Are you serious?
297,(sternly),297,"I am very serious, Willow.  There
is no time to lose."
298,WILLOW,298,"But I've got a family to think
about!  They need me!"
299,WILLOW,299,Hello...?
300,WILLOW,300,"Bavmord'a powers are growing like
an evil plague.  Soon she will con-
trol the lives of you children,
your wife, your village...everyone."
301,WILLOW,301,The choice is yours.
302,WILLOW,302,"I'll do it.  Yes, I will, I'll do
it!"
303,WILLOW,303,But I only have one shoe.
304,WILLOW,304,"Wait till I tell my children.
Stuff like this never happens in my
village."
305,TEEMO,305,"Hey, careful there!"
306,WILLOW,306,"How do these work I wonder?  I got-
ta save one to show the High
Aldwin."
307,ROOL,307,Look!  Death below!
308,WILLOW,308,Daikinis...
309,HORSEMEN,309,Hyaaaaahh!!
310,WILLOW,310,"Let's get out of here.  Shhh, don't
cry, Elora.  Things can't get any
worse than this..."
311,TEEMO,311,I'm not going in there.
312,ROOL,312,Me neither!
313,WILLOW,313,"Don't worry--I'm a sorcerer.  What
could possibly happen?"
314,WILLOW,314,"Could you spare some milk for this
poor hungry baby?"
315,BARMAID,315,"Get outa here, Peck!"
316,PATRONS,316,"A Peck!  Get him out!  Beat it,
Peck!"
317,WILLOW,317,"I could use your help, boys."
318,WILLOW,318,Willow?
319,WILLOW,319,This is not fun.
320,WILLOW,320,Woah!
321,WENCH,321,Hurry!  Hurry!
322,THE OTHER WOMAN,322,How do I look?
323,WILLOW,323,You!!
324,WILLOW,324,Where the hell did you come from?
325,WILLOW,325,I trusted you...
326,ROOL,326,Who's he?
327,ROOL,327,You're crawling with rodents.
328,LLUG,328,Where is he!!
329,WENCH,329,"There's nobody here except me and
my, um, cousin."
330,WENCH,330,How do you do.
331,WILLOW,331,Hey!  Give me that baby!
332,WILLOW,332,"These Pecks make terrible nurse-
maids."
333,WILLOW,333,Nursemaid?!
334,WILLOW,334,They get too excited.
335,LLUG,335,Wanna breeeeeeed?
336,"WILLOW
(mischievously)",336,Time to change her diaper.
337,"WILLOW
(mischievously)",337,Time to leave.
338,SORSHA,338,"You!  Are you the mother of that
child?"
339,SORSHA,339,"No.
(looks at Llug; in a high voice)
I mean yes."
340,SORSHA,340,Let me see it.
341,SORSHA,341,I can't.
342,SORSHA,342,Let me see it.
343,WILLOW,343,No!  You can't!
344,WILLOW,344,I can't.
345,SORSHA,345,Why not?
346,SORSHA,346,Why not?
347,WILLOW,347,Because she's sick.
348,WILLOW,348,Because she's sick.
349,SORSHA,349,Give it to me!
350,SORSHA,350,Gawd...you're...beautiful...
351,SORSHA,351,You're not a woman.
352,LLUG,352,Not a woman??!!
353,SORSHA,353,After them!!
354,WILLOW,354,Madmartigan!  Wait!
355,WILLOW,355,"We could've been killed, Madmarti-
gan!"
356,WILLOW,356,Heeyah!  Heeyah!
357,WILLOW,357,Oh no!
358,DEATH,358,Bordak!!
359,DEATH,359,Bordak!!
360,WILLOW,360,Woah...woah...!
361,WILLOW,361,That girl is a vision.
362,WILLOW,362,Where's the baby??
363,WILLOW,363,I thought you had her!
364,WILLOW,364,Willow!!
365,WILLOW,365,"Now Willow, I know you're gonna
blame me for this but it wasn't my
fault...!"
366,WILLOW,366,Elora Danan!
367,WILLOW,367,"When I left the crossroads, I got
ambushed by an elf!"
368,WILLOW,368,Madmartigan!  You saved her life!
369,WILLOW,369,I did?
370,WILLOW,370,"I mean, of course I saved her life.
She's almost my daughter, isn't
she?"
371,WILLOW,371,"Let's get out of here before they
come back."
372,TEEMO,372,"Northeast is that way.  We've come
west and south.  I think."
373,ROOL,373,"Watch it!  You're gonna set us on
fire."
374,ROOL,374,Not a bad idea.
375,ROOL,375,"So you're on your way to Tir
Asleen, huh?  I hate to tell you
this, Willow, but Tir Asleen dosn't
exist."
376,WILLOW,376,"Yes it does.  The Fairy Queen told
me."
377,WILLOW,377,"The Fairy Queen?  And the baby
here's a princess?  And these two
rodents are your guides?"
378,WILLOW,378,"Yeah well...in the morning I think
I'll be on my way."
379,WILLOW,379,"Madmartigan, I need your help."
380,WILLOW,380,"My help?  A great magician like
you?  You don't need any help."
381,WILLOW,381,But you're a great swordsman!
382,WILLOW,382,"You're not a warrior, Madmartigan!
A warrior wouldn't lie there and do
nothing!"
383,WILLOW,383,"We're in trouble!  You've seen the
big army that's after us!  You're a
fake!  You're a bum!  You're a--
you're a coward!!"
384,WILLOW,384,"What's with you, Peck?"
385,WILLOW,385,"I miss my wife!  I miss my chil-
dren!  My boy Ranon!  He's growing
up so fast, he even helps me on the
farm now!  And little Mims!  If you
ever saw her sweet little face
you'd *melt* Madmartigan, you'd
*melt*!"
386,WILLOW,386,"Or maybe you wouldn't.  You don't
know anything about love.  You
don't know anything about any-
thing..."
387,WILLOW,387,"I was in love once, Willow.  She
had a hold on my heart.  I could
barely function."
388,(a pause),388,"I *was* a great swordsman!  I was
knighted!  I could have been king!"
389,WILLOW,389,You?
390,WILLOW,390,"Yeah me.  King!  But she betrayed
me.  She robbed me of my dream."
391,WILLOW,391,I'll never fall in love again...
392,WILLOW,392,Madmartigan!  Madmartigan!
393,WILLOW,393,"Relax, Willow.  We're having fun."
394,ROOL,394,"That's it!  The sorceress lives
there!"
395,TEEMO,395,Are you sure?
396,"ROOL
(excited)",396,"Yes!  Raziel!  She lives out on
that island!"
397,TEEMO,397,"That tree dosn't look like gold to
me."
398,TEEMO,398,Gold!!
399,TEEMO,399,"Its branches are supposed to be
made of gold, solid gold."
400,WILLOW,400,How are we going to get out there?
401,WILLOW,401,"We'll find a way, Willow.  Look
over there--that looks like a
village--maybe they've got a boat.
Come on, what are you waiting for?"
402,WILLOW,402,"Give me a hand here, Peck!"
403,BOY,403,What are you doing?
404,BOY,404,It's nothing to do with you.
405,WILLOW,405,We need to get out to that island.
406,BOY,406,The island is cursed.
407,WILLOW,407,"We've traveled a long way.  We're
looking for Fin Raziel."
408,TEEMO,408,The sorceress.
409,BOY,409,"She's there.  But you can't go
there.  The island is cursed."
410,BOY,410,Yeah?  Who cursed it?
411,BOY,411,"Queen Bavmorda.  Her powers govern
the elements."
412,BOY,412,"Ahh, he's trying to protect the
gold.  Come on, Willow.  Jump in."
413,WILLOW,413,What would the Fairy Queen say?
414,ROOL,414,She's not here.
415,"TEEMO
(to Rool)",415,Obviously.
416,WILLOW,416,"Without Raziel we'll never find Tir
Asleen."
417,WILLOW,417,We'd better go.
418,WILLOW,418,Raziel?  Hello?  Fin Raziel?
419,RAZIEL,419,Get away!  Get away!
420,RAZIEL,420,You'll die!  You'll die!
421,RAZIEL,421,Who are you!  Who are you!
422,WILLOW,422,"I'm Willow Ufgood.  I'm here to
find Fin Raziel."
423,RAZIEL,423,That's me!  Raziel!  Raziel!
424,WILLOW,424,"This can't be right.  This isn't a
sorceress.  This is some kind of
animal."
425,TEEMO,425,Queen Bavmorda transformed her.
426,RAZIEL,426,What do you want!
427,WILLOW,427,"We need your help.  To take this
baby to Tir Asleen.  She's a prin-
cess."
428,RAZIEL,428,Elora Danan!
429,RAZIEL,429,"Rool!  Teemo!  You were right!
This whole tree is made of gold!!"
430,RAZIEL,430,"Fools!  You should never have come
to this place!  We're all going to
die!"
431,RAZIEL,431,"We've got to get off this island
right now.  Hurry!  The boat!  It's
our only chance!"
432,WILLOW,432,Madmartigan!
